type,text,VADER sentiment,VADER sentiment score,TextBlob sentiment,TextBlob sentiment score,date
posts,isye 3770 textbook anyone pdf isye 3770 textbook applied statistics probability engineers 7th edition help broke college student,neutral,-0.0258,neutral,0.0,08/23/2019
posts,sga wants apply board hello student government association information technology board looking individuals passionate technology join team undertake wide range projects technical nature policy based current projects working jacketpages coursecritique internal tools community jacketpages platform sga uses manage bill resolution budget submissions shows progress tech legislative system course critique georgia tech popular online resource analyzing professors courses semester gpas internal tools team creates maintains deploys internal tools needed sga include applications slack maintaining continuous integration deployment pipelines aws community focuses enriching campus community outreach board mission empower students promote student life development support infrastructure georgia tech aim provide tools policies help students achieve full potential ease effort daily tasks provide effective medium communication students faculty staff governance bodies visit submit application join board applications board accepted rolling basis encourage apply soon possible questions please hesitate reach us emailing thank,positive,0.9903,positive,0.1142857142857143,08/23/2019
posts,using vip senior design ii ece 4012 disadvantage using vip ece 4012 instead regular senior design,positive,0.7404,neutral,0.0,08/23/2019
posts,mit coming backyard dragoncon,neutral,0.0,neutral,0.0,08/23/2019
posts,major building major building cs majors klaus college computing thinking latter wanted make sure lol,positive,0.4497,positive,0.28500000000000003,08/23/2019
posts,gt package center processing time anyone good estimate time ups delivery time gt processing mail notification less hour hang go errands meantime either way answer cob,positive,0.8208,positive,0.14444444444444446,08/23/2019
posts,happy wet friday safe,positive,0.8011,positive,0.4000000000000001,08/23/2019
posts,anyone know college dems meeting find anything online gotta show rep mayor pete,neutral,0.0,neutral,0.0,08/23/2019
posts,stomach deleted,neutral,0.0,neutral,0.0,08/23/2019
posts,eas 1600 vs eas 1601 math content one least math heavy saying eas 1600 wilson least amount hand difficult eas 1601 reinhard,positive,0.1557,negative,-0.325,08/23/2019
posts,ece 3741 attendance question professor still posted syllabus section overlaps major career fair wanted see drop labs could skip day senior seeking job top priority,positive,0.3102,positive,0.42083333333333334,08/23/2019
posts,air conditioner psa air conditioners georgia tech dorms central meaning cold water piped main unit individual units heating desired water pipe switched hot water instead actuator toggles hot water cold water right side machine get stuck air conditioner seem blowing cold air may issue recommendation endorsement tampering air conditioner,negative,-0.2173,negative,-0.09417989417989418,08/23/2019
posts,low stakes nlh poker campus 5c 10c 10c 25c low stake nlh poker campus 5c 10c 10c 25c,negative,-0.5514,neutral,0.0,08/23/2019
posts,crossland tower open get always see signs say students beyond point construction progress crossland open,negative,-0.4098,neutral,0.0,08/23/2019
posts,wet friday psa know wet friday refers day alcohol officially allowed back greek events year day happens today actually start 7pm tonight please safe tonight consume alcohol 21 state georgia medical amnesty law provides limited immunity persons seeking help medical emergency please give us call need friend need assistance click read georgia medical amnesty law want stay safe possible encourage download free livesafe app livesafe provides quick convenient way communicate gtpd app allows send text photo video us provides access emergency phone numbers permits use location sharing friends family offers security alerts access important resources,positive,0.9911,positive,0.12261904761904763,08/23/2019
posts,isye 3770 harry sharp anyone able access online canvas assessments said seem find,neutral,0.0,positive,0.1875,08/23/2019
posts,ck housing know said enough share horror stories pls good stuff staff members different mean like cost living shitty conditions hidden budget etc,negative,-0.1027,neutral,0.04416666666666666,08/23/2019
posts,apph 1040 textbook anyoneb access health thank,positive,0.3612,neutral,0.0,08/23/2019
posts,professors curve power set cutoff 93 meaning get 92 get,neutral,0.0,neutral,0.0,08/23/2019
posts,hope get suck,positive,0.6492,neutral,0.0,08/23/2019
posts,refund deleted,neutral,0.0,neutral,0.0,08/23/2019
posts,anyone else trouble logging gatech email accounts afternoon,negative,-0.4019,negative,-0.2,08/23/2019
posts,club sports time commitment hi wondering much time commitment club sports general looking try tennis team know enough time schedule many times week club sports usually meet many hours week take,positive,0.2869,positive,0.16666666666666666,08/23/2019
posts,antico pizza local sexist pizza place past two months working antico pizza atlanta ga realized would difficult place work told women allowed make pizza cook traditional called curiously venturing pizzeria station owner oppress everyone warned woman previously fired owner said saw woman kitchen would fired spot manager recently became interested asked pride tattoo behind ear responded explaining attracted people based gender bi pansexual means like threesomes asked uneasy dodged question prodded asking past sexual experiences asked wanted threesome wife told wished wife interested girls like began hugging everyday came work standing uncomfortably close whenever rested screaming numbers running pizza started referring girlfriend recently got hair cut wanted touch told looked older 20 probably 60 told coworker beautiful told watch seemed manager interested disclosed situation gatech student longer work care mental health safety dehumanizing side hustle contacted eeoc wanted warn people looking apply people considering giving money place better less expensive pizza area go amazza varuni napoli go rocky mountain go pizza hut save set traditional italian pizza keep mind antico traditional sexual discrimination harassment consumer support behavior buy metoo update owners seen post meeting tonight thanks spreading experience would hope take action least suspend man sexually harassed unless overcome inability accept blame fear losing money might decide narrative take comment section hoping best keep spreading good word tohellwithantico,positive,0.9062,positive,0.07291666666666669,08/23/2019
posts,wrong recieve another clery act alert immediately think business usual another armed robbery deleted,negative,-0.2263,negative,-0.375,08/23/2019
posts,rep student transfer question hey guys currently sophomore ung rep program wondering could apply regular transfer spring 2020 see get apply rep transfer fall 2020 would negative affects chances get denied apply normally,negative,-0.7003,neutral,-0.0375,08/23/2019
posts,impact osi violation hello screwed one time freshman year transported hospital alcohol intoxication result issued student conduct code violation placed month social probation spring semester sophomore year junior considering applying graduate schools etc wondering one else personal experience impacted application schools osi say visible record unless decide tell still would like know guess alcohol violation better academic integrity violation thanks help,positive,0.686,positive,0.14666666666666667,08/23/2019
posts,reserving rooms scheller video interviews next week middle day need scheller due time constraint possible reserve breakout rooms find option googling,neutral,0.0,neutral,-0.03125,08/23/2019
posts,chinese student uga slams kneeling dogs wants hong kong traitors die streets,negative,-0.5994,positive,0.1,08/23/2019
posts,wet friday deleted,neutral,0.0,negative,-0.1,08/23/2019
posts,popular places skateboard campus could meet fellow skaters sorry cringe,positive,0.4628,neutral,0.04999999999999999,08/23/2019
posts,bingo bongo,neutral,0.0,neutral,0.0,08/23/2019
posts,tech students interested joining fantasy football league know gt students interested kinda thing guys league play season need people get around 14 generally play 10 20 stakes winner takes happy help anyone learn play interested,positive,0.7305,positive,0.32,08/23/2019
posts,farmer market changing hey heard one typical vendors gatech farmer market going major changes year getting rid regular vendors javagenesis marrakesh express others well changing market week month even less frequently heard similar rumors school made official announcements know everyone else loved weekly farmer market would hate see go,positive,0.505,neutral,-0.03385416666666667,08/23/2019
posts,frats lit yet fam deleted,neutral,0.0,neutral,0.0,08/23/2019
posts,everyone fun wet friday posting memes,positive,0.2846,positive,0.09999999999999999,08/23/2019
posts,anybody part salsa club much experience need join generally freshmen,positive,0.4098,positive,0.125,08/23/2019
posts,ee looking buy mydaq unit anyone need mydaq anymore happy buy used,positive,0.5719,positive,0.8,08/23/2019
posts,platonic date basically really socially anxious awkward want get better speaking particularly one ones also making friend hopefully along way finally going somewhere atlanta least campus close made new friends first year forcing talk strangers everywhere bus starbucks lines class clubs get better nothing seems ever click sadly idk things feel awkward minutes talking basic conversation fuel runs without ever gaining momentum keep going also pass end day social fatigue wondering anybody would interested platonic date nearby cafe something keep simple nice chat maybe something click okay awkward silences personally mind feel anxious silence bc feel like person feels like awkward enjoy food pay meals see new friendship born shoutout fellow anxious awkward bois gals struggling gonna eat soon,positive,0.9178,neutral,-0.04309090909090909,08/24/2019
posts,ato sucks deleted,negative,-0.3612,negative,-0.3,08/24/2019
posts,get prescription contacts near campus deleted,neutral,0.0,positive,0.1,08/24/2019
posts,reputations frats say least bad experience frat today freshman considering rushing spring definitely convinced rush particular fraternity wondering people know fraternities georgia tech frats haze frats frats build good character ones lend towards toxic masculinity assault understand many topics sensitive campus long want know particular fraternities check previously heard fraternities georgia tech generally sociable people tonight shown case across board frats consider find people sociable good character would harm another without due reason,positive,0.956,positive,0.08012820512820515,08/24/2019
posts,worst wet friday time deleted,negative,-0.6249,negative,-0.55,08/24/2019
posts,canvas unpublished hey techies concerned none classes published canvas yet everyone else asked classes wondering end,neutral,0.0,neutral,0.0,08/24/2019
posts,looking rent mydaq anyone willing rent mydaq fall semester,neutral,0.0,positive,0.25,08/24/2019
posts,eduroam issues anyone else inconsistent internet connection eduroam semester never unreliable past,neutral,0.0,negative,-0.25,08/24/2019
posts,biggest party last night friday biggest party last night asking friend odksksjd,positive,0.8385,neutral,0.0,08/24/2019
posts,whiteout shirt got voucher whiteout shirt comes student season tickets buy apparently get night tomorrow go night anyone know possible get somewhere later,neutral,0.0,neutral,0.016666666666666666,08/24/2019
posts,quality college computing career fair first time ive university separate career fair cs students im omscs student would book ticket attend experience various career fairs different levels success alma matter undergrad simply took everyone resume almost one got contacted benefits would love seek opinion,positive,0.8999,positive,0.30625,08/24/2019
posts,tell us things made school unnecessarily painful hello everyone team problem finding phase capstone moment would like hear things students found unnecessarily painful straightforward instance another member state big difficulties transporting storing stuff summers internships things think difficult,negative,-0.5693,negative,-0.305,08/24/2019
posts,casual piano spot like play piano casually know select pop songs songs like since helps clear mind want heard many people nice spot campus without lot people sit play 20 minutes time,positive,0.9148,neutral,0.039999999999999945,08/24/2019
posts,trying learn html linkedin learning pretty sure supposed happen anyone know fix,positive,0.6705,positive,0.375,08/24/2019
posts,biol 1510 access code bought access code learning catalytics reason thought lab stuff already bought access code online barnes noble take thing back already scratched bought 25 want sell 15 anyone buy please,positive,0.8126,positive,0.3,08/24/2019
posts,looking buy rent mydaq semester deleted,neutral,0.0,neutral,0.0,08/24/2019
posts,cs 2110 textbook anyone interested getting introduction computing systems bits amp gates amp beyond 3rd edition together pdf version costs 98 hopping split group people please upvote dm please,positive,0.8519,positive,0.125,08/24/2019
posts,new club campus help us recycle end semester goods homeless population hey guys new club campus collects goods big small donates homeless population directly indirectly care packages plan simple small collection boxes people donate small goods end semester drive picks packs stuff might thrown away looking helping hands prepare collect boxes semester many people help us recycle things end semester hands also searching people interested marketing event organizers donation collection ambitious looking officers volunteer coordinator new member recruiter interest send us message excited new semester,positive,0.9649,positive,0.09074675324675326,08/24/2019
posts,day day pain points hello everyone capstone team process finding idea could guys please share daily inconveniences pain points example hate standing long lines would great system skip thank,negative,-0.126,neutral,-0.012500000000000011,08/24/2019
posts,friends hard work creatingthenext chant,positive,0.4019,negative,-0.2916666666666667,08/24/2019
posts,loving acc network gt tv,positive,0.7739,positive,0.6,08/24/2019
posts,ece 6282 radar imaging textbook hey anyone know might able get textbook either free less posted amazon thanks advance,positive,0.7845,positive,0.23333333333333334,08/24/2019
posts,reconsider rushing deleted,neutral,0.0,neutral,0.0,08/24/2019
posts,one student ambassadors meant foster relationships us aramark please explain group students told allowed north ave hour opened title want emphasize north avenue dining hall stated open incident occurred 15 lady said chef going let us 10 dining hall open time sundays extremely frustrating edit referenced student ambassadors aramark contract update post,negative,-0.1513,negative,-0.13333333333333333,08/25/2019
posts,mr buzz feel good,positive,0.5777,positive,0.7,08/25/2019
posts,get expelled 2nd year recently entered sexual relationship gtpd officer believe rules relationship professor sure applies gtpd get found expelled,negative,-0.6644,positive,0.25,08/25/2019
posts,white shirt deleted,neutral,0.0,neutral,0.0,08/25/2019
posts,mbmbam taz fans hi anyone likes mcelroy podcasts brother brother adventure zone happens live shows weekend aug 30 31 got tickets trying sell dm interested seats next case wondering,positive,0.8118,positive,0.12878787878787878,08/25/2019
posts,anyone marching band know make cuts senior high school wondering anyone marching band knows make cuts think read cut people drumline sure tho wondering true whole band im somewhat mediocre trumpet player auditions solely assigning parts also give instrument audition practice prior audition,positive,0.5514,positive,0.11833333333333333,08/25/2019
posts,hive open get started 3d printing also rules printing school related novelty items friends,positive,0.5632,neutral,0.0,08/25/2019
posts,recently saw lizard couch building second floor even,neutral,0.0,neutral,0.0,08/25/2019
posts,free sublime shirt every today removed,positive,0.5562,positive,0.4,08/25/2019
posts,mac repair nearby think need get new battery recommendations nearby cheap good repair places,positive,0.6381,positive,0.4121212121212121,08/25/2019
posts,pro tip fyi agree stop going papa john lucky buddha close,positive,0.6841,positive,0.3333333333333333,08/25/2019
posts,vip courses first year cs major registered vip thanks transfer credits technically sophomore reading vip faq said students sophomores major applying much programming experience need already high school,positive,0.9552,positive,0.13357142857142856,08/25/2019
posts,microsoft visio gatech students anyone success installing visio recently gatech microsoft dreamspark imagine everything different found another gatech visio thread year old longer seems applicable,positive,0.3612,positive,0.1,08/25/2019
posts,broken tooth wet weekend fixed yellow jacket alum wet weekend got best amp broke half front tooth clean frantically searching dentist fix even though sunday found dentist yellow jacket alum amp awesome job wanted post bc love yellow jacket community amp shameless plug anyone needs dentist near atlanta especially chipped teeth name dr fantaski verde point dental association marietta go jackets,positive,0.8257,positive,0.1642857142857143,08/25/2019
posts,willage piano players deleted,neutral,0.0,neutral,0.0,08/25/2019
posts,student ticket tshirt anyone know pick tshirts bought student tickets,neutral,0.0,neutral,0.0,08/25/2019
posts,georgia tech football line atl depth chart released,neutral,0.0,neutral,0.0,08/25/2019
posts,tell trolley driver turn tracking teleported burger bowl student center great hasnt moved 10 minutes thanks nothing,positive,0.7906,positive,0.30000000000000004,08/25/2019
posts,psyc 1101 advice smith psyc 1101 readings incredibly long boring necessary read textbook class succeed learning vocab,positive,0.1621,negative,-0.35000000000000003,08/25/2019
posts,way view pdf version textbook launchpad would anyone want use garbage software taking psyc1101 stanzione using launchpad everything search function fucking garbage pages take forever load 100 100 mbps internet many fucking issues even copy text make notes gives garbage macmillain learning link also trying look terms glossary textbook look term even show unless scroll close enough word loaded page oh key terms page instead displaying definition clicking term bring page first appeared takes bricks load clicking back send back main menu instead key terms page edit say want copy definition well guess trying ctrl gives fucking retarded link sends main menu,negative,-0.662,negative,-0.07638888888888891,08/25/2019
posts,clicker 20,neutral,0.0,neutral,0.0,08/25/2019
posts,white tee selling size medium white game tee sale hmu price brand new,neutral,0.0,negative,-0.06590909090909092,08/25/2019
posts,gt barnes amp noble support mass shootings deleted,positive,0.8192,positive,0.6,08/25/2019
posts,night shirtless night anyone else disappointed waited long lines different booths run shirts even got shirt size sticker hopefully replacement item empty promise get mob go away,neutral,0.0258,negative,-0.225,08/25/2019
posts,printing balance reloaded anyone else printing funds reloaded week double checked printing site still says supposed reload friday,neutral,0.0,neutral,0.0,08/25/2019
posts,physics 2212 modern anyone resources 2212 code past exams quizzes etc thanks help,positive,0.7088,positive,0.05000000000000001,08/25/2019
posts,anyone mydaq willing rent fall 2019 urgent,neutral,0.0,positive,0.25,08/25/2019
posts,free mini fridge need mini fridge one giving away want give tech student wants needs hopefully turn around sell pm,positive,0.7184,positive,0.30000000000000004,08/25/2019
posts,apksi im interested rushing apksi heard super competitive get bid wondering competitive,positive,0.8834,positive,0.29166666666666663,08/25/2019
posts,riding electric skateboard bike lane one gatechpd pulled told ride electric skateboard road bike lane believe told city ordinance true feel like unsafe ride motorized skateboard pedestrians bumps concrete blocks edit thank ofc crabtree clarifying fellow redditors answering,positive,0.7907,positive,0.25,08/25/2019
posts,acceptance deleted,positive,0.4588,neutral,0.0,08/25/2019
posts,cfb thread marching bands dealing bad fanbases,negative,-0.5423,negative,-0.6999999999999998,08/26/2019
posts,bsms computer science went counselor year program computer science super vague unhelpful website program also detailed someone help fill blanks apply program year fall spring specialize master degree computational perception robotics computer graphics computing systems etc generic curriculum bsms students help would appreciated thanks,positive,0.9587,positive,0.10555555555555556,08/26/2019
posts,collins unveil georgia tech complete transformation,neutral,0.0,positive,0.1,08/26/2019
posts,know long shot really desperate missing glasses hey lost glasses went back location likely find pair right prescription genuinely see board classes even sitting front row anyone seen pair glasses like already ordered new pair take time get amp x200b exact pair pretty close thanks help everyone,positive,0.7587,positive,0.06109799291617473,08/26/2019
posts,harrison butker featured wired video,neutral,0.0,neutral,0.0,08/26/2019
posts,tech trolley deathmobile hey tech trolley drivers next time plan turn left use damn turn signal almost plowed proceeding intersection thinking going straight learn drive,negative,-0.4263,positive,0.06666666666666667,08/26/2019
posts,late study places campus places study past midnight library open 24 hours right,neutral,0.0,negative,-0.06607142857142859,08/26/2019
posts,cs group chat want ask cs group chat already exist yes add please anyone wanna make cs group chat,negative,-0.3395,neutral,0.0,08/26/2019
posts,hoar construction building across street north ave apartments massive hill dirt,negative,-0.34,neutral,0.0,08/26/2019
posts,thought lie malicious rumors spread scare freshman last night realize true giant ass gross fuck living rat smith residency hall,negative,-0.9231,neutral,-0.010000000000000009,08/26/2019
posts,jobs college im bio major honestly im junior idea wtf graduate feel like taking classes havent really practicing anything career upsetting bc like wtf know hate went year school couldve went year school already trained wanted wasted time,negative,-0.9286,negative,-0.1625,08/26/2019
posts,recommendations processor bme major,neutral,0.0,positive,0.0625,08/26/2019
posts,tell us summer storage experience hello everyone taking capstone semester team interested problems affect college students describe experiences storing things summer instance storage location use transport things frustrations encountered thanks,negative,-0.3907,positive,0.225,08/26/2019
posts,degree possibilities possible major comp media minor cs know coc weird allow,positive,0.0516,negative,-0.121875,08/26/2019
posts,using personal electric scooter ebike night know recently new electric scooter ebike ban seems apply rentable birds lime etc wording tim keane implement daily citywide ride zone 00 00 electric scooters bikes permitted device rentable time period nighttime ban effective friday august 2019 link personal electric scooter rentable good use whenever love gtpd input thanks,positive,0.7988,positive,0.26704545454545453,08/26/2019
posts,30 credits arts sciences pathway anyone got admitted arts sciences pathway familiar minimum 30 credit hours sure 30 credit hours institution currently 30 credit hours transfer georgia tech help please started classes current institution today like environment want end stuck thanks,positive,0.9118,positive,0.215,08/26/2019
posts,friendly campus spider man,positive,0.4939,positive,0.375,08/26/2019
posts,someone tell story horsemen calc today first day hearing,neutral,0.0,positive,0.25,08/26/2019
posts,options stock trading anyone trades options day trade,neutral,0.0,neutral,0.0,08/26/2019
posts,gt sunny club hi everyone interest starting club discuss watch always sunny philadelphia basically anime club instead japanese cartoon people indiscernible age groups danny devito paddy pub gang look forward hearing cheers,positive,0.871,neutral,0.0,08/26/2019
posts,best campus nap spots especially near skiles know culc nap room heard pretty nasty need quiet place chill take power nap,positive,0.25,positive,0.09,08/26/2019
posts,ae upperclassman needed need conduct quick interview ae upperclassman ae 1601 project someone meets requirements would greatly appreciate time,positive,0.554,positive,0.5666666666666667,08/26/2019
posts,best cheapest wings atl hey everybody lookin best deals wings area also cheap thanks,positive,0.8122,positive,0.65,08/26/2019
posts,studying applied electromagnetics hey anyone good resources applied electromagnetics ece6350 maybe someone even taking fall might want join forces,positive,0.8126,positive,0.7,08/26/2019
