type,text,VADER sentiment,VADER sentiment score,TextBlob sentiment,TextBlob sentiment score,date
posts,anyone know good nap locations scheller title im tired,neutral,0.0,positive,0.14999999999999997,02/19/2020
posts,ssm decisions removed,neutral,0.0,neutral,0.0,02/19/2020
posts,ssm decision anyone received decision housing said 12 today hard release like,positive,0.3919,negative,-0.2916666666666667,02/19/2020
posts,special problem specialization elective removed,neutral,0.0,positive,0.35714285714285715,02/19/2020
posts,roommate assistance grad athens past dec unit lined midtown july 18th going gt next aug two roommates planned backed looking replacement roommates dog lab mutt 12 years old good dogs cats much sleep days poor girl smokers children cook happy others keep delighted hang keep place clean absolutely prude end day job rent listed website minimum 2100 700 piece maximum 2800 933 piece depending bedroom bath select primary modifiers yes dedicated garage fine one recently renovation already waiting list signing may 1st details found 526 centennial olympic park dr nw atlanta ga 30313 subreddits ought go let know happy migrate copy necessary,positive,0.972,positive,0.2688888888888889,02/19/2020
posts,bed bug questions anyone bed bugs personally tech tech please pm asap willing answer questions would greatly appreciate thanks,positive,0.8418,positive,0.3125,02/19/2020
posts,mold writing article mold gt housing lmc class seems like something lot students experiences anyone stories knowledge opinions would willing share would appreciate feel free message well,positive,0.9351,positive,0.325,02/19/2020
posts,workshop introduction robotics using differential drive gt ieee starting series workshops introduction robotics using differential drive robot built participants workshop workshop divided parts hardware workshop build differential drive using wooden plank motors arduino wheels software workshop tbd use robot path planning localization computer vision etc meant crash course simple robotics anticipation ieee fall hackathon robotech 2020 students work robotics project details soon hoping help students get acquainted different technologies hardware software might use limited spots available workshops moreover get arduino kits given first come first serve registration basis students purchase materials could purchase however benefit purchasing materials get keep differential robot workshops experiment students using kits get come friends split cost get work robot link interest form amp x200b edit anyone wondering robot looks like amp x200b amp x200b,positive,0.9559,positive,0.14761904761904765,02/19/2020
posts,walking klaus like,positive,0.3612,neutral,0.0,02/19/2020
posts,typically start looking home park lease preparation next school year got phone agent apartment home park seemed told student looking start lease august told would slim chance location would still available want fill soon possible understandable begin wonder supposed find locations open want start lease,positive,0.2732,neutral,0.046666666666666676,02/19/2020
posts,pimp crib sheet advice recommendations improve midterm cheat sheets happy midterm season everyone fifth year student tends create crib sheets little extra like ways take crib sheets drab fab time bunch time use ultra fine pens pencil left handed person say lightly color code pencil last well mechanical pencil lead way thick want write super small going need pens likely find office supply stores reference pens usually nib size 5mm 8mm typically use pens nib size 05mm 3mm three recommendations order price formatting kinda messed bc mobile sorry pentel arts slicci 25 mm extra fine gel pen 17 assorted colors best bang buck generally last longer less delicate felt tip would say line width puts comparable 05 1mm pens describe list next able find amazon sakura pigma micron pens per pen felt tip art pens much higher quality pentel pens love using pens tend run ink pretty quick come good range colors make pen 03mm nib one would suggest using want write textbook one sheet primarily use 05mm 1mm also use super pressed space cheat sheets buy online recommend going local art store blick sam flax test choose ones like best stores also student discounts copic multiliner pens yeah expensive probably worth price basically micron pens nicer longer lasting expensive also start nib sizes 03mm recommend buying black pens intend use heavily buy online recommend going art store use fancy schmancy art paper copy paper heaven forbid notebook paper whether took pen advice make difference pens bleed paper hold well buy paper specifically made pen drawings like heavy card stock ink spread smear favorite sold blick midtown maybe 10ish 9x12 pad last college trim size canson fanboy comic manga paper write notes thin columns page try write notes horizontally end equations side side hard follow natural flow notes definitely whole brick thing million boxes bubbles equations hard find write notes order give equation line separate columns distinct bold line try make columns wide enough fit width longest equation space spare divide columns one straight line otherwise snake line along end row ideally still want maintain semblance column number box highlight equations allow easily reference equations places cheat sheet boxing highlights makes easy find create section subsection titles seems minor really helps find stuff write section titles large bold caps bright color underline box feel inclined basically make easy find different topics key ideas color code words according meaning definition write word blue definition black equation names pink followed equation black set rules guidelines numbered list title list orange numbers orange text black examples titled another color particular extra important statements written red use one side sheet paper personal preference anything allowed one page front back use two sheets write one side like able look sheets side side going limited desk space allowed multiple pages stick using sides scan cheat sheet digital copy case gets damaged especially get reuse cheat sheet future tests spilled 4loko part dynamics cheat sheet thing still smells icky sweet day also drink 4loko trash fill remaining space example problems may similar exam questions honestly time better make sure understand use concepts bunch example problems look exam still understand material none help much 10 choose making cheat sheet crazy fancy getting sleep get necessary stuff page go bed get least hours sleep well brain scrambled sleep 11 probably try wearing red blue 3d glasses writing page red ink blue ink top guess idea able write two pages notes one page seen idea float around internet point never actually tried maybe could work mostly makes laugh cramming much one page helpful still good understanding material said making intricate cheat sheets help learn material always good necessary fit notes want probably managed fit entire semester me2016 notes plus homework practice problems four sheets final exam made class cheat sheets easy follow made organized pretty well would probably hard anyone else use shown bottom pic pretty much took exam autopilot sleep cheat sheets never extreme made far maybe found something useful maybe think little weird confirm second part true life fun little weirdness one last note remember performance tech define worth pretty damn awesome matter happens nothing important wellbeing,positive,0.9992,positive,0.13982426303854872,02/19/2020
posts,teh hell,negative,-0.6808,neutral,0.0,02/19/2020
posts,system dynamics chen removed,positive,0.2732,neutral,0.0,02/19/2020
posts,whiteboards 2nd floor library go bruh,neutral,0.0,neutral,0.0,02/19/2020
posts,shirt store hello kid goes gatech want get fun gatech tee shirts look bland son college fun tee shirts like baby yoda avengers still say name college gatech anything like,positive,0.9224,positive,0.14444444444444446,02/19/2020
posts,taking semester removed,neutral,0.0,neutral,0.0,02/19/2020
posts,spoiler negotiations short,neutral,0.0,neutral,0.0,02/19/2020
posts,readmissionpolicy removed,neutral,0.0,neutral,0.0,02/19/2020
posts,ferst drive walk sign cross ferst drive,neutral,0.0,neutral,0.0,02/20/2020
posts,gt bus services green route especially bad 30am raining buses routes active already one lonesome green bus connects big chunk somewhat isolated campus students classes,negative,-0.4151,negative,-0.30666666666666664,02/20/2020
posts,horizons arts tech make thon applications closing sunday open majors skill levels come learn something new us,neutral,0.0,positive,0.06818181818181818,02/20/2020
posts,taco combo chips amp salsa good day good day,positive,0.7003,positive,0.7,02/20/2020
posts,prospective students visiting gatech passed tour guide telling parents football tickets free gotta get 60 season passes real truth free week game readily available long get day game sometimes tickets left though get free tickets,negative,-0.719,positive,0.10555555555555556,02/20/2020
posts,cs 1332 gt cs 1331 genuinely enjoy cs 1332 good damn time cs major,positive,0.5267,positive,0.3875,02/20/2020
posts,left hat red bus looks like,positive,0.3612,neutral,0.0,02/20/2020
posts,registered vote stop grace house 182 5th st today 30 grab free coffee get registered,positive,0.6939,positive,0.4,02/20/2020
posts,econ 2100 2101 2105 2106 soup class syllabus removed,neutral,0.0,neutral,0.0,02/20/2020
posts,isye 3770 hsiang lee removed,neutral,0.0,neutral,0.0,02/20/2020
posts,bolo justyce paige ross harris amp x200b justyce paige 18 ross harris 30 wanted atlanta police department armed robbery georgia tech student occurred january 31st 15pm biltmore place atlanta police department able identify paige harris collaborative efforts technology used marta police department georgia tech police department information regarding whereabouts paige harris contact atlanta police department 404 577 8477 remain anonymous may eligible reward,positive,0.5719,positive,0.5,02/20/2020
posts,test deleted,neutral,0.0,neutral,0.0,02/20/2020
posts,personalized logo design removed,neutral,0.0,neutral,0.0,02/20/2020
posts,need new adderall plug removed,neutral,0.0,positive,0.13636363636363635,02/20/2020
posts,strategic plan ga tech know like every new president strategic plan may difficult see progress amount things go campus positive negative think duty give honest feedback check strategicplan gatech edu let get voices heard,positive,0.9108,neutral,0.032727272727272716,02/20/2020
posts,isye 3370 hsiang lee removed,neutral,0.0,neutral,0.0,02/20/2020
posts,regular marta rider needed around clough removed,neutral,0.0,neutral,0.0,02/20/2020
posts,puzzle dragons stream viewing party official stream today anyone interested watching together,positive,0.6041,positive,0.25,02/20/2020
posts,ihouse gatech hey got accepted ihouse wanted ask questions distribution nationalities mostly american internationals europeans asians latinos africans americans etc typical major distributions people typically outgoing cool generally like live type person would like live house think anything else think important feel free weigh,positive,0.9499,positive,0.12018939393939394,02/20/2020
posts,georgia tech security beyond dumb new security systems implemented semester make want scream library new hours goes lock mode starting ridiculously early 30 end extremely late morning weave around construction worry getting hit cars get inside depending time day told turn turn around go street reenter building different location ridiculous security ass matter buzz card cold raining told rude tone following rules dismissed system makes zero sense fed petition going around change dumb system really pissing wastes time tired already ridiculous hoops jump school keeping students georgia tech safe security guards really nothing better time micromanage students amp x200b georgia tech care students systems implementing school waste everyone time money new dean done nothing improve school far tell made even worse thus far ok rant,negative,-0.993,neutral,-0.0483030303030303,02/20/2020
posts,every single time deleted,neutral,0.0,negative,-0.07142857142857142,02/20/2020
posts,doctor note makeup exam removed,neutral,0.0,neutral,0.0,02/20/2020
posts,makeup exam doctor note deleted,neutral,0.0,neutral,0.0,02/20/2020
posts,cs bs ms questions hello everyone questions regarding cs bs ms program someone explain specializations work free choose two specializations currently threads devices intelligence wanted take graduate level computer graphics course could also would appreciate comments general cost program thank,positive,0.9027,positive,0.15000000000000002,02/20/2020
posts,team joby aviation hiring want new coworker tech grad hey guys team joby aviation looking hire junior flight test engineer join world class flight test team joby aviation venture backed evtol startup based bay area mission save billion people hour day enabling dimensional urban mobility recently announced closing series course learn joby website extremely proud tech alum would absolutely love someone tech hopefully ae join team position approved two days ago want give tech students alums headstart process looking someone flight test experience belt definitely consider fresh graduates reach personally questions selective hire distinct culture venture funded startup startup mentality must looking cozy 24 365 hustle fundamentally change travel gt grad bsae 2016 msae 2018 hats currently wear joby flight test system safety failure modes effects testing flight controller analysis evaluation sim validation modeling system identification note share outside tech yet want give yellow jackets headstart start spreading word good luck,positive,0.9818,positive,0.147979797979798,02/20/2020
posts,apartment available next year removed,neutral,0.0,positive,0.2,02/20/2020
posts,ae school shirts removed,neutral,0.0,neutral,0.0,02/20/2020
posts,ae school shirts deleted,neutral,0.0,neutral,0.0,02/20/2020
posts,ae school shirts,neutral,0.0,neutral,0.0,02/20/2020
posts,bsms thesis removed,neutral,0.0,neutral,0.0,02/20/2020
posts,housing fill fast im pathway transfer program going going tge fall wont get acceptance letter till may good housing options gone,positive,0.1606,positive,0.44999999999999996,02/20/2020
posts,parking gt campus summer removed,positive,0.4278,neutral,0.0,02/21/2020
posts,parking campus removed,neutral,0.0,neutral,0.0,02/21/2020
posts,free talk friday ama gtpd social media team good morning jackets recently made new additions social media team georgia tech police department today like give chance ask questions want know us social media team gtpd whole answering questions 10am 5pm go ahead comment questions gtpd social media team made primarily students answer questions gtpd whole knowledge restricted regarding social media thank,positive,0.7475,positive,0.1835858585858586,02/21/2020
posts,saw thought us make sure eat shower get fresh air even weekends,positive,0.5574,positive,0.4,02/21/2020
posts,fills back keep,neutral,0.0,neutral,0.0,02/21/2020
posts,cs majors gtl fall 2020 would mind telling decided go year considering,neutral,0.0,neutral,0.0,02/21/2020
posts,quick survey junior design several gt students working junior design project wanted gather feedback ensure make something everyone able enjoy project new take audio tours museums making users get variety perspectives exhibits specific interests link survey take minutes complete,positive,0.8636,positive,0.20995670995670995,02/21/2020
posts,peak student performance,neutral,0.0,neutral,0.0,02/21/2020
posts,staying informed issues,neutral,0.0,neutral,0.0,02/21/2020
posts,stallworth solve cs problem need make pikachu ascii values solves problem stallworth deleted,negative,-0.2942,neutral,0.0,02/21/2020
posts,bars showing wilder fury fight called 10 bar restaurants luck anybody know places showing wilder fury fight tomorrow night,negative,-0.8957,neutral,0.0,02/21/2020
posts,used vpn could pirate using eduroam removed,neutral,0.0,neutral,0.0,02/21/2020
posts,fair fight georgia tech new student organization promoting voting voting rights read nothing else registration deadline voting ga primary coming monday feb 24th please register vote voice heard election data click check registration register vote bit us student chapter fair fight action fair fight organization advocates right vote recent efforts suppress voting states including georgia student chapter goal engage georgia tech around voting making sure registered ready exercise rights election day motivates us 214 polling locations 20 closed georgia 2012 2018 third state time period accounts 13 polling location closures us time frame source source million georgia voters purged roles 2012 2018 although someone previously registered vote may unable source 34 voters 18 24 fulton county voted 2018 election worst turnout rate age range fulton county source data secretary state get involved check registered georgia registered vote yet monday 24 eligible vote primary elections also follow instagram posting voting deadlines dates current events voting rights ga events campus friends drop links group messages help get friends registered remember yearly purges voter rolls happening make sure friends get caught guard election day campus really like voting rights help us get word around campus join slack stay updated efforts get involved feel free comment dm questions also interested collaborating organizations feel free dm us instagram reddit something organization interested,positive,0.9866,positive,0.18936570675701112,02/21/2020
posts,anybody else get asked feet pics happened turning head trying figure normal thing happen,neutral,0.0,positive,0.15,02/21/2020
posts,national guard bcc everyone time reply deleted,neutral,0.0,neutral,0.0,02/21/2020
posts,klaus tower since isye getting georgia tower business school getting scheller tower plz get tower may bigger two mr klaus plz santa klaus,positive,0.2406,neutral,0.0,02/21/2020
posts,scpc presents spring comedy show featuring trevor wallace attention georgia tech students faculty staff get ready march 3rd comedian trevor wallace performing ferst theater spring comedy show doors open 00 pm show begin 30 tickets sale prices follows students 10 guest 10 faculty get last show want miss trevor wallace stand comedian actor based los angeles wallace seen everywhere internet collectively built digital thumbprint 300 million views since 2018 wallace also original cast member wildly popular youtube channel def digital also featured comedy central buzzfeed unilad funny die super deluxe fusion tv ifc worldstar hip hop 9gag reddit amp mtv2 wallace performs comedy clubs colleges country biggest names although biggest accomplishment told beautiful hair todd glass questions concerns please contact amp x200b,positive,0.9785,positive,0.24679487179487178,02/21/2020
posts,scpc presents rollin decades ever wanted transported decades join us throwback themed rollerskating skate groovy tunes eat tiff treats play twister come rock disco themed photo booth come student center ballroom february 29th 00 10 00 pm rollerskating skates provided questions accommodations please email amp x200b,positive,0.7767,negative,-0.1,02/21/2020
posts,national guard recruiter know bcc ae undergrads amp x200b,neutral,0.0,neutral,0.0,02/21/2020
posts,extra graduation tickets removed,neutral,0.0,neutral,0.0,02/21/2020
posts,tis well could seems someone hath stolen,negative,-0.2732,neutral,0.0,02/21/2020
posts,tis well could seems someone hath stolen,negative,-0.2732,neutral,0.0,02/21/2020
posts,tech students wrote math equations glass gladiators game go jackets deleted,neutral,0.0,negative,-0.4,02/21/2020
posts,gt always like,positive,0.6523,neutral,0.0,02/21/2020
posts,future professors way knowing teaching classes next semeseter semsters future cs 3600 specifically,neutral,0.0,neutral,0.0,02/21/2020
posts,guy whistles,neutral,0.0,neutral,0.0,02/21/2020
posts,omscs application deleted,neutral,0.0,neutral,0.0,02/22/2020
posts,loner meetups hey trouble making friends campus people around really interested making friends seem like matter hard try make conversation ya still cant keep anyone well come one meetups originally started gsu expending school groups close reopening starting group made people want meet hang people around campus friendships last longer groupme made class discord,negative,-0.4501,neutral,0.022222222222222216,02/22/2020
posts,prospective student question deleted,neutral,0.0,neutral,0.0,02/22/2020
posts,looking paid spring semester tech co internship scheller comm econ etc majors looking biz dev growth role deleted,positive,0.3818,neutral,0.0,02/22/2020
posts,one goes class groupme buddies vip research clubs teammates og squad pals tech hard feel isolating times make worth thank deleted,positive,0.6597,neutral,0.004166666666666652,02/22/2020
posts,chance three year gap year immigrant georgia tech recently moved us instate georgia tech really want get following stats sat 1570 math ii 780 chemistry 760 levels 3as levels 2as 3bs ecs worked ai edtech startup whole gap years freelance webdev business mern stack lots international clients worked years startup supplied posters people country self taught musician co founded high school music club founded ngo raise awareness mental health home country,positive,0.5849,positive,0.06571428571428573,02/22/2020
posts,disc golf georgia tech removed,neutral,0.0,neutral,0.0,02/22/2020
posts,disc golf georgia tech enjoy frisbee like walking park disc golf gives ever interested disc golf currently play looking get involved unique rewarding outdoor activity feel free join slack dm reddit play every weekend practice week join us whenever free email,positive,0.9795,positive,0.33214285714285713,02/22/2020
posts,found car keys 2nd floor culc turned front desk,neutral,0.0,neutral,0.0,02/22/2020
posts,found car keys 2nd floor culc turned front desk,neutral,0.0,neutral,0.0,02/22/2020
posts,minor russian removed,neutral,0.0,neutral,-0.025,02/22/2020
posts,minor russian removed,neutral,0.0,neutral,-0.025,02/22/2020
posts,minor russian hello admitted gt fall 2020 thinking declaring minor russian mostly interested reading russian literature know minor probably enough read works russian hoping coursework would emphasis russian literature asking anyone familiar russian program recommend also take suggestions literature intensive minors instead russian think minor science technology society also fits looking certain thank,positive,0.3498,neutral,0.04261904761904762,02/22/2020
posts,,neutral,0.0,neutral,0.0,02/22/2020
posts,1098 2019 saw posts sub end last month saying able access 2019 1098 form bursar website checked says form available anyone else able access form yet thought supposed released beginning month edit bursar page looks like,positive,0.5023,positive,0.35,02/22/2020
posts,cs6515 cs 6476 offered every semester removed,neutral,0.0,neutral,0.0,02/23/2020
posts,scared yellow jacket removed,negative,-0.4404,neutral,0.0,02/23/2020
posts,buzz extended collegiate family around country came upon link website looking something else realize many colleges yellow jackets wasps hornets mascots enjoy,positive,0.4939,positive,0.3,02/23/2020
posts,georgia tech physicists unlock secret perfect wok tossed fried rice,positive,0.5719,positive,0.3,02/23/2020
posts,sophomores live freshman dorms deleted,neutral,0.0,positive,0.13636363636363635,02/23/2020
posts,stages life,neutral,0.0,neutral,0.0,02/23/2020
posts,facebook group sell stuff bought scooter gf one broken manufacturer made scooter free kinda wants get rid one want use craigslist sketch tried looking fb gt free sale type thing see know could get rid,positive,0.9064,positive,0.15000000000000002,02/23/2020
posts,klaus water fountain weird taste removed,negative,-0.1779,negative,-0.5,02/23/2020
posts,applying rep program give advantage prospective transfer student ksu know apply regular repp electrical engineering know ga residents applying regular transfers 50 50 chance find data rep thanks edit doesnt matter anymore got tech summer yayyy,positive,0.7514,positive,0.06666666666666667,02/23/2020
posts,free cheap furniture removed,neutral,0.0,positive,0.4,02/23/2020
posts,ken byers tennis center tennis center open students public exclusively team club play,positive,0.4479,negative,-0.05,02/23/2020
posts,message lightweights upstairs removed,neutral,0.0,neutral,0.0,02/23/2020
posts,accurate introduction,neutral,0.0,positive,0.4000000000000001,02/23/2020
posts,grea job,neutral,0.0,neutral,0.0,02/23/2020
posts,transfer housing pathway anyone know dorm current student georgia tech know pathway transfers usually housing left get stuck woodruff friend asked able dorm friends current student,positive,0.8276,positive,0.05,02/23/2020
posts,physics count lab science electives removed,neutral,0.0,neutral,0.0,02/23/2020
posts,getting hand,positive,0.4939,neutral,0.0,02/23/2020
posts,way unlock extra empty room nave apartment deleted,negative,-0.2023,negative,-0.05,02/24/2020
posts,fire near campus saw huge fire near library techwood,negative,-0.4329,positive,0.20000000000000004,02/24/2020
posts,changes reporting time hi everyone important changes student employees report time oneusg connect reminder oneusg connect launches week march 22nd,positive,0.2714,positive,0.4,02/24/2020
posts,today deadline register vote democratic primary ga article outlines check status register amp x200b edit direct links comment register vote requires dds issued photo id register online still fill forms online print mail check registration status get sample ballots,neutral,0.0,positive,0.25,02/24/2020
posts,gt like torture mental health lower level classes deleted,negative,-0.1943,negative,-0.1,02/24/2020
