type,text,VADER sentiment,VADER sentiment score,TextBlob sentiment,TextBlob sentiment score,date
posts,anyone went cellairis atlantic station screen repairs go ok fix screen properly kind paranoid getting iphone fixed 3rd party thanks advance,positive,0.6071,positive,0.28,02/29/2020
posts,tech vs uga campus campus life anyone transferred uga tech would able describe campus campus life different im currently uga probably transferring tech honestly really love uga campus dining halls really enjoy big campus large student population also applicable tech gym compare ramsey thanks,positive,0.969,positive,0.22678571428571426,02/29/2020
posts,look optimists,neutral,0.0,neutral,0.0,03/01/2020
posts,anyone know find list courses skip taking proficiency test deleted,neutral,0.0,neutral,0.0,03/01/2020
posts,placement exam get cs 2050 yes googled still find anything looked syllabus seems fairly doable since already done discrete math like much rather tolerate couple months studying summer deal entire semester,positive,0.1506,positive,0.3,03/01/2020
posts,wreckless trivia free food prizes removed,neutral,0.0,positive,0.4,03/01/2020
posts,ga tech ut cs removed,neutral,0.0,neutral,0.0,03/01/2020
posts,good luck everyone,positive,0.7568,positive,0.7,03/01/2020
posts,people graduated graduating semester year 1st 2nd 3rd 4th later favourite years spent gt,positive,0.4278,neutral,-0.025,03/01/2020
posts,chef boyardee strikes thank least courtesy cook afternoon instead midnight,positive,0.3612,negative,-0.3,03/01/2020
posts,cs 1332 math 1554 summer hey summer transfer student uga currently taking data structures however ga tech give cs 1332 credit like catch friends georgia tech two classes would allow classes fall semester wondering two classes reasonably doable together without getting overloaded work would imagine classes pretty rough summer due timeframe given friends experience summer classes tips would greatly appreciated,positive,0.9544,positive,0.07083333333333333,03/01/2020
posts,anyone know non cs majors take cs 1331 hard get cs 1331 possible fall transfer physics major trying get minor cs,negative,-0.1926,negative,-0.06979166666666667,03/01/2020
posts,truth school removed,positive,0.3182,neutral,0.0,03/01/2020
posts,bring friends join us trivia night come fun food prizes,positive,0.8475,positive,0.3,03/01/2020
posts,know stealing tradition please take ts hall floor decorations ssms spend lot time making coming home weekend campus see hurts,positive,0.1531,neutral,0.0,03/01/2020
posts,gt start facilities currently choosing uga gt want something involving statistics finance hoping majoring go uga industrial engineering gt yall think yall break pros cons going uga vs tech major well general also hope start company college athens area people good fit would better gt atl thinking terms talent school funding heard gt something called createx exactly really support creating start ups students gt,positive,0.9905,positive,0.2732142857142857,03/01/2020
posts,north avenue cooking class annoyed 4th time week due fire alarms offering basic cooking class apartment free charge requires prior knowledge cooking everyone north ave east required attend main points follows burn shit food popcorn button microwave best setting popcorn turn oven stovetop leave main area assume food fine start sign sheet session minutes long edit first silver name hating school love,negative,-0.2187,positive,0.16346153846153846,03/01/2020
posts,study abroad tech removed,neutral,0.0,neutral,0.0,03/01/2020
posts,voter education night grace house head grace house 182 5th st nw tuesday night march 3rd 7pm hear brief history voter rights us learn voter rights polls year grace house us civics policy expert emma menardi presenting amp x200b amp x200b edited clarity,positive,0.893,neutral,0.0,03/01/2020
posts,lost keys removed,negative,-0.3182,neutral,0.0,03/01/2020
posts,coronavirus ga please removed,negative,-0.296,neutral,0.0,03/02/2020
posts,lost laptop charger coda removed,negative,-0.3182,neutral,0.0,03/02/2020
posts,place give technical software talk around campus applying job requires technical speaking sample never done technical talk although plenty public speaking experience trouble finding places could get chance anyone know places tech maybe clubs events need want technical speaking content able give talk workshop web stuff building apis building basic websites building web apps react mobile stuff building apps react native programming language stuff javascript go systems programming stuff high level overviews operating systems work prepared talk cs3210 final project implementing libc xv6 focuses abstractions make computers work software engineering career skills git bash command line contributing open source building resume topics sound like something org event would need speaker drop line,positive,0.3076,positive,0.07166666666666667,03/02/2020
posts,gt groupchat deleted,positive,0.4278,neutral,0.0,03/02/2020
posts,ama student center construction,neutral,0.0,negative,-0.1,03/02/2020
posts,take community schools tech survey hi jackets posted weeks ago _still_ taking look schools campus hoping judge well foster community students would greatly appreciate help getting enough responses significant survey takes minutes helpful determine initiatives prove valuable schools show room growth thank,positive,0.9871,positive,0.39166666666666666,03/02/2020
posts,travelers institute host technology innovation cybersecurity symposium georgia tech,positive,0.3818,neutral,0.0,03/02/2020
posts,transfer change major removed,neutral,0.0,positive,0.0625,03/02/2020
posts,pcb equipment idc may stupid question required get training pcb fab equipment idc use buddy pi got sums email training confused,neutral,-0.0387,negative,-0.6,03/02/2020
posts,looking cs research summer tips labs available summer open first time researchers title,neutral,0.0,positive,0.21666666666666667,03/02/2020
posts,dr richard tapia speaks ferst center tuesday march 2020 00 pm 30 pm unlikely journey barrios los angeles white house amp national medal science,positive,0.4767,negative,-0.19999999999999998,03/02/2020
posts,tutoring 1331 anybody interested tutoring 1331 please dm,positive,0.6124,positive,0.25,03/02/2020
posts,housing fall removed,neutral,0.0,neutral,0.0,03/02/2020
posts,20 gatech weekly event megathread know events campus around atlanta let us know subreddits atlanta weekly events,neutral,0.0,neutral,0.0,03/02/2020
posts,anyone knows anything master science global media cultures,neutral,0.0,neutral,0.0,03/02/2020
posts,spring break stranded students planning going home staying us summer could see parents country live heavily restricted travel due covid 19 plans cancelled fun events atl last minute holiday plans spring break,positive,0.4767,neutral,0.022272727272727267,03/02/2020
posts,soccer mommy concert anyone else going soccer mommy concert march 26 forming group gatech students pm ur interested going,positive,0.7418,positive,0.25,03/02/2020
posts,elevator noise library year ago discussions regarding loud sound library elevator floor library said meeting student representatives actually happened still getting distracted sounds solution simply use headphones seen studying museum detrimental reading comprehension providing earplugs noice loud useless,negative,-0.504,neutral,0.016666666666666663,03/02/2020
posts,telling us dowjones 000 week sickness death rate sure something else removed,negative,-0.3818,positive,0.5,03/02/2020
posts,gt wf grades discrete math right considering dropping website says gt assign wf grades one however says confused drop discrete get wf lose zell,negative,-0.2634,negative,-0.05714285714285716,03/02/2020
posts,potential day accommodation request approx 30 university texas students friend mine last internship part non profit organization called texas 4000 raise cancer awareness donations receive goes straight cancer research support services every year group 100 students university texas make 70 day 687 mile bike trek texas campus austin texas anchorage alaska three routes 30 students taking ozark route atl stop along way would trekking way auburn alabama 12 stopping near atlanta couple nights would headed north towards tennessee long ride auburn needless say deserve rest link organizations page email want look ozark route students trekking org page bike route page affiliated organization however posting behalf friend texas 4000 organization see would way accommodate 30 students two nights middle june emailed gt housing department week ago said house gt students unfortunately would frats sorority houses generously willing accommodate 30 students two days 13 14 accommodation even floor space common areas would sufficient dont know reach anyone knows contact method would great additionally anyone knows method accommodate students two days information regarding would huge help help would greatly appreciated support organization charity event please reach asap,positive,0.978,neutral,0.04615384615384616,03/02/2020
posts,ramblin informal student led discussion group next ramblin session tomorrow 30pm rsvp ramblin place students open heard peers without engaging formal counseling services sessions consist student led discussions small groups touching different topics time mental health relationships academics donuts provided sessions rsvp spots limited sessions future well tuesday dates 24 wednesday dates 11 use link rsvp upcoming session throughout semester feel free reply post questions thanks,positive,0.6864,positive,0.09805194805194807,03/02/2020
posts,changing majors transfer removed,neutral,0.0,neutral,0.0,03/02/2020
posts,jason rich inta 1200 lecture notes removed,positive,0.5574,positive,0.375,03/02/2020
posts,gym etiquette tldr many people crc aware much time spend singular machine especially big groups block paths areas let people work limit phone use changing songs returning texts youtube videos netflix unless cardio machine go use multiple machines creep girls happy lifting friends hello people 3rd year crc regular entire time always noticed stuff crc ticks always tried ignore frankly way many people school crc even another built help maybe think would best etiquette explained people starting gym really sure stuff works time sets take length breaks need workout type rest longer minutes extreme strength training prs types workouts see crc 30 90 seconds rest really crowded day taking long breaks backs everything much everyone worst thing see people casually phones using social media watching youtube saw one guy lay bench watch entire 13 minute video people came workout waste time shared space person putting sweet sweaty work large groups school others worked separate universities people love come large groups completely fine however keep mind taking much time machines thread mandatory breaks someone else group using machine problem comes group comes grabs machine minutes separate people going conversing sets seen many groups spend 30 lt minutes machines could finished 15 amount machines use time acceptable use one machine cable machines group alternating timely manner another part take free weights absolutely need anyone sets dumbbells bench want drop set get front weights put back set move next set large group two machines except cardio take one take turns rotate reasonable speed fine spatial awareness things tight crc extremely important hit anyone weight middle lift happen times extreme injury hazard better wait 20 seconds tear someones rotator cuff trying stabilize weight putting weights back take something somewhere put back goes hard blocking paths put weights way walking paths front racquetball courts place weighted lunges done also group 15 form plank circle way everyone rest kind miscellaneous things ok get creative workouts using cable machines low rows set dumbbells machine sets break machine ok take bars benches racks curls someone asks work nice let notice someone waiting machine using know done tell maybe offer let work ok make noises lifting need scream lightweight baby 185 lb bench need spot ask people happy help sometimes people might try correct form hard tell genuinely worried getting hurt want flex knowledge know see someone confused something generally try help guys gym place hit girls go get fit dudes,positive,0.991,positive,0.18592314118629913,03/02/2020
posts,anyone going watsky next month hmu anyone go,neutral,0.0,neutral,0.0,03/02/2020
posts,taking classes changing majors removed,neutral,0.0,neutral,0.0,03/02/2020
posts,gt degree undervalued removed,positive,0.4278,neutral,0.0,03/02/2020
posts,people see gt ok clearly undervalued employers kinda started post seeing ripping poster anything wanted give context seen gt vs uga posts subreddit wondering gt brand undervalued especially people state maybe cause gt easier get state lot people know seems status quo idk seems odd someone would make post comparing world class program case literally program one regionally known speaking someone grew across country never even heard uga coming since follow college sports meanwhile seems every engineer know back home even plenty teachers lot classmates high school knew georgia tech good engineering school course knew since applied met plenty oos kids turned places like mit ivy leagues come since cheaper idk something interesting noticed maybe growing around gt makes people value much something theory upset anything thought interesting wanted see people noticed thing,positive,0.9878,positive,0.24933333333333332,03/02/2020
posts,people see gt deleted,neutral,0.0,neutral,0.0,03/02/2020
posts,people see gt deleted,neutral,0.0,neutral,0.0,03/02/2020
posts,people see gt deleted,neutral,0.0,neutral,0.0,03/02/2020
posts,georgia governor kemp calls 10 pm press conference likely coronavirus related removed,neutral,0.0,neutral,0.0,03/02/2020
posts,georgia governor kemp calls 10 pm press conference likely coronavirus related removed,neutral,0.0,neutral,0.0,03/02/2020
posts,switching majors removed,neutral,0.0,neutral,0.0,03/02/2020
posts,covid 19 confirmed georgia,neutral,0.0,positive,0.4,03/02/2020
posts,official georgia confirmed cases coronavirus gov brian kemp currently holding press conference right travel related case person person infection representative task force cases fulton county county us isolated feeling well stay home stay healthy jackets,negative,-0.3544,positive,0.23714285714285716,03/02/2020
posts,nice,positive,0.4215,positive,0.6,03/02/2020
posts,dear pts always fucking mess would make every midnight rambler inactive years bullshit time transfer school gives fuck,negative,-0.8609,negative,-0.2875,03/02/2020
posts,transfer applicant lab science class removed,neutral,0.0,neutral,0.0,03/02/2020
posts,love limon chile chips,positive,0.6369,positive,0.5,03/02/2020
posts,gotta love money shot,positive,0.6369,positive,0.5,03/03/2020
posts,academic inquiry dear yellow jackets deleted,positive,0.3818,neutral,0.0,03/03/2020
posts,sga budget meetings way find goes sga budget meetings organizations recordings anywhere,neutral,0.0,neutral,0.0,03/03/2020
posts,apartment recommendations removed,neutral,0.0,neutral,0.0,03/03/2020
posts,covid19 removed,neutral,0.0,neutral,0.0,03/03/2020
posts,sometimes upvotes mostly lurks deleted,negative,-0.3291,positive,0.5,03/03/2020
posts,thwg guys jerks deleted,negative,-0.2732,neutral,0.0,03/03/2020
posts,saa giving day event year last years gt alumni association saa giving day near campanile saa members could write letter something get bunch free food shirt happening year got couple emails gtaa claiming today giving day mention actual event requests donations,positive,0.4813,positive,0.125,03/03/2020
posts,trevor wallace tonight removed,neutral,0.0,neutral,0.0,03/03/2020
posts,corona virus question removed,neutral,0.0,neutral,0.0,03/03/2020
posts,petition deleted,neutral,0.0,neutral,0.0,03/03/2020
posts,coronavirus removed,neutral,0.0,neutral,0.0,03/03/2020
posts,blue buses move one behind catches,neutral,0.0,negative,-0.2,03/03/2020
posts,atlanta creative agency looking creatives participate monthly consumer panels hey alum reaching recruit new creative minds attend monthly creative club events would join creative minds work design challenges explore potential new products concepts participants compensated refreshments provided follow link interested signing,positive,0.9508,positive,0.31534090909090906,03/03/2020
posts,birds roosting tree,neutral,0.0,neutral,0.0,03/03/2020
posts,think temporarily closing georgia tech protect students faculty members removed,positive,0.3818,neutral,0.0,03/03/2020
posts,smith case members georgia tech community light recent increase cases coronavirus worldwide want update campus measures taken safeguard students faculty staff atlanta campuses abroad part international programs hosted throughout world first foremost encourage everyone follow appropriate preventative strategies recommended centers disease control prevention cdc wash hands regularly avoid touching eyes nose mouth cover coughs sneezes tissues avoid close contact people sick stay home experiencing symptoms illness illness common cold flu cough please stay home take care better help slow spread sickness working faculty allow excused absences cases like visit www cdc gov coronavirus 2019 ncov find prevention measures addition previously communicated canceled spring programs china south korea italy also preemptively cancelled china summer program continue uphold travel notice china issued university system georgia usg jan 31 advised faculty cancel travel commitments countries currently cdc level notice china south korea italy iran also established coronavirus task force lead preparation coordination institute response event operations affected asked chief staff frank neville chair group members include rob connolly chief police erika gravett deputy director human resources laura gustavson emergency management coordinator emergency management kasey helton vice president campus services jennifer herazy chief administrative officer academic affairs research dr ben holton senior director health services pooja juvekar undergraduate president student government association pinar keskinocak professor industrial systems engineering renee kopkowski vice president institute communications keith mcbride chief staff georgia tech research institute jim mcgarrah interim vice president information technology ajay patel director purchasing purchasing procurement jennifer rhodes project manager principal information technology narayan shirolkar graduate president student government association smith director emergency management john stein vice president student life dean students nazia zakir assistant vice president environmental health safety task force convened yesterday begun engage key units plan safety well students faculty staff atlanta abroad well start continuity planning case normal campus operations interrupted work help georgia tech prepare broader range potential future concerns beyond current public health threat following usg guidance concerning students international travel coming days task force considering recommendations faculty staff travel coming days conducting inventory personal protective equipment disinfectant cleaning supplies hand sanitizer currently available multiple departments campus placing additional orders ensure sufficient stockpiles items hand addition building services custodial staff alter building cleaning practices focus surface cleanliness disinfection coordinating plans federal state authorities well usg closely monitoring ongoing outbreak asia europe offered direction institutions line guidance cdc state department georgia department public health encourage visit usg resource guide latest information concerning travel advisories guidance www usg edu coronavirus continue learn keep updated regular communications communications archive located health gatech edu coronavirus please direct questions ángel cabrera,positive,0.9477,neutral,0.03932411674347159,03/03/2020
posts,two types tech people either two types people tech complain everyone everything complain people complain everyone everything good day,negative,-0.5574,positive,0.7,03/03/2020
posts,psa corona virus life university removed,neutral,0.0,neutral,0.0,03/03/2020
posts,asking important questions,positive,0.2023,positive,0.4,03/03/2020
posts,campus response covid 19 letter president cabrera removed,neutral,0.0,neutral,0.0,03/03/2020
posts,wrong wearing mask heard people even cdc saying wear mask unless sick truth people transmit covid 19 virus without showing symptoms temperatures checked people arrived us airport heavily infected regions already cases fulton county virus around us wrong protecting wearing mask,negative,-0.8948,negative,-0.4785714285714286,03/03/2020
posts,bus trolley sign,neutral,0.0,neutral,0.0,03/03/2020
posts,refunds cancelled study abroads people signed study abroad program later cancelled due coronavirus china south korea italy get refund program fee charges registered georgia tech berlin summer program provide estimate much could refunded case program cancelled program actually cancelled situation going directly analogous think help know whether people programs cancelled due coronavirus got money back,negative,-0.7757,neutral,0.007142857142857145,03/03/2020
posts,housing dorms deleted,neutral,0.0,neutral,0.0,03/03/2020
posts,tarp construction fence hemphill black tarp chain link fence construction hemphill 8th seems super unsafe crosswalks pedestrian see traffic coming north hemphill towards 10th street driver see anyone approaching crosswalk right top,positive,0.6908,positive,0.19047619047619047,03/03/2020
