type,text,VADER sentiment,VADER sentiment score,TextBlob sentiment,TextBlob sentiment score,date
posts,three tips people going back class semester science tl dr made video three tips college students help better semester time temperatures falling pollen gone away august atlanta falcons losing preseason games fall semester upon us whether dragging back campus showing fresh faset gonna tough spots semester someone got tm last year thought research helpful tips share make planner maintain planner love planner either get paper planner use google calendar scratch nave roommates door care set planner first put class times locations cause forget things going like work clubs sandstorm meditation also schedule yes schedule time sleep come back second next suggest scheduling one two weekly blocks time go somewhere whatever work need week lastly block little time cause taking care important strive 100 productivity recent meta analysis 94 independent studies showed people made plan would take goal directed actions likely stick actions avoid negative influences recognize goal related opportunities choose use planner well find meaning hell week month soon enough start building good habits like right ever notice get finals week even though actually kinda want study crack range seem pull away rewatching japanese dub king hill build habit regular studying throughout semester subconscious mind resisting feels uncomfortable something call subconscious homeostatic impulse widely accepted scientific term trying keep short essentially well established neural pathways relating frequent behaviors actions take less thought energy brain would really like keep taking actions brain uses lot energy overall actions kept alive far lucky us works ways make brain prefer habits help start little earlier november really reap benefits come finals sleep please look man reading matthew walker sleep basically scared straight far sleep concerned apparently sleep deprivation literally problem jokes aside getting enough sleep causes plethora negative side effects body mind one directly related tech impacts ability learn hold info short term memory really bake goods need store long term memory via memory consolidation important factor memory consolidation sleep specifically stage nrem sleep get first half night staying watching shrek 3d 4am every night missing lot stage nrem sleep even sleep late compensate reduced learning ability one reasons nighters dumb hate anyway hope helps someone follow tips nightmares watching football team trying figure passing ball works,positive,0.9615,neutral,0.02011974380395435,08/16/2019
posts,rising sophomore course schedule looking take 1770 dorozhkin coe 2001 zhou math 2552 yao 2016 guillot easy elective class people taken classes schedule look like much keep,positive,0.6597,positive,0.31666666666666665,08/16/2019
posts,confused gt parking rule moving car lot used games parking lot used 18 alternate parking location e66 thought could park non residential lots e66 residential lot stated image deleted,positive,0.1363,negative,-0.2,08/16/2019
posts,parking price alternate methods transportation new transfer student tech living campus 10 minutes car northeast campus wondering hacks parking since annual semester passes expensive 795 yr 400 sem car thinking maybe taking marta bus train conjunction tech trolley would save lot money thanks edit went parking transportation services office apparently start selling marta passes september 26th guessing ran ones month september already,positive,0.8594,neutral,-0.022727272727272728,08/16/2019
posts,confused gt parking rule moving car lot used games parking lot used 18 alternate parking location er66 thought could park non residential lots er66 residential lot stated image,positive,0.1363,negative,-0.2,08/16/2019
posts,2016 professors recommendations professors 2016 options shi arvanitis guillot sestito helps would appreciated,positive,0.7399,positive,0.2,08/16/2019
posts,club fair like event fall clubs come introduce recruit new members,positive,0.4329,positive,0.41818181818181815,08/17/2019
posts,freshman without buzzcard eat dining halls moved buzzcard yet told get monday morning buzzcard office opens meantime eat dining halls weekend without buzzcard accept using gtid eat dining halls update got buzzcard good,positive,0.2677,positive,0.7,08/17/2019
posts,parking non residential lots weekends park non residential lots gated annual parking permit weekends,neutral,0.0,neutral,0.0,08/17/2019
posts,wailist heck know number waitlist courses also whole process work supposed get email notification registration error saying open reserved waitlist choose waitlist,negative,-0.5204,positive,0.1,08/17/2019
posts,classes open reason 32 31 filled spots remain waitlist filled classes open reason try sign let saying waitlist waitlist filled like 32 31 open spots,negative,-0.3291,positive,0.20000000000000004,08/17/2019
posts,super intimated live apartment living friends gotta clean larger space stuff home friends one knock away lounge second year gotta something meaningful experience summer need internship never one europe count international internships still feel cultural differences going back surrounded strangers unlike freshman year really interested knowing,positive,0.9,positive,0.16863636363636364,08/17/2019
posts,delta chi reputation campus removed,neutral,0.0,neutral,0.0,08/17/2019
posts,delta chi reputation campus deleted,neutral,0.0,neutral,0.0,08/17/2019
posts,30 mins enough parking time move took 30 mins get room keys line growing longer behind nave wish would give us acceptable time move though dont think anyone would towed asked move unless stay hours heads,positive,0.6908,negative,-0.2,08/17/2019
posts,grocery shuttle grocery shuttle right operating supposed operation starting 10am showing bus tracker really need get target right,neutral,0.0,positive,0.19285714285714284,08/17/2019
posts,north ave able control ac apartment nav thanks,positive,0.4404,positive,0.35,08/17/2019
posts,thing spring recruitment sororities,neutral,0.0,neutral,0.0,08/17/2019
posts,online masters mechanical engineering program worth currently working fulltime georgia driving class work sound appealing practical even university question nearby anyone thoughts program,positive,0.3094,positive,0.3,08/17/2019
posts,struggling contribution community transfer application hello everyone currently working finishing transfer application would appreciate help left finish contribution community portion application trouble writing activities involved however details webpage application seem specify want write activities resume format asks information one page resume format include work experience sure include internship co op research experience assuming choose resume format online comfortable include things would traditional resume something understand information missing,positive,0.7729,positive,0.07142857142857142,08/17/2019
posts,best men barber atlanta need haircut places trash friends tell recs,positive,0.8253,positive,1.0,08/17/2019
posts,chi phi reputation deleted,neutral,0.0,neutral,0.0,08/17/2019
posts,waitlist appear progressing deleted,neutral,0.0,neutral,0.0,08/17/2019
posts,got charged twice sifu title states got charged twice special institutional fee charges 272 also tuition tab epay got charged twice 2000 3000 dollars anyone know going,negative,-0.4215,positive,0.35714285714285715,08/17/2019
posts,cx 4640 numerical analysis park class cx 4640 numerical analysis park class,neutral,0.0,neutral,0.0,08/17/2019
posts,thermo defbods 2110 planning take courses together fall feasible hang qi defbods seung woo lee thermo kristi mehaffey christopher saldana 2110 13 hours total 14 last semester reasonably well plan mess around semester please let know going basically kill thanks,positive,0.7013,neutral,0.045000000000000005,08/17/2019
posts,anybody know get rid timeout log back oscar buzzport browser,neutral,0.0,neutral,0.0,08/17/2019
posts,flag football classic 4v4 7v7 find website thanks,positive,0.4404,positive,0.18333333333333335,08/17/2019
posts,nas ac pin code idea menu thermostat north ave south pin anyone chance know pin get pin might curious,positive,0.5927,negative,-0.1,08/17/2019
posts,cant connect eduroam deleted,neutral,0.0,neutral,0.0,08/17/2019
posts,switching physics hi thinking switching majors mse physics wondering compilation textbooks google drive could use mse fb page link drive textbooks physics also go ahead talk physics advisor hold switch advice beyond also appreciated profs avoid terrible schedule looks like,positive,0.2755,negative,-0.4,08/17/2019
posts,math 3012 cs 1332 2110 2340 psyc 1101 possible get removed,neutral,0.0,neutral,0.0,08/17/2019
posts,advice get bid frat going couple frats past nights met lot brothers seemed get along great good conversations gotten bid yet seems like people gotten bids ones interested either prior connections summer events neither advice honestly little frustrated,positive,0.8885,positive,0.08750000000000001,08/17/2019
posts,mgt 3000 acct 2101 isye hey yall im emory dual degree want try get many classes way go make time easier figure one would easy cc also emory acct 2101 equivalent notoriously brutal would nice kill gpa probably hard read tldr mgt 3000 acct 2101 easy enough gpa booster hard case take go anyway,positive,0.7941,positive,0.06354166666666666,08/17/2019
posts,buy dining dollar use dining halls like brittain north ave,positive,0.466,neutral,0.0,08/17/2019
posts,textbooks buy rent textbooks classes start wait syllabi,neutral,0.0,neutral,0.0,08/17/2019
posts,anyone else hear loud cars area atlantic station loring heights rev v8 engine loudest competition going,neutral,0.0,positive,0.1,08/17/2019
posts,buzzfunds used could also used laundry,neutral,0.0,neutral,0.0,08/17/2019
posts,stamps physicals std testing deleted,neutral,0.0,neutral,0.0,08/17/2019
posts,hong kong amp uyghur posters campus display deleted,neutral,0.0,neutral,0.0,08/17/2019
posts,transfer anyone ever transferred mit tech trying year advice tips,neutral,0.0,neutral,0.0,08/18/2019
posts,math 3670 l1 statistics deleted,neutral,0.0,neutral,0.0,08/18/2019
posts,cs research looking computer science related research next steps forward finding research,neutral,0.0,neutral,0.0,08/18/2019
posts,aerospace engineering degree plan hi student gatech admitted major end freshman year changed major ae first year hit hard depression result grades affected got low gpa applied medical withdrawal got approved looking good suggestions degree plan helps keep gpa track moderate level work thoughts,positive,0.1796,positive,0.09791666666666665,08/18/2019
posts,taking engineering courses much classes deformable bodies fluid mechanics geomatics statistics applications environmental engineering principles,neutral,0.0,positive,0.1,08/18/2019
posts,applying transfer tech year looking talk people likelihood getting deleted,neutral,0.0,neutral,0.0,08/18/2019
posts,connecting wifi hell connect wifi plugging lan cable ps4 want connect laptop phone echo wireless says need enter mac addresses find edit figured connect eurodam phone laptop use credentials forget portion,negative,-0.686,neutral,0.0,08/18/2019
posts,byod workspace campus anyone know place bring laptop connect external monitors know grad area crosland grad student,neutral,0.0,neutral,0.0,08/18/2019
posts,72 hours deleted transcript already contacted registrar like happen classes last semester suddenly freshman enough hope money spend four years institution,neutral,0.0364,neutral,0.0,08/18/2019
posts,waitlist question exactly class waitlist georgia tech work specifically waitlisted class need attend class first week hopes add code given professors students present add codes thing kinda sit class buzzport get email says good,positive,0.7383,positive,0.3,08/18/2019
posts,water bottle filling stations klaus deleted,neutral,0.0,neutral,0.0,08/18/2019
posts,go dm smith classes freshman tried walking route classes today supposed enter dm smith entrance went closed construction another entrance side something update never mind stupid,positive,0.5132,negative,-0.44999999999999996,08/18/2019
posts,see lost looking person tomorrow probably looking classroom rather meaning life good chance help afraid offer heck turn existential crisis might able help well,positive,0.7809,positive,0.19999999999999998,08/18/2019
posts,feeling place tech imposter syndrome ten people met include dude funded startup three first year juniors credit hours dude built operating system high school people interning top companies right high school dude spends weekends watching netflix week homework pls help wtf supposed fit place,positive,0.595,positive,0.15696428571428572,08/18/2019
posts,nice,neutral,0.0,positive,0.6,08/18/2019
posts,lost get classroom 185 love mrdc ii building went twice look swear nonexistent find anywhere,positive,0.1655,positive,0.5,08/18/2019
posts,new laptop bike removed,neutral,0.0,positive,0.13636363636363635,08/18/2019
posts,another ga tech safety question sorry pedantic someone moved area near marietta street artery feel safe driving around day time lived several years nyc traveled work dc houston chicago etc traveled internationally person question international book smart common sense please tell worrying nothing anyway thanks,negative,-0.5779,neutral,0.02380952380952381,08/18/2019
posts,rejection possibility pathway deleted,negative,-0.5423,neutral,0.0,08/18/2019
posts,andy ogletree wins us golf amateur championship go jackets,positive,0.765,neutral,0.024999999999999994,08/18/2019
posts,planning rushing fraternities able attend rush orientation earlier week still allowed rush deleted,neutral,0.0,positive,0.25,08/18/2019
posts,place date good place take someone date also social life like gt edit asking restaurant options good place date restaurants good dates lol,positive,0.9378,positive,0.5866666666666666,08/18/2019
posts,gt use blackboard use deleted,positive,0.4927,neutral,0.0,08/18/2019
posts,iphone 8plus screen replacement hey fellow yellow jacket know buy good iphone plus white replacement screen digitizer wana pay apple premium look decent quality,positive,0.3612,positive,0.21666666666666665,08/18/2019
posts,gt golf andy ogletree us amateur championship,positive,0.8567,negative,-0.25,08/18/2019
posts,math 2552 recitation first week class taking yao yao semester wondering come recitations week,neutral,0.0,positive,0.25,08/18/2019
posts,fuck waitlist work past week since monday one class 80 spots shows 72 people registered waitlist since monday still 100 students waiting 100 students waiting amp x200b fuck work thought friday waitlist number would start going spots would start close class still right,negative,-0.7851,negative,-0.1910714285714286,08/18/2019
posts,nice,neutral,0.0,positive,0.6,08/18/2019
posts,sign hbo go moved tuesday still unable sign hbo go using gatech credentials anyone know able,neutral,0.0,neutral,0.0,08/18/2019
posts,cope two days ago close family member pass away genuinely trouble trying find courage motivation go start classes anyone experience loss college mind sharing advice,positive,0.5267,negative,-0.2,08/18/2019
posts,study abroad shenzhen china macau alumni questions area hi american ga tech alumni living working abroad macau china five years months ago great surprise happened across small group georgia tech students public bus mentioned part study abroad program shenzhen news asked macau said headed beach think seriously considering swimming put beaches macau anyway ga tech peeps board interested macau feel free ask questions might save crowded public bus ride disappointing beach pretty sure alumni lives duty marking another country global reach,positive,0.9609,positive,0.08472222222222221,08/18/2019
posts,see schedule classes hi previous semesters somehow found calendar registered classes buzzport seem find anymore way get official calendar view schedule registered classes locations courseoff thanks,positive,0.5502,neutral,0.016666666666666677,08/18/2019
posts,15 minutes get dm smith instructional center possible deleted,neutral,0.0,negative,-0.05,08/18/2019
posts,happening outside nave hear lots yelling drums,neutral,0.0,neutral,0.0,08/18/2019
posts,schedule classes without knowing clubs meet title,neutral,0.0,neutral,0.0,08/18/2019
posts,need separate mbed kits ece 2035 2036 taking 2035 2036 sem need mbed kits reuse kit classes,neutral,0.0,neutral,0.0,08/18/2019
posts,advice international students based experience class 2015 hi created short video covers best practices deployed time tech really helped thrive international student academically socially extracurricular co curricular pursuits sincerely hope find video valuable wishing best start incredible ride next years go jackets,positive,0.967,positive,0.36333333333333334,08/18/2019
posts,arch 2111 anyone arch 2111 danielle willkens,neutral,0.0,neutral,0.0,08/18/2019
posts,yang gang members andrew yang 2020 members tech looking join start group us campus campaign edit djs6990 commented hey dennis volunteer atlanta yang gang chapter would love support anything need feel free direct message also would love come events find us fb searching atlanta yang gang probably easiest way seeing upcoming events get idea hopefully give ideas let make yang president together,positive,0.9718,positive,0.375,08/18/2019
posts,question dl masters deleted,neutral,0.0,neutral,0.0,08/19/2019
posts,audit cs classes try cs minor want learn program multiple languages boost resume open opportunities terms internships helping clubs know hard self teach cs minor worth heard theory based really people want learn technical skills course would still get lot classes regardless also know would get much auditing professors would even let audit classes thoughts opinions auditing get professor let audit,positive,0.742,neutral,0.03425925925925926,08/19/2019
posts,bmed 3100 prilutsky anyone taken bmed 3100 prilutsky lot info class grading style web class tough grader,negative,-0.2593,negative,-0.3888888888888889,08/19/2019
posts,3057 lab week anyone know going labs week know labs usually meet first week received email nothing canvas lab couple hours would really appreciate help,positive,0.8375,positive,0.06666666666666667,08/19/2019
posts,anybody know course critique professor search working well example typed gebraeel professor popped clicked next page showed message data available table knew beforehand submission course critique went back main search page typed isye 2028 scrolled next page saw name clicked took page definitely visible gpa records professor search working,positive,0.2755,positive,0.09444444444444444,08/19/2019
posts,best teacher cs 1331,positive,0.6369,positive,1.0,08/19/2019
posts,fall hours amp info gt tech support deleted,positive,0.6739,neutral,0.0,08/19/2019
posts,fall hours amp info gt tech support deleted,positive,0.6739,neutral,0.0,08/19/2019
posts,good food compared previous semesters purchased meal plan yet wondering food dining halls better previous semesters everybody complaining,positive,0.5574,positive,0.21666666666666665,08/19/2019
posts,fall hours amp info gt tech support welcome new returning georgia tech students technology support center tsc wrecktechs combined form enterprise service desk offers onsite technology support three campus locations well phone online support please visit submit requests help call speak one wrecktech agents 404 894 0044 404 385 5555 amp x200b,positive,0.9683,positive,0.2340909090909091,08/19/2019
posts,prospective cs transfer fall 2020 tips hey everyone started freshman year indiana university bloomington initially admitted finance thinking hard life college settled computer science really want transfer gatech cs program freshman year outline classes would appreciate tips honest feedback transferring gatech cs program amp x200b credits english composition calculus high school amp x200b semester calculus physics intro com science intro micro econs amp x200b semester calculus physics eng comp intro software systems either intro cs discrete math intro macro econs amp x200b classes meet transfer requirements gatech transfer table plan submit application feb 2020 june 2020 window hopefully attend gatech fall 2020 would total 42 credits end freshman year june 2020 amp x200b academics plan join computer science club iu cs related activities amp x200b international student btw gatech takes consideration understand receiving financial aid gatech,positive,0.9696,positive,0.06683333333333333,08/19/2019
posts,lmc 3352 anyone taken film technology anyone thoughts whether good class take humanities credit,positive,0.1416,positive,0.7,08/19/2019
posts,cs1301 mcdaniel cs1315 southern deleted,neutral,0.0,neutral,0.0,08/19/2019
posts,cs 3210 andersen devecsery one better take cs 3210 andersen devecsery one better take,positive,0.7757,positive,0.5,08/19/2019
posts,counseling center initial consultation considering checking counseling center though also sure help nothing extremely bad issues probably need work know initial consultation schedule go person center like hear kind survey ask like really nervous go sure expect sure tell,positive,0.438,positive,0.11818181818181818,08/19/2019
posts,machine learning trading machine learning trading course cs department offers worth taking better take online course available udemy also difficult demanding course,positive,0.2359,positive,0.16,08/19/2019
posts,everyone taking ece class semester idea breadboard works,negative,-0.296,neutral,0.0,08/19/2019
posts,looking connect gt discord freshman confused find webster ii want connect others find new friend group year looking talk like minded students come join gt discord everything meetup organizations shitposts dedicated channels ask schedule advice school tips resources,positive,0.8936,negative,-0.13181818181818183,08/19/2019
posts,day electric scooter users driving crazy reminder returning fyi new people please follow rules road using electric scooter bicycle watched guy bird go middle ferst fowler intersection incoming traffic forcing cars slow getting hit car worth getting class extra minute early want learn rules gtpd resources help,positive,0.5813,negative,-0.05194805194805195,08/19/2019
posts,help moving boxes deleted,positive,0.4019,neutral,0.0,08/19/2019
posts,smash bros fighting games smash bros fighting game club gt least people go 404 esports lot wanna talk,negative,-0.2885,negative,-0.35,08/19/2019
posts,unprepared professor trying bullshit entire 90 minutes syllabus removed,negative,-0.5859,neutral,0.0,08/19/2019
posts,lost black hydroflask straw lid dm smith 105 happened forget water bottle 8am room found please lmk checked luck edit place could think would ic 211 sure lost,negative,-0.0691,positive,0.16666666666666669,08/19/2019
posts,bonus points thank bus driver,positive,0.7184,neutral,0.0,08/19/2019
posts,canvas access deleted,neutral,0.0,neutral,0.0,08/19/2019
posts,woventext 2019 2020 engl 1101 told get like 70 get older ones,positive,0.3612,positive,0.16666666666666666,08/19/2019
posts,environmental activism cleanup group new ish tech frantically looking clubs join fall months ago participated environmental cleanup group people one rewarding things done wondering sort club people want go neglected parts campus midtown part environment also interested club general environmental activism something along lines club things exist would joining sga good idea might able push kind agenda campus,positive,0.7471,positive,0.39090909090909093,08/19/2019
posts,throw frisbee nav roommates need make new friends want throw frisbee courtyard pm,positive,0.5267,positive,0.13636363636363635,08/19/2019
posts,advice schedule advisor wants take math 1552 phys 2211 together semester want start slow better foundation calculus 1552 take physics 2211 planning take next semester along 1770 classes,positive,0.6486,positive,0.09999999999999999,08/19/2019
posts,rats digital scavenger hunt library aug 19 23,neutral,0.0,neutral,0.0,08/19/2019
posts,isye 3770 questions hey everyone isye 3770 questions starting content someone please help difference enumerative analytic study amp x200b amp x200b difference mechanistic empirical model amp x200b amp x200b difference empirical model regression model amp x200b amp x200b probability models amp x200b amp x200b appreciate help,positive,0.8922,positive,0.06666666666666667,08/19/2019
posts,dining dollars buy dining dollars physical cash,neutral,0.0,neutral,0.0,08/19/2019
posts,fws vs campus job difference campus job work study position went financial aid office told work study award even going show bursar meaning even taking anything coa understood correctly currently campus job love divy time job fws job time consuming opt fws since even helping financially,positive,0.4363,positive,0.125,08/19/2019
posts,anyone guitar would allow borrow hr tmmr 30 min wednesday,positive,0.2263,neutral,0.0,08/19/2019
posts,ece 3894 anyone taken ece 3894 cryptographic hardware embedded systems thoughts got waitlist need decide soon going take,neutral,0.0,neutral,0.0,08/19/2019
posts,freshman confused college classes work please explain idea math labs access codes turningpoint works also online discussion platform piazza mathlab 1552 short says session expired course says need course id link direct also want know rent buy books like hard copy feel book reading understand topic also want access codes someone please recommend go explain stuff pleasee explain want miss announcement topic feel lost first day also looking interesting events clubs go feel alone miss home 8000 miles away miss friends back home even overthinking writing mail professor physics turning point link expired know wrong,positive,0.4912,neutral,-0.04270833333333335,08/19/2019
