type,text,VADER sentiment,VADER sentiment score,TextBlob sentiment,TextBlob sentiment score,date
posts,georgia tech league legends collegiate team d2 interested playing gt collegiate team please fill form team going tournament pennsylvania september trip paid gt d2 would like play less competitive environment join gtlol discord future announcements thanks,positive,0.9297,positive,0.07083333333333333,08/08/2019
posts,incoming ms cs student minimum number credits required per semester track specialization suggestions joining campus program heard 12 credits required considered full time student besides advantage reason become full time student part time paying less would still qualify internships,positive,0.6898,positive,0.17777777777777778,08/08/2019
posts,admissions advice sure right subreddit ask goes wanted go tech ages legacy decent ecs research experience hopefully able get published applications due oos fantastic act score 31 studying retake want bank score exist anyone get know someone got tech similar circumstances,negative,-0.6908,positive,0.2467687074829932,08/08/2019
posts,ece 6607 computer communication networks hi anyone experience course prof chuanyi ji,neutral,0.0,neutral,0.0,08/08/2019
posts,electrical engineer wanted company idea interested creating motion capture suit used home movies know adafruit bn0o55 track absolute position thinking combining suit along infrared sensors keep track initial offset goal able see motion capture skeleton software something like processing real issue know combine components personally think could good starting point company essentially looking business partner also electrical engineer,positive,0.8519,positive,0.20555555555555555,08/08/2019
posts,keep new scooter rule mind returning fall semester,neutral,0.0,positive,0.13636363636363635,08/08/2019
posts,cheapest way travel atlanta airport gatech luggage back pack,neutral,0.0,neutral,0.0,08/08/2019
posts,really dodged bullet deleted,neutral,0.0,positive,0.2,08/08/2019
posts,pickup soccer groupme pickup soccer tryna play times week next semester,positive,0.34,neutral,0.0,08/08/2019
posts,glc mailbox address since glc separate mailbox system way find address mailboxes online way prior move,neutral,0.0,neutral,0.0,08/08/2019
posts,late housing edition sooo planned commuting semester hour away house know rough couple days ago mom amp great said wanted pay housing like dope number 30 waitlist unsure whether get housing great people ever situation happened okay housing point even put woodruff pick update shot 23 today 08 09 19 called housing peeps asked explore options said gonna look around gt apartments check back tuesday see happens update future people end situation lol update 08 11 19 went 22 today expect go weekend maybe someone cancelled application update 08 13 19 21 believe already refunded prepayment given account summary student invoice soo think getting housing lol gonna shop around tonight tomorrow cancel application tomorrow night see anything signif happens moral story see family help sooner rather later lol major update 08 14 19 got housing jumped 20 gt baby let dreams dreams gotta let people contacted campus housing know interested still win,positive,0.9744,positive,0.3475,08/08/2019
posts,room 106 smith font pixelated cannot figure,neutral,0.0,neutral,0.0,08/08/2019
posts,distance calc math 1554 advice hey sorry wrong subreddit posting wondering difficult distance math math 1554 guys tips people taking semester pretty nervous taking course really appreciate advice thanks,positive,0.4994,negative,-0.1416666666666667,08/08/2019
posts,schedule help sorry type post annoying would appreciate wisdom whether schedule seems doable especially two math classes 14 hours math 4347 swiech math 2106 hom phys 2232 scherbakov span 2001 levin thank help,positive,0.9581,negative,-0.43333333333333335,08/09/2019
posts,stuff works new article george burdell,neutral,0.0,positive,0.13636363636363635,08/09/2019
posts,heard cries georgia tech coursicle credit hour support,positive,0.3818,neutral,0.0,08/09/2019
posts,board game group incoming freshman active club hobby board tabletop games trying decide bring games gt,positive,0.6739,negative,-0.26666666666666666,08/09/2019
posts,interested building rockets yellow jacket space program yjsp campus student run organization providing students hands experience designing building rocket launch vehicle technology first successful test launch past spring looking students majors help us coming launches help achieve goal developing suborbital launch vehicle capable reaching space orientations coming around first week school enter name email notified information visit website questions please feel free send pm,positive,0.9647,positive,0.23125,08/09/2019
posts,channel action news wsbtv covers campanile fountain issue petition visit campus,neutral,0.0,positive,0.1,08/09/2019
posts,minor cs knowledge topic think minor cs actually worthwhile important job prospects let say major thanks,positive,0.6958,positive,0.17708333333333334,08/09/2019
posts,guys think using social media necessary making friends title,neutral,0.0,neutral,0.016666666666666666,08/09/2019
posts,join gt quiz bowl hello fellow yellow jackets gearing fall semester hope consider joining gt quiz bowl team list pros cons ponder pros learn demonstrate awesome knowledge science literature history fine arts social science mythology philosophy religion sports tv competitive buzzer based questions give thrill sports without risk injury club useful non player tasks like tournament directing event organization question writing writing skills statistician math travel continental us playing tournaments join impressive network current former gt quiz bowl players include phd candidates startup founders cs 1371 tas pretty much guaranteed victories rocky mountain pizza trivia night amaze parents knowing answers watch jeopardy easy free get involved dues welcome everyone regardless experience age swole forearms hitting buzzer make friends cons addictive practice howey room numbering confusing hint north south east west amp x200b first meeting monday august 26th howey l3 45 pm future meetings howey s204 mondays thursdays 45 pm hope see pm us reply questions join slack join discord join engage formerly orgsync website,positive,0.9956,positive,0.2657407407407408,08/09/2019
posts,interested credit course happiness tech alum ms hci 00 post doc teaching course fall interested practical ways satisfied happy interested philosophy social sciences think find course interesting amp x200b special topics happiness may listed special topics places bmed 2803 section 91423 mwf 12 20 10 es amp 1125 section hp honors 91480 mwf 11 15 12 05 village dining commons 277 open majors practical stuff course sustainably increase happiness cope stress disappointment make better predictions future happiness people succeed fail find meaning life work effectively others appreciate cultural differences definition good life manage worry self deprecation theoretical stuff course covers sociology economics philosophy includes topics like association income happiness impact income inequality americans happiness changing definitions happiness across history difference happiness good life reviews previous students one rewarding classes terms personal growth understanding taken time georgia tech course major factor growth semester dr martin one knowledgeable passionate professors useful learned different theories history happiness importantly took away lot practical ways improve happiness think done better job getting closer person would like opportunity look introspectively never knew valuable regularly talk happiness keep forefront mind,positive,0.9951,positive,0.3510863095238094,08/09/2019
posts,college computing graduate student orientation info anyone details coc grad orientation next wednesday found email telling new students save 14th orientation able find anything else regarding time location,positive,0.4939,positive,0.21212121212121213,08/09/2019
posts,donald doyle chem 1211k 15 rate might stuck prof chem switch shepler need expense 8am jankowski another linear algebra class make switch rate prof shepler every comment chem 1211 shit show normally teaches 1310 1211,negative,-0.7506,neutral,-0.02500000000000001,08/09/2019
posts,freshman schedule phys 2211 parker math 1552 han lmc 2500 vacche chem 1211k gt 1000 context physics major pretty sure pre health well know 16 hrs alot first schedule doable,positive,0.6784,positive,0.265625,08/09/2019
posts,racist problem tech hi everybody believe staff faculty department racists talk evidences support claim way law prevent racism far know first amendment still trying protect speech racism,negative,-0.9429,positive,0.175,08/09/2019
posts,phase time tickets unfortunately time ticket says august 16th 8am thought would sooner oh well anyone else earlier,positive,0.3054,negative,-0.25,08/09/2019
posts,wet friday,neutral,0.0,negative,-0.1,08/09/2019
posts,time crunch freshman question college business 100 boggs long walk 15 minutes one time week really want phase ii registration,negative,-0.1281,positive,0.07500000000000001,08/09/2019
posts,starup lab vs idea prototype difference starup lab idea prototype junior design seem like class i2p harder application process harder course advice appreciated,positive,0.89,neutral,0.0,08/09/2019
posts,gt page dining joke,neutral,0.0,neutral,0.0,08/09/2019
posts,scam alert,negative,-0.3612,neutral,0.0,08/09/2019
posts,average amount credits freshman come gtech removed,positive,0.3612,negative,-0.15,08/09/2019
posts,part time student take 12 hours semester going forward last semester taking hours hr classes want take 15 credits semester guess part time student someone explain means affect zell miller,positive,0.5003,neutral,0.0,08/09/2019
posts,receive time ticket student recently approved readmission fall 2019 take classes last spring summer however time ticket anyone experienced,positive,0.4215,positive,0.26666666666666666,08/09/2019
posts,looking advice microsoft internship deleted,neutral,0.0,neutral,0.0,08/09/2019
posts,received last minute internship offer fall state contact cancel housing loans deleted,negative,-0.25,neutral,0.0,08/09/2019
posts,interesting gatech research,positive,0.4019,positive,0.5,08/09/2019
posts,404 894 2500 fyi georgia tech community call main 404 894 2500 number notice new automated message emergency need assistance press regards phone scam someone spoofed number,negative,-0.4883,positive,0.1515151515151515,08/09/2019
posts,cs 2110 waitlist deleted,neutral,0.0,neutral,0.0,08/09/2019
posts,best path someone interested finance banking business administration major deleted,positive,0.5346,positive,0.4375,08/09/2019
posts,room swap room lovely woodruff sent room swap request every advertised room outlook inbox currently buzzing offer rejected thought shoot shot reddit ik 99 want ur let know bud need applaud marketing skills,positive,0.9087,positive,0.25,08/09/2019
posts,learn history tech campus visuals interested learning building built looked like time campus evolved etc person online resources,positive,0.7053,positive,0.25,08/09/2019
posts,schedule kill incoming freshman ae currently following classes upcoming semester cs1371 kantwon yay ae1601 says instructor john dec find anything online anyone taken class math1554 barone know appeared american ninja warrior pretty dope idk well teaches coe2001 linsey really heard much online either idk expect class pubp1142 required course gc heard bad much work would apph1040 snow think might drop class try transfer another professor phase thoughts schedule much work entails since freshman like get used college make friends stuff sure currently much work also taken classes advice would appreciated thanks much,positive,0.8913,positive,0.12692307692307694,08/10/2019
posts,fantasy premier league new tech wanted see anyone interested fantasy premier league league join code zyxmdu groupme,positive,0.5994,positive,0.19318181818181818,08/10/2019
posts,apph1050 teach swim would like add apph1050 schedule pretty sure swimming option problem know swim anybody know teach like prerequisite already know,positive,0.7998,positive,0.375,08/10/2019
posts,laundry outside residency halls looked faq googled bit find info sorry advance missed something new student living campus housing wondering brother could go get laundry done seems buzzcard let dorm buildings hiding laundry machines people gone decades students local go mom pop dorm dwellers laundry sure answer exists,negative,-0.4665,neutral,0.02727272727272727,08/10/2019
posts,ae scheduling help hi wondering doable schedule cs1332 hudachek ae 2610 kennedy ae 2611 seitzman coe 3001 qi ae 3340 german ae 4451 yang ae 2220 hanagud research credits input would appreciated,positive,0.7184,positive,0.1,08/10/2019
posts,meal plan im first year required get meal swipes im sure kind meal plan get get dining dollars meal swipes someone tell exact differences two plan eat weekdays dining halls foods like cfa weekends would best option advice would help,positive,0.9324,positive,0.52,08/10/2019
posts,humanities credit special topics linguistics class hi want take special topics linguistics class next semester class able used humanities credit go see,positive,0.7935,positive,0.3035714285714286,08/10/2019
posts,earning associate degree worth college classes tech college good hey everyone currently sophomore high school wondering whether would look impressive earned associate degree high school georgia military college credits gmc online central georgia technical college elaborate already planning electives comp sci graphic design spanish additionally would taking ap comp sci principles ap spanish language ap english language literature think electives well suited desired degree computer science however feel like extra factor associate degree could make appealing end however would take classes summer order earn even know associate degree gmc impressive plus heard many online credits like lab sciences history mathematics psychology transfer trying get want overload summers work end benefiting end take classes earn associate degree remaining summers take dual enrollment classes remaining summers credits know transfer count towards degree thank much edit also mention involved school beta club participated national history day competition planning starting gay straight alliance school enough extracurriculars little,positive,0.9821,positive,0.2228819444444445,08/10/2019
posts,lab registration help trying register biol 1510 needs lab lecture lab want full waitlist right registered open lab figure get waitlist lab every time try gives duplicate course error drop current lab try join waitlist gives linked course error since need sign lab lecture anyone know get waitlist,negative,-0.714,positive,0.15892857142857142,08/10/2019
posts,math 2551 help deleted,positive,0.5319,neutral,0.0,08/10/2019
posts,phys 2212 amp cs 1371 conflict need take phys 2212 cs 1371 fall semester times offered able get best professor greco kantwon least heard read professor would beneficial take greco phys 2212 settle forsyth cs 1371 take kantwon cs 1371 settle someone else phys 2212,positive,0.8996,positive,0.39999999999999997,08/10/2019
posts,po box get po box previous school year change ordering something sure mailed box number last semester,negative,-0.2342,positive,0.11111111111111112,08/10/2019
posts,math 1553 workload like,neutral,0.0,neutral,0.0,08/10/2019
posts,2551 2550 registeration register 2551 2550 together anyone ever tried,neutral,0.0,neutral,0.0,08/10/2019
posts,musi 2525 musi 2012 deleted,neutral,0.0,neutral,0.0,08/10/2019
posts,would recommend taking math 2552 ece 2026 time bit worried kinda struggled taking math 2551 summer thinking taking two electives instead bad idea,negative,-0.6494,negative,-0.6999999999999998,08/10/2019
posts,interested building rockets blast winning international competitions removed,positive,0.7269,positive,0.25,08/10/2019
posts,college business boggs class college business 115 minutes class ends class starts boggs able make time edit 15 minutes,neutral,0.0,positive,0.5,08/10/2019
posts,rant rude gt security library edit hours since happened think may overreacted people make fun trigger words words trespass call gtpd must ticked thanks everyone deleted incident avoid retaliation lol know become paranoid,positive,0.5037,positive,0.25,08/10/2019
posts,registration machine broke one gonna able fix til monday get chat,negative,-0.6124,positive,0.5,08/10/2019
posts,crc open deleted,neutral,0.0,neutral,0.0,08/10/2019
posts,hope scholarships fall 2019 checked hope scholarship status says currently eligible august 8th 2019 checked balance statement tuition bill seems like scholarship applied first year know works registered 15 credits drop one class deadline based chart hope would pay 840 based hourly rate tuition still 129 worried probably go financial aid office meantime insight would help thank yall,positive,0.952,positive,0.08333333333333333,08/10/2019
posts,applying work study incoming freshman currently signing work study questions firstly ask resume send high school resume detailed also rough idea schedule single class health probably transfer sections drop phase bc currently snow wait final schedule emailing work study supervisors said wanted everyone start working within two weeks semester starting want freshmen emailing schedules determined bit confused thanks,positive,0.5001,neutral,0.03987012987012988,08/10/2019
posts,hard transfer cm major deleted,negative,-0.1027,negative,-0.11458333333333334,08/10/2019
posts,formula fans f1 fans campus interested getting together watch races interest creating groupme,positive,0.8146,positive,0.25,08/10/2019
posts,psa georgia tech data breach lawsuit investigation recently discovered multiple ongoing investigation tech data breach earlier year impacted data breach may something look amp x200b gt april 2019 georgia institute technology announced data breach exposing personal information million current former faculty members students university staff student applicants compromised information includes names addresses social security numbers birth dates gt gt georgia tech noticed breach late march someone gained unauthorized access web application hosted georgia tech servers gt gt,positive,0.25,neutral,-0.03333333333333333,08/10/2019
posts,waitlists cleared add drop phase trying figure chance getting section near end waitlist,positive,0.34,positive,0.1,08/10/2019
posts,math 2551 deleted,neutral,0.0,neutral,0.0,08/10/2019
posts,clough scheller 15 minutes manageable deleted,neutral,0.0,neutral,0.0,08/10/2019
posts,registration attribute code hi registered class currently recently added isol attribute accounting 2101 class signed anyone knows means thanks,positive,0.6707,positive,0.1,08/10/2019
posts,crc open students yet living campus move saturday living campus fall semester official move day saturday 17 unless want pay extra fees stay campus starting monday 12 wondering could scan crc buzzcard 12 17 without pay extra fee thanks,positive,0.4003,neutral,0.04,08/10/2019
posts,august 17 move put housing contract move sunday august 18 however something came may move 17th unable change move date housing contract arrive 17th charged 50 early move,negative,-0.2869,negative,-0.2,08/10/2019
posts,tips time management likely take around 14 credit hours semester want participate couple extra curricular activities however afraid might overcommitted experienced know add take things plate want participate enjoy life much possible getting involved wanna make overly stressed want,positive,0.1406,positive,0.10000000000000002,08/10/2019
posts,laptop would lenovo e430 win 64 bit 4gb ram lenovo t410 win 32 bit 4gb ram hp folio 13 win64 bit 4gb ram work tech would one feasible would upgrading ram make feasible look purchase new laptop recommendations looking lower price point preferably 500ish new refurbished thank insight cs major,positive,0.3058,positive,0.3870454545454545,08/10/2019
posts,liu math 2551 deleted,neutral,0.0,neutral,0.0,08/10/2019
posts,classes work load hey changed major fall wanted know classes could go together 1770 3322 2016 coe 3001 mse 2001 total 15 creds average student gt student thaaat smart get straight might also take apph 1050 workout training classes doable class drop aka hardest class thanks,positive,0.3697,positive,0.08779761904761905,08/10/2019
posts,take math 2603 semester deleted,neutral,0.0,neutral,0.0,08/10/2019
posts,anyone trouble registering classes getting errors something wrong system saw post said something wrong registration afraid really need register class tomorrow thanks,negative,-0.8599,negative,-0.2333333333333333,08/10/2019
posts,six flags night friend goes tech invited six flags night wondering busy expect,positive,0.4939,positive,0.1,08/11/2019
posts,mgt 3101 fan yifeng anyone taking mgt 3101 fan yifeng mwf 55 45 also fan yifeng tiffany johnson organizational behavior better course,positive,0.8466,positive,0.5,08/11/2019
posts,crc alumni membership hey recently graduated tech planning come back month chill starting job anyone know crc offers alumni memberships expensive month tried checking website find specific page details thanks,positive,0.6634,neutral,-0.028571428571428574,08/11/2019
posts,ece schedule advice fall 2019 deleted,neutral,0.0,neutral,0.0,08/11/2019
posts,applying cs minor less 48 credits remaining hi title says currently 3rd year 21 credits remaining really want get cs minor made 1301 1331 chances getting cs minor program website says still considered minor guaranteed thanks,negative,-0.2622,neutral,0.004166666666666666,08/11/2019
posts,physics gtl anybody taken physics gtl ypu know level difficulty campus,negative,-0.4137,neutral,0.0,08/11/2019
posts,register chem 1310 time ticket opened morning went register chem 1310 said restricted freshmen something get past need email advisor,negative,-0.5267,negative,-0.25,08/11/2019
posts,3017 system dynamics deleted,positive,0.2732,neutral,0.0,08/11/2019
posts,1332 sections cs 1332 noticed usual sections undergrads gr section grads o1 section o1 section capacity 150 opposed 50 everything else class week opposed times week recitation everyone else deal section wanna know different others lol cover material others faster,positive,0.4871,positive,0.18333333333333335,08/11/2019
posts,mini fridge questions freshman wondering upperclassmen stay campus housing typically bring keep using mini fridges trying decide whether worth paying new mini fridge something sell one year,positive,0.2263,positive,0.08989898989898988,08/11/2019
posts,bme 2400 deleted,neutral,0.0,neutral,0.0,08/11/2019
posts,wl remaining vs student detail schedule tried switch open section 2110 got error cross listed waitlist could add waitlist seeing waitlist spots open spots search classes however check student detailed schedule says 44th correct,negative,-0.6355,positive,0.1,08/11/2019
posts,fall housing options hi anyone know housing options still available fall would prefer live studio bedroom apartment,neutral,0.0,positive,0.2681818181818182,08/11/2019
posts,question distance math deleted,neutral,0.0,neutral,0.0,08/11/2019
posts,easy fun humanities free electives fall 2019 need humanities class free elective planning taking one semester would prefer something arts related possible know lot id classes major restrictions looking languages since need credits humanities,positive,0.7615,positive,0.22797619047619047,08/11/2019
posts,physics lab first week semester anyone know lab first week back taking physics modern,neutral,0.0,positive,0.175,08/11/2019
posts,length physics modern labs long physics labs especially compared physics modern greco know hour block lab class right wonder lab ever go hour block mainly concerned test quiz days class right,negative,-0.7319,positive,0.1554421768707483,08/11/2019
posts,anyone know ece major restrictions going lifted still active august 11th even get lifted edit looking getting 2040,positive,0.4696,neutral,-0.035416666666666666,08/11/2019
posts,ae 6760 acoustics deleted,neutral,0.0,neutral,0.0,08/11/2019
posts,hate cs major restrictions,negative,-0.5719,negative,-0.36875,08/11/2019
posts,engl 1102 question going 3rd semester planning taking engl 1102 semester stand topic section sections open take semester wait next semester take hopefully get better section,positive,0.6808,positive,0.125,08/11/2019
posts,fall 2019 registration mega thread reason please use instead posting ask question single course title,positive,0.3182,negative,-0.07142857142857142,08/11/2019
posts,anyone moved standard hey standard trying keep deposit longer 30 days state ga allows protect renter laws put place deposit return timely fashion standard clearly violation law expect us pay rent time also held standard return deposit time 30 days include mailing time even ask pick office still make wait month cant follow laws set forth returning deposits shouldnt allow collect first place,neutral,0.0088,positive,0.05833333333333334,08/11/2019
posts,cp 4310 deleted,neutral,0.0,neutral,0.0,08/11/2019
posts,cs2110 hardest topics deleted,neutral,0.0,neutral,0.0,08/11/2019
posts,rankings get updated could sworn ae 4th us,neutral,0.0,neutral,0.0,08/11/2019
posts,ece 4270 ece 3600 debating taking two classes since cover important topics interest signal processing also feel networking important concept learn regardless therefore classes worthwhile taking reference 4270 taught fekri 3600 taught ji,positive,0.7986,positive,0.43333333333333335,08/11/2019
posts,hi guys guys know bedrooms apartments houses fairly close gt good priced edit preferably furnished thanks edit 2400,positive,0.824,positive,0.5333333333333333,08/11/2019
