type,text,VADER sentiment,VADER sentiment score,TextBlob sentiment,TextBlob sentiment score,date
posts,deleted,neutral,0.0,neutral,0.0,01/31/2020
posts,saw google feed gt anti cheating bot,negative,-0.4708,neutral,0.0,01/31/2020
posts,cpt extension applying summer internships tech summer semester ends july 31st want spend weeks atlanta family nothing cpt related work usually must end semester apply extension c2d2 likely get approval,positive,0.254,negative,-0.08333333333333333,01/31/2020
posts,question engineering scholarship students removed,neutral,0.0,neutral,0.0,01/31/2020
posts,poker club poker club think cool one would anyone interested definitely mood play poker rn,positive,0.7757,positive,0.19999999999999998,01/31/2020
posts,new living learning communities removed,neutral,0.0,positive,0.13636363636363635,01/31/2020
posts,tech green makes happy shout gatech landscaping maintenance keeping tech green luscious vibrant makes day much better makes campus look alive,positive,0.929,positive,0.1944444444444445,01/31/2020
posts,freshmen labs ripoff,neutral,0.0,neutral,0.0,01/31/2020
posts,gtri georgia tech research institute security clearance drug test removed,positive,0.34,neutral,0.0,01/31/2020
posts,gtri georgia tech research institute testing removed,neutral,0.0,neutral,0.0,01/31/2020
posts,cs 3510 homework status anybody still gotten grades back since professor hit us address soon sorta makes feel awkward,negative,-0.1531,negative,-0.3,01/31/2020
posts,clery act safety alert incident date time january 31 2020 approximately 15 incident location 6th street spring street west peachtree street incident description victim walking 6th street towards west peachtree street approached two suspects displayed handgun demanded victim property suspects last seen headed north spring street towards 8th street injuries reported victim georgia tech student description suspects suspect one black male approximately 10 tall dark hooded jacket light colored sleeves dark pants dark shoes suspect two black female approximately 10 tall green hooded jacket dark pants white shoes armed handgun,negative,-0.7269,negative,-0.11990740740740741,02/01/2020
posts,campus area network networking fundamentals campus area network arya college removed,neutral,0.0,neutral,0.0,02/01/2020
posts,georgia tech physics credit ib physics hl removed,positive,0.3818,neutral,0.0,02/01/2020
posts,auburnhacks ride needed deleted,neutral,0.0,neutral,0.0,02/01/2020
posts,best tv 2020,positive,0.6369,positive,1.0,02/01/2020
posts,best xbox one games 2020,positive,0.6369,positive,1.0,02/01/2020
posts,best amazon echo 2020,positive,0.7096,positive,1.0,02/01/2020
posts,eufy spaceview baby monitor review,neutral,0.0,neutral,0.0,02/01/2020
posts,need fafsa hope zell removed,neutral,0.0,neutral,0.0,02/01/2020
posts,google pixel go review,neutral,0.0,neutral,0.0,02/01/2020
posts,easy become graduate deleted,positive,0.4404,positive,0.43333333333333335,02/01/2020
posts,gtri testing removed,neutral,0.0,neutral,0.0,02/01/2020
posts,coffee machine lavazza deséa review,neutral,0.0,neutral,0.0,02/01/2020
posts,wi fi,neutral,0.0,neutral,0.0,02/01/2020
posts,learn fold origami roses valentine day origami club since valentine day quickly approaching origami club folding kawasaki rose together next meeting beginners especially encouraged come prior experience necessary snacks origami paper provided hope see location skiles 255 time 00 00 pm date friday february 07,positive,0.6563,positive,0.09999999999999999,02/01/2020
posts,bachelors ie looking masters removed,neutral,0.0,neutral,0.0,02/01/2020
posts,best smart displays 2020 work gadgets,positive,0.7845,positive,0.6071428571428571,02/01/2020
posts,gtl housing deleted,neutral,0.0,neutral,0.0,02/01/2020
posts,gtl housing gone housing options listed residhome crous pythagore lafayette aloes say quality also would recommend signing class ends 35 thurdsday leaving early travel,positive,0.4329,positive,0.1,02/01/2020
posts,ie majors research hey wondering ie majors done research went also find interesting topic lost emailed couple professors really sure want considering operations research supply chain thanks go jackets,positive,0.5735,positive,0.39999999999999997,02/01/2020
posts,hot chocolate 5k 15k begin sunday february 2nd 7am go 11am time east campus roads closed vehicles parked peters parking deck brittain drive accessible please see map details,negative,-0.2411,positive,0.13125,02/01/2020
posts,go career fair looking job able go majors career fair year careerbuzz really good alternative feel like throwing resume black hole,positive,0.91,positive,0.48666666666666664,02/01/2020
posts,cs students like,neutral,0.0,neutral,0.0,02/01/2020
posts,researching student mentorship experience tech help us filling minute survey,positive,0.4574,neutral,0.0,02/01/2020
posts,alright one deleted,positive,0.25,neutral,0.0,02/01/2020
posts,gpa resume removed,neutral,0.0,neutral,0.0,02/01/2020
posts,gpa resume removed,neutral,0.0,neutral,0.0,02/01/2020
posts,rumors myths wondering spooky rumors go around tech maybe heard like ghosts myths secret rooms etc know campus really old using project mine anything give really appreciated lt,positive,0.5974,neutral,-0.03333333333333335,02/01/2020
posts,cs3510 brito like,positive,0.3612,neutral,0.0,02/01/2020
posts,videogame clubs hi currently waiting gatech decision wanted know rainbow six siege club,neutral,0.0,neutral,0.0,02/02/2020
posts,tickets ga tech vs nd game sale today great lower level sections mid court seats 13 14 row 110 10 11 row 109 row 108 10 removed,positive,0.4404,positive,0.13333333333333333,02/02/2020
posts,tickets ga tech vs nd game sale today great lower level sections mid court seats 13 14 row 110 10 11 row 109 row 108 10 removed,positive,0.4404,positive,0.13333333333333333,02/02/2020
posts,tech vs nd tickets removed,neutral,0.0,neutral,0.0,02/02/2020
posts,shot getting computer science program weighted gpa uw gpa 1570 sat removed,neutral,0.0,neutral,0.0,02/02/2020
posts,1332 recitation worksheets removed,neutral,0.0,neutral,0.0,02/02/2020
posts,pronounce clough deleted,neutral,0.0,neutral,0.0,02/02/2020
posts,declare thread cs removed,neutral,0.0,neutral,0.0,02/02/2020
posts,anyone car going ugahacks hi everyone team three people looking lift uga reimburse gas money delicious snacks road reply dm interested,positive,0.7896,positive,0.625,02/02/2020
posts,achio front porch girl sitting front porch achio wearing grey vale sweatshirt brown boots person wearing bunny ears walking haha fantasy football thing bad ff supposed ask someone take picture front house many girls kept coming door figured get explanation also cops called hope someone achio knows sees,positive,0.6467,neutral,-0.012499999999999956,02/02/2020
posts,harris residence hall removed,neutral,0.0,neutral,0.0,02/02/2020
posts,gravel parking area across nave removed,negative,-0.128,neutral,0.0,02/02/2020
posts,parking gravel lot across nave deleted,negative,-0.128,neutral,0.0,02/02/2020
posts,super bowl watching super bowl find cbs school tv stations,positive,0.8466,positive,0.3333333333333333,02/02/2020
posts,watching super bowl patrick mahomes calls ask necessary velocity throw football yards end zone break matlab picture literally candid picture someone working systems homework,positive,0.5994,positive,0.3111111111111111,02/02/2020
posts,vouchers evaporated less minute lol,positive,0.3687,positive,0.3166666666666667,02/02/2020
posts,harrison butker super bowl,positive,0.8356,positive,0.3333333333333333,02/02/2020
posts,metropolitan area network man networking arya college removed,neutral,0.0,neutral,0.0,02/03/2020
posts,guns roses bobby dodd stadium 12 20,neutral,0.0,neutral,0.0,02/03/2020
posts,ece 3710 help removed,positive,0.4019,neutral,0.0,02/03/2020
posts,ece 3710 help exam coming later week feel unprepared modules pretty useless opinion really cover approaches solving problems well anyone tips studying class thanks,positive,0.8118,neutral,0.030000000000000006,02/03/2020
posts,bike commuting survey research project removed,neutral,0.0,neutral,0.0,02/03/2020
posts,career fair query removed,positive,0.3182,positive,0.7,02/03/2020
posts,bike experience survey research removed,neutral,0.0,neutral,0.0,02/03/2020
posts,art gt get involved art campus love take drawing painting class perhaps join club campus organizations recommend id minor fun feel like need outlet creativity would really cool spend hours week painting drawing,positive,0.9546,positive,0.275,02/03/2020
posts,minor inta vs global development planning adding minor either international affairs global development wondering anyone advice pick aerospace engineering student interested deep space exploration colonization efforts sure minor would useful context things like space policy,positive,0.809,positive,0.09,02/03/2020
posts,accepted georgia tech phd student mechanical engineering unsure funding,negative,-0.2382,neutral,0.0,02/03/2020
posts,disability services ga dyslexia friendly ga deleted,positive,0.5514,positive,0.375,02/03/2020
posts,video philippines sensation kai sotto playing high school ball atlanta georgia tech hoops target full event raw highlights,positive,0.2023,positive,0.09307692307692307,02/03/2020
posts,anyone trouble logging oscar deleted,negative,-0.4019,negative,-0.2,02/03/2020
posts,parking permit cost protest deleted,negative,-0.25,neutral,0.0,02/03/2020
posts,undergraduate research opportunities houston aiden lab baylor college medicine rice university seeking highly motivated undergraduates interested obtaining research experience ultimately pursuing careers interdisciplinary research especially looking molecular biologists computer scientists biophysicists really creative scientist variety interested sorts things reach us believe undergraduate students critical part research lab actively encourage growth opportunities students work featured cover nature science cell included seminal advances diverse array fields spanning molecular biology biophysics linguistics computer science mathematics current projects include developing high throughput robotic workflows cutting edge dna sequencing de novo genome assembly upgrading existing genome assemblies computational side developing software visualize analyze genomic contact data building deep learning machine learning models detect 3d chromatin features lab alumni gone phd programs medical school industry facebook uber etc check website director dr erez lieberman aiden assistant professor department genetics bcm adjunct assistant professor department computer science computational amp applied mathematics rice university work numerous awards including lemelson mit student prize american physical society award outstanding doctoral thesis research biological physics 2009 dr aiden named one 35 top innovators 35 technology review 2011 one recipients presidential early career award scientists engineers 2014 dr aiden named one world economic forum top young scientists 2018 one recipients michael debakey excellence research award interested spending summer least 10 hours week school year kind research people still reading 10 years reach us please apply optional github link brief statement interest information email visit aidenlab org,positive,0.9978,positive,0.10876543209876546,02/03/2020
posts,found airpods techwood dr removed,neutral,0.0,neutral,0.0,02/03/2020
posts,busses softly whisper memory card front seat removed,negative,-0.296,positive,0.1,02/03/2020
posts,amazon testing delivery drone burger bowl,positive,0.1779,neutral,0.0,02/03/2020
posts,anyone know difficult tests robotics 4451 mazumdar anyone previous practice exams previous semesters,negative,-0.3612,negative,-0.27777777777777773,02/03/2020
posts,lost company,negative,-0.3182,neutral,0.0,02/03/2020
posts,shook,negative,-0.1027,neutral,0.0,02/03/2020
posts,recruit kai sotto want us deleted,positive,0.0772,neutral,0.0,02/03/2020
posts,iphone 11 pro ultra wide test,neutral,0.0,negative,-0.1,02/03/2020
posts,vibe like campus surrounding lgbtq rights acceptance know every school homophobia prejudice general overall tech population chill lgbtq rights administration amp x200b social justice issues,positive,0.7319,neutral,0.02777777777777778,02/03/2020
posts,makeclimateaclass powerdialogue georgiadrawdown ask teacher assign event homework discuss class hosting panel live kendeda building,neutral,0.0,positive,0.13636363636363635,02/03/2020
posts,combinatorics thang le removed,neutral,0.0,neutral,0.0,02/03/2020
posts,would anybody willing help fellow engineer naming couple organic structures deleted,positive,0.4019,positive,0.25,02/03/2020
posts,get point info session deleted,neutral,0.0,neutral,0.0,02/03/2020
posts,totally sure want keep anymore chances mood pass three four days back regular ol productive self really know want anymore really want keep studying feel smart anywhere near smart classmates think even fake til make nearly well know pushed school parents study something never really interest would earn lot money actual interests interests even time energy pursue balance studying feel shriveled grey like husk even mind crying right way least emotional release even feel human anymore dehumanized least enabled times laugh sounds hollow ears always fleeting felt anything stress anger sadness times apathetic shut completely want anymore want anymore time lying hopes enough start believing three years tired young age yet feel like hold excitement tomorrow anything days wish tomorrow would never come gone counseling center referred psychiatric department help find someone campus handle issues deep went stamps found therapist week took marta sat session paid fee taking marta back things got little better sometimes hours needed trip much even week stopped thought okay better place thought could take hopeless emptiness runs deep dig grown large ignore strength anymore keep trying maybe exceptionally weak minded literal thousands people graduated front people come back say gets better definitely worth great glad people cowards resilience call biggest one want anymore,positive,0.982,positive,0.0718112244897959,02/03/2020
posts,ssh gt network removed,neutral,0.0,neutral,0.0,02/04/2020
posts,crosland,neutral,0.0,neutral,0.0,02/04/2020
posts,canvas issues removed,neutral,0.0,neutral,0.0,02/04/2020
posts,flynn brantley scholarship removed,neutral,0.0,neutral,0.0,02/04/2020
posts,logo design photography website creation removed,positive,0.2732,neutral,0.0,02/04/2020
posts,bus driver heat 90 70 outside wtf,negative,-0.5859,negative,-0.25,02/04/2020
posts,honey bee georgia tech yellow jackets football yellowjacket gatech ga tech,neutral,0.0,neutral,0.0,02/04/2020
posts,cs2050 math3012 required cs major far least covering almost exact material something come later totally different,neutral,0.0,neutral,0.018750000000000003,02/04/2020
posts,english 1101 credit dual enrolled english 1102 got credit gsu 1101 since got ap exam gt website says give credit ap test would take 1101 already taking 1102 seem like makes sense,positive,0.5163,neutral,0.0,02/04/2020
posts,bmed 2310 tmj patient interview removed,neutral,0.0,neutral,0.0,02/04/2020
posts,anyone interested leetcode premium deleted,positive,0.4019,positive,0.25,02/04/2020
posts,suppose drop class oscar continues error deleted,negative,-0.2732,neutral,0.0,02/04/2020
posts,thank nate,positive,0.3612,neutral,0.0,02/04/2020
posts,tips homophobic student removed,neutral,0.0,neutral,0.0,02/04/2020
posts,wreck techs hiring hiring application open information link apply questions job hiring process feel free get touch,positive,0.3129,positive,0.2,02/04/2020
posts,work another phase probably hell week really hate everyday cyclical wake class study work eat repeat feel like stuff want learn know dedicate time towards upset well classes necessarily get grade wanted feel like right upset give class general really like content classes hate structure feel like enough time learn test really appreciate concepts learning new material time test week focus divided brain right feels numb used high stress time numb feeling numb regularly everyday like need something kickstart brain nowadays stress caffeine cloudiness goes away productive awake makes sense joke around friends reality feel empty inside really many close friends ones clearly hit hard semester everybody kind grinding nonstop makes think post college life everybody splits apart work relocation stuff working financially stable office job coming back en empty apartment repeating next day anyway probably feel bit better week cheers fellow jackets good luck week tests,negative,-0.5711,neutral,-0.021254609587942928,02/04/2020
posts,downtown atlanta night georgia tech,neutral,0.0,neutral,0.0,02/04/2020
posts,first year career fair removed,neutral,0.0,positive,0.475,02/04/2020
posts,atlanta parking survey,neutral,0.0,neutral,0.0,02/04/2020
posts,danger nae anyone hear sirens outside nae thinkk life danger wat could,negative,-0.7599,neutral,0.0,02/04/2020
posts,boarding frat planning boarding frat summer like hear people experiences boarding frat stayed costs etc would great hearing female perspective thanks,positive,0.8687,positive,0.3333333333333333,02/04/2020
posts,scpc comedy show removed,positive,0.3612,neutral,0.0,02/04/2020
posts,advices high school junior removed,neutral,0.0,positive,0.16,02/04/2020
posts,hack gt team removed,positive,0.4278,neutral,0.0,02/04/2020
posts,cs 3630 vibes,neutral,0.0,neutral,0.0,02/04/2020
posts,,neutral,0.0,neutral,0.0,02/05/2020
posts,join us learn godzilla expert bill tsutsui doom laden dreams japanese popular culture tuesday feb 11 seventh floor reading room,positive,0.6124,positive,0.3,02/05/2020
posts,current former restaurant employees quick questions context member team mobile apps services cs 4261 building application users specific dietary needs found difficult special diet gluten free avoiding processed sugars strict vegan find nearby restaurants accommodate attempting build app surfaces information highlight nearby restaurants potentially specific menu items user order based dietary profile however need gauge restaurants currently deal reporting ingredients fulfilling special requests worked restaurant chef server cashier etc love get perspective questions title work ever needed deal customer specific dietary request need modify existing menu item recommend item worked restaurant menu indicators specific ingredients gluten free dairy free vegan vegetarian processed sugars customer question menu item ingredients know answer ask answers one questions suggestions project please reply thread prefer submit anonymously respond google form thanks perspectives,positive,0.9464,positive,0.1529761904761905,02/05/2020
posts,subleasing uhouse apt summer removed,neutral,0.0,positive,0.6,02/05/2020
posts,anyone know bus gt ugahacks title,positive,0.4278,neutral,0.0,02/05/2020
posts,uh apartment summer removed,neutral,0.0,neutral,0.0,02/05/2020
posts,rest,neutral,0.0,neutral,0.0,02/05/2020
posts,new jacket alert,neutral,0.0,positive,0.13636363636363635,02/05/2020
posts,first year students career fair removed,positive,0.3182,positive,0.475,02/05/2020
posts,clubs social events week cycle going class library back dorm crash think need attend socials gonna go nuts,negative,-0.6124,neutral,0.016666666666666666,02/05/2020
posts,severe weather possible tomorrow situational awareness subject severe weather possible thursday sitrep 2020 issued wednesday february 2020 3pm overview deep upper level trough push eastern half country overnight setting stage severe weather thursday surface expect relatively strong cold front impact region tomorrow morning expect storms develop along squall line ahead front producing heavy rain strong winds possibly tornadoes see figure timing region 9am 12pm rain may heavy times may exceed inches event storm prediction center expanded slight risk area see figure include metro atlanta region large area enhanced risk south east addition severe weather threat thursday may wrap around precipitation friday morning form light snow showers flurries see figure expect much colder temperatures mid 30s friday morning breezy conditions however expect impacts roadways travel friday amp x200b figure day convective outlook spc primary hazards primary hazards straight line winds gt 60 mph isolated tornadoes timing thursday 12 noon next steps georgia tech police department office emergency management continue monitor situation provide updates necessary follow gt office emergency management twitter latest forecast information please visit national weather service storm prediction center amp x200b figure simulated radar 7am thursday feb 6th 12z 20200205 nam 3k amp x200b figure simulated radar 7am friday feb 7th 12z 20200205 nam 3k ps chance cancel classes approaching chance someone responding post cancel classes approaching 100 safe ga tech office emergency management,negative,-0.8947,positive,0.0707482993197279,02/05/2020
posts,bs 2110 hw due procrastinate redo make perfect min right timed lab deleted,positive,0.7227,positive,0.38690476190476186,02/05/2020
posts,angry marta able protest outside david purdue office 3280 peachtree rd ne 30 pm today would love see yackets,negative,-0.1007,positive,0.125,02/05/2020
posts,math 2550 removed,neutral,0.0,neutral,0.0,02/05/2020
posts,guy almost hits way class starter pack,neutral,0.0,neutral,0.0,02/05/2020
posts,smash board games poker boba amp removed,neutral,0.0,neutral,0.0,02/05/2020
posts,smash games boba amp removed,neutral,0.0,neutral,0.0,02/05/2020
posts,class survey interview request removed,neutral,0.0,neutral,0.0,02/05/2020
posts,opening atlanta community startup side project launches amp news gt biz createx atdc coder peeps,positive,0.4278,neutral,0.0,02/05/2020
posts,gtvsa valentine casino night february 16 student center ballroom,neutral,0.0,negative,-0.1,02/05/2020
posts,gtvsa valentine casino night february 16 student center ballroom removed,neutral,0.0,negative,-0.1,02/05/2020
posts,anyone going pearlhacks deleted,neutral,0.0,neutral,0.0,02/05/2020
posts,oh god cs 2340 removed,positive,0.2732,neutral,0.0,02/05/2020
posts,bts concert parking going bts concert bobby dodd student without parking pass get parking benefits stadium gonna park visitor lot something,positive,0.5803,neutral,0.0,02/05/2020
posts,choose ee ce help deleted,neutral,0.0,neutral,0.0,02/05/2020
posts,cs 2050 removed,neutral,0.0,neutral,0.0,02/05/2020
posts,chance cs removed,positive,0.3164,neutral,0.0,02/05/2020
posts,questions home park landlords phd student looking move fall looked places managed michelle wei home park living wondering anyone rented experiences like mean apartments looked okay first glance always good get another opinion edit place hampton heard way better used anyone lived chime,positive,0.8823,positive,0.3275,02/05/2020
posts,career fair free headshots heard career fair opportunity getting headshot taken true want head way mccamish rain nothing,positive,0.9275,positive,0.5375,02/05/2020
posts,math 2603 summer removed,neutral,0.0,neutral,0.0,02/05/2020
posts,math 2603 summer removed,neutral,0.0,neutral,0.0,02/05/2020
posts,smart coronavirus tech want encourage everyone keep eye health fellow students international campus potential risk person entering campus coronavirus frankly higher many places us heard reports infection campus panic foolish stupid however strong evidence supporting story official numbers infection fatality rates coming china blatantly false vastly understated best dealing something worse flu worst dealing virus potential 15 mortality rate see stories fluctuating tencent numbers take preventative measures wash hands often educate aware oh racist assume chinese students ones may potentially transmissive chinese students probably worried family back home support best nice everyone else,positive,0.4973,positive,0.09036281179138321,02/06/2020
posts,student life forcing students flu go class removed,negative,-0.3818,neutral,0.0,02/06/2020
posts,physicists mad stressed apparently,negative,-0.6808,negative,-0.2875,02/06/2020
posts,unofficial georgia tech soccer kit,neutral,0.0,neutral,0.0,02/06/2020
posts,gtri urip anyone heard back gtri urip yet edit ask either sad yet still hope us,negative,-0.126,negative,-0.25,02/06/2020
posts,yall think vention machine design platform especially majors removed,neutral,0.0,neutral,0.0,02/06/2020
posts,make rain stop seriously shoes drenched,negative,-0.1779,negative,-0.3333333333333333,02/06/2020
posts,input first years career fair idea removed,positive,0.3182,positive,0.475,02/06/2020
posts,whoever stole umbrella suck,negative,-0.4404,neutral,0.0,02/06/2020
posts,get chat buses waiting outside rain today blue bus stopped went back doors open bus driver started driving away started waving hands yelling wait one said anything stop drove away still bus stop chilling rain,negative,-0.784,negative,-0.1,02/06/2020
posts,student democratic primary debate today come check especially teampete reps buttigieg gabbard sanders yang campaigns support warren biden probably still join klaus 2443 7pm,positive,0.6326,positive,0.2,02/06/2020
posts,class ring anyone used another company get class ring balfour want one basically dont plan wearing ton hard justify spending 1000 cheapest gold one dont plan wear mind using another company look decent cheaper,negative,-0.1447,negative,-0.06250000000000001,02/06/2020
posts,counseling deleted,neutral,0.0,neutral,0.0,02/06/2020
