type,text,VADER sentiment,VADER sentiment score,TextBlob sentiment,TextBlob sentiment score,date
posts,considering withdrawing exchange program coronavirus tl dr coronavirus close suburb starting think withdraw study abroad withdrawing mean get credit semester might pay back loan probably apply readmission amp x200b edit three chruch community risen seven overnight including pastor church seven also within suburb community madrid 76 56 cases according latest numbers amp x200b post questions asked advisor financial aid office registrar office happens decide leave program gt decides leave program amp x200b exchange program spain coronavirus may may broken suburb news sources saying corona yesterday councilor health mayor refuse confirm today started raise lot questions thought might help someone else similar situation list questions asked staff gotten answers point might overreacting wanted gather information could making best informed decisions situation develops glad atl task force ready assess everything going feel like us exchange told everything fine listen host university wait cdc put us level designation really trust gt watching us closely anything going done us wanted ready make choices know right ones make amp x200b background specific situation three people may may coronavirus part church 200 people find likely spread others within church going spread get disease spread works three people showed symptoms yesterday feeling going blow coming weeks study abroad programs pulled china south korea italy reached level designation cdc programs japan level designation pulled spain designation time fear problem suburb going get worse quickly perhaps rest spain case maybe cdc feel need raise entire country level point gt send us home sure want wait around problem get bad enough host university cancels classes cdc says sent home amp x200b amp x200b questions asked gotten answers point georgia tech send us home asked gt education abroad advisor continue monitor contact host university regarding changes campus activities ie suspension cancellation classes etc require students depart cdc state department travel advisories reach level currently spain level cdc level level since october increased since outbreak coronavirus state department answer expecting basically going wait cdc says something otherwise decision still sure exactly cdc decides start assigning levels different places amp x200b parents feel safe anymore want leave happens asked gt education abroad advisor decide depart need discuss host university options complete semester remotely heard host university offering distance learning options offering option able complete semester would withdrawn fs4000 able transfer credits semester please note would finaid implications case asked host university whether completing semester remotely option yet receive reply made fairly clear beginning semester distance exams never allowed circumstances extrapolate infrastructure place facilitate distance learning asked nonetheless perhaps making preparations case becomes widespread amp x200b withdraw semester implications financial aid need pay back loan lose eligibility future loans asked office scholarships financial aid normal circumstances refund process march 11th point 100 loan would retained hand chance courses fees waived cancelled loan would simply returned lender seem though lose financial aid future think withdraw program get cancelled may pay back loan face hold account wait march 11th maybe repay really sure amp x200b information give asked email office scholarships financial aid withdrawing program could also impact pace according sap policy eligibility would suspended pace goes 75 two consecutive semesters explain pace asked follow email osfa pace referring completion rate credit hours earned divided hours attempted actually checked pace specifically gave update would mean withdraw semester entirely amp x200b case host university classes cancelled options lose entire semester equivalent online courses tech available asked gt education abroad advisor host university decides cancel classes remainder semester cannot offer options finish semester remotely would able enroll gt courses offer options remotely completing semester would lose semester decide leave early required return home heard programs able take courses online got cancelled able point probably far along semester amp x200b withdraw semester considered unenrolled semester words withdraw take summer classes institute need apply readmission fall semester asked office registrar missing two consecutive terms requires admission link provides information regarding georgia tech admission policy procedures asked clarity since directly answer whether withdrawing semester counts unenrolled semester heard grapevine students studying south korea need apply admission take summer classes assume withdrawing semester counts unenrolled threads within subreddit regarding readmission amp x200b amp x200b really sure anyone else similar situation needs information tired hearsay able understand protocol different corners gatech websites found answers needed wanted share case anyone else needs good luck everyone stay healthy,positive,0.9729,positive,0.13046536796536798,03/03/2020
posts,anyone selling trevor wallace tickets removed,neutral,0.0,neutral,0.0,03/03/2020
posts,looking someone handle business side removed,neutral,0.0,neutral,0.0,03/03/2020
posts,discussion coronavirus first pessimistic situation closely follow news since beginning outbreak china believe outbreak atlanta inevitable problem two confirmed cases quarintined immediately airport means others flight highly likely get infected already quarintined yet usually takes 14 days develop symptom yet infected people symptom still infect others suggestion wear mask even though cdc guidline recommend reasoning actually extremely difficult avoid touching face mouth nose daily life wearing mask means mouth nose covered greatly reduces possibility touch case study lancet spread virus family cluster shows person infeced among group family members wear surgical mask time reported case ningbo zhejiang person infected 15 second exposure confirmed case wearing mask,negative,-0.9771,positive,0.14545454545454548,03/03/2020
posts,gpa requirements ece department true forgot class syllabus found registration last semester saved picture wondering still true ece department official published gpa policy curving based course level 2xxx 3xxx find online done away edit also general must curve,negative,-0.1754,positive,0.1875,03/03/2020
posts,kamibet situs casino online resmiterpercaya,neutral,0.0,neutral,0.0,03/03/2020
posts,brittain go got extra protein deleted,neutral,0.0,neutral,0.0,03/03/2020
posts,brittain go got extra protein,neutral,0.0,neutral,0.0,03/03/2020
posts,major related classes removed,neutral,0.0,neutral,0.03125,03/03/2020
posts,data science visualization bootcamp post grads removed,neutral,0.0,neutral,0.0,03/03/2020
posts,somebody really got transported trevor wallace mans goin hard,negative,-0.1027,neutral,-0.04583333333333334,03/03/2020
posts,coronavirus heard many different things regarding possible cancellation class coronavirus gets hand jokes aside everyone think chance happening would even heard tech may make classes go online know obviously answer right questions wanting know everyone else thoughts,positive,0.6199,positive,0.15714285714285714,03/03/2020
posts,guys think gt sponsored asbs cancelled coronavirus removed,positive,0.2103,neutral,0.0,03/03/2020
posts,asb coronavirus removed,neutral,0.0,neutral,0.0,03/03/2020
posts,watch containment netflix wanna procrastinate deleted,neutral,0.0,neutral,0.0,03/03/2020
posts,spring 2020 afternoon graduation tickets removed,neutral,0.0,neutral,0.0,03/03/2020
posts,know united health insurance mandatory us covers coronavirus,positive,0.4767,neutral,0.0,03/03/2020
posts,minimester grades come hey guys took minimester class received feedback naturally wondering grades available earlier wait spring grades come curious,positive,0.1007,positive,0.1,03/03/2020
posts,gt berlin 2020 groupme removed,positive,0.4278,neutral,0.0,03/03/2020
posts,gt berlin 2020 groupme removed,positive,0.4278,neutral,0.0,03/03/2020
posts,gt berlin 2020 groupme removed,positive,0.4278,neutral,0.0,03/03/2020
posts,gt berlin 2020 groupme made groupme berlin summer program redacted bots pm link,positive,0.4278,neutral,0.0,03/03/2020
posts,conditional transfer pathway question deleted,neutral,0.0,neutral,0.0,03/04/2020
posts,megathread coronavirus covid 19 sars cov coronavirus discussions quarantined megathread 15 rona posts day much stop posts pertaining virus removed see one please report using report button,positive,0.3182,positive,0.2,03/04/2020
posts,classes next week daylight savings time spring forward one hour removed,neutral,0.0,neutral,0.0,03/04/2020
posts,accurately represents calculus experience,neutral,0.0,positive,0.4000000000000001,03/04/2020
posts,fostering pets removed,neutral,0.0,neutral,0.0,03/04/2020
posts,fostering pets removed,neutral,0.0,neutral,0.0,03/04/2020
posts,fostering pets removed,neutral,0.0,neutral,0.0,03/04/2020
posts,fostering pets hi guys know everything going corona virus problems world seem sort insignificant like get quick minute attention something deeply troubles every year thousands families across united states displaced due natural disasters terrible tornado hit nashville might think problem addressed really well mean thats organizations like fema emergency response personnel right agree job extremely well respect thank one thing though sort gets swept rug forgotten wake disaster pets large scale natural disaster lot people lose homes although often able find safe place live usually say goodbye part family dogs cats plethora pets simply given shelters adoption owners simply place couple friends thought idea losing member family love amidst already losing home majority way life simply deplorable humbly asking fellow yellow jackets would interested fostering displaced pets know someone willing know someone also facing impossible choice letting go loved one simply place keep right love hear interested love could take second time let us know fosterlink thanks much guys love,positive,0.9849,positive,0.09488954672778203,03/04/2020
posts,student employee training student employee time reporting method determined job department following sessions self guided web based trainings take approximately 15 minutes register,positive,0.34,negative,-0.2,03/04/2020
posts,cs threads max overlap removed,neutral,0.0,neutral,0.0,03/04/2020
posts,lost apple watch deleted,negative,-0.3182,neutral,0.0,03/04/2020
posts,anyone tried coca cola energy good better options removed,positive,0.8053,positive,0.6,03/04/2020
posts,really wish way make professors better deleted,positive,0.7089,positive,0.35,03/04/2020
posts,georgian tech tee interest form comments,neutral,0.0,neutral,0.0,03/04/2020
posts,paid research study new aptitudes attitudes assessments deleted,neutral,0.0,positive,0.13636363636363635,03/04/2020
posts,rain pants waterproof backpack cover anyone recommendations tapered ankle rain pants waterproof backpack cover figure descend depression rain days week might well stay dry thanks,positive,0.1511,positive,0.06666666666666668,03/04/2020
posts,curve mayer 1554 removed,neutral,0.0,neutral,0.0,03/04/2020
posts,curve math 1554 mayer removed,neutral,0.0,neutral,0.0,03/04/2020
posts,current giving called tuition amp fees like used help students anyway,positive,0.457,neutral,0.0,03/04/2020
posts,rescinding got summer term transfer semester drop two classes means first two ws final transcripts fine talk counselor,negative,-0.1154,positive,0.22222222222222224,03/04/2020
posts,spring break survey hi conjunction gt administration collecting information regarding student needs spring break determine whether hours dining halls crc student center adjusted ensure meeting demand due travel alerts many students may altered plans hope take account plan potential impacts plan staying campus spring break please fill following short survey indicate services hope utilize time please feel free let us know questions,positive,0.9532,positive,0.09642857142857143,03/04/2020
posts,thoughts institute graduating soon lot people high school age know work asking think school consider usually honest experience school personal life difficult last years think fair give opinion guess wondering everyone else thoughts feel student body social scene academics faculty literally anything school think would tell someone considering coming,positive,0.2144,positive,0.1419047619047619,03/04/2020
posts,anyone interning facebook seattle summer removed,neutral,0.0,neutral,0.0,03/04/2020
posts,frats renting rooms summer hey working gtri summer would prefer pay like 3400 housing frats renting rooms amp renting rooms guys summer person charge frat dm something thanks,positive,0.4094,positive,0.2,03/04/2020
posts,professor ta posts exam grade lowers posted grade couple days later gfy,negative,-0.128,neutral,0.0,03/04/2020
posts,please ban,positive,0.6398,neutral,0.0,03/04/2020
posts,rear lab coc little science humor goes long way,positive,0.2075,negative,-0.11875,03/04/2020
posts,apply next undergrad sga president hello yellow jackets interested serving next sga president vice president applications currently open undergraduate student government association sga elections serving student body elected position incredible opportunity enact change campus may apply run student body president student body vice president together executive ticket additionally may apply seat undergraduate house representatives uhr sga legislative branch may learn sga positions responsibilities going sga gatech edu applications close friday march 6th 11 59pm find application engage clicking additional questions elections running position please contact amanda healy chair sga elections committee,positive,0.8684,positive,0.19166666666666665,03/04/2020
posts,cs3451 mood deleted,neutral,0.0,neutral,0.0,03/04/2020
posts,cs 3451 mood,neutral,0.0,neutral,0.0,03/04/2020
posts,likely c2d2 ban career fair renege offer removed,negative,-0.3182,positive,0.35,03/04/2020
posts,adhd add resources strongly suspect might add adhd based typical symptoms read online also older sister officially diagnosed last year thats first learnt symptoms way get officially diagnosed amp needed get medication campus read similar post years back saying stamps psychiatry true tech accommodations support students add adhd also students officially diagnosed navigated tech know officially diagnosed feel like might strongly negatively impacting academics,positive,0.8276,positive,0.08148148148148146,03/04/2020
posts,interested product management product management club georgia tech would like extend invitation come interest meetings inaugural semester club meeting coming monday march 9th 00 pm est skiles room 368 meeting last 45 minutes learn mission daily basis future career product management complimentary food refreshments provided look forward meeting everyone introducing club plan attending please rsvp event date 9th march time pm location skiles 368 questions concerns please hesitate reach us email linkedin www linkedin com company gtpm amp x200b,positive,0.9471,positive,0.11000000000000001,03/04/2020
posts,dr lubinksy class anyone know particular strategies lubinksy 2551 class rn distance student horrible tests small mistakes always low 30s 40 points far get material 100 often time crunched also heard final bad think might banking study,negative,-0.9468,negative,-0.24047619047619048,03/04/2020
posts,opened trevor wallace heard friend opener funnier rip anybody remember name,positive,0.7399,neutral,0.0,03/04/2020
posts,nujabes concert nujabes tribute concert hosted collaborator shing02 monday march 9th 00 aisle wondering anyone tech going pm,neutral,0.0,neutral,0.0,03/04/2020
posts,good try,positive,0.4404,positive,0.7,03/04/2020
posts,veterans transfer pathway program removed,neutral,0.0,neutral,0.0,03/05/2020
posts,math 1553 maymester removed,neutral,0.0,neutral,0.0,03/05/2020
posts,jobs campus freshmen idk asking little early wondering work get georgia tech fall good ok campus jobs paid research opportunities,positive,0.8705,positive,0.27812499999999996,03/05/2020
posts,schedule classes release delay got scheller figured rest might like hear well registrar pushed back release schedule classes summer fall semesters tuesday march 10th updated calendar cob academic advising canvas reflect,positive,0.3182,neutral,0.0,03/05/2020
posts,cocoon forum share stories never alone removed,positive,0.4479,neutral,0.0,03/05/2020
posts,cocoon forum share stories build community removed,positive,0.296,neutral,0.0,03/05/2020
posts,international women day game event got lot available listed hope see,positive,0.4926,neutral,0.0,03/05/2020
posts,know waterfall campus,neutral,0.0,neutral,0.0,03/05/2020
posts,housing room selection room selection housing start finished application little ago heard anything else since,neutral,0.0,negative,-0.1875,03/05/2020
posts,tangle build create connect cardboard drag racing music video filmed ga tech startup launched android app website blast making video launch deleted,positive,0.2481,negative,-0.1,03/05/2020
posts,tangle build create network cardboard drag racing music video filmed ga tech blast filming making app website launch,positive,0.1984,negative,-0.1,03/05/2020
posts,apartment recommendations hi transfer student thinking living campus recommendations 1bed preferred also studio want near gt library idk one main one yeah big ones preferred market near korean markets car budget 1300 per month less better thanks,positive,0.9091,positive,0.1285714285714286,03/05/2020
posts,georgia tech launch pilot program alcohol sales home baseball games,neutral,0.0,neutral,0.0,03/05/2020
posts,source located midnight storm culc end good,positive,0.4404,positive,0.7,03/05/2020
posts,fuck burdell seriously fuck place paid twenty two dollars world shittiest umbrella bought piece trash two days ago already falling apart shittiest build quality ever seen,negative,-0.9694,negative,-0.4,03/05/2020
posts,anyone want swim lake kendeda,positive,0.0772,neutral,0.0,03/05/2020
posts,clothing repair store near campus anyone know store nearby campus fixes holes jeans shirts etc,neutral,0.0,positive,0.1,03/05/2020
posts,self isolate,neutral,0.0,neutral,0.0,03/05/2020
posts,kancilbola situs judi slot online vip di indonesia,positive,0.6166,neutral,0.0,03/05/2020
posts,get top companies even talking spacex tesla boeing etc idk competitive get internships mid tier companies like gm cat l3 ge context first year grad student paid research,positive,0.6299,positive,0.25,03/05/2020
posts,ever stop raining forgotten fearing go outside forgotten getting point point dry forgotten walking fear puddles forgotten like live free world fin amp x200b wont mind rain megathread,negative,-0.2964,positive,0.11742424242424243,03/05/2020
posts,free campus food delivery gu dumplings zunzi deleted,positive,0.5093,positive,0.4,03/05/2020
posts,doggo game cute airbud boi caught frisbees basketball game yesterday would love see social media possible,positive,0.802,neutral,0.03888888888888888,03/05/2020
posts,ieee board application open ieee executive board applications open 2020 2021 academic year lot positions open want guys join team lot exciting events planned next year including hackathon benefits joining board include time head recruiters sponsors like microsoft gm samsung amd etc sponsors ieee gatech edu many execs interned places would love recommend well chance gain leadership experience part largest ieee chapter country something cool write resume hosting hackathon sponsored different companies chance interact elections held 11 00 thursday 31st march van leer c340 interested running ieeeofficer position 2020 2021 school year please fill form linked positions open gt student senior executive officer positions reserved previous officers ieee event previous officers run senior executive position position open anyone link application hope see lot,positive,0.9634,positive,0.10444444444444442,03/05/2020
posts,sps hosting smash tournament fundraiser saturday ultimate singles doubles melee singles doubles crew battles going cash prizes trophies winners event also pizza drinks available purchase tournament deleted,positive,0.6229,positive,0.2,03/05/2020
posts,sps hosting smash tournament fundraiser saturday come food prizes smash amp x200b ultimate singles doubles melee singles doubles crew battles going cash prizes trophies winners event also pizza drinks available purchase tournament tournament going howey l1 saturday march 7th doors open 9am event starts 10 30am cost per event pre register smash gg per event door day come saturday support society physics students make event stream questions comment email,positive,0.8852,positive,0.13333333333333333,03/05/2020
posts,got chem 1310,neutral,0.0,neutral,0.0,03/05/2020
posts,free campus food delivery gu dumplings zunzi removed,positive,0.4588,positive,0.4,03/05/2020
posts,tech school said deleted,neutral,0.0,neutral,0.0,03/05/2020
posts,starting fab weekly like 10 minutes hell diamonds deleted,positive,0.3218,neutral,0.0,03/05/2020
posts,staring fab weekly like 10 minutes hell diamonds,positive,0.3218,neutral,0.0,03/05/2020
posts,helppp high schooler removed,neutral,0.0,positive,0.16,03/05/2020
posts,ode rain haiku one day sun left dismal wet despair felt shoes weep socks winter coming winter rain ponder cs1301 thank,negative,-0.5423,negative,-0.05,03/05/2020
posts,request extension midterm deleted,neutral,0.0,neutral,0.0,03/06/2020
posts,need yr olds asap,neutral,0.0,neutral,0.0,03/06/2020
posts,nearby place get facial removed,neutral,0.0,neutral,0.0,03/06/2020
posts,sxsw video internship 2020 2021 big internships,neutral,0.0,neutral,0.0,03/06/2020
posts,giant black busses rolling outside howey,neutral,0.0,negative,-0.05555555555555555,03/06/2020
posts,day without like year without rain officially insult deleted,negative,-0.6608,neutral,0.0,03/06/2020
posts,rejoice today sweet georgian sun shines rays upon us knows next shall grace us radiance,positive,0.8172,positive,0.175,03/06/2020
posts,gtpd free talk friday investigators criminal investigation division investigators georgia tech police department criminal investigation division reddit ama 10am 4pm feel free ask anything criminal investigation crimes campus please keep questions safe appropriate,positive,0.2924,positive,0.08571428571428572,03/06/2020
posts,psa huge ball fire sky know seems emitting heat light familiar almost seen ages ago,neutral,-0.0129,positive,0.39166666666666666,03/06/2020
posts,research study compensation campus gt students removed,positive,0.4278,neutral,0.0,03/06/2020
posts,recruitment campus study compensation upto 80 georgia tech student use android phone one plus moto g5 requested participate research study go months intention study understand role eating experience play mental health providing smartwatch asking daily weekly responses quick questionnaire typical georgia tech student busy schedule becomes challenging researchers obtain self reported information natural setting eating habits participation inform us eating affects well using information investigate eating habits college population affect well receive gift card participation week drop first week receive compensation getting gift card week need enrolled entire week partial participation considered compensating respective week earn maximum 80 study located european union eu country permitted participate study due general protection data regulation gdpr want join study please write,positive,0.9413,positive,0.06011904761904762,03/06/2020
posts,anyone currently scheller ie pls dm removed,positive,0.0772,neutral,0.0,03/06/2020
posts,upvote think abnormally large number smiling faces campus today,positive,0.5106,positive,0.21428571428571427,03/06/2020
posts,lost buzzcard today removed,negative,-0.3182,neutral,0.0,03/06/2020
posts,free campus food delivery gu dumplings zunzi removed,positive,0.5093,positive,0.4,03/06/2020
posts,free campus food delivery gu dumplings zunzi removed,positive,0.5093,positive,0.4,03/06/2020
posts,free campus food delivery gu dumplings zunzi tired lacking dining options terrified student center closing summer teamed best local restaurants offer exclusive deals delivering lunch campus zero delivery fees work sign next week deliver gu dumplings zunzi south african subs simply place order 11am day 10 discount get meal anywhere campus food insulated bags food sure remain warm fresh order options custom boxes discounted lower menu price even delivery still able order item restaurants menu price delivery fees typically delivery fee well commission taken restaurant pay drivers since sending multiple orders pay driver full wage without relying fees tips additionally offerings save kitchen time effort since prepare food bulk discounts meals please sign using link directly join service preferred group chat groupme whatsapp discord strive provide absolute best value quality meals please let us know restaurants would like see questions,positive,0.9654,positive,0.23796296296296296,03/06/2020
posts,person went full speed jeep red light glc seconds turned red instinctively look ways despite red would dead right gatechpd something report gtpd slow,negative,-0.6486,positive,0.06696428571428571,03/06/2020
posts,perfectly balanced thank mr pts,positive,0.7717,positive,1.0,03/06/2020
posts,anyone else notice warm rainy sunny cold windy atl needs calm,positive,0.7876,positive,0.10000000000000002,03/06/2020
posts,compensation anyone fix phone tonight deleted,neutral,0.0,neutral,0.0,03/06/2020
