type,text,VADER sentiment,VADER sentiment score,TextBlob sentiment,TextBlob sentiment score,date
posts,housing winners losers welcome machine rip north ave north amp south gt march 23 2020 stay students buildings listed able choose stay current room march 23 2020 eligible buildings gt gt north campus shared apartments tenth home thb thd thf thg graduate living center glc gt gt west campus fulmer ful woodruff south 4th 5th floors wds crecine cre center street north csn center street south css eighth street east ese eighth street south ess eighth street west esw maulding mld nelson shell nsl zbar zbr gt gt east campus harris hrs gt gt north avenue campus north avenue east nae north avenue west naw amp x200b gt march 24 26 2020 campus community options gt gt honors crecine gt gt explore nelson shell gt gt grand challenges global leadership impact north avenue south gt gt rising 2nd year housing option north avenue south north avenue north floor gt gt north avenue grandfathered north avenue east north avenue west students indicated survey want live north avenue 2020 2021 gt gt live north ave lived north ave fall 2019 co oped interned spring 2020 amp x200b gt unfortunately survey question decisions eligible asked cannot changed buildings rooms chosen based information assignments received however good news four half months august move work roommate groups able assign together gt thank placing trust us applying next year value resident strive support academic endeavors continue education georgia institute technology amp x200b thoughts,positive,0.9622,positive,0.117003367003367,03/06/2020
posts,north ave north north ave south exclusively 2nd years removed,neutral,0.0,neutral,0.0,03/06/2020
posts,nan nas reserved exclusively 2nd years arguably nicest nav apartments especially north ave north exclusively reserved 2nd years feel,positive,0.296,neutral,0.0,03/06/2020
posts,video georgia tech gets clutch shot michael devoe give win clemson,positive,0.5859,positive,0.8,03/06/2020
posts,online look roomates deleted,neutral,0.0,neutral,0.0,03/06/2020
posts,white beanie willage 3rd floor removed,neutral,0.0,neutral,0.0,03/07/2020
posts,lost beanie removed,negative,-0.3182,neutral,0.0,03/07/2020
posts,beanie removed,neutral,0.0,neutral,0.0,03/07/2020
posts,officials multiple city departments present update residents amp students variety issues address questions amp concerns also cover issues related epa lead cleanup efforts westside mlk crime safety amp concerns impacting dist amp atlanta,neutral,0.0,neutral,0.0,03/07/2020
posts,looking roommates fall 2020 hello current roommates planning studying abroad fall guys looking roommates plan housing campus spring internship co op graduation please consider rooming us loud smoke relatively tidy clean makes difference majors cs compe ee hoping get person apartment west currently nave south rip,positive,0.6458,positive,0.21333333333333332,03/07/2020
posts,music technology major long shot anyone student graduate music technology bs program questions good amount jobs available music tech grads trouble finding jobs similarly internships co ops imagine research opportunities looking center music technology exist looking coursework noticed different concentrations engineering disciplines aware major example electrical engineering add music tech minor would feasible double major would coursework intense reference engineering student great university great tech t50 engineering considering applying transfer current school great really found place would even worth transfer id state,positive,0.9443,positive,0.21187499999999998,03/07/2020
posts,fidelity internship removed,neutral,0.0,neutral,0.0,03/07/2020
posts,please bully uga students deleted,positive,0.6031,neutral,0.0,03/07/2020
posts,international students bad gpa amp internships really worried getting internships gpa heard many people tech getting internships jobs great gpa think us citizens amp heard happening international students companies willing hire international students amp top heard international students need competitive regular applicants citizens obviously working improving gpa advice btw 2nd year ie major,positive,0.4911,positive,0.11517857142857145,03/07/2020
posts,lost demon slayer lanyard keys removed,negative,-0.4648,neutral,0.0,03/07/2020
posts,favorite classes classes really enjoyed tech would recommend free elective,positive,0.9145,positive,0.4666666666666666,03/07/2020
posts,music art technology fair bored interested intersection art music technology come caddell building fair ton cool interactive exhibits till 7pm fair also guthman musical instrument competition concert 7pm ferst theater probably biased exhibit super super cool thing,positive,0.9617,positive,0.3216666666666667,03/07/2020
posts,advice messy situation hey guys spite moderate efforts following situation international masters student lost easy subject lose max percent likely curving definitely mean gonna get high another subject borderline really hard course cse 6643 numerical linear algebra percentage points median worried get easy subject linear algebra course gpa sem gonna drop 66 get academic probation might cause funding assistantship problems current gpa 33 bs overall would brazen especially since prof linear algebra says gives 80 class bs play safe convert pass fail graduate next spring instead fall take either course intro hpc cse 6220 graduate,negative,-0.7563,neutral,-0.013874999999999998,03/07/2020
posts,long fire alarms flashing willage walked silently flashing ones giving flying shit get stuck something classic,negative,-0.836,neutral,-0.020833333333333336,03/07/2020
posts,check hydroponics removed,neutral,0.0,neutral,0.0,03/07/2020
posts,save north ave north removed,positive,0.5411,neutral,0.0,03/07/2020
posts,sex making frustrated removed,negative,-0.6808,negative,-0.7,03/08/2020
posts,gt parkour group two random guys running top coc pettit jumping morning tell going,positive,0.6115,neutral,0.0,03/08/2020
posts,crc open late sundays understand later opening weekend opening 9am saturdays wait till noon sundays open reason,neutral,0.0,negative,-0.075,03/08/2020
posts,early voting ferst center tomorrow vote fulton county vote ferst theater lobby tomorrow tuesday 30 pm check ga voter registration,neutral,0.0258,neutral,0.0,03/08/2020
posts,housing summer 2020 transfer recently got accepted transfer summer major wondering difference campus vs campus housing gt current uni know campus way go since way cheaper commute minimal idk atlanta since city setting,positive,0.2183,neutral,-0.009375000000000001,03/08/2020
posts,brutal truth,negative,-0.6249,negative,-0.875,03/08/2020
posts,atlanta corona news removed,neutral,0.0,neutral,0.0,03/08/2020
posts,deleted,neutral,0.0,neutral,0.0,03/08/2020
posts,anyone living bankhead heard bankhead gotten safer past couple years curious know anyone living comment like seems like good housing options near campus affordable safe 800,positive,0.9136,positive,0.19,03/08/2020
posts,big shout women club basketball team 4th straight swamp shootout championship gainesville fl next stop wichita,positive,0.5386,positive,0.06666666666666667,03/08/2020
posts,fuck,neutral,0.0,negative,-0.4,03/08/2020
posts,help students learn data structure visualizing execution code,positive,0.4019,neutral,0.0,03/08/2020
posts,unami shoppe closed removed,neutral,0.0,negative,-0.1,03/08/2020
posts,anyone else trouble accessing canvas getting screen whenever try access canvas 2fa thing screen pops firefox ie chrome site seems infinitely looping 2fa process right login,negative,-0.4019,neutral,0.042857142857142844,03/08/2020
posts,fidelity internship removed,neutral,0.0,neutral,0.0,03/08/2020
posts,boosted board stripped screw help deleted,positive,0.5859,neutral,0.0,03/08/2020
posts,could graduation tickets megathread need one extra afternoon ceremony even paying sure plenty people could sticky least central place people swap tickets,positive,0.3939,positive,0.05,03/08/2020
posts,update regarding campus services spring break confirmations campus services continuing spring break crc dining halls going open,neutral,0.0,neutral,0.0,03/08/2020
posts,check hydroponics hey everyone hustle exams homework classes issue climate change pressure put world food resources often put back burner planet warms world experiences increasing amount substantial heat waves hinders crop growth decreases arable land freshwater supply thus necessary optimize food production order sustain growing population one best ways hydroponic farming hydroponics alternative farming method grows plants water instead soil hydroponics systems vertically stacked decreasing amount growing space necessary addition hydroponics extremely water efficient using substantially less water traditional field farming hydroponics also grown indoors allowing anyone become farmer perceived benefits hydroponics one might wonder hydroponics common resource food production one major reason difficulty getting hydroponics process steep learning curve many unusual issues new users farmers run many problems maintaining system building supply chain part grand challenges group georgia tech tackling problem difficulty entering hydroponics someone know would interested learning project hydroponics find us link sign monthly newsletter contact us email please let us know comments suggestions us moving forward tldr check ankaponics com interested hydroponics grow space lettuce hydroponically saw post already got removed accidentally sorry thank great day week,positive,0.9768,positive,0.17262205387205387,03/08/2020
posts,work home job available interested making 12 24 hour home message lead verification job would validating phone numbers provide finding info online using tools give calling numbers find order validate contact monotonous job get boring steady money works around schedule morning business hours base pay 12 hour plus verified lead certain number,positive,0.631,negative,-0.1281746031746032,03/08/2020
posts,congressional candidate campus anyone know going,neutral,0.0,neutral,0.0,03/08/2020
posts,please ignore virus removed,positive,0.5283,neutral,0.0,03/08/2020
posts,petition close schools help prevent transmission corona virus,positive,0.4215,neutral,0.0,03/09/2020
posts,hey everyone check playlist maker app spotify,neutral,0.0,neutral,0.0,03/09/2020
posts,20 gatech weekly event megathread removed,neutral,0.0,neutral,0.0,03/09/2020
posts,20 gatech weekly event megathread know events campus around atlanta let us know subreddits atlanta weekly events gastate,neutral,0.0,neutral,0.0,03/09/2020
posts,gt housing roommate search option working yet anyone know housing portal list roommate options currently seeing select term term select option housing email said roommate search would available march 23 00 03 still uploaded figure time change thing looking returning llc apartment might also delay sure anyone else also issue,negative,-0.4169,positive,0.3,03/09/2020
posts,good econ program first year thinking switching majors econ worried prospect jobs graduate know interested subject wondering econ majors could speak like graduation thanks also cs minor necessary,positive,0.9179,positive,0.16904761904761903,03/09/2020
posts,ece 4180 team removed,neutral,0.0,neutral,0.0,03/09/2020
posts,know excused absence applied online filling form dean students got back message said thank filing care report know actually absence get screwed,positive,0.3811,neutral,-0.008333333333333333,03/09/2020
posts,creepy guy trench coat bird mask walking around campus removed,neutral,0.0,negative,-0.5,03/09/2020
posts,student jobs spring semester internship offer starting june able go home due various reasons job take month,neutral,0.0,positive,0.09375,03/09/2020
posts,wanna homework,neutral,0.0,neutral,0.0,03/09/2020
posts,ece 4180 team removed,neutral,0.0,neutral,0.0,03/09/2020
posts,paid research study new aptitude attitude assessments study hi everyone recruiting study georgia tech research study involves new traditional assessments aptitudes knowledge along questionnaire attitudes interests experiences spend time completing questionnaire home two lab sessions complete aptitude knowledge tests summarize ted talks total time include hours lab sessions hour questionnaire finish study receive 100 participate must fluent english high school graduate college experience normal corrected normal vision hearing motor coordination 18 25 years old able complete portions study information screening please call 404 385 0157 please call detail exact times gt park lab school psychology georgia tech,positive,0.8666,positive,0.13713286713286713,03/09/2020
posts,community amenities standard atlanta,neutral,0.0,neutral,0.0,03/09/2020
posts,pro life ryan bomberger founder radiance foundation speaking thurs students life gt hosting exciting speaker ryan bomberger thursday march 12th pm bill moore scc presidents suite amp pro life civil rights advocate ryan believes abortion social injustice topic discusses providing gt community new look social justice modern age ryan taking look abortion human rights issue unique perspective man conceived sexual violence placed birth mother multi racial adoptive family 15 10 13 brothers sisters also adopted work garnered massive media coverage new york times usa today la times cnn msnbc believe pro life feminism something everyone embrace welcome viewpoints experiences strongly encourage attendees bring questions even difficult ones identify pro choice political event ryan backing specific legislation candidates fb event info event got questions event hesitate ask,positive,0.9401,positive,0.16318181818181818,03/09/2020
posts,buses really committed leaving anyone behind willage,positive,0.3384,negative,-0.1,03/09/2020
posts,coop international ece master student possible international engineering master student managed secure coop position please share experience thanks,positive,0.8574,positive,0.12000000000000002,03/09/2020
posts,transfer gsu gt engineering help starting college next fall feel tech going take still like go legacy tech able get conditional pathway reason choose gsu proximity tech make transfer easy sure classes take first year college apply gsu sure people went process advice would helpful edit thank downvoting guess lmao,positive,0.9664,positive,0.3479166666666667,03/09/2020
posts,move georgia tech,neutral,0.0,neutral,0.0,03/09/2020
posts,stamps 100 34 fever eight hours able sleep eat drink water feel like literally dying stamps closest appointment portal days called twice able get feel like literal death head feels like manhattan project really glad tuition dues go update finally able get stamps 20 minutes calling appointment tomorrow morning hope internally bake lol update went stamps fever broke thankfully test ran negative clue currently better clear go back class tomorrow 11 since stayed home 24 hours fever broke thank love comments,positive,0.8781,positive,0.32727272727272727,03/09/2020
posts,fulton county closed schools removed,neutral,0.0,negative,-0.1,03/09/2020
posts,megathread coronavirus thread covid 19 coronavirus discussions quarantined megathread people post relevant news articles parent comment thread updated try keep updated alas one man speculation pertaining allegations campus cases allowed comment removed discussions gt response allowed march 11th today probably last day megathread depending flow news typing 418 comments know like fresher let know want presumptive cases 22 ga swelled gt 000 nationwide fulton county schools remain closed today brian kemp urged tell georgia state congress stay home gt faculty meeting today update get news officially declared covid 19 pandemic march 10th updated github gist containing college closures mod team would like recommend vote early ferst center state given trends university closings might returning vote canton waffle house employee tests positive coronavirus daycare employee tests positive covid gtpd comment ambulances seen campus earlier sick call crime log gtpd guidance regarding coronavirus march 9th princeton instructing students remain home spring break fulton county schools employee tests positive fulton county schools closed tomorrow georgia confirmed 11 presumed cases useful links coronavirus atlanta coronavirusga coronavirusatlanta official gt coronavirus page conta previous megathread,positive,0.9618,neutral,0.031304112554112556,03/09/2020
posts,covid19,neutral,0.0,neutral,0.0,03/09/2020
posts,best gt 15 food whats best food within 10 minute drive campus tryna pay 10 15 max yall got,positive,0.8541,positive,1.0,03/09/2020
posts,recovering lot skipped classes class attendance terrible semester past tried best attend every lecture semester fucking sucks feel disconnected classmates professors made easy stop going personal life took downturn bring want anything feeling little better want pick backlog work reading feel hopeless ever properly catching month since consistently attended classes longer since done reading assignments absolutely essential even skipped important assignments good excuse skipping much rather ask professors help especially since never spoken trying pick classes still difficult keep focused keep thinking panicking crap catch help attendance participation count courses anyone advice almost wondering take incompletes get together soon,positive,0.7522,positive,0.055324074074074074,03/09/2020
posts,gt housing contract cancellation deleted,positive,0.4278,neutral,0.0,03/09/2020
posts,much complain least happened,negative,-0.3612,neutral,-0.04999999999999999,03/09/2020
posts,girl coon asked okay thank flashback past trauma overall shitty day asking okay helped bring flashback thank edit thank stranger silver,positive,0.4927,positive,0.1875,03/09/2020
posts,many hours take short summer session early short summer session year wondering recommended number classes hours many humanities courses idea intense classes think good time management handle suggestions help thanks,positive,0.9237,positive,0.275,03/09/2020
posts,ready classes move online removed,positive,0.3612,positive,0.2,03/09/2020
posts,interested getting paid talk fave podcasts removed,positive,0.6808,positive,0.25,03/09/2020
posts,washing hands end 3rd quarter deleted,neutral,0.0,neutral,0.0,03/09/2020
posts,student action team covid 19 removed,neutral,0.0,positive,0.1,03/09/2020
posts,cios bonus cs 2050 removed,positive,0.5423,neutral,0.0,03/09/2020
posts,way get copy original acceptance letter looking oscar admissions website email even went home find help appreciated,positive,0.8834,positive,0.2875,03/09/2020
posts,girls saw take epic tumble outside kendeda touched kindness making sure ok embarrassed fact dumb enough trip painful way amp x200b thank bruised knees pride,positive,0.0772,neutral,0.0035714285714285904,03/09/2020
posts,cs 1301 availability removed,neutral,0.0,neutral,0.0,03/09/2020
posts,smart people tech removed,positive,0.4019,positive,0.21428571428571427,03/10/2020
posts,dude watched fall bird scooter middle 8th street hemphill avenue afternoon idk else find face made right stuck mind day shocking realize mouth could stretch far long know capable closely approximating gargoyle hope okay wow face stretch thought broken,positive,0.6597,neutral,-0.029365079365079372,03/10/2020
posts,helicopter nave anyone else see helicopter flying extremely low nave know reason,negative,-0.3384,neutral,0.0,03/10/2020
posts,two thumbs two hours sleep two exams two labs week presentation friday work tomorrow 101 degree fever added cough aches guy fucking kill edit emory scan covid update still feel awful symptoms continue flu swab came back negative apparently test chance false negative tested covid,negative,-0.8933,negative,-0.36428571428571427,03/10/2020
posts,nice lasted goodbye sun brought happiness running around campus stressing shitty me2110 robot,positive,0.0772,positive,0.6499999999999999,03/10/2020
posts,make deadline day send reminder email 10pm night inspired confidence gtl especially require join facebook,positive,0.8271,neutral,0.0,03/10/2020
posts,green bus gone rogue,neutral,0.0,negative,-0.2,03/10/2020
posts,fall summer 2020 courses buzzport pray ams,neutral,0.0258,neutral,0.0,03/10/2020
posts,arthritis user feedback bmed 2310 hi everyone currently bmed 2310 engineering design class biomedical engineering currently group looking people arthritis get user feedback prototypes may small chance anyone know someone arthritis willing meet one us 30 minutes willing meet week later next week spring break week next thank,positive,0.6177,neutral,0.03125,03/10/2020
posts,chbe 2100 dr champion removed,positive,0.5994,neutral,0.0,03/10/2020
posts,conversations cabrera episode susan lozier gt youtube,positive,0.4278,neutral,0.0,03/10/2020
posts,oneusg survey student employees hi everyone wanted get survey find want know best way get updates us current future gt student employee please consider filling survey take minute thank,positive,0.9086,positive,0.3333333333333333,03/10/2020
posts,research credit internship anyone experiences research internship getting research credit possible get research credit research online cs research btw thanks advance,positive,0.8818,positive,0.1,03/10/2020
posts,please post reddit flu like symptom amp class schedule removed,positive,0.3802,neutral,0.0,03/10/2020
posts,applies cs majors whole,neutral,0.0,positive,0.2,03/10/2020
posts,take language requirement taking chinese right first transfer semester tech far dominated majority study time sure bad studying simply bad time take language everyone else take language requirement last semesters semester filled easy courses etc,negative,-0.7919,positive,0.05690476190476194,03/10/2020
posts,loans take federal loan time semester unexpected expenses came gonna able pay financial aid office said room take loan according cost attendance,negative,-0.3818,positive,0.19999999999999998,03/10/2020
posts,crazy train whistle someone laying train whistle props prof trucking solid min train whistle bananza,negative,-0.2023,negative,-0.3,03/10/2020
posts,sign petition free north avenue rising sophomores removed,positive,0.5106,positive,0.4,03/10/2020
posts,class withdrawal removed,neutral,0.0258,neutral,0.0,03/10/2020
posts,fall 2020 classes coursicle,neutral,0.0,neutral,0.0,03/10/2020
posts,great migration continues,positive,0.6249,positive,0.8,03/10/2020
posts,early voting campus ends today go ferst center arts vote early time today registered vote,neutral,0.0,neutral,0.03333333333333333,03/10/2020
posts,anyone want reel adhesive blue leds closet years dunno somebody could use cool project edit trying hand unsocial_crab asked first,positive,0.7003,positive,0.19999999999999998,03/10/2020
posts,even buzz save us,negative,-0.3875,neutral,0.0,03/10/2020
posts,message sent today gatech really going address anything heard anything stamps,neutral,0.0,positive,0.2,03/10/2020
posts,accounting removed,neutral,0.0,neutral,0.0,03/10/2020
posts,shoe refuses drop,negative,-0.2732,neutral,0.0,03/10/2020
posts,thoughts schedule compe fall 2020 removed,neutral,0.0,neutral,0.0,03/10/2020
posts,meme removed,neutral,0.0,neutral,0.0,03/10/2020
posts,anywhere get viral masks campus removed,neutral,0.0,neutral,0.0,03/10/2020
posts,true deleted,positive,0.4215,positive,0.35,03/10/2020
posts,georgia tech spring break campus services update hi everyone wanted provide quick update regarding services opening spring break heard back administration today saw number people asking dining stamps health crc full list hours may found stamps health services open following times mon march 16 wed march 18 thurs march 19 fri march 20 dining services meal swipes typically accepted spring break included meal plans buffet option added ferst place following times fri 13 11 00a 30pmon 16 fri 20 11 00a 30p 00p 00p administration agreed allow meal swipes used ferst place periods additional charge addition chick fil added option saturday 14 11am 3pm full list dining hall hours may found crc open following times sat march 14 10 sun march 15 12 10 mon march 16 fri march 20 30 10 sat march 21 10 sun march 22 12 12 full list hours may found questions concerns please let us know edit fixed link,positive,0.4888,positive,0.10972222222222223,03/10/2020
posts,curiosity potential classes moving online removed,neutral,0.0,neutral,0.0,03/10/2020
posts,scheduling conflicts make want cry basically title try everything feel damn time keep well approaching last semesters terrifying many classes keep pushing back swear going end last semester great giant heap conflicts like one senior design required class minor orchestra time fkn orchestra moved tuesday noon monday 11 swear playing music keeps sane god almost want straight ask senior design lecturer project self study lectures go orchestra instead entire situation much want graduate damn damn close get hermione time turner already end rant,negative,-0.8556,positive,0.054166666666666675,03/10/2020
posts,ladies amp gentlemen got deleted,neutral,0.0,neutral,0.0,03/10/2020
posts,ladies amp gentlemen got deleted,neutral,0.0,neutral,0.0,03/10/2020
posts,labels malfunctioning dryers please stop fucking removing labels machines work used labels laundry area near brittain rec whichever department responsible needs take care,positive,0.6808,negative,-0.09999999999999999,03/10/2020
posts,dropping full time state removed,neutral,0.0,positive,0.35,03/10/2020
posts,working two part time campus jobs hello anyone know work campus jobs know usually school crc allows 20 hours wondering work two jobs 20 hours per week,neutral,0.0,negative,-0.25,03/10/2020
posts,help find extra grad tickets removed,positive,0.508,neutral,0.0,03/11/2020
