type,text,VADER sentiment,VADER sentiment score,TextBlob sentiment,TextBlob sentiment score,date
posts,without warning department housing chosen lay 60 ssms without email anyone within housing supervisor let know returning position ssm student staff member ra pl along 59 ssms throughout campus let due budget changes due performance measures according supervisor decision made several weeks ago upper level housing staff failed notify ssms capacity since decision made laid added alternate pool new ssm candidates least automatically welcome reapply become ssm next fall opening positions graduating students filled incoming applicants meaning new untrained applicants preferred ssms worked housing several years honestly insulting waiting long let us know housing made difficult find place live summer deadline apply campus housing less week much harder find affordable lease campus apartments summer become clear housing longer cares employees matter students georgia tech well ssms front line defense mental health wellbeing students laying 60 ssms housing effectively reduced ability georgia tech reach students need housing recently increased ssm responsibilities requiring additional duty round ssms record resident conversations every week asked changes made especially without increase pay compensate simply cited schools policies used say department worse housing dining honestly aramark shown vast improvements terms service care housing ashamed part organization,positive,0.9765,neutral,-0.022675026123301995,02/16/2020
posts,bout banner linkedin profile photographers callin atl ga tech photos could pretty linkedin profiles anybody bueller bueller,positive,0.6322,positive,0.25,02/16/2020
posts,ways increase windows 10 performance,positive,0.3182,neutral,0.0,02/16/2020
posts,sga campus services feedback form hi everyone sga new undergraduate vp campus services hijacking reddit ran account last year hello anyone around last week began working feedback form campus services related feedback concerns comments suggestions etc may goal create avenue submit feedback would like heard administration last year something similar address dining specifically expanding include campus services form may found campus services includes housing parking amp transportation services dining services retail health wellbeing student center crc safety gtpd suggestions improve form please let know happy go alter goal make form short enough able fill multiple times easily open ended enough give thorough rundown thoughts option enter email address choose reaching regarding feedback follow spoken relevant administrators questions please let know best respond quickly possible new role cannot guarantee immediate response everyone respond 24 hours however please reply original comment tag us give update whether someone following,positive,0.9783,positive,0.16238636363636363,02/16/2020
posts,lost earphones deleted,negative,-0.3182,neutral,0.0,02/17/2020
posts,gtri internship phone interview hello state aerospace engineering undergrad student phone interview gtri tomorrow summer intern position within elsys lab really sure expect anyone process tips regarding phone interview gtri sorry gets asked lot first interview gotten year want mess thanks,negative,-0.3319,positive,0.05500000000000001,02/17/2020
posts,ra pl appreciation thread light recent decisions gt housing think would wonderful shared stories ras pls impacted lives freshman helped us difficult transition time never one friends ra pls know deeply many care students blood sweat tears put shepherding think would great thank care well show critical georgia tech community,positive,0.9788,positive,0.31428571428571433,02/17/2020
posts,internship yet worried deleted,negative,-0.296,neutral,0.0,02/17/2020
posts,possum klaus,neutral,0.0,neutral,0.0,02/17/2020
posts,app developer removed,neutral,0.0,neutral,0.0,02/17/2020
posts,multivariable calculus test li 2550 removed,neutral,0.0,neutral,0.0,02/17/2020
posts,type grass tech green removed,neutral,0.0,negative,-0.2,02/17/2020
posts,become ra pl take stand sorry going needs said gt housing treatment employees residents gone downhill past years belittled disrespected gaslit hall directors area managers professional staff none concerns ever listened stability department overall times ask support ignored pushed aside emotional toll takes ssm insane provided proper support dealing number cases sexual assault depression homesickness coming break ups break downs roommate conflicts general bad days seen fellow ras pls go nearly daily basis unparalleled department except counseling problem trained compensated fairly kind work pretty much volunteer triage counselors takes fucking toll add clubs jobs classes personal issues audacity remove half pl positions across campus leaving one pl per floor deal double residents duty shifts general bullshit additional compensation providing double work joke even banning ssms kind job campus campus unless research loved position like past years let malpractice go unnoticed longer applying become ssm considering returning position please reconsider worth period putting decent number hours week part time job enjoy would pay avoiding stress anger go daily basis way anyone housing ever listen issues starved candidates function please join good fight spread word together maybe move era shitty maintenance overpriced housing staff neglect,negative,-0.9907,neutral,0.00833333333333334,02/17/2020
posts,chances getting gpa im finishing associates engineering community college year college highschool finished calc4 senior year hs applied fall 2020 gtech mechanical engineering chances getting state transfer,positive,0.4515,neutral,0.0,02/17/2020
posts,free food campus megathread deleted,positive,0.5106,positive,0.4,02/17/2020
posts,stallworth office hours deleted,neutral,0.0,neutral,0.0,02/17/2020
posts,new buzzport wack anyone else problem error message pops every time click anything want see unofficial grades last semester see grade change request went option,negative,-0.4142,positive,0.06818181818181818,02/17/2020
posts,lol,positive,0.4215,positive,0.8,02/17/2020
posts,easiest ece electives ece electives easiest wondering future planning purposes,positive,0.6808,neutral,0.0,02/17/2020
posts,something wrong,negative,-0.4767,negative,-0.5,02/17/2020
posts,number one industrial systems engineering program country one image deleted,positive,0.0772,neutral,0.0,02/17/2020
posts,number one industrial systems engineering program country one image deleted,positive,0.0772,neutral,0.0,02/17/2020
posts,number one industrial systems engineering program country one image deleted,positive,0.0772,neutral,0.0,02/17/2020
posts,gt housing ruined life removed,negative,-0.0688,neutral,0.0,02/17/2020
posts,walking exam hope exams last week big project due sunday tried best study cs 3510 dynamic programming making progress got stories walking exam feeling unprepared still coming ok really appreciate case got plenty stories going exams feeling prepared still bombing lol,positive,0.9565,positive,0.296875,02/17/2020
posts,cs ta application dates removed,neutral,0.0,neutral,0.0,02/17/2020
posts,anyone summer internship equifax deleted,neutral,0.0,neutral,0.0,02/17/2020
posts,senti appreciation idk graduation months really check reddit much looking old posts wanted say even fucking shit gt life throws everyone damn thankful every person tech amount normal weird things people good makes happy love people thank making campus unique,positive,0.9506,positive,0.2325,02/17/2020
posts,dae feels like gt get much clout deserves feeling career fairs companies underrate difficult georgia tech many companies still gpa requirements georgia tech students students similar caliber schools significantly easier mit gpa gpa look better caltech students get take entire freshman year pass fail ivy like harvard notorious grade inflation policy competing students jobs feels like slap face gt student companies hold us standards top schools get boost,positive,0.9269,positive,0.11944444444444444,02/17/2020
posts,question current gt students average cost aid live state average total aid received sorry know taboo talk considering going sophomore year family working class work part time,positive,0.2793,negative,-0.1106060606060606,02/17/2020
posts,ece design requirement overhaul thread ece advising session 3030 today went changes ece requirements seems like moved goalposts graduation change senior design requirement take additional ece credits 2xxx higher depending whether begin junior level senior level design course want hear change affects others take additional ece class graduate,positive,0.6486,positive,0.25,02/17/2020
posts,clery alert,positive,0.296,neutral,0.0,02/17/2020
posts,easy ae options anyone knows ae options easiest appreciate fea right dying trying anymore options lol thanks,positive,0.9468,positive,0.42976190476190473,02/17/2020
posts,never ashamed student gt gatech housing hope extra money pockets worth loss sanity financial security several students know ones taking away students wage may need feed ones shutting every social emotional academic outlet ones increasing already stressful pressure every gt student feels every single day gt says care worry mental health want us succeed literally care money disgusting gt institution today every single student step foot campus better give us basic respect laughable beg students servants give us deserve sincerely student even pl ra severely saddened lack humanity like holy sh new low student mad get mad pl ra speak terrified getting fired,positive,0.7965,negative,-0.08016632490316701,02/18/2020
posts,heard back fro job yet alright know issue seem big housing people wanna see anything couple weeks ago applied student technician job campus last monday got email saying got accepted job emailed person asked since last monday heard anything back yet emailed asking update job yesterday still gotten email back yet anyone know case really want job begin start earning money really use money right anything appreciated thanks bois hope great day,positive,0.9746,positive,0.15714285714285714,02/18/2020
posts,mean fall break columbus weekend fall,neutral,0.0,negative,-0.3125,02/18/2020
posts,anyone old list soup classes hi want know type classes offered past plan upcoming semester,positive,0.0772,negative,-0.075,02/18/2020
posts,ece 4011 4012 vs ece 3882 gt 4823 removed,neutral,0.0,neutral,0.0,02/18/2020
posts,buzzport oscar registration session timeout error need get verification enrolment whenever try open oscar buzzport opens blank window pop error text session timeout occurred anyone know potential cause contact anyone,negative,-0.6966,neutral,0.0,02/18/2020
posts,ra mental health concern hi everyone know ras past lived person rooms able choose roommates however contract next year allows us bring roommate two rooms open anyone although many interesting topics circling reddit right related department housing main concern nervous mental health future know school stressful times absolutely love helping residents trying build strong community job also adds lot stress getting come home every day room full close friends important honestly scared mental health next year without support system life reality upperclassmen next year roommates likely time ticket allows self assign room everything work okay question department housing feel need add stress position like said love position get help students need would like voice concerns improve housing experience future residents,positive,0.9662,positive,0.1952380952380952,02/18/2020
posts,update found girl stole umbrella steal back,negative,-0.4939,neutral,0.0,02/18/2020
posts,paying bus driver much spending 40 minutes sitting nav telling us youre going service fitten repeatedly meanwhile fitten exactly half way anyone brain would realize youd take blue bus instead anything past,neutral,0.0,negative,-0.05416666666666666,02/18/2020
posts,random question exactly good food bento bus offer worth standing notably long line rain get one rice bowls,positive,0.6322,positive,0.11249999999999999,02/18/2020
posts,fyi new detour campus center construction temporary pathway use longer accessible pedestrian traffic need divert around north side boggs chemistry building ferst center arts,positive,0.0857,positive,0.0778409090909091,02/18/2020
posts,anyone experiencing canvas issues one classes seem removed deleted,neutral,0.0,neutral,0.0,02/18/2020
posts,flynn brantley scholarship incoming students,neutral,0.0,neutral,0.0,02/18/2020
posts,video hoops signee tristan maxwell finishes 26 points senior night full game highlights eager hear think game,positive,0.4857,negative,-0.15000000000000002,02/18/2020
posts,executive director housing residence life campus colleagues presentation amp student interview session good afternoon next two weeks opportunity interview candidates position executive director housing residence life ed hrl ed hrl position top level position within department oversees functionality entire department since september 2019 position vacant impact quite noticeable within department throughout residential community department housing residence life critical juncture functionality service provider residential community member ed hrl search committee fellow student asking assistance likely one important decisions made foreseeable future regards hrl emphasize enough important right person role ensure many issues faced year residential community ameliorated future residents live campus proudly wears name reputation georgia institute technology available sessions listed well signup link indicate participation process ed hrl available sessions candidate one campus colleagues presentation friday february 21st 30am 10 30am candidate one student interview session friday february 21st 2pm 30pm candidate two campus colleagues presentation tuesday february 25th 30am 10 30am candidate two student interview session tuesday february 25th 11 15am 11 45am please indicate participation process later thursday february 20th noon thank assistance welcoming new paradigm department housing residence life emmett miskell georgia institute technology residence hall association executive president 2019 2020 office phone 404 894 8742,positive,0.9606,positive,0.21174734356552544,02/18/2020
posts,laundry,neutral,0.0,neutral,0.0,02/18/2020
posts,get official transcript deleted,neutral,0.0,neutral,0.0,02/18/2020
posts,cs 1371 removed,neutral,0.0,neutral,0.0,02/18/2020
posts,concerned alums would like help hi 2014 alum isye bsba matters since back campus keeping reddit grad student friends etc honestly saddened concerned major issues plaguing student life tech particularly mental health know firsthand struggles face took time anxiety depression struggled find resources help cope school since time tech reputation burgeoned terms prestige also academic rigor clear improvements student life care kept looking point fingers whose fault want see help turn around years school benefit hindsight broader perspective us alums bay area discussing tackle real issues facing tech today besides upping donations getting cold shoulder administration response emails requests discussion like hear perspectives also looking suggestions best way gather data issues surveys etc start put together something concrete going start real broad please sound tech hurting need thanks advance,positive,0.9792,positive,0.16201923076923078,02/18/2020
posts,summer research abroad experience info anyone experience applying researching universities abroad curious process timeline anyone talk experiences specifically epfl eth zurich anyone details swiss universities,positive,0.3182,negative,-0.1,02/18/2020
posts,air quality campus removed,neutral,0.0,neutral,0.0,02/18/2020
posts,lost wallet hello lost wallet either student center somewhere near bio quad dark brown leather wallet buzzcard anyone finds please contact update found,negative,-0.4374,neutral,-0.049999999999999996,02/18/2020
posts,sic ga,neutral,0.0,neutral,0.0,02/18/2020
posts,looks like someone tried gordon ramsey,positive,0.3612,neutral,0.0,02/18/2020
posts,mentors needed hackgt catalyst sat march 28th apps due friday hi everyone saturday march 28th hackgt hosting annual free day steam education 400 high school students metro atlanta area goal exposing underserved students computer science catalyst offer four tracks info security gaming robotics music tech order make event success need help mentors individuals like catalyst opportunity positively change impact trajectory sensational students students currently limited access steam education high schools like invite friends help teach inspire others mentors mentor responsibilities include co leading student cohort 12 students encouraging mentees network within cohorts encouraging mentees learn throughout day encouraging mentees learn catalyst arriving time staying throughout entire duration event cover breakfast lunch dinner well swag hackgt sponsors interested please register mentor registration close 11 59 pm friday february 21st register questions feel free send email love help,positive,0.9954,positive,0.22057775557775555,02/18/2020
posts,faset interview removed,neutral,0.0,neutral,0.0,02/18/2020
posts,phone repair recommendations removed,neutral,0.0,neutral,0.0,02/18/2020
posts,classes avoid spread tech deleted,neutral,0.0,neutral,0.0,02/18/2020
posts,wreckless tech less trivia come trivia march 3rd 9pm money goes towards club increase positivity campus free food,positive,0.7339,positive,0.07777777777777779,02/18/2020
posts,wreckless tech less trivia come trivia march 3rd pm 20 per team members proceeds go towards gt wreckless help spread positivity campus free food prizes,positive,0.8561,positive,0.07777777777777779,02/18/2020
posts,coc students gauging interest resources research grad school anonymous form get soft numbers interested coc undergrad students academia shared administrative staff toying resource provision ideas space want info many students would genuinely take advantage form restricted coc majors minors sure check major care grad school research filling form also helps reflect numbers accurately encouraged thanks guys amp x200b link form,positive,0.9638,positive,0.3015625,02/18/2020
posts,take minute travel survey help gt project group removed,positive,0.7027,neutral,0.0,02/18/2020
posts,asking give free pizza removed,positive,0.5106,positive,0.4,02/18/2020
posts,cs ms program removed,neutral,0.0,neutral,0.0,02/18/2020
posts,asking give free pizza cs social good starting weekly talks casually discussing ethical issues within tech sector enjoying pizza everyone welcome regardless major whatever else especially new members come meet new people friendly promise thursday 11 12 morning skiles 169 weeks topic surveillance,positive,0.9681,positive,0.24832702020202022,02/18/2020
posts,month half,neutral,0.0,negative,-0.16666666666666666,02/18/2020
posts,internship opportunity donation philanthropy club,positive,0.4215,neutral,0.0,02/18/2020
posts,studying transportation needs gatech help us deleted,positive,0.4019,neutral,0.0,02/18/2020
posts,gt osrs players looking people learn tob person inbox ironman btw 123 cb 35b bank yes fucking nerd posting wrong subreddit,neutral,-0.0155,negative,-0.55,02/18/2020
posts,nuclear engineering actually major deleted,neutral,0.0,positive,0.0625,02/18/2020
posts,update yesterday post walking exam hope bombed two questions got one right one wrong expecting 60 go yackets get next time edit anyone else class share also bombed midterm,negative,-0.1984,negative,-0.07142857142857144,02/18/2020
posts,late cancel gt housing contract without penalty investigating campus options would like campus back case find anything works based emails last year reduced refunds starting april 1st mean penalties,positive,0.3019,negative,-0.12250000000000001,02/18/2020
posts,wanna get active removed,positive,0.4019,negative,-0.13333333333333333,02/18/2020
posts,lol half rooms campus love school,positive,0.7906,positive,0.37777777777777777,02/18/2020
posts,every exam,neutral,0.0,neutral,0.0,02/19/2020
posts,transfer tech removed,neutral,0.0,neutral,0.0,02/19/2020
posts,decide want transfer tech removed,negative,-0.3283,neutral,0.0,02/19/2020
posts,least something work desk,neutral,0.0,negative,-0.3,02/19/2020
posts,gtso laptop orchestra today 17 30 ferst center admission free music fun edit meant say 19,positive,0.765,positive,0.20000000000000004,02/19/2020
posts,gtso laptop orchestra today 19 30 ferst center admission free music fun,positive,0.765,positive,0.20000000000000004,02/19/2020
posts,booting curran deck guy veteran plates fancy rims better get fast also note atlanta crime remove steal damage keep mind,negative,-0.1655,positive,0.2333333333333333,02/19/2020
posts,anyone labcoat straight forgot labcoat emory yesterday got bio lab 12 15 anyone one borrow today 12 starbucks anybody help,positive,0.6072,positive,0.2,02/19/2020
posts,stupid sexy buzz skiles,neutral,0.0,negative,-0.14999999999999997,02/19/2020
posts,night shirt never got chance pick traditions night shirt anyone know get one size small someone willing sell one willing pay pretty penny,positive,0.264,positive,0.125,02/19/2020
posts,quick look inside housing campus services general working closely housing student leader past couple years want provide personal view things bad done lot say still much works may change take grain salt official statement provide lot sources right hope helps clarify things got first place currently dealing aftermath years poor management housing entire institute fraud scandals couple summers ago culmination student since 2017 clear interactions various departments still bit widespread attitude done like years want change led lack proper oversight allowing shady practices well stagnation student services interesting things discovered year within housing alone include maintenance sitting ton money apparent reason instead know actually maintaining residence halls software already use register housing actually way advanced seems setup improperly kind quick hack nobody gotten around fixing seriously assignments team lot stuff hand existing software already capable used correctly housing internal communication horrendous probably even worse looks outside policy changes often communicated word mouth resulting long game telephone nobody really knows sure going resident issues also communicated people charge campus housing capacity really long term plans address residents living converted common areas closets literally rooms one factors behind proposed north ave changes still super air since scandal massive turnover around institute amplifying shit show many student services become housing without permanent director since last year yes lot things happening nobody wheel residence life division housing people interact also vacant sheree interim director unfortunately interim positions much power make real long term changes permanently filled happening fortunately cabrera administration seems willing make large changes need slowly trickling great new vp campus services seems way focused reform based student input students amp admin midst interviewing candidates housing res life leadership line mission lot tangible change little sorted focus right establishing better culture well planning long term solutions actually affect honestly us long gone time lot biggest issues fixed much bureaucracy red tape public institution especially scandals things happen slowly getting short end stick glad guys mad deal state campus services past years unacceptable important mean us helping establish culture tech new administration need leaders listen students actively seek act feedback need people afraid making big changes even means spending big money need greater transparency accountability pleasure working many brilliant passionate people students administrators focused making happen people bureaucracy care listening student representatives rha sga constantly monitoring social media collecting survey data interacting directly greater student body feedback vital much easier sit head department push change point tto angry reddit posts emails survey feedback please keep keep telling us problems see post social media email student representatives go office hours fill surveys make sure gets someone act follow even already known issue numbers higher priority lot time feel like anything really happens examples small changes right direction interactive feedback focused people top tech leadership cabrera frequently mingles students small example student involvement hiring decisions students directly involved selecting vp directors etc recent search committee made mixture administrators students staff resistant much needed change replaced maintenance example management restructured turnover insane right hopefully smooth next year two new residence halls early stages planning completed years actual contracts place design firms major renovations residence halls coming soontm scope timeframe air personally fought new paint go summer among things really speak happening ra pl area focus lot issues around expected know significant focus residence life interviews especially working close huge disconnect housing leadership ra pl actually front lines one last note want stress importance involved student representatives set high goals made big plans around see generation graduates need new leaders pick fight keep holding administration accountable often group students start initiative die year two later freshmen sophomores passionate making things better future students please get involved let admin scare serve students lot power people realize tl dr campus services bad long time effectively burning starting take long time though,positive,0.9969,positive,0.06208504909724423,02/19/2020
