type,text,VADER sentiment,VADER sentiment score,TextBlob sentiment,TextBlob sentiment score,date
posts,campus air quality inhaling air pollution takes away years typical human life concern sign petition improve air quality campus petition improve campus air quality respiratory health,positive,0.7263,negative,-0.08333333333333333,02/11/2020
posts,hang dog campus removed,neutral,0.0,neutral,0.0,02/11/2020
posts,transfer questions removed,neutral,0.0,neutral,0.0,02/11/2020
posts,struggling cs 1301 rn removed,negative,-0.4215,neutral,0.0,02/11/2020
posts,would say late transfer far college education would say point late transfer without detrimental setback degree,neutral,0.0,negative,-0.16666666666666666,02/11/2020
posts,struggling cs1301 removed,negative,-0.4215,neutral,0.0,02/11/2020
posts,market amp bike repairs 12 2020,neutral,0.0,neutral,0.0,02/11/2020
posts,register vote check registration hello fellow yellow jackets may may know georgia primary election held march 24th deadline register february 24th get vote org register check registration status find polling place voice heard vote counted,neutral,0.0,positive,0.2,02/12/2020
posts,ded boi sad,neutral,0.0,negative,-0.5,02/12/2020
posts,anakin high ground,neutral,0.0,positive,0.16,02/12/2020
posts,fuckface walked getting class whispered islam breath removed,negative,-0.6369,neutral,0.0,02/12/2020
posts,buzzport acting anyone deleted,neutral,0.0,neutral,0.0,02/12/2020
posts,tabletop groups good resources settibg tabletop group campus trying get cyberpunk 2020 game set need dm,positive,0.4404,positive,0.14999999999999997,02/12/2020
posts,many percent people keep zell miller removed,neutral,0.0,positive,0.5,02/12/2020
posts,tornado drill deleted,neutral,0.0,neutral,0.0,02/12/2020
posts,test georgia tech emergency notification system test,negative,-0.516,neutral,0.0,02/12/2020
posts,hmm today put lock puzzle major tech university use locks picked looking,neutral,0.0,positive,0.0625,02/12/2020
posts,community space amp living area feedback calling residents residence hall association currently collecting feedback community spaces lounge areas across campus additionally gathering feedback expectation utilization living areas traditional style apartment style residence halls feedback area access form feedback would greatly appreciated prepare report living area utility suggestions community spaces jordan baxter rha director external relations,positive,0.5974,positive,0.05,02/12/2020
posts,transfer questions removed,neutral,0.0,neutral,0.0,02/12/2020
posts,lost airpods hey lost airpods today black amazon prime student case likely dead please let know seen,negative,-0.7357,negative,-0.12222222222222223,02/12/2020
posts,anyone gone phys2211 plus session removed,neutral,0.0,neutral,0.0,02/12/2020
posts,anyone link physics plus session removed,neutral,0.0,neutral,0.0,02/12/2020
posts,orlando removed,neutral,0.0,neutral,0.0,02/12/2020
posts,saw video japanese vending machines fuck willage student centre dining damned vending machines offered hot meals 4usd one world best engineering universities handle vending machines,negative,-0.2942,positive,0.2125,02/12/2020
posts,georgia tech upsets louisville jose alvarado louisville dad rules,negative,-0.5719,neutral,0.0,02/12/2020
posts,guess aced 1371 exam got 29 even know possible get low score,negative,-0.2732,neutral,0.0,02/12/2020
posts,hey mechanical engineers play violin around project might interested dm edit viola cello bass works,positive,0.6249,neutral,0.04999999999999999,02/13/2020
posts,act like gordon ramsay ducking days deleted,negative,-0.2755,neutral,0.0,02/13/2020
posts,stop acting like gordon ramsay 3rd fire alarm week nav east please stop acting like gordon ramsay fact chef boyardee please us tests morning hard cook eggs,neutral,0.0,negative,-0.07291666666666667,02/13/2020
posts,raining hard outside feel swimming air cancel classes,negative,-0.4341,negative,-0.14583333333333334,02/13/2020
posts,finna cry,negative,-0.4767,neutral,0.0,02/13/2020
posts,electric buses really efficient ga tech electric buses screenshot talk may post links later,positive,0.607,positive,0.1,02/13/2020
posts,research lorraine paid research opportunities gtl campus jobs could get abroad,positive,0.3818,neutral,0.0,02/13/2020
posts,anyone else go weekdays generally go classes eat study weekdays friends acquaintances classes really hang outside class weekdays always see everyone else dining halls eating friends makes kinda sad know often go dining hall spontaneously also gonna randomly hit people know asking wanna go dining hall honestly makes feel lonely weekdays get bored lot downtime know sick staring phone easy make friends lecture classes promote person person interaction even find study buddies rare keep talking move different classes sections next semester gonna become social adult college life like sigh,negative,-0.5797,neutral,0.00014880952380952155,02/13/2020
posts,anyone going party shpe tonight sadly forgot buy aquarium ticket tonight got sold looks like society hispanic professional engineers throwing party campus tonight well anyone else thinking going,positive,0.8677,negative,-0.2,02/13/2020
posts,companies prefer hire students ksu tech schools ga cute deleted,positive,0.4588,positive,0.5,02/13/2020
posts,exciting opportunity take survey please help students research project take less minutes thank,positive,0.9247,positive,0.06666666666666667,02/13/2020
posts,oneusg connect introduction needed hi everybody baylor outreach engagement intern georgia tech new hr system oneusg connect go live march 23 2020 oneusg connect new hr platform impact employees student employee planning becoming one impact use oneusg connect view paychecks report time update personal information etc happy answer questions oneusg connect feel free also check transformation gatech edu additional information meantime going make sure get relevant info build ama guys ask questions directly thanks allowing introduce go jackets,positive,0.9507,positive,0.3159090909090909,02/13/2020
posts,library partnering patent office host hiring fair next friday saturday full info comments,positive,0.3802,positive,0.3499999999999999,02/13/2020
posts,anyone selling aquarium ticket removed,neutral,0.0,neutral,0.0,02/13/2020
posts,aquarium ticket sale deleted,neutral,0.0,neutral,0.0,02/13/2020
posts,valentines day cards carnations hi tech tomorrow valentine 10 2pm skiles walkway alpha chi sigma selling valentine day cards carnations first philanthropy event semester hope see carnation card buy many friend significant others someone tech also holding card drive would like valentine card addressed dear come grab one ask specific person mind also write one alpha chi sigma 30 hand spread tech friendship love semester would like also write another tech student name dear ever want end alpha chi sigma looks aim advancement stem fields next generation promotion love friendship tech students life tough hopefully alpha chi sigma spread spirit light tomorrow day meant everyone loved proceeds go fulton academy science technology stem oriented school specializes creating scientists engineers hope see poster poster link htpps imgur com zbuch86,positive,0.9947,positive,0.28361111111111115,02/13/2020
posts,anyone mse etc speak experiences semiconductor electronics industry internship job hi guys undergrad mse previously worked consumer packaged goods industry really enjoyed fast development products constantly put market timeline concept product quick loved seeing progress made considering trying find job semiconductor electronics industry wondering feels like development slower like manufacturing standpoint since quantities might much lower something like huge paper towel line pumping thousands rolls minute enjoyed working research lab tech sometimes felt little bit disheartened working early ideas progress would slow electronics industry ever felt like research standpoint tldr semiconductor electronics industry internship job like industry like reference either manufacturing roles research amp development roles,positive,0.9854,positive,0.18993055555555557,02/13/2020
posts,aquarium ticket sale longer make aquarium night since tickets sold figured someone could use please dm interested looking 15,positive,0.4215,positive,0.25,02/13/2020
posts,aquarium ticks removed,neutral,0.0,neutral,0.0,02/13/2020
posts,carmax case interview prep session removed,neutral,0.0,neutral,0.0,02/13/2020
posts,30 210 classroom kendeda paper cranes anyone else see paper cranes around know happening kendeda building tonight amp x200b amp x200b,neutral,0.0,neutral,0.0,02/13/2020
posts,selling ticket aquarium tonight deleted,neutral,0.0,neutral,0.0,02/13/2020
posts,got runner,neutral,0.0,neutral,0.0,02/13/2020
posts,student center renovations starting june 1st 2020 closed fall 2022,neutral,0.0,negative,-0.06666666666666667,02/13/2020
posts,contract job mechanical design engineering student removed,neutral,0.0,neutral,0.0,02/13/2020
posts,sell aquarium ticket tonight removed,neutral,0.0,neutral,0.0,02/13/2020
posts,anyone selling aquarium ticket missed online sales wondering anyone cant go would want sell ticket pm,negative,-0.2942,neutral,0.0,02/13/2020
posts,place buy cool tees removed,positive,0.3182,positive,0.35,02/13/2020
posts,people rerack mom hoe deleted,neutral,0.0,neutral,0.0,02/13/2020
posts,calling georgian tech feminists excited announce auditions one night stand collection feminist bedtime stories one night stand feminist bedtime stories show composed compilation selected pieces eve ensler vagina monologues works feminist icons stories submitted georgia tech students like theatre writing experience necessary purpose show make space marginalized voices heard dedicated giving people gender identities platform talk navigating relationships femininity gender expression bodies sex everything typically deemed taboo talk let get mic put stage auditions held women center gt tuesday 00 pm 30 pm wednesday 00 pm 30 pm please sign audition time slot lastly would like submit piece last call submissions due february 17th please submit piece thank much sponsors wsgw gatech women center huge thank women ucsb helped make possible mik knight created beautiful artwork see logo questions please feel free post send message also email,positive,0.9879,positive,0.13333333333333333,02/13/2020
posts,procrastinating tell update 13 20 9pm yes already lost account made thing changed link remaking feel free apply sorry amp x200b felt cute might delete later see surveys floating around thought attempt make one money research involved maybe friendship opportunity rant anyway going back work feel free fill fun rant hope read responses later tonight tomorrow edit also yes spending valentine day reading responses eating ice cream,positive,0.9403,positive,0.1375,02/13/2020
posts,gtri post grad thinking working gtri start career tipped gtri someone currently goes tech rn applied position last month rejected possible get job working gtri went school state cs heard research experience beneficial summer research tech also hoping apply grad programs soon moment want take break school gain work research experience including tech heard encourage going back school gtri,positive,0.8677,neutral,0.0,02/13/2020
posts,living campus lived campus years since many people know graduating planning live campus last year uhouse specifically wondering safe night ride bike walk alone,positive,0.2263,positive,0.28409090909090906,02/13/2020
posts,happy valentine day gtpd,positive,0.6114,positive,0.8,02/14/2020
posts,cards carnations 10 2pm skiles walkway come grab red carnation great valentine day gift friends loved ones wait see great valentine day,positive,0.9622,positive,0.575,02/14/2020
posts,guy handing roses pickup lines thank much made day gonna smiling day also posting video anywhere,positive,0.7059,positive,0.2,02/14/2020
posts,remembering william andrew collins dear students faculty staff great sadness write today inform death william andrew collins first year biomedical engineering bme major kathleen ga wrenching report news even following deaths members community academic year offer deepest condolences andrew family friends coping shock grief resulting heartbreaking news thoughts sigma nu fraternity process loss one members also focused continuing strengthen support community working bme provide counseling grief support andrew friends departmental colleagues georgia tech offers multiple services resources assist community troubling times including counseling mental health support students center assessment referral education care gatech edu staff faculty may find support employee assistance program hwb gatech edu eap need immediate assistance also contact georgia crisis amp access line 800 715 4225 moment like important take care friends loved ones know watchful need ready support one another please hesitate inform someone tech concern concern another sincerely john stein vice president student life brandt fritz dean students chair,positive,0.9695,positive,0.08083333333333333,02/14/2020
posts,remembering william andrew collins removed,neutral,0.0,neutral,0.0,02/14/2020
posts,remembering william andrew collins removed,neutral,0.0,neutral,0.0,02/14/2020
posts,think right gt auction dog deleted,positive,0.4278,positive,0.2857142857142857,02/14/2020
posts,passionate web developer looking bolster resume want experience working 2020 inventure prize finalist team opportunity queues georgia tech start bringing wait times favorite campus dining locations looking someone experience react angular vue similar frameworks addressing problem long lines interests send us email examples work set time meet person discuss details email sam,positive,0.9125,positive,0.1,02/14/2020
posts,gt transportation proposal dear georgia tech transportation currently transit options offered georgia tech buses go select points campus buses theory nice usually late time dependent meaning wait usual 15 minutes average catch next one proposing electric scooters bus stops lock hubs students scan buzzcard unlock scooter hub hubs equipped solar panels used charge scooters backup power grid overcast days scooters returned back hubs charged account student account enough scooters everyone hour use scooter user charged create sense scarcity use scooters general maintenance added student tuition transportation fees needed would really awesome get across campus efficient manner bring bike scooter burden day scooter apps nice however slowly dying user accountability scooters lock hubs would solve causes massive cost burden replacing damaged missing scooters please let know think warm regards jerraay134,positive,0.5583,positive,0.11,02/14/2020
posts,dear buzz know known weeks feels like taken entire chemistry lab sequence together already everywhere anywhere campus thinking valentine,positive,0.6187,neutral,0.0,02/14/2020
posts,please avoid ferst drive regents cherry traffic diverted time due vehicle fire,neutral,0.0258,negative,-0.125,02/14/2020
posts,valentines events near campus uh asking friend,positive,0.4939,positive,0.1,02/14/2020
posts,guide consequences sleep deprivation careful guys,negative,-0.296,negative,-0.1,02/14/2020
posts,day buzz gt pr intern ton time creativity,positive,0.6932,neutral,0.0,02/14/2020
posts,particular reason dont get presidents day complaining curious,negative,-0.0951,neutral,0.033333333333333326,02/14/2020
posts,dc tv series fans wanted check dc tv series fans campus personally watch flash black lightning batwoman supergirl wanted see people campus wanted form kind watch party new episodes come,positive,0.4019,positive,0.14242424242424243,02/14/2020
posts,travel packs,neutral,0.0,neutral,0.0,02/14/2020
posts,summer different university hey wondering possible summer semester different university usa transfer credits georgia tech yes procedure,positive,0.6946,neutral,0.0,02/14/2020
posts,accepting internship offer couple internship questions accepting internship offer set stone company revoke seen posts company goes mia student student ends internship wanted know often happens companies check grades academic standing assume well accept internship offer one company later get better offer another company already signed shitty email recruiter say taking another offer know would receive,positive,0.3939,positive,0.16666666666666666,02/14/2020
posts,fresh grapes nave,positive,0.3182,positive,0.3,02/14/2020
posts,got pat back last one deleted,neutral,0.0,neutral,0.0,02/14/2020
posts,rep transfer removed,neutral,0.0,neutral,0.0,02/14/2020
posts,summer campus job international student people usually work campus summer,neutral,0.0,negative,-0.125,02/15/2020
posts,would like unmoderated open space talk tech trying gather data every popular online forum moderated rn reddit overheard meme page shit always gets sacked moderators mass downvoted giving herd mentality kno people strong opinions unmoderated free speech trying gauge need open anonymous forum community feel uncomfortable replying anonymous google doc,positive,0.2382,positive,0.10476190476190476,02/15/2020
posts,foreign spies looking target georgia tech,neutral,0.0,negative,-0.125,02/15/2020
posts,ga tech mid program removed,neutral,0.0,neutral,0.0,02/15/2020
posts,hellava week gt,positive,0.4278,neutral,0.0,02/15/2020
posts,graduation ticket dilemma removed,negative,-0.1779,neutral,0.0,02/15/2020
posts,graduation tickets removed,neutral,0.0,neutral,0.0,02/15/2020
posts,computational media tech im currently computer systems engineering major student uga applied transfer computational media since class requirements apply computer engineering major tech wanted ask anyone computational media major feel like good chance getting im sure want change major similar cs major would easy get job college ive already taken many major specific courses computer engineering uga im sure transfer major cs ce major would definitely transfer dont know much computational media major thanks,positive,0.8457,positive,0.17979166666666668,02/15/2020
posts,good statistics based courses mscs ml major taking ml realized huge gap stats knowledge weak area anyone good recommendation stats courses especially classes think best compliment ml ai knowledge thanks,positive,0.9437,positive,0.3359375,02/15/2020
posts,toner third floor printer library deleted,neutral,0.0,neutral,0.0,02/15/2020
posts,incel meetup deleted,neutral,0.0,neutral,0.0,02/15/2020
posts,aware others us feared,neutral,0.0,positive,0.25,02/15/2020
posts,gt white walls deleted,positive,0.4278,neutral,0.0,02/15/2020
posts,renege internship removed,neutral,0.0,neutral,0.0,02/16/2020
posts,renege internship deleted,neutral,0.0,neutral,0.0,02/16/2020
posts,hey kappa alpha cool breaking glass bottles everywhere fucking disgusting disrespectful peers planet,negative,-0.6863,negative,-0.325,02/16/2020
posts,gtpd cars outside howell guy cuffs gatechpd walked past howell saw scene anything know,neutral,0.0,negative,-0.125,02/16/2020
posts,last semester thoughts removed,neutral,0.0,neutral,0.0,02/16/2020
posts,graduating bs thoughts removed,neutral,0.0,neutral,0.0,02/16/2020
posts,graduating thoughts came 2016 well think lower points part like major classes another part lt gt trying accumulate friends structured group grew gone short summary fucked adjusted years ago realized things gonna work mean would want hell even labs wanted free work switched major even though maybe max semesters graduating liked new er classes enjoyed material part learned struggle something like force go content master joined research lab 2nd semester transferring new major eventually got pura grant scheme things much something maintained last semesters 04 left months till graduate problem clue going attended last career fairs company events written least 500 applications positions interested partially interested heard back nothing solid ghosting companies havn even checked resume look online probably got filtered would like attend grad school think realized know little bachelor basically given crash course things happen within industry delayed grad school apps gpa greatest anyways maybe make sounds whole lot better 04 98 studying gre free time slow think well sure point guess time start applying stuff like maybe look productive experience outside internships apply spring fall 2021 master programs jobs post years ago rock bottom get another class particularly care give get better proactive make difference special thank professor gambled kid randomly wanted join research glad chest thwg may well midterms tldr fucked first two years fixed somewhat last two years looking job masters program hopeful even graduating time even screw fix things mostly amp x200b edit tldr,positive,0.9275,positive,0.12394966144966141,02/16/2020
posts,looking hacklytics team members deleted,neutral,0.0,neutral,0.0,02/16/2020
posts,shoutout rugby boys,neutral,0.0,neutral,0.0,02/16/2020
posts,motorcycle accident pike anyone else see accident know badly rider actually injured saw happen called 911 ambulance immediately looked like trying catch buddies going ferst took curve fast ran road bike endo went flying really worried hit tree light post pedestrian,negative,-0.8999,neutral,0.02000000000000004,02/16/2020
posts,fun things gatech atlanta hey everyone preface accepted gatech cs ea cycle visiting atlanta couple days chicago clue haha could drop suggestions visit campus atlanta would greatly appreciated thanks,positive,0.9038,positive,0.22499999999999998,02/16/2020
posts,largest museum world gem 2020 deleted,neutral,0.0,neutral,0.0,02/16/2020
posts,choong man chicken saw choong man chicken going tech taco lucky buddha previously anyone know choong man officially opening location duluth must say wow spicy fuck happy see solid korean fried chicken close tech,positive,0.8637,negative,-0.1259259259259259,02/16/2020
posts,gt housing dumpsterfire ashamed apart housing department community pl living freshman experience residence hall always eager change lives new students yet housing makes creating community nearly impossible since joined housing always told hall directors help ssms jobs also help emotional burden yet one time reached help issues put back burner cant even make contact direct superior opinion one housing seems know roundabout way made feel like narc hall directors duty identifying resident abusing alcohol everything going unacceptable director housing sheree gibson higher ups housing destroyed good things freshman experience setting housing receive applicants desperate free housing eliminating half first year positions expected double work extremely minimal increase pay stress sheree added life harming relationship bf going next year expected job people pursue bme classwork capstone housing care employees housing care residents community housing wants money,negative,-0.7684,positive,0.05572390572390572,02/16/2020
posts,looking morning ceremony tickets anyone ticket morning commencement ceremony,neutral,0.0,neutral,0.0,02/16/2020
posts,challenge removed,positive,0.0772,neutral,0.0,02/16/2020
posts,launching app fellow gt cmu grads would love get feedback pretty long road completely bootstrapped project finally got deals signed company supply hardware take project market aiming early 2021 launch seems like long way lot government red tape clear app like could take minute fill survey greatly appreciate edit realized never gave app background developing app help users navigate nearest open street parking spot using vision based system identify spots algorithms develop probabilistic determination spot open upon arrival testing system go pros far finally position go legit,positive,0.9776,positive,0.13214285714285715,02/16/2020
posts,looking people play kendama removed,positive,0.34,neutral,0.0,02/16/2020
posts,good professors taken last faset international attend earlier fasets without pay shitload extra money move earlier classes cs otherwise especially cs going full time last faset rolls around sections good professors taken edit also know professors going teaching particular class fall 2020 latest info find 2019 schedule pretty much,positive,0.9044,positive,0.20476190476190476,02/16/2020
posts,looking people play kendama recently getting back kendama wondering anyone plays would want meet sometimes please pm interested,positive,0.8271,positive,0.08333333333333333,02/16/2020
posts,gt women basketball gets huge road upset nc state,positive,0.4263,positive,0.4000000000000001,02/16/2020
posts,subleasing 1bd 1bath sq5 summer removed,neutral,0.0,neutral,0.0,02/16/2020
