type,text,VADER sentiment,VADER sentiment score,TextBlob sentiment,TextBlob sentiment score,date
posts,learning swim hey gt always wanted join gt rowing gt sailing literally cannot swim tips learning preferably free,positive,0.8873,positive,0.4,07/31/2019
posts,clep tests deleted,neutral,0.0,neutral,0.0,07/31/2019
posts,taking phys 2021 amp 2022 hey incoming physics transfer student wondering anyone ever taken phys 2021 amp 2022 know offered different semesters decent interest astronomy probably try get astrophysics concentration wondering academic advisor recommends take one two throughout gatech career interested topics covered 2022 currently signed 2021 needed elective reach full time credits fall 2019 choose one probably try find different elective phase ii registration opens taking reasonable keep 2021 schedule,positive,0.7812,positive,0.12083333333333332,07/31/2019
posts,survive drowning class serve credit physical health deleted,positive,0.3818,neutral,0.0,07/31/2019
posts,professors sections changed tba professors truly tba trying hide names,positive,0.296,neutral,0.0,07/31/2019
posts,glc office jobs available fall semester title wanted know jobs available applications open thanks,positive,0.4926,positive,0.25,07/31/2019
posts,clery act safety alert july 31 2019 clery act safety alert campus armed robbery incident date time july 31 2019 approximately 10 31 pm incident location 75 fifth street nw atlanta centergy courtyard incident description three victims practicing tricks bike centergy courtyard approached suspect suspect brandished knife demanded give bike suspect rode away bike one victims owner bike chasing far moe suspect threw knife without striking suspect fled bike westbound across fifth street bridge toward techwood drive nw three victims students georgia institute technology description suspect white male short hair goatee wearing beige shirt tan hat cargo pants suspect multiple tattoos arms description suspect vehicle blue white schwinn bike status investigation incident investigated atlanta police department report information regarding criminal incidents crime stoppers atlanta 404 577 tips 8477 see something say something report information regarding criminal incidents georgia tech police department gtpd calling 404 894 2500 emailing addition help gtpd community fight crime look way ignore suspicious activity see something prompts concern say something notify gtpd immediately additional safety information georgia tech amp x200b walk well lit areas report inoperative exterior campus lighting visit walk friend group aware surroundings immediately report suspicious activity georgia tech police calling 404 894 2500 program gtpd number cell phone campus transportation 00 00 please request ride stingerette com call 404 385 7433 safety escorts available georgia tech police department calling 404 894 2500 gtpd download livesafe safety app quick access georgia tech police department safety resources clery act requirements federal law clery act requires colleges universities report certain crime statistics well make timely notifications crimes pose threat community purpose alert help make aware crime able take appropriate precautions information please visit www police gatech edu,negative,-0.9493,positive,0.10264550264550264,07/31/2019
posts,clery alerts usual last week imagining,neutral,0.0,negative,-0.125,07/31/2019
posts,student health insurance united heads blue cross blue shield plan last year expired looking enroll new plan united health care info,positive,0.8316,neutral,0.02727272727272727,08/01/2019
posts,foreign language advice really sure type thing people usually post subreddit looking advice learning languages gt since starting fall come mixed family parents speak hokkien chinese lot family members speak mandarin korean made goal learn least little bit languages point talk relatives language comfortable would really mean lot said wondering consider taking classes one two languages want learn maybe club organization might help worry learning mandarin really difficult since pretty much native english speaker little scared take actual chinese class tech really sure people feel korean classes really appreciate advice suggestions might familiar foreign language department classes gt love two cents,positive,0.9645,neutral,0.04261363636363636,08/01/2019
posts,parking wait list 2019 2020 trying get parking pass either peter tech square says wait list spots school starts sign different lot,neutral,0.0,neutral,0.0,08/01/2019
posts,phase class availability hey everyone registered classes yesterday transfer faset lucky picking classes lot faset leaders said worry getting classes spots would open phase registration august 10th true lot spots actually open courses eas 1600 sorry noob question something first year tech clueless lol,positive,0.5667,positive,0.1761904761904762,08/01/2019
posts,elite aerospace fellowship program undergraduate women accepting applications hey wanted let know brooke owens fellowship program bofp accepting applications class 2020 program matches undergraduate women gender minority students paid internships awesome aerospace companies like nasa spacex blue origin amazon prime air also providing fellows mentorship industry executives program culminates networking summit washington dc better inform fellows opportunities available industry amp x200b last year tech brooke owens fellows ashleigh bunch bsae 2020 amazon prime air rikhi roy bsae 2020 bryce space technology saumya sharma bsae 2021 astranis amp x200b application quite extensive anyone know meets following requirements please send application form way brookies far ae fellowship major agnostic requirement interest pursuing career aerospace questions feel free comment pass onto current past brookies amp x200b requirements undergraduate student today identify woman member another gender minority group available full time employment summer 2020 interested pursuing career aerospace aspect field program website amp x200b ad astra go jackets,positive,0.9787,positive,0.21416666666666667,08/01/2019
posts,transfer schedule thoughts schedule plan take fall 2019 wondering 17 credit hours classes doable manageable specific classes professors thanks advance 1770 dorozhkin good reviews ratemyprofessor rmp ae 1601 dec unknown ae 2010 steinberg unknown apph 1040 snow mixed reviews rmp coe 2001 balic one review class rmp ece 3710 harris good rmp mse 2001 losego good rmp primarily concerned professors good reviews help welcomed terms workload grading time spent outside class etc,positive,0.827,positive,0.25833333333333325,08/01/2019
posts,anyone else ticked campanile fountain going away context student center renovation campanile fountain torn replaced brick always loved area campus fountain adds nice feature center student activity provides scenic spot also nice white noise studying eating outside mention nice little mist get wind favor get wrong like brick brick cool red cool although cool white gold hard makes cool noises bike reasonably durable fountains man water sooo much cooler brick ya think effort tech put making campus look less sterile help think massive step backwards get anyone else edit response gotten someone start change org petition,positive,0.9813,positive,0.1406746031746032,08/01/2019
posts,send cable provider carrying acc network want watch gt sports,positive,0.4824,neutral,0.0,08/01/2019
posts,received parking permit mail ordered annual individual parking georgia tech parking permit 2019 2020 july 24th parking permit mailed house chicago seven days received yet long take expect parking permit mail,neutral,0.0,neutral,-0.025,08/01/2019
posts,gt gpa requirement high school seniors applying senior class 2020 hs want apply gt applying state heard heavy influence gpa application 64 unweighted gpa go higher weighted gpa wondering got gt gpa range get accepted please thanks,positive,0.971,positive,0.10250000000000001,08/01/2019
posts,take summer semester 2020 situation currently trying study test math 1551 1552 else fails 2nd semester schedule math 1552 physics 2211 1770 cs1371 elective way looking makes near impossible 1770 cs together overlap classes eachother pick one could add one first semester currently math 1551 math 1553 engl 1102 hist 2212 econ 2100 drop one listed take summer semester maybe classes thoughts opinions suggestions,negative,-0.644,negative,-0.11666666666666667,08/01/2019
posts,funding grad school deleted,neutral,0.0,neutral,0.0,08/01/2019
posts,missed phase due medical issues got hours worth classes thoughts hey guys going tough times last semester phase going back school part plan back however grace whoever healthier much better place wondering chances getting psych courses 22xx bio orgo cs1331 class 1554 thanks advice guys getting really anxious thinking,positive,0.7649,neutral,0.02361111111111111,08/01/2019
posts,internet related storm something else eduroam 10 minutes,neutral,0.0,neutral,0.0,08/01/2019
posts,please aware international student fee quadruple starting fall 2019 75 yr 300 yr deleted,positive,0.3182,positive,0.08333333333333333,08/01/2019
posts,fusion georgia tech deleted,neutral,0.0,neutral,0.0,08/01/2019
posts,scam phishing attempt got email new billing statement link unable log onto bursar reason access buzzport bursar,neutral,0.0,negative,-0.18181818181818182,08/01/2019
posts,question switching majors applying tech fall question switching majors tried looking answer find anything lol say apply biomedical engineering quickly easily would able switch major computer science think apply bme many ecs premed related summer decided hate thought becoming doctor realized much like cs ap cs coding free time put cs first choice despite nothing app related cs,negative,-0.1798,positive,0.23298611111111112,08/01/2019
posts,postponing regular action hello hope okay ask admissions questions first sat 1370 first act 32 taking sat month hopefully get 1400 assuming get like 1390 would worth apply regular instead early action get test scores think would okay 1370 32 happt sat okay act happy know one small part admissions process want put best foot forward numbers help would greatly appreciated,positive,0.9683,positive,0.29000000000000004,08/01/2019
posts,possible transfer gpa 30 credit hours major computer science wanted know even chance apply,positive,0.5574,neutral,0.03125,08/01/2019
posts,thoughts student section blocking system football game aspects hiiii wanted hear think blocking system students tickets football games wanted express opinions think block system creates division within student body games know many students apart organizations want go games feel super weird sitting swarm away everyone else also everyone around greek organizations huddle little packs get opportunity go stand front games feel apart school spirit another way prioritize greek community honestly mostly fraternities create less cohesive student body even feel like affiliated including want block want sit stand friends greek others arent wherever want feel like need know fraternity dudes apart one organizations block able stand somewhere games feel included tickets free sides stadium first come first serve go stand want games perhaps people show 40 minutes would elimination division excitement get game create sense comradery would attendance go know large universities football tickets free everyone sometimes sporting event point system place sporting events go likely get ticket football game specific section case north south know many say go sit swarm go sit south side dont block pay attention game say fair enough suppose know football often mainly interest greek life anyway feel like another way gt prioritizes greek community excludes students makes game days less georgia tech talk student organizations people greek people time may say ones want involved know true eye roll let hear thoughts thanks,positive,0.9942,positive,0.0701078869047619,08/01/2019
posts,ae exchange student anything aware general coming gt advice helpful feel free comment even minor things,positive,0.7269,positive,0.1625,08/01/2019
posts,gunshots west anyone else hear sounded gunshots near west campus,neutral,0.0,positive,0.1,08/01/2019
posts,someone hear something like gun shots west campus want make sure crazy like six loud pop sounds,positive,0.738,neutral,9.25185853854297e-18,08/01/2019
posts,questions internet dorm students get wifi free included housing cost decent internet keep connected wifi throughout campus available dorm major buildings mobile internet necessary assuming intentions leaving campus,positive,0.3899,positive,0.20583333333333337,08/02/2019
posts,ebb student assistant job description engineered biosystems team looking assistance information technology maintenance projects maintain heterogeneous network consisting windows mac os linux systems hosting various services general computer experience required experience bash powershell scripting development languages preferred job entails user support diagnosing hardware software network problems configuring installing maintaining laptops workstations servers packaging software av support generally whatever necessary keep people running important quality candidate willingness learn commitment building positive client relationships work times flexible individual must reliable hourly rates competitive work environment relaxed amp x200b please apply submitting resume hours schedule flexible location ebb work study pay rate 12 16 based experience,positive,0.9293,positive,0.1038961038961039,08/02/2019
posts,trading spots accounting 2101 hey guys know right place post think anywhere else trying readjust fall class schedule accommodate job schedule currently registered accounting 2101 hales 30 pm tuesdays thursdays would like trade spot hu mondays wednesdays fridays let know interested would appreciate help,positive,0.938,positive,0.17857142857142858,08/02/2019
posts,fellow freshman anyone interested amp friends going start game semester need players going play fifth edition hopefully long lasting campaign first time players welcome comment dm interested also let know better places post amp stuff edit thanks interested hit max many people confidently invite encourage everyone keep looking plenty groups tech,positive,0.9885,positive,0.25416666666666665,08/02/2019
posts,petition save campanile fountain,positive,0.5411,neutral,0.0,08/02/2019
posts,arrest made armed robbery tech square clery act safety alert arrest update campus armed robbery incident date time july 31 2019 approximately 10 31 pm incident location 75 fifth street nw atlanta centergy courtyard incident description update two people robbed knifepoint suspect stole bicycle fled gtpd investigated identified andrew durham suspect august 2019 gtpd secured warrants durham charges aggravated assault armed robbery sent photo vehicle description surrounding agencies atlanta police department located durham downtown approximately 11 15 arrested great job gatechpd,negative,-0.7767,neutral,-0.019999999999999997,08/02/2019
posts,confused courses take computational perception robotics specialization hi guys planning take computational perception robotics specialization ms computer science program fall thinking taking following courses semester computer vision 6476 computational photography 6475 artificial intelligence 6601 want take another course sure one selection seem doable possible someone please suggest course add list thanks advance,positive,0.7761,neutral,-0.049999999999999996,08/02/2019
posts,rats digital scavenger hunt first week school full details comments,neutral,0.0,positive,0.19999999999999998,08/02/2019
posts,chem 2344 mcdonald anybody taken mcdonald genetics wonder hard class much time consuming comments appreciated,positive,0.504,neutral,0.036111111111111115,08/02/2019
posts,gatech recruitment allow girls phones sister pnm potential new member rushing weeks know lot southern schools take girls phones recruitment know sure thank edit recruitment mean sorority recruitment national panhellenic council changed name rush recruitment years ago im exactly sure though,negative,-0.195,positive,0.13731060606060605,08/02/2019
posts,immunization hi simple question guys bring documents required immunization form like shot histories stamps,positive,0.4199,neutral,0.0,08/02/2019
posts,break registration times phase seniors go first juniors open time students anyone know time junior would able register really trying get organic,neutral,0.0,positive,0.2375,08/02/2019
posts,classes physics prerequisite 95 sure failed summer physics class wanted know prerequisite classes could put long possible fucking hate electricity magnetism,negative,-0.7178,negative,-0.17,08/02/2019
posts,phase questions anxiety hey pre med chem junior managed register credits phase anxiety killing right need credits full time deathly afraid getting necessary classes get full time classes want 30 spots left organismal bio physics 2212 cs 1331 math 2550 chances getting please mean freaking kinda bad,negative,-0.6605,negative,-0.07834821428571427,08/02/2019
posts,easy credit course anyone taken easy credit course gt please let know ones,positive,0.9374,positive,0.43333333333333335,08/02/2019
posts,parking permit help hello transfer student unfortunately living woodruff trying buy parking permit curran parking deck options showing smart park evening weekend standard 5pm e81 tech square deck er53 naa north deck er54 naa south deck evening weekend 4pm access evening weekend 3pm access evening weekend 2pm access motorcycle permit motorcycle permit 2nd amp x200b yet friend gt year looks driverseat sees option purchasing w30 curran deck try use online support form nothing shows anyone help,positive,0.9478,negative,-0.07142857142857142,08/02/2019
posts,anyone else internet deleted,neutral,0.0,neutral,0.0,08/02/2019
posts,future president gerald ford teammate willis ward university michigan 1934 ford threatened quit team ward benched game georgia tech time refused play black players,negative,-0.4215,negative,-0.18888888888888888,08/02/2019
posts,anyone cassandra kierzkowski math 3012 deleted,neutral,0.0,neutral,0.0,08/02/2019
posts,anyone cassandra timothy kierzkowski specifically combinatorics seem find anything professor online,neutral,0.0,neutral,0.0,08/02/2019
posts,used kind poker,neutral,0.0,positive,0.6,08/03/2019
posts,pokemon go community incoming transfer student wondering pokemon go groupchat discord join love pokemon btw,positive,0.6199,positive,0.5,08/03/2019
posts,freshman schedule advice needed please hey guys incoming math major international student attending faset thinking registering math 1551 math 1554 engl 1101 cs1301 first going take inta1200 instead cs many said internationals hard time history decided take cs joyner class available clue classes take first semester know hard time fitting want easy semester give opinions take prof recommend classes take first semester take math courses previously alevel math waiting result also get take placement test 1551 lot time study siblings friends seniors said alevel math calc college different need take class friend got alevel said someone alevels british system tell experience fitting american system terms assignments gt1000 mandatory everyone optional credit class,positive,0.9659,positive,0.14973958333333331,08/03/2019
posts,internet service fraternity fraternity house campus wifi since outages reported earlier august 1st many people around good way go fixing since oit available monday sub collection best cs students trying pick yalls brain,positive,0.8573,positive,0.52,08/03/2019
posts,anyone pdf list anything topics 1102 fall 2019 guys keep tryina follow link course descriptions keeps hitting error message tried laptop phone got nothing tried google even lmc site still nothing anyway got faset like next week wanna pick good english class anyone list working link anything 1102 topics,positive,0.7657,positive,0.2333333333333333,08/03/2019
posts,room swap north ave north west campus apartments currently assigned 6th floor person male room north ave north looking swap west campus apartment interests please let know,positive,0.5499,neutral,0.0,08/03/2019
posts,around dates fall midterms usually,neutral,0.0,negative,-0.25,08/03/2019
posts,nobody watching deleted,neutral,0.0,neutral,0.0,08/03/2019
posts,nobody watching another existential crisis post fellow yellow jacket school gets closer 2nd yr major lot want say really know put every different thing words wanted touch things hear thoughts bit scattered type nobody watching something keep hearing reading attempted self reflection put healthier mindset summer social media stressing grades family expectations perceived expectations friends looked smart person fear losing image find derive passion find knowing like terms academic passion non academic hobbies know start somewhere feel like anything pick drop relatively quick see progression enough checkpoints growth give dopamine rush push onwards days mind feels really cloudy find anything exception comes study school albeit procrastinate fear kicks fear failure mind feels active sudden studying subjects material seems fascinating find enjoying motive fear realized thing high school perhaps never really found passion everything fear driven feel like age least hobby good enjoy want help people fear bad negatively affecting people want help stops feel inexperienced everything also damn socially awkward anxious quiet part program feel like belong grateful opportunity help feel imposter syndrome often times guilt made mistake accepting maybe unintentionally lied applications interviews made appear figure feel like may deprived someone actually worthy thought guilt make want work harder prove worth brings back pt scared hurting people want help sounding stupid misinformed found withdrawing ever fears made really detached everyone fear exposed imposter,negative,-0.9867,neutral,0.01872899159663865,08/03/2019
posts,class registration incoming grad students deleted,neutral,0.0,neutral,0.0,08/03/2019
posts,fire pits campus fire pits campus afternoon campfires something like even allowed campus,negative,-0.3939,neutral,0.0,08/03/2019
posts,meal plan hey kind meal plan buy transfer student forming tech also meal plan work ike dining points dining dollars many dining points one swipe worth dining dollars,positive,0.4329,positive,0.46666666666666673,08/03/2019
posts,hard transfer cm major currently gsu thinking transferring ga tech 63 gpa around 58 credit hour gpa credit good enough thanks,positive,0.8738,positive,0.11180555555555555,08/03/2019
posts,cross registration emory seems tech limited choice liberal arts courses hope take courses emory anyone tech taken course emory restriction besides upperclassmen experience,positive,0.3141,neutral,-0.03571428571428571,08/04/2019
posts,upvote party deleted,positive,0.4019,neutral,0.0,08/04/2019
posts,going die ive seeing lot fellow freshmen posting schedules look really light usually 14 hours ee major taking 16 17 hours first semester die please give advice professors cool terrible thanks math 1551 gupta gt 1000 valenta chem 1310 schurmeier cs 1301 mcdaniel econ 2106 fritz engl 1101 dean ruzicka,positive,0.5838,neutral,0.0017857142857142874,08/04/2019
posts,campus ms analytics hi everyone currently looking complete application georgia tech masters analytics campus fall 2020 currently research couple questions much average program cost gre gmat score required average score get accepted program read online version optional wanted know applied campus version thank,positive,0.6072,neutral,-0.039999999999999994,08/04/2019
posts,meme lord spoken,neutral,0.0,neutral,0.0,08/04/2019
posts,interest unfolding origami club heard gt origami club years ago wondered club folded extremely interested japanese art paper folding also engineering mathematics physics industrial design applications origami looking people interested helping make club members learn new folds open public events regarding origami maybe publish paper book conducting research together experience necessary currently planning public paper airplane competitions prizes philanthropy event folding 1000 cranes hospitals weekly fold anything workshops snacks teaching origami children adults making paper gonna take years research teams work research adviser many interest idea form,positive,0.9372,positive,0.11363636363636362,08/04/2019
posts,hi point even applying transfer tech meet course requirements major transferring 30 hours cs major however lab science elective section complete taken chem said would even consider admitting,neutral,0.0,positive,0.075,08/04/2019
posts,believe gtpd great job measures tech taking prevent stop mass shooting like ones seemingly happen twice month asking inflammatory know perhaps paranoid one thinks students relatively large diverse inter city institution based current climate things frightening least,negative,-0.5647,neutral,0.04285714285714285,08/04/2019
posts,mom got good bye present college,positive,0.4404,positive,0.35,08/04/2019
posts,asian grocery stores near campus planning cooking next semester would like go way duluth asian groceries,positive,0.3612,neutral,0.025,08/04/2019
posts,getting buzzcard hello recently transferred gt fall semester faset forgot bring id unable take picture use buzzcard anyone know suppose go order ensure get buzzcard school starts,positive,0.6633,negative,-0.25,08/04/2019
posts,pass fail letter grade took class letter grade changed pass fail withdrawal deadline see actually got class way change class back letter grade chance answer trying make sure absolutely way class humanities elective way,neutral,0.0,neutral,-0.049999999999999996,08/04/2019
