type,text,VADER sentiment,VADER sentiment score,TextBlob sentiment,TextBlob sentiment score,date
posts,everyone give mods love place getting wilder wilder guys really top sure despite commitments tech puts us thank keeping sub sane hell week crazy stories floating around good luck take care yackets,positive,0.8959,positive,0.32,03/11/2020
posts,georgia open primary forgive dumb question well versed voting process voted yesterday paper sign section choices democratic republican non partisan time read time fill places poll worker marked highlighter thought asked party affiliation marked non partisan poll worker saw paper scoffed said democratic primary knew asked georgia open primary however ignored insisted make changes paper sign initials anyone knows could favor explain section actually meant thanks advance,positive,0.8192,positive,0.12249999999999998,03/11/2020
posts,isye 3104 online removed,neutral,0.0,neutral,0.0,03/11/2020
posts,creating next,positive,0.296,neutral,0.0,03/11/2020
posts,fuck gt dining deleted,negative,-0.2404,negative,-0.4,03/11/2020
posts,good place make friends campus since august always thought would able accumulate friends time seven months later looking back realize made friends convenience many whole life relied closely knit group friends one come school still keep contact really substitute point suffering pretty badly realized able make connections like thought could understand blame largely difficulty initiating trying find places might easier mitigate guess question really tightly knit group friends meet places making new connections easier,positive,0.9575,positive,0.17862137862137867,03/11/2020
posts,eduroam,neutral,0.0,neutral,0.0,03/11/2020
posts,sad gt dining deleted,negative,-0.0688,negative,-0.5,03/11/2020
posts,morning classes required class looks time required class required class 00 tech ends suicide together bold aspirational plan based international initiative represents paradigm shift suicide prevention suicide elimination,negative,-0.9169,positive,0.16666666666666666,03/11/2020
posts,ksu georgia tech physics transfers hello upcoming physics major ksu opportunity transfer georgia tech georgia first pathway program fall first year ksu plan pursuing graduate school though unsure school would best overall preparing would greatly appreciate advice students might insight share schools,positive,0.8805,positive,0.39375,03/11/2020
posts,gt like deleted,positive,0.6523,neutral,0.0,03/11/2020
posts,give mods love deleted,neutral,0.0,positive,0.5,03/11/2020
posts,thoughts geomatics cee 3010 physics major computer science minor taken required cs classes last elective class minor basically trying pick easiest simplest class particularly interested taking anymore cs one options cee 3010 anyone taken class like background previous experience taken classes civil engineering thanks help,positive,0.7939,neutral,0.03511904761904762,03/11/2020
posts,must expendable,neutral,0.0,neutral,0.0,03/11/2020
posts,lets show love mods deleted,positive,0.6369,positive,0.5,03/11/2020
posts,guest wi fi campus meetings midtown today evening thinking spending time culc get work done throughout day since anyways much rather campus random starbucks problem know gt account still let login wifi using buzzport longer student guest wifi would helpful guest wifi campus specifically culc building way request internet access day,positive,0.6281,negative,-0.15,03/11/2020
posts,looks like vietvana pho noodle house break saw gtpd amp apd front door window smashed anyone frequents lunch might closed,positive,0.3612,negative,-0.1,03/11/2020
posts,reminder student employee training hi everyone reminder sign student employee training yet guide registration page help figure kind time reporting use know yet access guide right also quick reminder gtri student employees exempt either clock trainings still recommended take intro ess course please ask questions great day,positive,0.9251,positive,0.5047619047619047,03/11/2020
posts,isye 2027 removed,neutral,0.0,neutral,0.0,03/11/2020
posts,university phoenix move classes online classes removed,neutral,0.0,neutral,0.0,03/11/2020
posts,university phoenix switches classes online classes removed,neutral,0.0,neutral,0.0,03/11/2020
posts,cs 4803 3du anyone taking 3d user interfaces macintyre semester curious class difficult,negative,-0.0516,negative,-0.3,03/11/2020
posts,isye 2027 isye 3232 good morning jackets wondering able take isye 2027 3232 time know 2027 prereq 3232 possible get override semester anyone experience like feedback appreciated,positive,0.8753,positive,0.35,03/11/2020
posts,coronavirus joke,neutral,0.0,neutral,0.0,03/11/2020
posts,fresh press gossip removed,positive,0.3182,positive,0.3,03/11/2020
posts,please cautious removed,positive,0.3182,neutral,0.0,03/11/2020
posts,people wearing masks campus removed,neutral,0.0,neutral,0.0,03/11/2020
posts,hate gt deleted,negative,-0.5719,negative,-0.8,03/11/2020
posts,gt make hard student orgs represent tech everyone talk process getting shirts student organizations horror story georgia tech licensing trademarks practically impossible student org georgia tech trademarks shirts licensing trademarks office extremely unhelpful seem borderline incompetent trademark law gt care students god forbid try even make slightest reference yellow jacket logo feel like buzz gt logo belong athletic department nobody else school real mascot students,negative,-0.2156,negative,-0.20555555555555552,03/11/2020
posts,easy get sick,negative,-0.1027,negative,-0.14047619047619048,03/11/2020
posts,tournament bracket best football uniforms acc gt finals unc take second break coronavirus fears vote white gold poll ends tonight 830pm est,positive,0.7019,positive,0.3333333333333333,03/11/2020
posts,megathread coronavirus thread covid 19 coronavirus discussions quarantined megathread people post relevant news articles parent comment thread updated try keep updated alas one man speculation pertaining allegations campus cases allowed comment removed discussions gt response allowed created preparation university news friday march 12th ga confirmed cases 31 study abroad canceled remaining semester usg said classes continue ga risk low mls suspends season first death ga confirmed 67 year old male march 11th presumptive cases 22 ga swelled gt 000 nationwide fulton county schools remain closed today brian kemp urged tell georgia state congress stay home gt faculty meeting today update get news officially declared covid 19 pandemic highly recommended article scope disease please share message provost instructors academic continuity resources amp planning second fulton county schools employee tests positive march madness played fans trump declared total europe travel ban 30 days nba suspended regular season march 10th updated github gist containing college closures mod team would like recommend vote early ferst center state given trends university closings might returning vote canton waffle house employee tests positive coronavirus daycare employee tests positive covid gtpd comment ambulances seen campus earlier sick call crime log gtpd guidance regarding coronavirus march 9th princeton instructing students remain home spring break fulton county schools employee tests positive fulton county schools closed tomorrow georgia confirmed 11 presumed cases useful links coronavirus atlanta coronavirusga coronavirusatlanta official gt coronavirus page megathread megathread,positive,0.1898,positive,0.08480019980019979,03/11/2020
posts,move online classes spring break coronavirus removed,neutral,0.0,neutral,0.0,03/11/2020
posts,cs 4731 game ai experience hello could taken game ai share experiences reading past reddit posts seems like lot concepts already covered cs 3600 pretty interested game development would like take class goes depth 3600 thanks,positive,0.9391,negative,-0.10714285714285714,03/11/2020
posts,please stop touching face removed,neutral,0.0258,positive,0.5,03/11/2020
posts,summer courses hello yellow jackets question pertains mostly ies anyone know isye 2027 offered online summer planning internship summer take online would fantastic amp x200b thank hope yall great day,positive,0.962,positive,0.42500000000000004,03/11/2020
posts,new food fines program pay parking fines canned food,negative,-0.1027,positive,0.13636363636363635,03/11/2020
posts,flattenthecurve,neutral,0.0,neutral,0.0,03/11/2020
posts,gt covid 19 case true deleted,positive,0.5224,positive,0.35,03/11/2020
posts,gt covid 19 case rumor professors self isolating gt sent official confirmation deleted,positive,0.7207,neutral,0.0,03/11/2020
posts,blekherman removed,neutral,0.0,neutral,0.0,03/11/2020
posts,message provost instructors academic continuity resources amp planning message sent behalf provost bras georgia tech instructors record dear colleagues instructional faculty situation around covid 19 coronavirus outbreak evolves critical prepare ensure academic continuity students need restrict access campus point restriction place continue assess situation closely evaluate options university system georgia message share students additionally current information always available health gatech edu coronavirus academic standpoint first priority must minimize impact academic progress students leadership college school working identify relevant degree granting credit courses determine alternative delivery plans course section academic continuity work group also formed team members georgia tech professional education office information technology oit center teaching learning group creating action plan needed continue instruction supporting faculty student student student interaction using existing familiar tools like canvas kaltura bluejeans conferencing information sessions workshops individual consultation sessions made available week next week faculty member needs training refreshing available tools oit enterprise service desk serve single point access technical assistance resource documents students faculty staff uploaded services gatech edu soon available college school leadership stands ready assist get resources training need monitoring situation closely appreciative support students deal inevitable uncertainty communicate soon additional details available please reach via questions concerns regards rafael bras provost,positive,0.9468,positive,0.17050264550264552,03/11/2020
posts,online cs 2050 anyone know school summer online discrete math cs 2050 transfers tech,neutral,0.0,neutral,0.0,03/11/2020
posts,got saved midterm today,positive,0.4215,neutral,0.0,03/11/2020
posts,many police cars outside culc removed,neutral,0.0,positive,0.25,03/11/2020
posts,watch buses please make sure guys stop behind buses stop almost hit watched someone almost get hit getting paper bus stop bc someone flew past bus shout bus driver honking horn got flattened,negative,-0.25,negative,-0.05000000000000001,03/11/2020
posts,girl name mallory west willage removed,neutral,0.0,neutral,0.0,03/11/2020
posts,many police cars outside culc hour ago removed,neutral,0.0,positive,0.25,03/11/2020
posts,app track closings across us removed,neutral,0.0,neutral,0.0,03/11/2020
posts,track closings across us removed,neutral,0.0,neutral,0.0,03/11/2020
posts,wtf going many cops ambulances fire trucks campus yesterday today removed,negative,-0.5859,neutral,0.0,03/11/2020
posts,sirens library today deleted,neutral,0.0,neutral,0.0,03/11/2020
posts,gt corona deleted,positive,0.481,neutral,0.0,03/11/2020
posts,lt corona,neutral,0.0,neutral,0.0,03/11/2020
posts,anyone syllabus lmc 3403 derek lee professor sections available cs students tba,neutral,0.0,positive,0.4,03/11/2020
posts,anyone know many ambulances fire trucks campus removed,negative,-0.34,positive,0.5,03/11/2020
posts,anyone know many ambulances fire trucks campus removed,negative,-0.34,positive,0.5,03/11/2020
posts,caption needed,negative,-0.296,neutral,0.0,03/11/2020
posts,anyone currently robert wood lmc 3104 removed,neutral,0.0,neutral,0.0,03/11/2020
posts,covid conditinal pathway applicants given conditional transfer pathway 2020 fall meaning tech next semester long meet requirements submit application however circulation georgia colleges may turn online courses rest semester currently taking lab class credit hour meet 30 hour credit requirement also lab science course requirement also read lab classes online rather would complete course later date summer next fall however requirements due end spring semester later predicament many conditional applicants currently wondering would happen us classes go online able meet course requirements,negative,-0.0516,positive,0.08409090909090909,03/11/2020
posts,siege,neutral,0.0,neutral,0.0,03/11/2020
posts,thanos got,neutral,0.0,neutral,0.0,03/11/2020
posts,hell georgia real removed,negative,-0.6808,positive,0.2,03/11/2020
posts,going cancel class deleted,negative,-0.3164,neutral,0.0,03/11/2020
posts,going cancel class deleted,negative,-0.3164,neutral,0.0,03/11/2020
posts,cobb county elementary school closes 14 days following positive coronavirus case removed,positive,0.5574,positive,0.17575757575757575,03/11/2020
posts,angel make house calls dad asking graduation cancelled angel hand deliver kid diploma house otp welcome stay overnight sleep pull rumpus room,positive,0.3313,positive,0.8,03/11/2020
posts,chances combo test cancelled tomorrow removed,negative,-0.0516,neutral,0.0,03/11/2020
posts,study abroad europe peeps removed,neutral,0.0,neutral,0.0,03/11/2020
posts,girl name mallory willage 4th march removed,neutral,0.0,neutral,0.0,03/11/2020
posts,someone needs take eng1102 deleted,neutral,0.0,neutral,0.0,03/11/2020
posts,hell week rages,negative,-0.8271,neutral,0.0,03/11/2020
posts,someone needs take eng1102,neutral,0.0,neutral,0.0,03/11/2020
posts,sga undergraduate house representatives applications extended attention election applications seats undergraduate house representatives uhr extended saturday march 14th 11 59pm apply seats available represent class academic school sga legislative branch members elected constituency may also apply represent special constituencies international students student athletes co op students transfer students member large represent entire student body member uhr help allocate almost million student activity fee funds student organizations vote resolutions embody student opinion participate discussions shaping future campus enriching student body experience questions please contact sga elections committee learn sga gatech edu uhr,positive,0.7717,positive,0.13877551020408163,03/11/2020
