type,text,VADER sentiment,VADER sentiment score,TextBlob sentiment,TextBlob sentiment score,date
posts,GTPD at Barnes and Noble. This afternoon there were several GTPD officers questioning an African American gentleman. What was going on? Is he OK?,positive,0.7089,positive,0.22000000000000003,06/30/2019
posts,"Rigor of GT Lorraine campus vs ATL campus?. Hey yall! I am currently a student at Emory but I am planning on doing the Dual Degree Program. I was thinking about studying abroad next summer at the GT Lorraine campus(if I can work out the details with both schools etc.). But, before I actually try to do anything, I was wondering how the courses there compare to the main campus in terms of difficulty and workload?",positive,0.497,neutral,0.041666666666666664,06/30/2019
posts,GTPE proctoring service thru GTPE. Does anyone else also feel like the proctoring service through GTPE is a huge shit show? The sign up link looks sketchy and they recently got rid of a bunch of time blocks without emailing the students about it?,negative,-0.264,positive,0.0666666666666667,06/30/2019
posts,Spring 2020 Transfer Advice/Chances. [removed],neutral,0.0,neutral,0.0,06/30/2019
posts,"TAship Query: Incoming MSCS student Fall '19. Hi All! 

I am an incoming Grad student and want to apply for TAship in my first semester. I wanted to know how difficult is it to secure for a new grad student, considering that most positions will be filled up by Grad seniors already? Is it worth a try? If yes, what the best way to go about it (directly emailing profs etc.)? Also, can I apply for TAship in undergrad level courses? 

Any help is greatly appreciated :) TIA",positive,0.9754,positive,0.2987603305785124,07/01/2019
posts,Any incoming freshman get their AP scores yet?. ,neutral,0.0,neutral,0.0,07/01/2019
posts,"Shipping via FedEx. so I'm trying to return the fitbits and was just wondering where I could send my package? The Gatech post office only delivers USPS i believe. Are there drop off locations on campus and if there are, in your experience are they secure?",positive,0.168,positive,0.2,07/01/2019
posts,How to acquire clout?. fr tho,neutral,0.0,neutral,0.0,07/01/2019
posts,"Your Neighbors at Relapse Theatre! (Weekly Shows). Hey guys we're right down the road from you so I wanted to show you all what shows we have this week! Go Jackets!  


**July 2 8:00 PM** \- *People Garden Improv*: Every Tuesday at 8pm enjoy two hours of improv from the Relapse House Cast.

[Ticket information here.](https://relapsecomedy.com/event.cfm?id=529071&amp;cart)

**July 4 1030 PM** \- *Filibusters*: After the fireworks and celebrations, come on down to Relapse Theatre to watch stand up comics improvise sets based on words or phrases that pop up on a screen. Quick note: If you want to try performing on this show simply fill our this [form](https://forms.gle/BajJXgriiV2LhFD36) and bring people and buy something at the bar! Everyone's welcome!

[Ticket information here.](https://relapsecomedy.com/event.cfm?id=529843&amp;cart)

**July 5th 800 PM** \- *Six Kids Improv*: This isn't even a show I produce but these guys are great. So check them out

[Ticket information here.](https://relapsecomedy.com/event.cfm?id=529840&amp;cart)

***DOUBLE FEATURE!*** **July 6th 800 PM and 1030 PM** \- *People Garden Improv -* A special double show from the house cast at Relapse Theatre. Buy one ticket and see both shows.

[Ticket information here.](https://relapsecomedy.com/event.cfm?id=529747&amp;cart)",positive,0.9483,positive,0.252507215007215,07/01/2019
posts,"ATL Reign Homestand Weekend: Sunday Tickets still available!. Attention all eSports fans! 

The Atlanta Reign is hosting HOMESTAND WEEKEND this July 6th and 7th at the Cobb Energy Centre. Eight Overwatch League teams from around the world will come together to compete in this two-day event. The festivities will carry over to our after-party where you can meet the ATL Reign team and hear MayhemSLR and HeroesxVillains perform live!

We still have Sunday tickets available, which you can purchase [here](https://www1.ticketmaster.com/atlanta-reign/event/0E005683B7173C52). Can’t make it to the games? Join us for the after-party by registering [here](https://go.skillshot.com/atlreignafterparty/332172).

For more information, visit [ATL Reign’s website](https://www.atlreign.com). We look forward to seeing you there!",positive,0.8209,positive,0.45511363636363633,07/01/2019
posts,"Will I need my suit?. Hi, I am from Spain and the next year I will be at Georgia Tech. I am organizing everything I have to take with me. Are there social events at GeorgiaTech that require to wear a suit? The amount of things that I can put in my bag is limited, that's why I am asking. Thanks!",positive,0.3923,positive,0.052976190476190475,07/01/2019
posts,"Any ISYE pre-med students?. I am an ISYE major and am really interested in the major, but also have a passion for healthcare. ISYE would be a good backup in case med school doesn’t pan out. I am wondering if there are any people who are doing or did this combination successfully. How did you plan internships along with fulfilling med school requirements like volunteering/shadowing/research, and what was the timeline like? Any info would be appreciated!",positive,0.9793,positive,0.3458333333333334,07/01/2019
posts,Six Flags early bird tix are now available. ,neutral,0.0,positive,0.25,07/01/2019
posts,"Gatech Organic Chemistry Course Question. Hello everyone,

So I'm considering to transfer to Gatech, and I was looking at the courses that will get transferred. Then I realized that Georgia Tech doesn't have Orgo chem I and II labs, instead it has 1 synthesis lab that is 2 credit houres. My question is, does this class cover both organic chemistry I and II labs from other universities and if it satisfies the pre-med requirement of taking 1 year of organic chemistry with lab (to my understanding, this class is only for 1 semester and not a whole year). Thanks.",positive,0.4577,neutral,-0.006249999999999999,07/01/2019
posts,"Clery Act Safety Alert Off Campus Armed Robbery.   

**Clery Act Safety Alert**  
 **Off Campus Armed Robbery**

  

**Incident Date/Time:** July 1, 2019, at approximately 2:46 pm.  
 

**Incident Location:** West Peachtree Street NW at Ponce de Leon Avenue NW  
 

**Incident Description:**  The victim stated he was standing next to his vehicle on West Peachtree Street when a male approached him and presented a black handgun. The male took his cell phone and the keys to his car, then drove off in his car. The suspect was last seen traveling westbound on Ponce de Leon Avenue toward Spring Street NW in the victim’s vehicle. The victim is a graduate student at Georgia Institute of Technology.  
 

**Description of Suspect**

African-American male, tall with a thin build and a beard, wearing a blue hooded jacket with the hood up. Armed with a black handgun.

**Description of Suspect Vehicle**

2016 Lexus GS350 4-door sedan, black in color, Florida tag DKZA71 

**Status of Investigation:** This incident is being investigated by the Atlanta Police Department. Report any information regarding this and other criminal incidents to Crime Stoppers Atlanta at **404-577-TIPS (8477)**.  
 

**See Something, Say Something**  
 Report any information regarding this and other criminal incidents to the Georgia Tech Police Department (GTPD) by calling **404-894-2500** or by emailing [crimetips@police.gatech.edu](mailto:crimetips@police.gatech.edu). In addition, you can help GTPD and the community fight crime. Don’t look the other way or ignore suspicious activity. If you see something that prompts concern, say something and notify GTPD immediately.  
 

**Additional Safety Information for Georgia Tech**

&amp;#x200B;

* Walk in well-lit areas. To report inoperative exterior      campus lighting, visit: [http://www.facilities.gatech.edu/om/requests/lighting.php](http://www.facilities.gatech.edu/om/requests/lighting.php).
* Walk with a friend or in a group.
* Be aware of your surroundings.
* Immediately report suspicious activity to the      Georgia Tech Police by calling 404-894-2500. Program GTPD's number into your cell      phone.
* For on campus transportation from 6:00 p.m. to 7:00      a.m., please call Stingerette at 404-385-RIDE.
* Safety escorts are available through the Georgia      Tech Police Department by calling 404-894-2500 or 4-GTPD.
* Download the [LiveSafe](http://livesafe.gatech.edu/) safety app for quick access      to the Georgia Tech Police Department and      other safety resources. 

**Clery Act Requirements**  
 *Federal law, the Clery Act, requires colleges and universities to report certain crime statistics as well as to make timely notifications about crimes that pose a threat to the community. The purpose of this alert is to help make you aware of crime so that you are able to take appropriate precautions.  For more information, please visit* [*www.police.gatech.edu*](http://www.police.gatech.edu/)*.*",negative,-0.6908,neutral,-0.02163382594417077,07/01/2019
posts,"Shipping label returning fitbits. For those who are returning their fitbits, how did you obtain the FedEx shipping label? All I have gotten from Fitbit was a return authorization. Thanks!",positive,0.4926,positive,0.25,07/01/2019
posts,The AJC wrote an article about the Fitbit fiasco. ,negative,-0.5106,neutral,0.0,07/01/2019
posts,Financial aid. [deleted],neutral,0.0,neutral,0.0,07/01/2019
posts,"Intend to Transfer Summer 2020. Need Advice or Information. I’m planning on transferring to Georgia Tech for Computer Science in the summer of 2020, which means I’ll need to apply in December after fall classes end. It will be right before Spring, but I’ll assume I can put the classes I’m signed up for in Spring on my application as “in progress.”

I will have 60 credit hours at University of North Georgia fully completed, and 75 total if I include the Spring in-progress classes. I’m applying for Summer because I believe it will be a little less competitive compared to the influx of high school seniors in the fall and because it will be easier to find an apartment.

Overall GPA: 3.89
UNG GPA: 3.97
Math &amp; Science GPA: 3.92

These are subject to slight change over the upcoming semesters.

I’m taking Calculus II right now as a summer course and will be taking Computer Science I, Physics II, and Calculus III in the fall.

The Oakwood campus only offers 3 Computer Science related courses, so I’ve chosen to wait until right before I transfer to take them.

I have a few extracurriculars, but the internship I was going to secure ghosted me after a change in funding.

I’m concerned that I’m going to be denied and not have anywhere to go considering that my current school does not offer any other classes after this. Tech has been my dream school since I was a child and I want to do anything possible to make my place there.

Does anyone have any advice as far as my essays, anyone I could contact, or things I could do to further ensure that I land a spot? I can provide more info if asked, but it is quite a lot to type out.

Thank you.",positive,0.9446,positive,0.05260204081632654,07/01/2019
posts,"Is it normal to not get aid?. I'm an incoming transfer student. I'm supposed to start this fall. I just got my financial aid letter and... it looks a lot more empty than I expected.

There are no grants, loans, or scholarships listed. I've taken courses at plenty of schools and I've NEVER had that happen. Is that... normal? I'm in such a low income bracket that I always get at least some aid. I find it really weird. I know I'm eligible for Zell, but that's not on there, either.",negative,-0.4772,neutral,-0.01999999999999999,07/01/2019
posts,"Dorm Stuff Advice?. Hey guys! 

I'll be a freshman this upcoming fall, and was wondering what necessities some of you guys consider as things you should definitely bring or buy for your dorm?  I'm the first in my family to attend a college in the US so my parents and I are a bit clueless as to some of the things we should not forget.

Thanks so much in advance!",negative,-0.3578,positive,0.175,07/02/2019
posts,"Fitbit question. So I know that the Fitbit link was originally only for Georgia tech staff, but does it count than I’m a student employee at Georgia tech currently employed  by the school? I got the USG email telling me to return it but is there any way I could dispute it?",negative,-0.6007,neutral,0.0,07/02/2019
posts,"Registration for Transfer Students?. Hello, everyone! Incoming fall transfer student here - have a quick question regarding registration. I am unable to attend the July 30-31 orientation and must opt for the August 15th session; does this mean I will not be registering for classes until a few days prior to the start of the semester? If so, what are the odds of me getting into the courses I need?

Anyone willing to share advice on this matter would be greatly appreciated, go Jackets! 🐝",positive,0.793,neutral,-0.025595238095238098,07/02/2019
posts,GTPD u good?. ,neutral,0.0,positive,0.7,07/02/2019
posts,fitbit returns from abroad. [deleted],neutral,0.0,neutral,0.0,07/02/2019
posts,"missing transfer faset. Hello!
I am about to transfer to gt for the fall and there are two faset options. It’s looking like I won’t be able to attend either. I was wondering how exactly this would impact my registration and when registration would become open to me? Is it hard to get any classes? Thanks so much for the help!",positive,0.8198,positive,0.09404761904761905,07/02/2019
posts,"Need Help Moving 8/3. So August 3rd is the official day for Summer-Fall room switch day, if I'm not mistaken. I live in WDS right now and need to move to Harris. I don't have family who lives down here to help me, my friends will be gone, and the trip between the two dorms is far too lengthy to just take x trips back and forth to say the least. If anyone would be willing to take a couple of hours to help me drive my stuff over to Harris, PM me. I'll gladly pay you for your help. :)

Thanks!",positive,0.969,positive,0.14241112422930605,07/02/2019
posts,Hurts to see. ,negative,-0.4767,neutral,0.0,07/02/2019
posts,Any students who fix electronics as a side business?. [deleted],neutral,0.0,neutral,0.0,07/02/2019
posts,"Incoming freshman(international) wanting answers for some questions/confusions. -So I got to know about my email(known as the gt account related address) after my housing was confirmed. But today I also made a customized GT email address from PASSPORT. Can someone tell me the difference between customized gt email address and gt account related address? Both emails are now showing up on my email preferences in passport. I thought after I created the customized one, the other would disappear but it didn’t. 
The customized one is coming under contact info-&gt;directory entry-&gt; your directory listing. 

-What’s the difference between buzzport and passport? These portals are hella confusing. What is OSCAR?

-In my housing, my roommate had the earlier number so she assigned us a room. I later checked and saw from my portal too and our name, room number and email address was there. What I mean to say is that I didn’t select anything, she did so it means that the room is confirmed right?

-Can I submit the immunizations form later in July. On the website I saw that according to my last name, my deadline is 8 July. Can I submit it like 5-6days late? I was out of country and got to know about the deadline very late. 

I’m sorry if some are dumb questions but I just want to know that I’m on the right track and know what is what.",positive,0.8033,negative,-0.054768907563025215,07/02/2019
posts,"People who graduated ISyE, where are you now?. [deleted]",neutral,0.0,neutral,0.0,07/02/2019
posts,Georgia Tech Distance Math admissions. [removed],neutral,0.0,neutral,0.0,07/02/2019
posts,Ice Cream Statue Spotted.. [deleted],neutral,0.0,neutral,0.0,07/02/2019
posts,GT Scholarship App. The deadline for the scholarship application for Zell Miller (GT App) was July 1 but my form only went through today - am I still going to be able to get Zell for the Fall and Spring Semesters?,positive,0.2303,positive,0.25,07/02/2019
posts,"Has anyone bought their dorm stuff from OCM? If so, how’d it end up being quality-wise?. Incoming freshman, and I keep getting emails about these OCM dorm packs with sheets, laundry bags, etc. This seems pretty convenient since it’s a one time purchase, and I’ll be getting the majority of my dorm supplies. I’m worried if it’s overpriced though and the quality as well.",positive,0.5362,positive,0.25,07/02/2019
posts,"What the hell do we do with the Fitbits?. I've seen many people return their Fitbits, but I've also seen many people keep theirs and claim that USG won't come after them and charge them or go to collections. Will they or will they not actually follow through with their weird threat, and wtf do we do?",negative,-0.9433,neutral,0.0,07/02/2019
posts,The T on Coda. I noticed today that the T in the logo on top of the Coda building is white while the rest of the logo is gold. Is it always like that or had somebody pulled off the next best thing to stealing it?,positive,0.5859,positive,0.375,07/02/2019
posts,Fall 2019 Upperclassmen Move In Dates. Is it possible to move in the Sunday before school starts or just Saturday? Is there any info about this anywhere on the housing site?,neutral,0.0,neutral,0.0,07/02/2019
posts,On r/UGA. ,neutral,0.0,neutral,0.0,07/03/2019
posts,Update from Fitbit Customer service! (we dont have to pay or return). ,positive,0.1501,neutral,0.0,07/03/2019
posts,Is MS-HCI course a STEM Major?. Hoping to apply to GATech but would like to know if the HCI major is STEM. Thanks,positive,0.8402,positive,0.10833333333333334,07/03/2019
posts,We Won!!!!. ,neutral,0.0,neutral,0.0,07/03/2019
posts,"How much do recommendations matter?. Hey guys, I’m a rising junior at my first internship - it’s a fairly large company based in Florida. There’s around fifty other interns, with a few of them also being from GT, but everyone is scattered throughout the buildings. However, I sit by 5-6 other interns that are all from UF.

Last week, I got pulled aside by a full-time employee and was told that our “group” has already made a name for being loud and not doing work. The other interns like to sit in a circle and talk for most of the day. None of us are really assigned a ton of work, so we usually finish it within a few hours, and there’s nothing to do but look bored on the computer. I don’t sit and talk nearly as much as they do, but I do have a bad habit of sitting on my phone sometimes, which I know isn’t a good look at all for an intern. I’ve been trying to do the normal “help, I don’t have any work at my internship” things - do personal projects, learn new things, etc. But, it’s still hard to focus, and I understand why the full-time employees are all annoyed. Any advice? I’m not particularly looking for a full-time or return offer, so at this point I’m more worried about if a company I interview with for next summer calls my current boss and he tells them about our current “reputation.” Thanks!",negative,-0.5307,neutral,0.014308905380333954,07/03/2019
posts,"Melissa (no) Moore, Press F to Pay Respects. ",positive,0.2263,neutral,0.0,07/03/2019
posts,Feasability of a Class Action Lawsuit. [deleted],negative,-0.2263,positive,0.1,07/03/2019
posts,"Has anyone done or doing the BS/MS Digital Media degree? Need some help.... So it seems like I'll graduate in Fall 2019, but as a result, I won't be able to follow the program properly (cause some classes must be taken in sequence). Has anyone had this experience before? What does/did your schedule end up being like? Did you do internships or something in the gaps?",positive,0.757,positive,0.16666666666666666,07/03/2019
posts,Please tell me I am not the only one.... [deleted],positive,0.3182,neutral,0.0,07/03/2019
posts,"Looking to buy a 3D printer. I’m an ECE MS student thinking of getting started in 3D printing without investing too much upfront. Is anyone looking to sell a used printer?
Something like an ender 3 perhaps?",positive,0.4329,positive,0.2,07/03/2019
posts,Official confirmation. Enjoy your fitbit!. ,positive,0.5411,positive,0.5,07/03/2019
posts,Update about this Fitbit nonsense. ,negative,-0.4019,neutral,0.0,07/03/2019
posts,Now that this Fitbit issue is ending.... I really enjoyed talking/ arguing/ complaining with you all!,positive,0.474,positive,0.625,07/03/2019
posts,Buying all your Fitbits. [deleted],neutral,0.0,neutral,0.0,07/03/2019
posts,Even better Fitbit news if you've already returned yours:. ,positive,0.4404,positive,0.5,07/03/2019
posts,For those asking about what to do if you're already submitted your Fitbit back - Response from USG. ,neutral,0.0,neutral,0.0,07/03/2019
posts,GTRI Co-op position and don't know whether to accept. Just got an offer for the fall of 2019 and was wondering if I should accept if it's my first semester here. I have only taken summer courses here and thought my fall courses would be kind of an important milestone academically and socially. I'm also scared of the three-semester commitment as I don't think I will be committed long enough to be there. I'm honestly tied up and don't what I should do. Any suggestions would be greatly appreciated!,positive,0.9285,positive,0.2314814814814815,07/03/2019
posts,"Canceled Fitbit Order. They canceled my fitbit order before it shipped... but I reached out to them and they are ""uncanceling"" and sending me the fitbits anyway!

&amp;#x200B;

[https://imgur.com/6eff5D8](https://imgur.com/6eff5D8)",positive,0.2244,neutral,0.0,07/03/2019
posts,"Seeing as the FitBits have been returned. I want to introduce my new business model.. I'mma sell some hot contraband FitBits that I fought the man for!!! They're worth like $70 but I got a low price for you and a couple ways to pay:

1) treethiddy cash

2) Notes for whatever class I'mma be taking in fall.

3) A really sexy graphing calculator to add to my collection (no I'm not aroused by them *that much*) 

I'll be the one in a Matlab &amp; chill shirt and a black fedora hanging out by the nearest dark corner filled with electric scooters. Come see me if you dare.",positive,0.6559,positive,0.17345256542699722,07/03/2019
posts,Should I retake classes for gradschool/internships. [deleted],neutral,0.0,neutral,0.0,07/03/2019
posts,Transfer Housing Waitlist. [deleted],neutral,0.0,neutral,0.0,07/03/2019
posts,"Create - X Scholar?. Hey,
Any Create X scholars out there?

I received an email invitation to become a create x scholar and I don't know what it's about. The website contains very little information too. 

The email said that these were the benefits.

""
*A startup adviser to answer your questions and help you hone your business idea

*A guaranteed paid internship working with a startup

*Guaranteed slots in Startup Lab and Idea to Prototype, two courses that help you learn evidence based entrepreneurship and help you develop a prototype of your idea

*Eligibility for a guaranteed slot in the coveted Startup LAUNCH, during which your team will receive a $4,000 grant for living expenses; $50,000 in legal services to help launch your startup; and $50,000 in accounting services to help build the financial structure of your startup. 


In addition to the benefits above, you'll receive VIP access to the entrepreneurship ecosystem at GA Tech through a host of CREATE-X programs, workshops, and special events. 
""

It definitely looks interesting. I would like to know any students currently enrolled in it.",positive,0.9899,positive,0.10167410714285714,07/04/2019
posts,CRC open today (July 4th)?. [deleted],neutral,0.0,neutral,0.0,07/04/2019
posts,"Personal Training for Cheap. Hey all! if you still want to try to get that summer beach body, or you just want to feel better; I'd love to help you. My services include: building you a meal plan, being a CRC buddy up to 3 days a week, and I'll try to be available if you ever have questions. I'm only planning on having one or two clients max, so this will probably fill up pretty soon. DM me on here if you are interested or have any further questions.

Edit: also to encourage trying, the first 2 days are free trial sessions, if you don't like what we're doing by day 3, no charge to you at all.",positive,0.9632,positive,0.2772727272727273,07/04/2019
posts,"How hard is it to get housing as an incoming sophomore transfer. Currently, 77 on the waitlist and I don't really want to live off campus. At this point, I wouldn't mind even living in Woodruff.
Thanks!",positive,0.3298,positive,0.05893939393939394,07/04/2019
posts,"Car dealerships near campus. I've been wanting to get a used car for a while now (something affordable) and am wondering what's the best way I can get a solid deal in Atlanta. Is it a good idea to just walk in some car delearships and see what they're offering? Can anyone recommend a good one that's near campus or an area that has a lot of them and I could just walk from one to another? I tried websites that people list their cars on and the GT thrift shop group but wasn't successful (this would be my first car btw). For reference, I'm looking for something that's around \~$2000. Thanks!",positive,0.8343,positive,0.4277777777777778,07/04/2019
posts,Gatech students after the fit bit fiasco. ,negative,-0.2023,positive,0.4,07/04/2019
posts,4TH of July CRC/Tech??. Is the CRC or Tech doing something for fourth of July? I'm looking for plans or fun things to do for today?,positive,0.644,positive,0.15,07/04/2019
