type,text,VADER sentiment,VADER sentiment score,TextBlob sentiment,TextBlob sentiment score,date
posts,"Recommendations on dorm router?. Hi, my daughter was accepted to Georgia Tech for this Fall. She hasn't done FASET yet to ask, and thought to ask here. I'm thinking of getting her a router, laptop and small printer in the next few days. So, as far I can tell from the GT web site, routers are allowed, but their WiFi radios need to be disabled. Then I thought about a switch, but THAT seems to be prohibited. What's the real deal at GT with dorm connectivity? Any advise would be appreciated. Thanks.",positive,0.9421,neutral,0.006249999999999999,07/04/2019
posts,"LLCs and Fraternities. Hey, oncoming freshmen here. I know you guys hate these kinds of posts but I couldn't find anything online so here I am.         

Anyways, are there any restrictions with regard to joining both LLCs and fraternities your first year? I am in Grand Challenges and was recently wondering if it was possible for me to join a fraternity at the same time. Would I have to wait, or is it fine?        

Side question, apart from rushing, what is the best way to find out about the characteristics of each of the different chapters (such as which are academically focused, party frats, religious, etc)? Any online groups where I could ask questions (discord?). Thanks.",positive,0.9791,positive,0.13055555555555556,07/04/2019
posts,Real Engineer watches Big Bang Theory - Thought you guys would enjoy this. ,positive,0.4939,positive,0.20000000000000004,07/04/2019
posts,"Undergraduate Data Science Courses. Hi, I'll be attending gatech for the upcoming fall sem as an exchange student! Would love to hear your thoughts on which courses are good for someone looking to get into data analytics. I also see that there are some graduate level courses, would I be able to take those courses?",positive,0.8122,positive,0.5666666666666667,07/04/2019
posts,#CactusJackets. ,neutral,0.0,neutral,0.0,07/05/2019
posts,"Gatech sorority rush. Hi guys Im a third year transfer to GT and I was wondering if third years can still go through formal recruitment for a sorority and end up getting a bid? I know at some schools, its very unlikely. Thanks for the help!",positive,0.8403,negative,-0.1,07/05/2019
posts,Anyone driving to the airport in the next hour and a half?. Will pay for a ride,negative,-0.1027,negative,-0.08333333333333333,07/05/2019
posts,I got a 4 on BC. Should I skip calc 2?. Title,neutral,0.0,neutral,0.0,07/05/2019
posts,Where to jump from?. [removed],neutral,0.0,neutral,0.0,07/05/2019
posts,To the person dropping their mancala pieces around west campus this summer. I've been picking them up. I'm willing to return them if you can best me in the game when we bring the pieces together to make a full set.,positive,0.6369,positive,0.3,07/05/2019
posts,"IE majors, what math classes did/will you take?. Incoming freshman IE major, was trying to plan out my classes and didn’t know whether to take MATH 1553 + 2551 or MATH 1554 + 2550.",neutral,0.0,positive,0.0625,07/05/2019
posts,"No classes Today?. I'm about to reveal myself as a moron, but do we not have class today? The classroom is locked but the professor referred to having class today multiple times despite acknowledging the 4th as a holiday.",positive,0.2982,negative,-0.4,07/05/2019
posts,Idk if this has been posted yet - GT Professor explains why malls are dying. ,positive,0.347,neutral,0.0,07/05/2019
posts,"Dont live at the standard. The heater and A/C works poorly in our unit. It was freezing in the winter time but hot as hell in the summer time. Management basically told us to fuck off and didnt do anything to fix it. 

Anyone have similar problems living there?",negative,-0.9509,negative,-0.06893939393939395,07/05/2019
posts,CRC hours today. Is the CRC running on regular hours today?,neutral,0.0,neutral,0.0,07/05/2019
posts,"Career after BME undergrad -- someone to speak with?. Hi everyone, I'm entering my 3rd year as a BME with a CS minor and am starting to think about my post-graduation plans. At the moment I think my ideal situation would be finding an industry job (I'm interested in bioinformatics) and eventually moving on to pursue my Masters degree. I'm not sure if I'm on the right track, and was wondering if there are any recently graduated BMEs who might be willing to speak with me about their experiences after graduation. Thanks!",positive,0.809,positive,0.16357142857142856,07/05/2019
posts,"ECE 2026 (help!). I don't know what's going on in this class for the past 4 weeks. I got a decent score on our first midterm but we have another one coming up next week. Basically I need to learn almost all the material by myself. Any tips? Lecturer says we need to have the book when we go to office hours but there's no way I'm spending $200 on something I'll never use and the only TA is rude and literally gets mad when we ask too many questions. There's not much on Youtube, so I was wondering if anyone has some outside resources to recommend?

Also, is this class similar to other general EE classes? Except for ECE 3084, will the other classes I take be like this one if I don't concentrate in this area? Thank you!!",negative,-0.6353,neutral,-0.0449032738095238,07/05/2019
posts,Good resources for learning cache and virtual memory. Hi I have an ECE 3057 quiz Tuesday and am confused about virtual memory and cache. Any good online resources?,positive,0.5423,positive,0.3333333333333333,07/05/2019
posts,"For alumni who have participated ORGT as a student, have you managed to find any organizations similar to participate in around Atlanta?. I'm looking for kayaking trips mainly right now, but am open to backpacking, hiking or mountain biking too",neutral,0.0,positive,0.09523809523809523,07/05/2019
posts,"Transfer Fraternity Rush Experience. Do transfers often get bids from fraternity's or is there really no point in rushing as a transfer? I'm going to be a junior by time in college when I transfer in this fall but my graduation timeline is looking like I'll be taking 5 years to graduate. So should I just state that I'm a sophomore if people ask?

Also kind of off topic question but is it true that only the top 10 or so fraternities have co-ed parties at Tech? I've heard from some people that the gender ratio of the greek scene at tech causes this to happen. Not sure if they were just pulling my leg though since at my previous Big 10 college that wasn't the case but they also didn't have so few sororities at my previous school.",positive,0.8765,positive,0.05151515151515152,07/05/2019
posts,Overseen at the street in Taiwan. ,neutral,0.0,neutral,0.0,07/06/2019
posts,Any Cute Girls in 2110?. [deleted],positive,0.4588,positive,0.5,07/06/2019
posts,"Shipping amazon stuff to gatech mail address. Since I am interning abroad and the hub at Tech Square holds stuff for only like 20 days, wanted to confirm ahead of prime day if we can have like a shit ton of parcels delivered to our 3XXXXX mailing addresses and collect them like a month later without any hassels.",positive,0.5574,negative,-0.06666666666666667,07/06/2019
posts,"CS Major Schedule Question. Hi everyone, I'm an incoming freshman majoring in CS and was trying to decide my course schedule. I got 5 in AP Calculus BC, AP micro and macroeconomics, AP CSA, and AP Physics 1. So,right now I am planning to take:
CS1331(3 credit)
MATH1554 (4 credit) (I took a linear algebra course on MIT Open course taught by Professor Gilbert Strang this summer, so I may have some background knowledge for this course)
PHYS2211(4 credit)
ENGL1101(3 credit)

In total, it is 14 credits. I am wondering whether this schedule is doable and what about taking one more social science course. By the way, since I signed up for FAEST 7, am I able to register for all these courses I want to take? 
Thanks!!!",positive,0.7633,positive,0.21235119047619047,07/06/2019
posts,"Transfer Student...Missed Financial Aid Deadline. The title says it all...I just checked buzz port and saw the financial aid application link and it says the deadline was July 1st.  It's Saturday so I can't call them until Monday.  I was wondering if anyone has ever been in this situation before and what I should do.  Does this mean I might not get Zell?  Thanks for you help guys.  By the way, I already submitted FAFSA a while back.",positive,0.0757,neutral,-0.0225,07/06/2019
posts,"minor is CS. Hey guys, I was wondering if a minor in Computing and intelligence is actually worth it?

Can someone please help me figure out the pros and cons?

Like is there a stark difference in salary/ internship offers

I am an IE that would love to graduate in 4 years.

Here are the required classes btw :)

 

* CS 1332 Data Structures and Algorithms, 3
* CS 2110 Computer Organization and Programming, 4
* CS 3600 Introduction to Artificial Intelligence, 3
* Pick 1 from *Embodied Intelligence (below)*:
   * CS 3630 Robotics and Perception, 3
   * CS 3790 Introduction to Cognitive Science, 3
* Pick 1 from *Approaches to Intelligence (below)*:
   * CS 4476 Intro Computer Vision, 3
   * CS 4635 Knowledge-based AI, 3
   * CS 4641 Machine Learning, 3
   * CS 4646 Machine Learning for Trading, 3
   * CS 4649 Robot Intelligence, 3
   * CS 4650 Natural Language and Processing, 3
   * CS 4731 Game AI, 3

&amp;#x200B;

Thanks!",positive,0.9892,neutral,0.040909090909090916,07/06/2019
posts,For those who transferred as Computer Science majors. Did you guys have to take CS 1301 and CS 1371 or just CS 1301?? I am kinda confused,negative,-0.3328,negative,-0.4,07/06/2019
posts,Financial Aid Refunds. I recently got a refund for getting rewarded more scholarships/aid then the cost of attendance for summer. The money went into my bank account and I was wondering if that’s supposed to happen? Or should it have went to my student account?,positive,0.5514,positive,0.16666666666666666,07/06/2019
posts,Whats the easiest way to move in from oos?. I’m coming from California for my first year at GT and was wondering how most people from far away are planning on shipping their stuff to campus.,positive,0.6841,positive,0.2833333333333333,07/06/2019
posts,"I visited the campus for the first time today and I am HYPED to join y'all. I'm a transfer student, any tips? (especially from other transfer students, but I'd appreciate anyone's input)",positive,0.631,neutral,0.041666666666666664,07/06/2019
posts,"Fws. I had a fws job last semester, and did not discuss returning this fall with my supervisor. Should I go ahead and apply to other positions or check in with my past job? If there are other positions I’d prefer would it be appropriate to go ahead and apply for those, and then decline an offer to return if I do hear anything?",neutral,0.0,neutral,0.0,07/06/2019
posts,"Any pianos on campus?. Doesn't have to be anything amazing, I just miss playing and want to get back into it. Anyone know where one is on campus?

Thanks!",positive,0.8339,positive,0.2833333333333334,07/06/2019
posts,"Semester withdrawal due to unexpected circumstance?. As the title suggests, I've been trying to find more info on whether or not such a thing exists at Tech but had no luck so I figured this would be my next best option.

A little background on my situation: Since the start of summer break, I've been taking care of my ill mother who I recently found out has been diagnosed with stomach cancer. I was hoping she would recover slightly by the time Fall semester starts so I could return to my studies without any worry. Unfortunately, that doesn't seem likely as I may need to be by her side for a little longer than expected. 

That being said, I was wondering if anyone here could direct me to a GT related site/source that may assist me in finding a solution for my circumstance, perhaps  leaving Tech for a semester (maybe more or less) or any other options. Thanks!",positive,0.9711,neutral,0.01958333333333334,07/07/2019
posts,"What's Good Laptop type for CS Students?. Hey everyone! I'll be transferring in this fall as a CS student. I was thinking about getting a new laptop as mine is getting a bit aged. I do have a pretty decent gaming desktop I'm bringing so my laptop will primarily be for class notes and on-the-go work (in the student center and such). I'm trying to decide between a more traditional style 13.5 in. laptop or something like a surface pro/surface book for having the touchscreen/stylus for notes. Thanks in advance.

Edit: Basically I'm asking if y'all think a traditional or 2-in-1 would be better, and apparently from some replies Windows or macOS.",positive,0.9286,positive,0.20557359307359307,07/07/2019
posts,"Meal Plans for Fall 2019?. Does anyone know anything about the non freshman meal plans for next semester? I was hoping to give the new dining provider a chance, but I can’t find anything about it on the school website.",positive,0.4137,positive,0.06818181818181818,07/07/2019
posts,Question about PHYS 2211. [deleted],neutral,0.0,neutral,0.0,07/07/2019
posts,How do I confirm that my IB credits were transferred?. I should be getting 24 credits from IB (recieved scores yesterday). Where can I see that Tech recieved my scores?,positive,0.6553,neutral,0.0,07/07/2019
posts,Missed your Bitcoin change?. [removed],negative,-0.296,neutral,0.0,07/07/2019
posts,Anyone play AOE2 on Steam?. ,positive,0.34,neutral,0.0,07/07/2019
posts,Testing out of phys 2211. What study materials are there to prepare for the test to get out of phys 2211 (which I heard is basically the final exam for that class)?,neutral,0.0,neutral,0.0,07/07/2019
posts,"The Love Machine(Learning) Writeup and Visualizations. Hi everyone! I hope that those of you who used The Love Machine(Learning) enjoyed it. This summer I wrote up the results and methodology we used, along with some visualizations I made. It might be helpful to read through if you weren't paired so you can find out why and find love someday. 

&amp;#x200B;

Would folks be interested in another iteration this coming year? Any things we should take into consideration?

[https://medium.com/@valentineawilson/the-love-machine-learning-2cfa524a8c78](https://medium.com/@valentineawilson/the-love-machine-learning-2cfa524a8c78)

&amp;#x200B;

XOXO The Agency",positive,0.9844,positive,0.475,07/07/2019
posts,"Anyway to go inside the new Coda building?. It was closed today (Sunday); but wondering if there is a way for the general public to access this building, or do I have to know someone? Really I want to check out the spiral staircase, just a curious GT alum.",positive,0.838,neutral,0.031060606060606063,07/07/2019
posts,Happy anniversary to this absolute chad of a Jacket and his wife. ,positive,0.5719,positive,0.5,07/07/2019
posts,Feedback on Schedule. [deleted],neutral,0.0,neutral,0.0,07/07/2019
posts,"Labs that will take undergrads for fall semester. Hey guys, I tried looking up labs that will still take undergrads for the fall semester but was unable to find the info I am looking for. Can someone please point me to the direction of websites/ names of labs that meet the following requirements

\-Lab relating to Machine Learning/Data Science/Isye operations research 

\-Preferred to get paid rather than credit

\-will give valuable experience in the field

&amp;#x200B;

Sorry if this question was already asked before and thanks for the help!",positive,0.9568,negative,-0.1875,07/07/2019
posts,withdrawing from summer semester = withdrawing from entire school &amp; petition to faculty = am I still eligible to come back ?. [deleted],neutral,0.0,neutral,0.0,07/07/2019
posts,"Dorm Supplies. Hey, incoming freshmen living on campus next year. Had a few questions about stuff I am planning on buying for my dorm.

1. What size couch/futon can I fit underneath the bunkbed?
2. Where do people usually get their minifridges/microwaves from? Is there a standard place to buy/rent from?
3. Do I need a network switch for ethernet or is the wifi generally good enough? (I don't game, just standard internet browsing etc) 

Thanks!",positive,0.8608,neutral,0.04999999999999999,07/08/2019
posts,Should I skip math 1551/1552 as an engineering major?. [deleted],neutral,0.0,positive,0.0625,07/08/2019
posts,Housing waitlist. I’m an incoming transfer for fall semester. I applied for  housing a couple days ago and the status says that I’m 87 on the waitlist. What exactly does that mean? Is it for my preferred buildings or for woodruff?,neutral,0.0,neutral,-0.03125,07/08/2019
posts,Would anyone be interested in a Sign Language club?. Title. I just really wanna learn and figure it would be fun to do it with others!,positive,0.7424,positive,0.27499999999999997,07/08/2019
posts,Locked out of Willage. Does anybody know why willage has been locked?? In the mornings when I try to get breakfast I can't buzz into any of the entrances and usually someone from Panera will let me in. This is usually around 8-9 am. A friend of mine also found that the buzzcard readers wouldn't open the doors for anyone studying late at night. Isn't willage supposed to be open 24 hrs for students?,positive,0.5775,negative,-0.16,07/08/2019
posts,Not going to FASET and what to do?. Sorry if this is a popular question but for anyone who didn't go the FASET Orientation either as a transfer or freshman can you tell me what you had to do after all the sessions were done? Or you can tell me who to ask cause I am not sure who I would ask other than my adviser I guess?,negative,-0.3034,negative,-0.06875,07/08/2019
posts,"Advice for getting your foot in the door of GTRI?. Hey all, I am a recent KSU EE graduate trying to get into GTRI. It seems like every application I send in just goes into the void, occasionally some ""pass the initial review stage"" and went onto the hiring manager but I never seem to get an interview. After taking some networking classes I have now sent out connection messages to several GTRI HR members and researchers in my field in hopes to make a personal connection, but I really would love to know if there is more I can do.

&amp;#x200B;

I really just wish to work in the DoD while staying in the heart of Georgia. I have had offers from companies like Lockheed and Raytheon but they wish me to relocate to military bases far away from home and far from civilization. Currently there are three fantastic openings at GTRI in my field of : a Jr EE, a Jr. Antenna and Radar engineer, and am image and signal processing engineer (my specialty).  All three I am once again ""under review"" but like the countless other times I have applied I feel that status won't change for weeks till I just get a rejection email.

&amp;#x200B;

I am really hoping I can connect and meet with one of the people on LinkedIn so I can at least get their advice or have them look me over and tell me what might be what is causing GTRI from turning me down. Even advice on just making myself stand out would be wonderful.

&amp;#x200B;

Thanks in advance for any advice you guys have.",positive,0.9914,positive,0.12815656565656566,07/08/2019
