type,text,sentiment,topic,score,date
comment," ADAM: Oh, this is so hard! (Barry remembers what the Pollen Jock offered him and he flies off) Heating, cooling, stunt bee, pourer, stirrer,  : humming, inspector number seven, lint coordinator, stripe supervisor,  : mite wrangler. Barry, what do you think I should... Barry? (Adam turns around and sees Barry flying away)  : Barry! POLLEN JOCK: All right, we've got the sunflower patch in quadrant nine... ADAM: (Through phone) What happened to you? Where are you? BARRY: - I'm going out. ADAM: - Out? Out where? BARRY: - Out there. ADAM: - Oh, no! BARRY: I have to, before I go to work for the rest of my life. ADAM:  You're gonna die! You're crazy! (Barry hangs up) Hello? POLLEN JOCK #2: Another call coming in.  : If anyone's feeling brave, there's a Korean deli on 83rd  : that gets their roses today. BARRY: Hey, guys. POLLEN JOCK #1 == - Look at that. POLLEN JOCK #2: - Isn't that the kid we saw yesterday? LOU LO DUVA: Hold it, son, flight deck's restricted. POLLEN JOCK #1: It's OK, Lou. We're gonna take him up. (Puts hand on Barry's shoulder) LOU LO DUVA: (To Barry) Really? Feeling lucky, are you? BEE WITH CLIPBOARD: (To Barry) Sign here, here. Just initial that.  : - Thank you. LOU LO DUVA: - OK.  : You got a rain advisory today,  :  and as you all know, bees cannot fly in rain.  : So be careful. As always, watch your brooms,  : hockey sticks, dogs, birds, bears and bats.  : Also, I got a couple of reports of root beer being poured on us.  : Murphy's in a home because of it, babbling like a cicada! BARRY: - That's awful. LOU LO DUVA: (Still talking through megaphone) - And a reminder for you rookies,  : bee law number one, absolutely no talking to humans!  : All right, launch positions! POLLEN JOCKS: (The Pollen Jocks run into formation)  : Buzz, buzz, buzz, buzz! Buzz, buzz, buzz, buzz! Buzz, buzz, buzz, buzz! LOU LU DUVA: Black and yellow! POLLEN JOCKS:  Hello! POLLEN JOCK #1: (To Barry)You ready for this, hot shot? BARRY: Yeah. Yeah, bring it on. POLLEN JOCK's: Wind, check.  : - Antennae, check. - Nectar pack, check.  : - Wings, check. - Stinger, check. BARRY: Scared out of my shorts, check. LOU LO DUVA: OK, ladies,  : let's move it out!  : Pound those petunias, you striped stem-suckers!  : All of you, drain those flowers! (The pollen jocks fly out of the hive) BARRY: Wow! I'm out!  : I can't believe I'm out!  : So blue.   : I feel so fast and free!  : Box kite! (Barry flies through the kite)  : Wow!  : Flowers! (A pollen jock puts on some high tech goggles that shows flowers similar to heat sink goggles.) POLLEN JOCK: This is Blue Leader. We have roses visual.  : Bring it around 30 degrees and hold.  : Roses! POLLEN JOCK #1: 30 degrees, roger. Bringing it around.  : Stand to the side, kid. It's got a bit of a kick. (The pollen jock fires a high-tech gun at the flower, shooting tubes that suck up the nectar from the flower and collects it into a pouch on the gun) BARRY: That is one nectar collector! POLLEN JOCK #1== - Ever see pollination up close? BARRY: - No, sir. POLLEN JOCK #1:  (Barry and the Pollen jock fly over the field, the pollen jock sprinkles pollen as he goes)  : I pick up some pollen here, sprinkle it over here. Maybe a dash over there,  : a pinch on that one. See that? It's a little bit of magic. BARRY: That's amazing. Why do we do that? POLLEN JOCK #1: That's pollen power. More pollen, more flowers, more nectar, more honey for us. BARRY: Cool.",Neutral,"flight, work, pollen jocks, hive, bees, honey, nature, adventure",1,2023-06-11
comment,"Hello /u/brokegtstudent,

It looks like you might be a prospective new student here at GT. If so, welcome to /r/gatech! Around admission season, we get a huge influx of very common and repeated questions from new students. Usually we pin a Q&A thread for all prospective student questions. Check for this megathread on the subreddit homepage. We also recommend that you try [searching google and the subreddit](https://www.reddit.com/r/gatech/comments/cd4gcw) for the answer to your question first. 

If you believe this is a mistake, or you think your post is truly worthy of its own dedicated post, then you can [message the moderators to approve your post](https://www\.reddit\.com/message/compose?to=%2Fr%2Fgatech&subject=About my removed submission&message=I'm writing to you about my submission: /r/gatech/comments/146lhxs/how_to_tell_modern_or_classical/. %0D%0DI think my submission should be approved because\:).

*I am a bot, and this action was performed automatically. Please [contact the moderators of this subreddit](/message/compose/?to=/r/gatech) if you have any questions or concerns.*",Neutral,"admissions, welcome, faqs, moderation, bot.",1,2023-06-11
comment," POLLEN JOCK #1: I'm picking up a lot of bright yellow. could be daisies. Don't we need those? POLLEN JOCK #2: Copy that visual.  : Wait. One of these flowers seems to be on the move. POLLEN JOCK #1: Say again? You're reporting a moving flower? POLLEN JOCK #2: Affirmative. (The Pollen jocks land near the ""flowers"" which, to the audience are obviously just tennis balls) KEN: (In the distance) That was on the line!  POLLEN JOCK #1: This is the coolest. What is it? POLLEN JOCK #2: I don't know, but I'm loving this color.  : It smells good. Not like a flower, but I like it. POLLEN JOCK #1: Yeah, fuzzy. (Sticks his hand on the ball but it gets stuck) POLLEN JOCK #3== Chemical-y. (The pollen jock finally gets his hand free from the tennis ball) POLLEN JOCK #1: Careful, guys. It's a little grabby. (The pollen jocks turn around and see Barry lying his entire body on top of one of the tennis balls) POLLEN JOCK #2: My sweet lord of bees! POLLEN JOCK #3: Candy-brain, get off there! POLLEN JOCK #1: (Pointing upwards) Problem! (A human hand reaches down and grabs the tennis ball that Barry is stuck to) BARRY: - Guys! POLLEN JOCK #2: - This could be bad. POLLEN JOCK #3: Affirmative. (Vanessa Bloome starts bouncing the tennis ball, not knowing Barry is stick to it)  BARRY== Very close.  : Gonna hurt.  : Mama's little boy. (Barry is being hit back and forth by two humans playing tennis. He is still stuck to the ball) POLLEN JOCK #1: You are way out of position, rookie! KEN: Coming in at you like a MISSILE! (Barry flies past the pollen jocks, still stuck to the ball) BARRY: (In slow motion) Help me! POLLEN JOCK #2: I don't think these are flowers. POLLEN JOCK #3: - Should we tell him? POLLEN JOCK #1: - I think he knows. BARRY: What is this?! KEN: Match point!  : You can start packing up, honey, because you're about to EAT IT! (A pollen jock coughs which confused Ken and he hits the ball the wrong way with Barry stuck to it and it goes flying into the city) BARRY:  Yowser! (Barry bounces around town and gets stuck in the engine of a car. He flies into the air conditioner and sees a bug that was frozen in there) BARRY: Ew, gross. (The man driving the car turns on the air conditioner which blows Barry into the car) GIRL IN CAR: There's a bee in the car!  : - Do something! DAD DRIVING CAR: - I'm driving! BABY GIRL: (Waving at Barry) - Hi, bee. (Barry smiles and waves at the baby girl) GUY IN BACK OF CAR: - He's back here!  : He's going to sting me! GIRL IN CAR: Nobody move. If you don't move, he won't sting you. Freeze! (Barry freezes as well, hovering in the middle of the car)  : GRANDMA IN CAR== He blinked! (The grandma whips out some bee-spray and sprays everywhere in the car, climbing into the front seat, still trying to spray Barry) GIRL IN CAR: Spray him, Granny! DAD DRIVING THE CAR: What are you doing?! (Barry escapes the car through the air conditioner and is flying high above  the ground, safe.) BARRY: Wow... the tension level out here is unbelievable. (Barry sees that storm clouds are gathering and he can see rain clouds moving into this direction)  : I gotta get home.  : Can't fly in rain.  : Can't fly in rain. (A rain drop hits Barry and one of his wings is damaged)  : Can't fly in rain. (A second rain drop hits Barry again and he spirals downwards) Mayday! Mayday! Bee going down! (WW2 plane sound effects are played as he plummets, and he crash-lands on a plant inside an apartment near the window) VANESSA BLOOME: Ken, could you close the window please? KEN== Hey, check out my new resume. I made it into a fold-out brochure.  : You see? (Folds brochure resume out) Folds out. (Ken closes the window, trapping Barry inside) BARRY: Oh, no. More humans. I don't need this. (Barry tries to fly away but smashes into the window and falls again)  : What was that?  (Barry keeps trying to fly out the window but he keeps being knocked back because the window is closed) Maybe this time. This time. This time. This time! This time! This...  : Drapes! (Barry taps the glass. He doesn't understand what it is) That is diabolical. KEN: It's fantastic. It's got all my special skills, even my top-ten favorite movies. ANDY: What's number one? Star Wars? KEN: Nah, I don't go for that... (Ken makes finger guns and makes ""pew pew pew"" sounds and then stops)  : ...kind of stuff. BARRY: No wonder we shouldn't talk to them. They're out of their minds. KEN: When I leave a job interview, they're flabbergasted, can't believe what I say. BARRY: (Looking at the light on the ceiling) There's the sun. Maybe that's a way out. (Starts flying towards the lightbulb)  : I don't remember the sun having a big 75 on it. (Barry hits the lightbulb and falls into the dip on the table that the humans are sitting at) KEN:  I predicted global warming.  : I could feel it getting hotter. At first I thought it was just me. (Andy dips a chip into the bowl and scoops up some dip with Barry on it and is about to put it in his mouth)  : Wait! Stop! Bee! (Andy drops the chip with Barry in fear and backs away. All the humans freak out)  : Stand back. These are winter boots. (Ken has winter boots on his hands and he is about to smash the bee but Vanessa saves him last second) VANESSA: Wait!  : Don't kill him! (Vanessa puts Barry in a glass to protect him) KEN: You know I'm allergic to them! This thing could kill me! VANESSA: Why does his life have less value than yours? KEN: Why does his life have any less value than mine? Is that your statement? VANESSA: I'm just saying all life has value. You don't know what he's capable of feeling. (Vanessa picks up Ken's brochure and puts it under the glass so she can carry Barry back to the window. Barry looks at Vanessa in amazement) KEN:  My brochure! VANESSA: There you go, little guy. (Vanessa opens the window and lets Barry out but Barry stays back and is still shocked that a human saved his life) KEN: I'm not scared of him. It's an allergic thing. VANESSA: Put that on your resume brochure. KEN: My whole face could puff up. ANDY: Make it one of your special skills. KEN: Knocking someone out is also a special skill. (Ken walks to the door) Right. Bye, Vanessa. Thanks.  : - Vanessa, next week? Yogurt night? VANESSA: - Sure, Ken. You know, whatever.  : (Vanessa tries to close door) KEN== - You could put carob chips on there. VANESSA: - Bye. (Closes door but Ken opens it again) KEN: - Supposed to be less calories.  VANESSA: - Bye. (Closes door) (Fast forward to the next day, Barry is still inside the house. He flies into the kitchen where Vanessa is doing dishes) BARRY== (Talking to himself) I gotta say something.  : She saved my life. I gotta say something.  : All right, here it goes. (Turns back) Nah.  : What would I say?  : I could really get in trouble.  : It's a bee law. You're not supposed to talk to a human.  : I can't believe I'm doing this.  : I've got to. (Barry disguises himself as a character on a food can as Vanessa walks by again)  : Oh, I can't do it. Come on!  : No. Yes. No.  : Do it. I can't.   : How should I start it? (Barry strikes a pose and wiggles his eyebrows) ""You like jazz?"" No, that's no good. (Vanessa is about to walk past Barry) Here she comes! Speak, you fool!  : ...Hi! (Vanessa gasps and drops the dishes in fright and notices Barry on the counter)  : I'm sorry. VANESSA: - You're talking. BARRY: - Yes, I know. VANESSA: (Pointing at Barry) You're talking! BARRY: I'm so sorry. VANESSA: No, it's OK. It's fine. I know I'm dreaming.  : But I don't recall going to bed. BARRY: Well, I'm sure this is very disconcerting. VANESSA: This is a bit of a surprise to me. I mean, you're a bee!  BARRY: I am. And I'm not supposed to be doing this, (Pointing to the living room where Ken tried to kill him last night) but they were all trying to kill me.  : And if it wasn't for you...  : I had to thank you. It's just how I was raised. (Vanessa stabs her hand with a fork to test whether she's dreaming or not)  : That was a little weird. VANESSA: - I'm talking with a bee. BARRY: - Yeah. VANESSA: I'm talking to a bee. And the bee is talking to me! BARRY: I just want to say I'm grateful. I'll leave now. (Barry turns to leave) VANESSA: - Wait! How did you learn to do that? BARRY: (Flying back) - What? VANESSA: The talking...thing. BARRY:  Same way you did, I guess. ""Mama, Dada, honey."" You pick it up. VANESSA: - That's very funny. BARRY: - Yeah.  : Bees are funny. If we didn't laugh, we'd cry with what we have to deal with.  : Anyway... VANESSA: Can I...  : ...get you something? BARRY: - Like what? VANESSA: I don't know. I mean... I don't know. Coffee? BARRY: I don't want to put you out. VANESSA: It's no trouble. It takes two minutes.  : - It's just coffee. BARRY: - I hate to impose. (Vanessa starts making coffee) VANESSA: - Don't be ridiculous!  BARRY: - Actually, I would love a cup. VANESSA: Hey, you want rum cake? BARRY: - I shouldn't. VANESSA: - Have some. BARRY: - No, I can't. VANESSA: - Come on! BARRY: I'm trying to lose a couple micrograms. VANESSA: - Where? BARRY: - These stripes don't help. VANESSA: You look great! BARRY: I don't know if you know anything about fashion.  : Are you all right? VANESSA: (Pouring coffee on the floor and missing the cup completely) No. (Flash forward in time. Barry and Vanessa are sitting together at a table on top of the apartment building drinking coffee)",Neutral,"conversation, bees, tennis, survival, human interaction, gratitude, dreams, insects, life, fashion, coffee",1,2023-06-11
comment,"I'd love to rappel down it with a chisel, make it look natural again.",Neutral,"rappelling, chiseling, restoration",14,2023-06-11
comment,when is orientation? I am also a pathway student and was curious :),Neutral,"orientation, pathway, curiosity",1,2023-06-11
comment,"Given your credentials, you can't go wrong in both of these. I will give my two cents., but the best advice I could give you is directly connect with Sr leaders in industry and Professors and get their inputs. The opportunity for CS is huge and ECE is niche. I am in wireless VLSI design, and I see that in most companies in this area in US, the average age of Design Engineers is 40+ and we have very limited folks getting in as New college grads. Having said that there are lots of interesting problems to be tackled like 6G, AI, IOT and edge devices, analog based neural network, Satellite communication etc.,  I know a person who did MS ECE from Columbia and joined Investment banking, so even doing an ECE you wont miss out software jobs. Also keep an eye on LLM's on what kind of problems they could tackle and how the knowledge gained through your education could use them or augment. I would strongly recommend you to talk to some s/w systems middle managers in Google or Microsoft as well.",Neutral,"career advice, education, technology industry, job opportunities.",2,2023-06-11
comment,I quote this post weekly,Positive,social media,1,2023-06-11
comment,Praise quant,Positive,praise,1,2023-06-11
comment,"QUANT QUANT QUANT[.](https://www.reddit.com/r/gatech/comments/12bz8uc/quant_quant_quant_quant_quant_quant/)

*I am a bot, and this action was performed automatically. Please [contact the moderators of this subreddit](/message/compose/?to=/r/gatech) if you have any questions or concerns.*",Neutral,quantitative analysis,1,2023-06-11
comment,I clicked on this so fast 😭,Positive,excitement,5,2023-06-11
comment,"As long as you’re not doing really intense renders you should be fine. You’re going to run into CPU bottlenecks before GPU bottlenecks for most Solidworks projects, it doesn’t really utilize the GPU all that much until you tell it to render",Neutral,"computer hardware
categories: hardware, performance, rendering, bottlenecks, solidworks",1,2023-06-11
comment,"Is TransLoc really as bad as they say for Georgia tech 

I was at ksu this past year and the app worked great 

I'm hoping to start at tech this fall (I hear back this Thursday) and I'll be relying a lot on the buses and the app so I hope it's not as bad as they say",Neutral,public transportation,1,2023-06-11
comment,"Hello /u/SkyAlarming1435,

It looks like you might be a prospective new student here at GT. If so, welcome to /r/gatech! Around admission season, we get a huge influx of very common and repeated questions from new students. Usually we pin a Q&A thread for all prospective student questions. Check for this megathread on the subreddit homepage. We also recommend that you try [searching google and the subreddit](https://www.reddit.com/r/gatech/comments/cd4gcw) for the answer to your question first. 

If you believe this is a mistake, or you think your post is truly worthy of its own dedicated post, then you can [message the moderators to approve your post](https://www\.reddit\.com/message/compose?to=%2Fr%2Fgatech&subject=About my removed submission&message=I'm writing to you about my submission: /r/gatech/comments/1471542/please_help_very_confused_person_who_doesnt_know/. %0D%0DI think my submission should be approved because\:).

*I am a bot, and this action was performed automatically. Please [contact the moderators of this subreddit](/message/compose/?to=/r/gatech) if you have any questions or concerns.*",Neutral,"admission, questions, megathread, searching, moderators.",1,2023-06-11
comment,"How much does a large bucket of golf balls cost at the CRC, or are they free? This is urgent please help.",Neutral,"cost, golf, crc",1,2023-06-11
comment,I’m wondering about this too,Neutral,"curiosity
general categories: curiosity, inquiry",1,2023-06-11
comment,"Hello /u/Juli_247,

It looks like you might be a prospective new student here at GT. If so, welcome to /r/gatech! Around admission season, we get a huge influx of very common and repeated questions from new students. Usually we pin a Q&A thread for all prospective student questions. Check for this megathread on the subreddit homepage. We also recommend that you try [searching google and the subreddit](https://www.reddit.com/r/gatech/comments/cd4gcw) for the answer to your question first. 

If you believe this is a mistake, or you think your post is truly worthy of its own dedicated post, then you can [message the moderators to approve your post](https://www\.reddit\.com/message/compose?to=%2Fr%2Fgatech&subject=About my removed submission&message=I'm writing to you about my submission: /r/gatech/comments/147473c/is_woodruff_still_that_bad_now_in_2023/. %0D%0DI think my submission should be approved because\:).

*I am a bot, and this action was performed automatically. Please [contact the moderators of this subreddit](/message/compose/?to=/r/gatech) if you have any questions or concerns.*",Neutral,"admissions, q&a, google search",1,2023-06-11
comment, **Have any of you been approved to walk in the Spring graduation with more than two classes remaining in Summer semester? What was your situation and how did you get it approved?**,Neutral,"graduation
categories: approval, walk, spring, graduation, classes, summer, semester, situation.",1,2023-06-11
comment,Also any business majors have a 4 year plan they want to share?,Neutral,academics,2,2023-06-11
comment,"If you're a freshman, I think they open late June. Check the housing website.",Neutral,housing,1,2023-06-11
comment,Whitaker roof,Neutral,home improvement,5,2023-06-11
comment,"Thank you for continuing to act in the interest of the Georgia Tech community with your concrete goals of ""causing the highest profit loss to disruption ratio, in a sustainable, ongoing way and we intend to continue this until the situation improves.""

Those are some incredibly achievable goals- and extremely measurable as well.

>our protest will end when demands are met, when directed by the larger leadership, or when unable to continue

I hope Georgia Tech continues to produce such amazing leadership.",Positive,"leadership, community, goals, protest",70,2023-06-16
comment,Why do you or any other mods think you have the right to unilaterally shut down subreddits. This subreddit isn’t your personal property- you’re a volunteer janitor. I’m sure most people here don’t care at all about Reddit’s API changes. Even if most people thought this was a good idea it still wouldn’t make sense to shut down any subreddits because those people could just voluntarily not use Reddit and contribute to ad revenue.,Negative,moderation,27,2023-06-16
comment,🤓,Neutral,emoticon,37,2023-06-16
comment,"Hello /u/hunny_16,

It looks like you might be a prospective new student here at GT. If so, welcome to /r/gatech! Around admission season, we get a huge influx of very common and repeated questions from new students. Usually we pin a Q&A thread for all prospective student questions. Check for this megathread on the subreddit homepage. We also recommend that you try [searching google and the subreddit](https://www.reddit.com/r/gatech/comments/cd4gcw) for the answer to your question first. 

If you believe this is a mistake, or you think your post is truly worthy of its own dedicated post, then you can [message the moderators to approve your post](https://www\.reddit\.com/message/compose?to=%2Fr%2Fgatech&subject=About my removed submission&message=I'm writing to you about my submission: /r/gatech/comments/14b0yvh/gt_housing_waitlist_as_first_year/. %0D%0DI think my submission should be approved because\:).

*I am a bot, and this action was performed automatically. Please [contact the moderators of this subreddit](/message/compose/?to=/r/gatech) if you have any questions or concerns.*",Neutral,"admission, q&a, prospective student, megathread, search, google, moderator.",1,2023-06-16
comment,"Hello /u/hunny_16,

It looks like you might be a prospective new student here at GT. If so, welcome to /r/gatech! Around admission season, we get a huge influx of very common and repeated questions from new students. Usually we pin a Q&A thread for all prospective student questions. Check for this megathread on the subreddit homepage. We also recommend that you try [searching google and the subreddit](https://www.reddit.com/r/gatech/comments/cd4gcw) for the answer to your question first. 

If you believe this is a mistake, or you think your post is truly worthy of its own dedicated post, then you can [message the moderators to approve your post](https://www\.reddit\.com/message/compose?to=%2Fr%2Fgatech&subject=About my removed submission&message=I'm writing to you about my submission: /r/gatech/comments/14b152p/housing_waitlist_help_how_do_i_get_off_the/. %0D%0DI think my submission should be approved because\:).

*I am a bot, and this action was performed automatically. Please [contact the moderators of this subreddit](/message/compose/?to=/r/gatech) if you have any questions or concerns.*",Neutral,"admission, faq, moderator, helpful",1,2023-06-16
comment,"Not going to distinguish my comment since I don't speak for the full mod team, but here's my response.

> Why do you or any other mods think you have the right to unilaterally shut down subreddits. This subreddit isn’t your personal property- you’re a volunteer janitor. 

By virtue of being the people maintaining the space. I'd also like to push back on this framing; mods are also users of this subreddit. We weren't brought in externally, every single one of the mods was a user just like you, so to frame this like we are taking a ball and going home isn't fair. These decisions have been hotly debated in the internal mod chat for the last weeks.

If the userbase in aggregate believes this is misguided, then we will reconsider our stance, but for now we believe this stance and protest will overall result in the best community possible for all of you. The mods here put in a lot of F R E E time into maintaining this place, these are not idle decisions.

> I’m sure most people here don’t care at all about Reddit’s API changes. Even if most people thought this was a good idea it still wouldn’t make sense to shut down any subreddits because those people could just voluntarily not use Reddit and contribute to ad revenue.

This is somewhat unrelated to the topic of reddit but the purpose of protesting as a whole. Protests are supposed to be inconvenient. Train protests in the UK result in thousands of people being late for work. I'm sure that pissed off a ton of passengers. That doesn't make the goals of the drivers any less important, though.

We believe we are in the right here on the API issue. When that changes, we will re-evaluate, but as of now I do not think that the disruption to end users is outweighed by the damage sitewide solidarity will do to the admins goals.",Negative,reddit api changes and subreddit shutdowns,4,2023-06-16
