type,text,sentiment,topic,score,date
comment,"i also had dr k! she’s a great professor. i remember that we only covered the basics in her class and didn’t go too much in depth. her tests reflected this and you were usually fine if you knew the basic procedure for problems. she was also much more willing to change the syllabus throughout the semester. we didn’t finish the circular motion unit, so she decided to not include it in the final. this also happened in some of my other classes at csu like calc 1 and 2 and chem. she also gave us an extra final project to lift up our grade bc a lot of people did bad on the second test. at gt, you go much deeper into each topic and the syllabus is very strict. there aren’t many extra credit opportunities and the professors always get through all of the material. the tests are challenging bc they don’t just go over the basics. you have to truly know how to apply the basics bc you’ll see situations that are different from what you saw in class. i don’t think my study methods have changed, i just have to study more than i did at csu lol. i mostly review homework and do old exam problems and that’s usually good enough for me. sometimes i’ll grab a whiteboard in the library to do practice problems bc it’s a nice alternative to doing problems in my notebook. i think where you study is also a very important part. my favorite spots are crosland 6, price gilbert 4, and the mason lobby.

it’s really good that you’re already a part of ieee! in asce, we have a lot of different competitions and then we go compete against other schools. idk if ece is like that, but it’s really fun bc you get to do work related to your major and you also get to meet other people in your major. it’s especially nice to be able to talk to upperclassman and learn about the classes you’ll be taking later. if you want to do athletic stuff, intramurals are a great place to start. there’s also almost always pick up games going on at the crc during the weekends. as for class sizes, it can definitely be a bit scary to walk into a big classroom, but ultimately it works the same way as the classes at clayton. just try to get a good seat that you like and listen to what the professor has to say. i’d also recommend to talk to whoever you sit next to on the first day so that you know someone in the class. most people here are really nice and willing to meet new people. there isn’t much of a competitive culture between students bc everyone wants to see each other succeed.",Positive,"education, professors, study methods, student life, clubs and organizations, athletic activities, class sizes, social interaction.",2,2023-06-06
comment,"Totally agree, after discovering tannour I never go to halal guys",Positive,dining,10,2023-06-06
comment,"1. Inflation
2. Long afternoon-to-night shifts
3. Decrease in demand bc summer

I don't blame them, and I have actually received things for free in here bc I've been nice to the people working there.

I also use my Halal Guys app to earn points and sometimes I get my entire meal for free.",Positive,customer service,-4,2023-06-06
comment,"Always loved halal guys back home, was disappointed by the one by campus. Not even the value that gets me, it’s the time they ran out of lettuce and just straight up didn’t mention it while charging full price without substituting with anything else.",Negative,restaurant,7,2023-06-06
comment,You dont need to be a PhD student for GTRI,Neutral,"education
categories: phd, student, gtri",2,2023-06-06
comment,They take Masters students,Neutral,education,1,2023-06-06
comment,I am an international phd lol,Neutral,education,1,2023-06-06
comment,"Yea, I’m also wondering when we get room assignments. Last I checked it said sometime in june but now I can’t even find it on the website :(",Negative,room assignments,1,2023-06-06
comment,"Hello /u/momo98123, welcome to /r/gatech

It appears that you have not participated much in /r/gatech. To submit your own posts to this subreddit, we requires a minimum account-age and a minimum subreddit-specific comment karma count. This is to enable you time to get acquainted with our subreddit and our rules. 

If you are using a throwaway account, please resubmit your post on your main account. If you feel like you MUST use a throwaway account for privacy purposes, you must request an exception: [message the moderators](https://www\.reddit\.com/message/compose?to=%2Fr%2Fgatech&subject=About my removed submission&message=I'm writing to you about my post: /r/gatech/comments/142bhqj/some_advice_needed_for_a_project/. %0D%0DI think my post deserves an exception because\:).

*I am a bot, and this action was performed automatically. Please [contact the moderators of this subreddit](/message/compose/?to=/r/gatech) if you have any questions or concerns.*",Neutral,"reddit, gatech, throwaway accounts, rules.",1,2023-06-06
comment,Wow 225,Neutral,numbers,1,2023-06-06
comment,Nope… They said after June 15th but I don’t know if it can be earlier.,Neutral,"date, uncertainty",1,2023-06-06
comment,"Tegra and William are both really great. If they're in-office and available, I'm sure they'll do walk-ins. you should for sure swing by the office in person some time, if that's a safe alternative for you","Positive 
Topic: Personal Interaction 
Categories: Great, In-office, Available, Walk-ins, Office, Person, Safe, Alternative",error,10,2023-06-06
comment,"The only thing you really need to be careful of is open records requests, but they redact names in those.",Neutral,"records requests, redaction",-1,2023-06-06
comment,"I know both Tegra and William.  They'll find a way for you, OP.",Neutral,introduction,6,2023-06-06
comment,the only time id ever contemplate even going is if im going with a friend who has a discount (iirc people that live at modera get a discount there). Even then that only really puts it in line with other options in the area,Negative,entertainment,1,2023-06-06
comment,It’s about time people realize this,Neutral,awareness,2,2023-06-06
comment,"Hello /u/Ok_Effective4933, welcome to /r/gatech

It appears that you have not participated much in /r/gatech. To submit your own posts to this subreddit, we requires a minimum account-age and a minimum subreddit-specific comment karma count. This is to enable you time to get acquainted with our subreddit and our rules. 

If you are using a throwaway account, please resubmit your post on your main account. If you feel like you MUST use a throwaway account for privacy purposes, you must request an exception: [message the moderators](https://www\.reddit\.com/message/compose?to=%2Fr%2Fgatech&subject=About my removed submission&message=I'm writing to you about my post: /r/gatech/comments/142l9zs/are_there_microwaves_on_gsu_campus_for_commuters/. %0D%0DI think my post deserves an exception because\:).

*I am a bot, and this action was performed automatically. Please [contact the moderators of this subreddit](/message/compose/?to=/r/gatech) if you have any questions or concerns.*",Neutral,"reddit, gatech, participation, account, posts, subreddit, rules, throwaway, privacy, microwaves, gsu, campus, commuters, bot, action, moderators, questions, concerns.",1,2023-06-06
comment,"I'll be coming to Atlanta as a master's student in medical physics and am looking for a furnished apartment. I don't mind ""student living"" apartments as long as they're clean; I've lived in one for my undergrad at UT Austin for 2 years and it has its problems, but I don't mind it. As long as it's close enough to campus that I can walk/bike there easily and I have my own bedroom, I'm fine with it. Does anyone have recommendations? Also, if you are looking for a roommate and think I'd be a good fit, let me know! I'm generally a pretty quiet person. I'm also considering adopting a cat, so you have to either be fine with that, or if you have a cat/dog yourself, I will do my best to befriend them lol",Neutral,"housing, roommate, pets",1,2023-06-06
comment,"this is probably better suited for a different subreddit, something like r/Atlanta.",Neutral,subreddit,13,2023-06-06
comment,"Hello /u/u_fat, welcome to /r/gatech

It appears that you have not participated much in /r/gatech. To submit your own posts to this subreddit, we requires a minimum account-age and a minimum subreddit-specific comment karma count. This is to enable you time to get acquainted with our subreddit and our rules. 

If you are using a throwaway account, please resubmit your post on your main account. If you feel like you MUST use a throwaway account for privacy purposes, you must request an exception: [message the moderators](https://www\.reddit\.com/message/compose?to=%2Fr%2Fgatech&subject=About my removed submission&message=I'm writing to you about my post: /r/gatech/comments/142n620/help_needed_survey_for_pedestrian_issues/. %0D%0DI think my post deserves an exception because\:).

*I am a bot, and this action was performed automatically. Please [contact the moderators of this subreddit](/message/compose/?to=/r/gatech) if you have any questions or concerns.*",Neutral,"reddit, gatech, throwaway accounts, privacy, rules, moderation.",1,2023-06-06
comment,Gotcha,Neutral,expression,1,2023-06-06
comment,If you can try to get him into Northview High School or Alpharetta High School. Good teachers and good rate of upper level universities. The forsyth schools are overpopulated and usually struggle with disciplinary control.,"Positive
Topic: Education
More general categories: Schools, Teachers, Universities, Overcrowding, Discipline",error,2,2023-06-06
comment,"Hello /u/afb3123, welcome to /r/gatech

It appears that you have not participated much in /r/gatech. To submit your own posts to this subreddit, we requires a minimum account-age and a minimum subreddit-specific comment karma count. This is to enable you time to get acquainted with our subreddit and our rules. 

If you are using a throwaway account, please resubmit your post on your main account. If you feel like you MUST use a throwaway account for privacy purposes, you must request an exception: [message the moderators](https://www\.reddit\.com/message/compose?to=%2Fr%2Fgatech&subject=About my removed submission&message=I'm writing to you about my post: /r/gatech/comments/142oo4c/help_needed_short_survey_on_campus_transportation/. %0D%0DI think my post deserves an exception because\:).

*I am a bot, and this action was performed automatically. Please [contact the moderators of this subreddit](/message/compose/?to=/r/gatech) if you have any questions or concerns.*",Neutral,"account requirements, throwaway accounts, moderators, post submission.",1,2023-06-06
comment,try the atlanta forum on city-data.com ([city-data.com/forum/atlanta/](https://city-data.com/forum/atlanta/)),Neutral,forum,1,2023-06-06
comment,"Your submission has been removed from /r/gatech for the following reason(s):

Rule 3. No unrelated content. All content must be related to Georgia Tech.

Unrelated posts include: sketchy job listings, buy/sale/lost/found posts, lease transfers, and political posts. We recommend exploring other subreddits and relevant Facebook groups.



DO NOT REPLY TO THIS MESSAGE. This is an auto-generated message.

If you have any questions, you can [message the moderators](https://www\.reddit\.com/message/compose?to=%2Fr%2Fgatech&subject=About my removed submission&message=I'm writing to you about my submission: https://www.reddit.com/r/gatech/comments/142mmrm/-/. %0D%0DMy issue is\:).",Negative,moderation,1,2023-06-06
comment,"This is true of public universities like Tech, but not necessarily so for private colleges. Just didn't want anyone passing by this thread attending private schools let their guard down. :)",Neutral,education,15,2023-06-06
comment,You can definitely show up in the center and ask for William or Tegra- folks do it all the time! If you just want to hang out w other queer folks people also just hang out in the center to do hw or talk,Neutral,"center, william, tegra, folks, queer, hang out, hw, talk.",6,2023-06-06
comment,"Hi, I'm in the exact same boat. I think I want to do an apartment and split the costs with 1-2 others so its cheaper. Are you still looking for roommates?",Neutral,housing,1,2023-06-06
comment,Hey I don’t have a ton of experience with the lgbt center (personal choice) however I am queer so feel free to dm if you wanna chat. Should def reach out to Tegra/William tho because they’re both great people,Neutral,lgbt center,2,2023-06-06
comment,"Yeah when did Taco Bell get so exclusive, food is pretty bad for the money",Negative,"fast food
general categories: food, prices, quality",6,2023-06-06
comment,"Hit F12, click Sources at the top, expand isc01(dot)gradimages(dot)com, expend the GIT... and subsequent photo folders. From there you can right click, open in new tab, then download.

It also helps to change the preset at the end of the photo URL to p before you download.",Neutral,instructions,1,2023-06-06
comment,I'm going!,Neutral,going,1,2023-06-06
comment,"Hello /u/Pretty_Extension6566,

It looks like you might be a prospective new student here at GT. If so, welcome to /r/gatech! Around admission season, we get a huge influx of very common and repeated questions from new students. Usually we pin a Q&A thread for all prospective student questions. Check for this megathread on the subreddit homepage. We also recommend that you try [searching google and the subreddit](https://www.reddit.com/r/gatech/comments/cd4gcw) for the answer to your question first. 

If you believe this is a mistake, or you think your post is truly worthy of its own dedicated post, then you can [message the moderators to approve your post](https://www\.reddit\.com/message/compose?to=%2Fr%2Fgatech&subject=About my removed submission&message=I'm writing to you about my submission: https://i.redd.it/bxcrvqrhqg4b1.jpg. %0D%0DI think my submission should be approved because\:).

*I am a bot, and this action was performed automatically. Please [contact the moderators of this subreddit](/message/compose/?to=/r/gatech) if you have any questions or concerns.*",Neutral,"admission season, q&a, megathread, search, google, moderators, bot.",1,2023-06-06
comment,Seconded - truly good people who take fantastic care of students,Positive,student care,4,2023-06-06
comment,"Its literally cheaper to eat oncampus, im just sticking at chickfila and panda nowadays",Negative,"on-campus dining.

categories: cost, convenience, food.",2,2023-06-06
comment,"Thank you for submitting a job listing to r/gatech! Please include the job pay/salary/compensation, or your budget for the work you are seeking. If your post does not include pay details, then it will be subject to removal.

*I am a bot, and this action was performed automatically. Please [contact the moderators of this subreddit](/message/compose/?to=/r/gatech) if you have any questions or concerns.*",Neutral,"job listing, pay details",1,2023-06-06
comment,"Hey there [r/gatech](https://www.reddit.com/r/gatech/)! I'm a rising first-year Computer Science Major and I'm currently researching my courses for next year. Since I'm not too clear on the average first-year course schedule and which classes are a priority to take for my freshman year (or in general), I feel this would be an excellent place to ask.

I'm also not too sure which Computer Science Thread I would like to pursue, but I think the two Threads Intelligence and Devices seem to catch my interest the most. My school does not provide AP Comp Sci, so I'm pretty much starting off with little to no prior knowledge.

I'm also not sure if I would like to pursue an engineering major/minor (probably not because I've heard the Computer Science major is already difficult in itself).

The classes I can skip out of that are on the required courses:

1. MATH 1551 and 1552
2. PHYS 2211

Credits I'm not sure I can use:

1. CHEM 1310
2. CHIN 1001 and 1002
3. EAS 1600
4. PHYS 2XXX (idk what these X's mean)
5. PHYS 2212 (might wanna retake)

The classes I'm waiting to see if I can skip:

1. ENGL 1101
2. PSYC 1101

My schedule that I'm thinking of is:

First semester:

1. ENGL 1101 (3)
2. CS 1100 (1)
3. CS 1301 (3)
4. POL 1101 (Need advice on the required SS courses) (3)
5. MATH 1554 or 1564 (idk which one is better) (4)

Second semester:

1. ENGL 1102 (3)
2. CS 1331 (3)
3. A SS course (idk which one i should take... recommendations pls) (3)
4. MATH 2550 (2)
5. Lab Science Sequence (I'm not too sure what Labs with sequences are, so any info is greatly appreciated) (4)",Neutral,"computer science, course selection, college life",1,2023-06-06
comment,"From the mods' side, it's possible!",Neutral,possibility,2,2023-06-06
comment,"Sorry about your situation, but I'm pretty sure it's more complicated than that.    Best of luck on your endeavors though.   Distance sometimes helps reshape thoughts.",Neutral,"apology, situation, complication, luck, endeavors, distance, reshape, thoughts.",1,2023-06-07
comment,"Hello /u/KartlindWitch, welcome to /r/gatech

It appears that you have not participated much in /r/gatech. To submit your own posts to this subreddit, we requires a minimum account-age and a minimum subreddit-specific comment karma count. This is to enable you time to get acquainted with our subreddit and our rules. 

If you are using a throwaway account, please resubmit your post on your main account. If you feel like you MUST use a throwaway account for privacy purposes, you must request an exception: [message the moderators](https://www\.reddit\.com/message/compose?to=%2Fr%2Fgatech&subject=About my removed submission&message=I'm writing to you about my post: /r/gatech/comments/143833a/writing_a_book_main_character_goes_to_ga_tech/. %0D%0DI think my post deserves an exception because\:).

*I am a bot, and this action was performed automatically. Please [contact the moderators of this subreddit](/message/compose/?to=/r/gatech) if you have any questions or concerns.*",Neutral,"reddit, participation, subreddit, rules, throwaway accounts, privacy, moderators.",1,2023-06-07
comment,"Monorail:  "" 'It's heartbreaking:' Demolition of failed maglev underway at ODU.""  

6/5/23 News 3 WTKR Norfolk:

[https://www.wtkr.com/news/its-heartbreaking-demolition-of-failed-maglev-underway-at-odu](https://www.wtkr.com/news/its-heartbreaking-demolition-of-failed-maglev-underway-at-odu)",Negative,demolition,2,2023-06-07
comment,"Yes and no....so your ""not neceearily"" is correct.  


"" The law applies to all schools that receive funds under an applicable program of the U.S. Department of Education. ""  


[https://www2.ed.gov/policy/gen/guid/fpco/ferpa/index.html](https://www2.ed.gov/policy/gen/guid/fpco/ferpa/index.html)",Neutral,"education, law, funding.",4,2023-06-07
comment,"Thank you for submitting news to r/gatech! If your post pertains to sports, please amend the flair to `Sports`. If you have not already, please include a link to your news source. This helps other people learn more and verify your information.

*I am a bot, and this action was performed automatically. Please [contact the moderators of this subreddit](/message/compose/?to=/r/gatech) if you have any questions or concerns.*",Neutral,"news, sports, flair, link, information, bot, action, moderators, subreddit, questions, concerns.",3,2023-06-07
comment,"Why don't you just write about what you actually know instead of trying to make up a character and setting from scratch that you clearly don't know anything about? You are really stretching here, asking for Redditors to do your work for you, and it's not going be authentic.  I mean all that: he school, the major, the campus, the campus life, the greek life, the specific sorority, the bars, the entire city? If you really want authentic then this is not the way to go.",Negative,writing,-21,2023-06-07
comment,"It’s fiction and OP is doing research! I, for one, really appreciate OP trying to get things right!",Positive,research,42,2023-06-07
comment,"Hello /u/Deep-Tradition3768, welcome to /r/gatech

It appears that you have not participated much in /r/gatech. To submit your own posts to this subreddit, we requires a minimum account-age and a minimum subreddit-specific comment karma count. This is to enable you time to get acquainted with our subreddit and our rules. 

If you are using a throwaway account, please resubmit your post on your main account. If you feel like you MUST use a throwaway account for privacy purposes, you must request an exception: [message the moderators](https://www\.reddit\.com/message/compose?to=%2Fr%2Fgatech&subject=About my removed submission&message=I'm writing to you about my post: /r/gatech/comments/143cpxj/gtens_siren_warning_system_test_today_at_noon/. %0D%0DI think my post deserves an exception because\:).

*I am a bot, and this action was performed automatically. Please [contact the moderators of this subreddit](/message/compose/?to=/r/gatech) if you have any questions or concerns.*",Neutral,"subreddit rules, account requirements, throwaway accounts, message to moderators",1,2023-06-07
comment,"As a fellow writer, I think what OP is doing is fine. If that's what they want for their story, then research isn't a bad thing!",Positive,writing,22,2023-06-07
comment,"Out of curiosity, is your story idea sparked by an AITA thread about a Zeta who quit her sorority? You seem to be anti-Greek on that thread. Riding the 'tide,' so to speak, of the Bama rush doc?",Neutral,"sorority, aita, zeta, bama, rush, documentary.",5,2023-06-07
comment,All the dinning halls are so garbage that it’s not even a competition which is the best one. Comparing trash to poop to barf. Señor Patrons has half off house margaritas on Monday’s,Negative,"dining halls, garbage, comparison, senor patrons, margaritas",53,2023-06-07
comment,"Please do not be like ""Lessons in Chemistry"" where every male she encounters rapes her or steals from her.  I found that book insulting to the Chemistry profession and the professors I had in Chemistry at two universities, undergrad and grad.  I later found out that the author was not a chemist and never experienced these issues in any way.  She just picked ""Chemistry"".    So, if you have never attended Tech, please do not use it as a backdrop for something negative.",Negative,"book, chemistry, professors, universities, tech, negative depiction.",30,2023-06-07
comment,"Hello /u/Adventurous-Dark-416, welcome to /r/gatech

It appears that you have not participated much in /r/gatech. To submit your own posts to this subreddit, we requires a minimum account-age and a minimum subreddit-specific comment karma count. This is to enable you time to get acquainted with our subreddit and our rules. 

If you are using a throwaway account, please resubmit your post on your main account. If you feel like you MUST use a throwaway account for privacy purposes, you must request an exception: [message the moderators](https://www\.reddit\.com/message/compose?to=%2Fr%2Fgatech&subject=About my removed submission&message=I'm writing to you about my post: /r/gatech/comments/143gmgm/should_i_take_linear_algebra_somewhere_else/. %0D%0DI think my post deserves an exception because\:).

*I am a bot, and this action was performed automatically. Please [contact the moderators of this subreddit](/message/compose/?to=/r/gatech) if you have any questions or concerns.*",Neutral,"reddit, gatech, account requirements, throwaway accounts, moderators.",1,2023-06-07
comment,This is super cool! Sophomores can live on-campus in student apartments,Positive,housing,4,2023-06-07
comment,Don’t do trash and poop and barf like that 😔,Negative,inappropriate,11,2023-06-07
comment,Just being on that list is great news.,Positive,news,5,2023-06-07
comment,"Hello /u/jtr5802, welcome to /r/gatech

It appears that you have not participated much in /r/gatech. To submit your own posts to this subreddit, we requires a minimum account-age and a minimum subreddit-specific comment karma count. This is to enable you time to get acquainted with our subreddit and our rules. 

If you are using a throwaway account, please resubmit your post on your main account. If you feel like you MUST use a throwaway account for privacy purposes, you must request an exception: [message the moderators](https://www\.reddit\.com/message/compose?to=%2Fr%2Fgatech&subject=About my removed submission&message=I'm writing to you about my post: https://i.redd.it/b3sefmq3fm4b1.jpg. %0D%0DI think my post deserves an exception because\:).

*I am a bot, and this action was performed automatically. Please [contact the moderators of this subreddit](/message/compose/?to=/r/gatech) if you have any questions or concerns.*",Neutral,"reddit, gatech, rules, throwaway account, privacy, moderators, exception, bot.",1,2023-06-07
comment,Your student account password does expire once in a while. It's just a way the school forces you to change your password. Just make sure the links actually lead to oit and/or the correct sites.,Neutral,"password expiration, school, links, oit, sites.",41,2023-06-07
comment,Make sure to make them sleep-deprived 🤗,Neutral,sleep-deprivation,61,2023-06-07
comment,"If you are ever unsure, you can attach the item and send it to [phishing@gatech.edu](mailto:phishing@gatech.edu).  


That email does look like the Passport Password notification that goes out. If you aren't sure, you can sign into Passport and it will tell you when your password will expire.",Neutral,"cybersecurity, email",27,2023-06-07
comment,"The visitors wifi is for visitors, so yes.",Neutral,wifi,2,2023-06-07
comment,"/u/GaTechOEM I just graduated and switched off the notifications in Passport a month ago, but I still got a text and phone call and email today. Can you help me disable it",Negative,technology,3,2023-06-07
