type,text,sentiment,topic,score,date
comment,"Hello /u/maryblooddy, welcome to /r/gatech

It appears that you have not participated much in /r/gatech. To submit your own posts to this subreddit, we requires a minimum account-age and a minimum subreddit-specific comment karma count. This is to enable you time to get acquainted with our subreddit and our rules. 

If you are using a throwaway account, please resubmit your post on your main account. If you feel like you MUST use a throwaway account for privacy purposes, you must request an exception: [message the moderators](https://www\.reddit\.com/message/compose?to=%2Fr%2Fgatech&subject=About my removed submission&message=I'm writing to you about my post: /r/gatech/comments/144zp39/careeracademic_path_advice_for_a_computer/. %0D%0DI think my post deserves an exception because\:).

*I am a bot, and this action was performed automatically. Please [contact the moderators of this subreddit](/message/compose/?to=/r/gatech) if you have any questions or concerns.*",Neutral,"reddit, gatech, guidelines, account, exceptions.",1,2023-06-09
comment,"Hello /u/Economy_Economy103,

It looks like you might be a prospective new student here at GT. If so, welcome to /r/gatech! Around admission season, we get a huge influx of very common and repeated questions from new students. Usually we pin a Q&A thread for all prospective student questions. Check for this megathread on the subreddit homepage. We also recommend that you try [searching google and the subreddit](https://www.reddit.com/r/gatech/comments/cd4gcw) for the answer to your question first. 

If you believe this is a mistake, or you think your post is truly worthy of its own dedicated post, then you can [message the moderators to approve your post](https://www\.reddit\.com/message/compose?to=%2Fr%2Fgatech&subject=About my removed submission&message=I'm writing to you about my submission: /r/gatech/comments/1452wxm/arts_and_sciences_transfer_question_gpa/. %0D%0DI think my submission should be approved because\:).

*I am a bot, and this action was performed automatically. Please [contact the moderators of this subreddit](/message/compose/?to=/r/gatech) if you have any questions or concerns.*",Neutral,"admissions, faq, moderation.",1,2023-06-09
comment,"for the arts and sciences does GT recalculate the STEM GPA requirement with the GT scale (quality points, etc.) or do they just accept it as calculated by the institution I'm transferring from?","Neutral 
Topic: STEM, GPA, transfer 
More general categories: Education, GPA, Transfer, STEM, Arts, Sciences, Grading",error,1,2023-06-09
comment,I believe that they recalculate it from the GT scale.,Neutral,recalculation,1,2023-06-09
comment,"What happens if you're an iGniTe student, but you have pending AP/IB tests whose results come out in July? (Way after summer term for freshmen has started.) Do you get credit for those?",Neutral,education,1,2023-06-09
comment,"Hello /u/Ok_Path_5026, welcome to /r/gatech

It appears that you have not participated much in /r/gatech. To submit your own posts to this subreddit, we requires a minimum account-age and a minimum subreddit-specific comment karma count. This is to enable you time to get acquainted with our subreddit and our rules. 

If you are using a throwaway account, please resubmit your post on your main account. If you feel like you MUST use a throwaway account for privacy purposes, you must request an exception: [message the moderators](https://www\.reddit\.com/message/compose?to=%2Fr%2Fgatech&subject=About my removed submission&message=I'm writing to you about my post: /r/gatech/comments/1456dcs/hey_guys_gabriel_here_i_need_a_little_bit_of_help/. %0D%0DI think my post deserves an exception because\:).

*I am a bot, and this action was performed automatically. Please [contact the moderators of this subreddit](/message/compose/?to=/r/gatech) if you have any questions or concerns.*",Neutral,"reddit, gatech, throwaway account, privacy, moderators.",1,2023-06-09
comment,BLOW THIS UP SO THAT GAME THEORY CAN SEE IT,Neutral,game theory,1,2023-06-09
comment,"Hi! I'm currently an incoming freshmen, and I am currently on the waitlist for housing. Is that common for freshmen to be on the waitlist and not be offered on-campus housing their freshmen year?","Neutral
Topic: Housing
Categories: Freshmen, Waitlist, On-campus",error,3,2023-06-09
comment,"I don’t have specific advice for this situation, but just a reminder to take care of yourself in the meantime. Caffeinate if you need to on the long days, just try not to overdo it. I’m reward driven so constantly reminding myself to look forward to my next free evening is a good motivator to stay energized at work/school. Good luck",Neutral,self-care,1,2023-06-09
comment,"Hello /u/m_kasi, welcome to /r/gatech

It appears that you have not participated much in /r/gatech. To submit your own posts to this subreddit, we requires a minimum account-age and a minimum subreddit-specific comment karma count. This is to enable you time to get acquainted with our subreddit and our rules. 

If you are using a throwaway account, please resubmit your post on your main account. If you feel like you MUST use a throwaway account for privacy purposes, you must request an exception: [message the moderators](https://www\.reddit\.com/message/compose?to=%2Fr%2Fgatech&subject=About my removed submission&message=I'm writing to you about my post: /r/gatech/comments/1457lt7/participation_in_a_study_about_ai_and_its_use/. %0D%0DI think my post deserves an exception because\:).

*I am a bot, and this action was performed automatically. Please [contact the moderators of this subreddit](/message/compose/?to=/r/gatech) if you have any questions or concerns.*",Neutral,"welcome message, subreddit rules, throwaway account, privacy protection, bot response, moderator contact.",1,2023-06-09
comment,Sure,Neutral,confirmation,114,2023-06-09
comment,I'd support it for sure,Positive,support,14,2023-06-09
comment,"To elaborate: We had already discussed and decided to participate, we have just not yet gotten around to constructing and posting an announcement.",Neutral,decision,68,2023-06-09
comment,"Hello /u/catsandvideogames70, welcome to /r/gatech

It appears that you have not participated much in /r/gatech. To submit your own posts to this subreddit, we requires a minimum account-age and a minimum subreddit-specific comment karma count. This is to enable you time to get acquainted with our subreddit and our rules. 

If you are using a throwaway account, please resubmit your post on your main account. If you feel like you MUST use a throwaway account for privacy purposes, you must request an exception: [message the moderators](https://www\.reddit\.com/message/compose?to=%2Fr%2Fgatech&subject=About my removed submission&message=I'm writing to you about my post: /r/gatech/comments/145b7jn/about_the_neuroscience_program_and_other_premed/. %0D%0DI think my post deserves an exception because\:).

*I am a bot, and this action was performed automatically. Please [contact the moderators of this subreddit](/message/compose/?to=/r/gatech) if you have any questions or concerns.*",Neutral,"rules, requirements, exceptions",1,2023-06-09
comment,I would support it.,Positive,"support
categories: support, agreement",9,2023-06-09
comment,writing is hard :(,Negative,writing,37,2023-06-09
comment,We don't go to GT for writing we go for ~~crippling substance addictions and depression~~ science.,negative,"education, addiction, mental health.",58,2023-06-09
comment,clutch,Neutral,fashion,1,2023-06-09
comment,Glad gt is joining this. A lot of students and alum could be directly impacted by Reddit's choices,Positive,reddit,15,2023-06-09
comment,Good call,Positive,call,7,2023-06-09
comment,"Why not blame OpenAI and Google for using Reddit to train their own AI language models to help K-12 use their brains less and the rest of society rely less on the average person and their degrees ? I’m not against temporary protest of Reddit, but permanent that some communities are suggesting seems outlandish. I’m curious how many ppl use third party apps anyway, maybe for moderation convenience or preference, but I’ve never heard of them until today.. and regardless this change doesn’t seem like the average user is losing anything besides maybe convenience. Am I missing any implication of this?",Neutral,"artificial intelligence, education, society",-28,2023-06-09
comment,"Reddit users when reddit decides to stop spending money that enable their competition to republish their website and make ad/subscription money off them.

Just wait for the LLM bots to hit the internet and we’ll be cheering that Reddit and Twitter are basically preventing their access to this massive trove of data by charging high API prices.",Negative,reddit,-12,2023-06-09
comment,lmao what are you talking about right now?,"Neutral
Topic: Questioning
General categories: Humor, Confusion, Communication",error,13,2023-06-09
comment,API's are generally preferable to having someone scrape your website using CURL.,Neutral,"api, scrape, curl",11,2023-06-09
comment,"A large portion of mobile reddit users use 3rd party apps, since the official reddit app was released in 2016, while the 3rd party apps have been around since the early 2010s. Also the official app has a poor video player and little regulation on the ads it shows.",Negative,"mobile, reddit, apps, video player, ads.",7,2023-06-09
comment,"Better statement than I’ve seen elsewhere. However, serious question, what message is the blackout really supposed to send? That reddit isn’t allowed to make money? That users should have a say in vendor/vendee cost negotiations? That reddit’s customer data sharing policies aren’t robust enough? That we demand a better native app?

Bigger picture, I am skeptical that 3P apps will become extinct. It will cost reddit users and an opportunity for an important stream of revenue. Why is everyone so adamant that apps closing down is the only possible scenario?",Neutral,"reddit, blackout, 3p apps, revenue, customer data sharing policies, native app, vendor/vendee cost negotiations.",-1,2023-06-09
comment,"Which is why the majority of large websites IP ban if you get caught scraping with curl and other scripts. 

Even the Apollo creator said his app's access to the API is worth 10mil/year and that’s not counting the several other apps out there that may be less efficient.

Alien Blue was way more popular back in its day (before an official reddit app) and reddit bought them out.",neutral,"website, ip ban, scraping, curl, scripts, apollo creator, api, app, 10mil/year, other apps, efficient, alien blue, popular, official reddit app, bought out.",-7,2023-06-09
comment,"His app does not cost reddit ~10 mil/year. Reddit is *charging him* $10 million a year.

My previous company used to charge $0.003/call. The actual cost to us was even less than that.",Neutral,"business, technology, cost.",10,2023-06-09
comment,"> However, serious question, what message is the blackout really supposed to send? That reddit isn’t allowed to make money?

I don't think anyone is opposed to companies doing company things, it's the unilateral shutting down of options that I take ire with.

> That users should have a say in vendor/vendee cost negotiations? That we demand a better native app?

I don't see why we shouldn't have a say, and yes, the app is genuinely awful.

This site's hardware has always been owned by a for-profit company, that's never really been in doubt and anyone who thought this platform was just altruistically hosting was deluding themselves. But there is a wide gulf between doing things to keep the lights on and what Reddit is doing. This is a pretty naked push to shove users onto their native app so that they can get more user data to sell to advertisers. If the new paradigm required me to have a Reddit premium sub to use my 3rd party app, I'd probably do that, but I'm not going to be forced off of the gangplank to do so.

> Bigger picture, I am skeptical that 3P apps will become extinct. It will cost reddit users and an opportunity for an important stream of revenue. Why is everyone so adamant that apps closing down is the only possible scenario?

Because the app creators have stated so? You can do the math yourself, it's not possible for these companies to stay open and eat a million-dollar operating cost increase. The creator of Apollo wrote extensively on this topic here: https://www.reddit.com/r/apolloapp/comments/144f6xm/apollo_will_close_down_on_june_30th_reddits

Reddit as a company is making a gamble that users will care more about the site than they will about how they access it. We will see if they are right.",Negative,"reddit, native app, revenue, user data, advertising",4,2023-06-09
comment,My dude ✊,Positive,emotion,4,2023-06-09
comment,"Reddit is charging him 20mil a year, and he countered by saying 10mil was fair. If the creator of the project is willing to pay 10mil/year then he's either making a lot of money and/or he's costing reddit a lot of money.

.003/call is in line with a service like Google Cloud that is designed for high-volume services and is the best API platform in the world.

Either way, why in the world would Reddit want to support companies like Apollo that cost them money and profit off their service? Reddit and Twitter's API pricing is built to support small projects and not massive projects that make billions of requests a year. It's so obviously not in the interest of these companies to pay for competitors to their official apps lol.",Negative,"reddit, api, pricing, competition, profit, support.",-8,2023-06-09
comment,"Reddit actually bought out Alien Blue which was by far the most popular 3rd party app back when they launched their official app.

I bet they've expected to potentially make this move since then. Probably testing the waters to see if people would adopt the official app.

When people didn't, this is the only option. They could buy out every popular 3rd party app, but that still leaves other devs open to create more.",Neutral,"reddit, alien blue, 3rd party app, buyout, official app, developers",-1,2023-06-09
comment,"Yup, agreed. It's a significant stream of revenue as it's not just about increasing the pricing of api fees but also having those users come back to the reddit app.",Positive,"revenue 
general categories: business, finance, marketing, growth, customer retention",2,2023-06-09
comment,"I don't see what your issue is. Your argument is the ""interest struggle one"". If Reddit is justified in doing whatever they want with their user base because they can squeeze out more money, users are justified to attempt to fight that and try to prevent that to keep their services. That's absolutely the same approach, with the only difference that users have much less power. 

The best that happens is the blackout ends up so big and such a stab to Reddit's reputation and user count that they reverse changes or come up with a reasonable compromise. The worst that happens is nothing changes in comparison to the lack of blackout.",Neutral,"reddit, user base, money, power, reputation, user count.",4,2023-06-09
comment,"You should consider how hard your classes are going to be next semester. Since they're probably higher-level classes, 17 credits will probably be a lot to handle, but the best way to know is to look at past CIOS data of how many hours each of your courses takes and compare it to your last semester. Also, if your internship is virtual, it might then be a good idea to take a summer class as you'll inevitably have some spare time as an intern.

Something I would consider is the worst case scenario if you don't get a return offer. It might be very stressful if you don't get a return offer and have to navigate both a hard course load and finding a new grad job in a bad economy.

Also, you could consider graduating next Spring. That way, you can take some more classes you are interested in and have a more chill last year to hang with friends.",Neutral,"college, internship, return offer, graduation, stress, economy, classes, cios data, intern, spring, friends.",1,2023-06-09
comment,"Hi I’m a freshmen coming to gt this fall and I was wondering if we choose to go random for our roommate, would we still be able to pick the residence hall that we would like to live in.",Neutral,"roommate, residence hall",2,2023-06-09
comment,*I'm a ramblin' wreck from Georgia Tech and a hell of a ~~functioning alcoholic~~ engineer!*,Positive,humor,16,2023-06-09
comment,"As far as money or advertising or whatever goes, I just don’t see why reddit wouldn’t make as much as they can while also providing a valuable service to their customer base. And as far as data goes, I always assume there’s a way to work that out between parties. Just as a possible example, the 3P apps will have to serve reddit ads or provide data from their users back to reddit. Idk how it would work but I’m sure they could figure it out. 

And as for other parts. Aren’t the app creators just bargaining as well? And taking advantage of redditor populism to better position themselves? 

I’m not sure why I should pick a side when it’s just corporate politicking playing itself out. 

Both are interested in the users continuing to participate so they are both highly incentivized to come to a solution.

Edit: obviously I think it is fine if y’all want o boycott regardless",Neutral,"money, advertising, reddit, customer service, data, 3rd party apps, bargaining, populism, corporate politicking, solution, boycott.",-4,2023-06-09
comment,"Hello /u/Yarkle72, welcome to /r/gatech

It appears that you have not participated much in /r/gatech. To submit your own posts to this subreddit, we requires a minimum account-age and a minimum subreddit-specific comment karma count. This is to enable you time to get acquainted with our subreddit and our rules. 

If you are using a throwaway account, please resubmit your post on your main account. If you feel like you MUST use a throwaway account for privacy purposes, you must request an exception: [message the moderators](https://www\.reddit\.com/message/compose?to=%2Fr%2Fgatech&subject=About my removed submission&message=I'm writing to you about my post: /r/gatech/comments/145h6au/m2_macbook_air_for_industrial_engineering/. %0D%0DI think my post deserves an exception because\:).

*I am a bot, and this action was performed automatically. Please [contact the moderators of this subreddit](/message/compose/?to=/r/gatech) if you have any questions or concerns.*",Neutral,"reddit, guidelines, throwaway accounts, moderators",1,2023-06-09
comment,The moderation issue is real. Reddit’s official mod tools are garbage compared to third parties. It’s been like that for years with no signs of changing since they laid off a bunch of workers. Mods already work for free for all our sakes and now you expect them to be okay with their job getting infinitely harder?,Negative,"moderation, reddit, mod tools, third parties, layoffs, workers, expectations.",3,2023-06-09
comment,"I think this is one of the most asinine things I’ve ever seen. Somehow we’re living in a world where we expect data to be free. Reddit built a platform that other people are profiting off of and they want a slice of that pie, and somehow we have a problem with it?

If this decision truly is going to do all the bad things that people are fear mongering (which is never the case), then Reddit will start sucking, less people will use it and ultimately Reddit will make less money. That’s how the free market works.",Negative,"online platforms, data, profits, fear mongering, free market",-10,2023-06-09
comment,"> I’m not sure why I should pick a side when it’s just corporate politicking playing itself out. 

Well, there are significant problems for end users (even those who use the first party client) - moderation will be worse (moderation bots and other tools will no longer be usable), and the official client does not play nicely with screen readers and other accessibility tools. As such, even if this is just ""corporate politicking,"" users will still be worse off.",Negative,"corporate politics, end users, moderation, accessibility",4,2023-06-09
comment,I’m with y’all on this. If Apollo dies then I will likely leave Reddit all together.,Negative,reddit,34,2023-06-09
comment,Because you as the user are getting the raw deal. I care about the net impact to the end user. I only care about reddits profitability insofar as it allows the communities on here to exist. Everything else in window dressing.,"Negative
Topic: Customer service
General categories: User, Raw deal, Net impact, End user, Community, Profitability, Window dressing",error,5,2023-06-09
comment,"I really don’t care about who’s right in the API fight other than that the position Reddit Inc has is going to negatively affect me. Do they owe me anything? No, of course not. 

Am I going to be annoying about it online? Why else are we even here?",Negative,api,1,2023-06-09
comment,"Fair enough, I suppose I'm just whining about how other people on other subs are thinking Reddit is the devil for this. Some other subs I follow are going complete blackout until Reddit reverses the decision lmfao.",Neutral,social media,1,2023-06-09
comment,"I'm not saying subs can't blackout in protest. Just saying it's dumb because this is a pretty straightforward business decision on Reddit's part. Protesting against them doing something obvious to protect their product is kinda dumb. 

It's not like Reddit is doing this out of spite like how Nintendo takes down fan remakes. 3rd party apps are monetization circumvention problem for them in addition to the API costs. 

I think the vast majority of people have no idea what an API is, and the business implications. They just hear that they are going to have to shift to a slightly worse UI and are whining about it.

Frankly in 50 years, these types of 3rd party apps might be completely illegal. You can easily make an argument that these apps infringe on Reddit's copyright by republishing content with a new UI.",Negative,"reddit, protest, business decision, api, monetization circumvention, 3rd party apps, spite, fan remakes, copyright infringement, ui.",1,2023-06-09
comment,"Wow, you’re a moron. The problem is not that it costs money (reasonable) but instead the exorbitant cost and lies about said cost (unreasonable). Instead, now we’re just gonna have big LLMs essentially DDoS Reddit to webscrape since they can’t make API calls to train their models anymore.",Negative,"criticism
more general categories: criticism, cost, lies, unreasonable, ddos, reddit, webscrape, api, training, models.",1,2023-06-09
comment,"I see what you are saying, but I really don't see anything dumb in that. It's a no-loss bet. 

It's either about profits, or morals. If one could make a case about copyright infringement, then it's about morals. And then they gotta explicitly forbid 3rd party apps and, more importantly, moderation. Reddit didn't do that and didn't provide any alternative to the latter (and about the former, I have no idea what's the difference, never used those, but I appreciate people having the ability to view a website at a layout they prefer). So, we aren't doing anything immoral here. 

If it's about profits - there is a reason B2C companies care about their PR and appearance. If that gains enough traction, there is a reasonable chance that Reddit sees the backlash of users and backs down. I don't wanna use reddit if every other post is gonna be ads, NSFW unless I specifically wanted it, or bots. I am willing to try to pressure Reddit, a company whose main asset is it's user base, to back down from transforming current experience into all that annoying stuff.",Neutral,"social media, content moderation, user experience, advertising, copyright infringement, company policies, backlash, pressure.",2,2023-06-09
comment,"I just think that 3rd party apps were operating in a grey zone where they weren't legally infringing copyright, but ethically probably were.

Reddit could have gone about it in a nice way by buying out or offering jobs to the top 3rd party apps like Apollo, Narwhal, etc. but instead chose to lead them on and then attempt to gauge them. To be fair, they did try that by buying out Alien Blue and launching an official app, but they botched it by having a terrible launch and not making these API changes back then.

It's not about the 3rd party apps or how Reddit hates blind people or whatever. It's about Reddit leadership being a completely soulless operation for the past 5-10 years at this point.

Another thing to factor in that was brought up in the AMA was making sure data was protected against LLM usage.",Negative,"reddit, third-party apps, copyright infringement, ethics, acquisition, api changes, leadership, soulless operation, data protection.",1,2023-06-09
comment,"Data isn’t free, but it’s also not worth $10 million a month. 

>	Reddit built a platform that other people are profiting off of and they want a slice of that pie, and somehow we have a problem with it?

My user experience is getting worse, why should I care what the impetus is?

>	If this decision truly is going to do all the bad things that people are fear mongering (which is never the case), then Reddit will start sucking, less people will use it and ultimately Reddit will make less money. That’s how the free market works.

This site has gotten steadily worse ever since I joined and this shows no signs of slowing. When old.Reddit is removed I’ll be gone for good. 

Twitter has lost 2/3rds of its value but I’m glad they are serving as a good example for this site to emulate.",Negative,"platform, profiting, free market",7,2023-06-09
