type,text,sentiment,topic,score,date
comment,I think it is in Boggs. (Boggs 104-B),Neutral,"location, product.",3,2023-05-31
comment,"Hello /u/centarsirius,

It looks like you might be a prospective new student here at GT. If so, welcome to /r/gatech! Around admission season, we get a huge influx of very common and repeated questions from new students. Usually we pin a Q&A thread for all prospective student questions. Check for this megathread on the subreddit homepage. We also recommend that you try [searching google and the subreddit](https://www.reddit.com/r/gatech/comments/cd4gcw) for the answer to your question first. 

If you believe this is a mistake, or you think your post is truly worthy of its own dedicated post, then you can [message the moderators to approve your post](https://www\.reddit\.com/message/compose?to=%2Fr%2Fgatech&subject=About my removed submission&message=I'm writing to you about my submission: /r/gatech/comments/13x301s/housing_recs_needed_for_incoming_intl_grad_student/. %0D%0DI think my submission should be approved because\:).

*I am a bot, and this action was performed automatically. Please [contact the moderators of this subreddit](/message/compose/?to=/r/gatech) if you have any questions or concerns.*",Neutral,"admission, q&a, megathread, search, google, moderators, housing, incoming student, bot, action, contact.",1,2023-05-31
comment," 

I've browsed this sub for tips on housing and understood to never go for student housing like mark or hub. But I don't wanna go to homepark/atlantic station either rn, maybe a year later. So, this leaves me with places that let out the whole apartment in west and midtown. I'm looking for 2b2b accommodating 4 people with rent+utils maxing out at 750 per person. I need your reviews on my shortlist (old reviews are too old)

1. The brady - I really like this place, also like west midtown cos it's the perfect balance b/w noise and isolation. Rent is also under budget but the recent reviews have been really poor. latest google reviews are filled with 1 star saying it's not the place it used to be before.
2. Marq on Ponce - one more I really like, accessible cos in midtown. recent reviews are good too, although bloated with leasing agent reviews more than about the place itself. But it's a bit far away from my dept, 26 mins on maps.
3. local on 14th - idk why it is kinda expensive, esp more than 1 and 2. also heard someone was killed in their garage sometime ago. But a lot of people recommended local, idk what do you say?!
4. farrington (?) - is tooo far and there's no direct bus route either, but reviews are the best out of 4. worth the commute?

I've looked at other places like mstreet (very last option) and 935m, biltmore, bower (no units available for august move in) . If you got any other suggestions, please do lmk. Thanks!",Neutral,"housing, reviews",2,2023-05-31
comment,"I mean, the real answer here is don’t plagiarize. You knew exactly what you were doing, and the syllabus clearly states the penalty. Why are you mad?",Negative,plagiarism,7,2023-05-31
comment,"I’m under general policy right now for these posts, let them be (Let the mobs deal with them). Weed out the ones that are blatantly breaking rules (these ones being spam can also be a murky case as it also pertains to Tech ""politics"" and another being “why"" the previous one was removed). People generally make their opinions known and upvote or downvote them to eternity",Neutral,general policy,6,2023-05-31
comment,"Hello /u/Stuttering_Breath, welcome to /r/gatech

It appears that you have not participated much in /r/gatech. To submit your own posts to this subreddit, we requires a minimum account-age and a minimum subreddit-specific comment karma count. This is to enable you time to get acquainted with our subreddit and our rules. 

If you are using a throwaway account, please resubmit your post on your main account. If you feel like you MUST use a throwaway account for privacy purposes, you must request an exception: [message the moderators](https://www\.reddit\.com/message/compose?to=%2Fr%2Fgatech&subject=About my removed submission&message=I'm writing to you about my post: /r/gatech/comments/13x5xej/course_selection_computer_science_major_first_year/. %0D%0DI think my post deserves an exception because\:).

*I am a bot, and this action was performed automatically. Please [contact the moderators of this subreddit](/message/compose/?to=/r/gatech) if you have any questions or concerns.*",Neutral,"reddit, gatech, participation, posts, subreddit, rules, throwaway, privacy, exception, moderators.",1,2023-05-31
comment,"It looks like you may be trying to make a post about housing. If you are trying to find roommates, trade rooms, sublet/rent an apartment or find housing in your submission, it has been removed as per rule 3. We may occasionally pin a housing coordination megathread to the subreddit, dedicated for submissions such as yours. Check to see if one is pinned. 

We also recommend exploring other better suited platforms for such posts. Some examples include the [GT Subleases & Roommates Facebook group](https://www.facebook.com/groups/GeorgiaTechSubleasesRoommates), Facebook marketplace, or Craigslist.

If you believe this is a mistake, you can [message the moderators](https://www\.reddit\.com/message/compose?to=%2Fr%2Fgatech&subject=About my removed submission&message=I'm writing to you about my submission: /r/gatech/comments/13x6wso/iso_roommates_to_pair_with_incoming_masters_phd/. %0D%0DI think my submission should be approved because\:).

*I am a bot, and this action was performed automatically. Please [contact the moderators of this subreddit](/message/compose/?to=/r/gatech) if you have any questions or concerns.*",Neutral,"housing.

categories: housing, rules, coordination, platforms, mistake, bot",1,2023-05-31
comment,"Hi Folks! We're looking for incoming students to pair with Masters and PhD students at 1100 Holly Street apartments. 

We have applicants for an upstairs 4b/2ba unit and they're looking for additional roommates.

If you're looking for roommates and an awesome place to live that's just a 5-minute walk to campus and a 2-minute walk to the GT Stinger bus stop, visit [1100holly.com](https://l.facebook.com/l.php?u=http%3A%2F%2F1100holly.com%2F%3Ffbclid%3DIwAR1C2HhGzY-QlmpKbeBnRViahD7p6UQI6av6kquMjPMQOj-EaumBjuIMbZ0&h=AT2t1HycYTR6w69pqTe4IAcXXkQ0u9AnRjDEIJDrD5LB2LWSpwGAkjh68RnM2m36SPI0c4IMsAitBGbUP2Ql4KOeaYVb-SZE1pBi0zFiS6-UPfP8Uesug8-m4C3_8KuqZU6IdlAEHTT31abBpLMxThDKFg&__tn__=-UK-R&c[0]=AT2pfV_20fJDiJt-4KzlSE0TIaPQp4xoE5NmzdQF70VPx6cgvoPyB3nuN1IQSU3ZszBz7eTJ7BkJ2tUT5EzTQv_3DD3gSD2XvKuzTHx1uzkUGiDeMa8Bc8XubhRZIRHu4tR2erO8Y3A8AlQD4aBNgMrAUf4eSmDUj3lST4c)

Also DM me for questions!",Neutral,"housing, roommates, university",1,2023-05-31
comment,"Hello /u/rockenman1234,

It looks like you might be a prospective new student here at GT. If so, welcome to /r/gatech! Around admission season, we get a huge influx of very common and repeated questions from new students. Usually we pin a Q&A thread for all prospective student questions. Check for this megathread on the subreddit homepage. We also recommend that you try [searching google and the subreddit](https://www.reddit.com/r/gatech/comments/cd4gcw) for the answer to your question first. 

If you believe this is a mistake, or you think your post is truly worthy of its own dedicated post, then you can [message the moderators to approve your post](https://www\.reddit\.com/message/compose?to=%2Fr%2Fgatech&subject=About my removed submission&message=I'm writing to you about my submission: /r/gatech/comments/13x7ivi/off_campus_housing_suggestions/. %0D%0DI think my submission should be approved because\:).

*I am a bot, and this action was performed automatically. Please [contact the moderators of this subreddit](/message/compose/?to=/r/gatech) if you have any questions or concerns.*",Neutral,"admissions, q&a, guidelines, moderation.",1,2023-05-31
comment,"you’re actually given a 0, not a 3.5","Negative
Topic: Grading
Categories: Grade, Score",error,1,2023-06-01
comment,You get one unrestricted major change so it would be pretty easy and guaranteed.,Positive,change,1,2023-06-01
comment,"Congrats on receiving a pathway offer! It is a really great opportunity.

1. I did my first year at KSU and had a pretty easy time meeting requirements. Just make sure you look at the transfer requirements by major chart to know which ones you need. It is also helpful to look at the equivalency table because some courses offered at your first year institute don’t offer the credit for the GT course. I originally couldn’t get into a chem lab at KSU that I needed for my major requirement. I called GT and talked to an advisor that told me I could switch my major if I just took physics instead of chem to switch to a physics major from biochem, which I successfully did.

2. I think you should definitely pursue your transfer  pathway. If you’re doing study abroad your first semester then your transcript should be fine by spring semester. GT also honors any and every credit that is on your UNC transcript.

3. I’m actually not sure about this one as I was a fall admit and not summer. It would make sense though since summer has a lot of courses offered through the SOUP.",Positive,"pathway, transfer requirements, major switching, study abroad, transcript, credit transfer, summer courses.",2,2023-06-01
comment,"Thank you for submitting news to r/gatech! If your post pertains to sports, please amend the flair to `Sports`. If you have not already, please include a link to your news source. This helps other people learn more and verify your information.

*I am a bot, and this action was performed automatically. Please [contact the moderators of this subreddit](/message/compose/?to=/r/gatech) if you have any questions or concerns.*",Neutral,"news, sports, source, verification, bot, moderators, questions, concerns.",1,2023-06-01
comment,"Thank you for submitting news to r/gatech! If your post pertains to sports, please amend the flair to `Sports`. If you have not already, please include a link to your news source. This helps other people learn more and verify your information.

*I am a bot, and this action was performed automatically. Please [contact the moderators of this subreddit](/message/compose/?to=/r/gatech) if you have any questions or concerns.*",Neutral,"news, sports, flair, link, bot, action, contact, moderators, subreddit, questions, concerns.",1,2023-06-01
comment,Instead of all this. You can hire me and I'll deliver high quality work and guarantee you an A. Am very affordable,"Positive
Topic: Job
General categories: Work, Quality, Guarantee, Affordable",error,0,2023-06-01
comment,was this 3790?,Neutral,question,2,2023-06-01
comment,it’s HTS 2015,Neutral,technology,1,2023-06-01
comment,Not enough bababooey. Not enough BOH. Not enough sequel jokes. I haven't been made Discord mod.,Negative,humor,4,2023-06-01
comment,Thank you!,Positive,gratitude,1,2023-06-01
comment,"I had to look the class up.    History of sports in America?    Not to come down on you, dude.... but why jeopardize your academic career over such an inconsequential class?",Negative,"education, sports, american history.",3,2023-06-01
comment,"no! they say it online with the rest of the transfer info, u have to START and finish 30 New credits. ap and dual enrollment dont count -also a future uga to tech transfer",Negative,education,1,2023-06-01
comment,yea they do really good recruitment. also theyre very highly ranked in terms of quality of cs program and are one of the top engineering schools in the us,Positive,"recruitment, quality, cs program, engineering, ranking",1,2023-06-01
comment,"Hello /u/Tanmay_2109,

It looks like you might be a prospective new student here at GT. If so, welcome to /r/gatech! Around admission season, we get a huge influx of very common and repeated questions from new students. Usually we pin a Q&A thread for all prospective student questions. Check for this megathread on the subreddit homepage. We also recommend that you try [searching google and the subreddit](https://www.reddit.com/r/gatech/comments/cd4gcw) for the answer to your question first. 

If you believe this is a mistake, or you think your post is truly worthy of its own dedicated post, then you can [message the moderators to approve your post](https://www\.reddit\.com/message/compose?to=%2Fr%2Fgatech&subject=About my removed submission&message=I'm writing to you about my submission: /r/gatech/comments/13xhpnr/georgia_tech_europe_for_mscs_fall_2023/. %0D%0DI think my submission should be approved because\:).

*I am a bot, and this action was performed automatically. Please [contact the moderators of this subreddit](/message/compose/?to=/r/gatech) if you have any questions or concerns.*",Neutral,"admission, common questions, q&a thread, search, mistake, moderators, bot, contact.",1,2023-06-01
comment,I am trying to relet my room to a female in a 4 x 4 for Paloma West Midtown for the 23-24 year. Please pm me if interested. It’s 1150 a month.,Neutral,"roommate, housing, sublet",1,2023-06-01
comment,Isn't this a phishing test? :),"Neutral
Topic: Phishing, Test
General categories: Security, Assessment",error,5,2023-06-01
comment,"If you can't Right Click on the images, add the ""Allow Right-Click"" extension to Google Chrome and then refresh the web page! 

[https://chrome.google.com/webstore/detail/allow-right-click/hompjdfbfmmmgflfjdlnkohcplmboaeo/related](https://chrome.google.com/webstore/detail/allow-right-click/hompjdfbfmmmgflfjdlnkohcplmboaeo/related)

I tried a few different extensions and most were broken, but this one was legit. Also, the watermark remover tool is incredible! The upscaler is pretty good too. Thanks for this post!",Positive,"google chrome, extension, tips.",2,2023-06-01
comment,"Reviving this cos I really wanna know about the Brady with recent experiences. Google reviews say ""it's not the place it was anymore"", ""too noisy and has the lost the charm it had previously"".",Neutral,brady,1,2023-06-01
comment,u guyz r da best mods ever. quant.,Positive,praise,5,2023-06-01
comment,"QUANT QUANT QUANT[.](https://www.reddit.com/r/gatech/comments/12bz8uc/quant_quant_quant_quant_quant_quant/)

*I am a bot, and this action was performed automatically. Please [contact the moderators of this subreddit](/message/compose/?to=/r/gatech) if you have any questions or concerns.*",Neutral,quant,2,2023-06-01
comment,"Hello /u/Srhinehart2003, welcome to /r/gatech

It appears that you have not participated much in /r/gatech. To submit your own posts to this subreddit, we requires a minimum account-age and a minimum subreddit-specific comment karma count. This is to enable you time to get acquainted with our subreddit and our rules. 

If you are using a throwaway account, please resubmit your post on your main account. If you feel like you MUST use a throwaway account for privacy purposes, you must request an exception: [message the moderators](https://www\.reddit\.com/message/compose?to=%2Fr%2Fgatech&subject=About my removed submission&message=I'm writing to you about my post: /r/gatech/comments/13xkjgm/algebra_tutor_needed_for_high_school_students/. %0D%0DI think my post deserves an exception because\:).

*I am a bot, and this action was performed automatically. Please [contact the moderators of this subreddit](/message/compose/?to=/r/gatech) if you have any questions or concerns.*",Neutral,"welcome, participation, requirements, throwaway accounts, privacy, exceptions, bot, moderators.",1,2023-06-01
comment,Sadly I fell for it. Apparently it is a test sent by OneUSG itself.,Negative,deception,1,2023-06-01
comment,I am new to Reddit because a friend recommended this platform to find a tutor for my daughter wh’o’s starting summer school on Monday after struggling in Math all year.,"Positive
Topic: Recommendation
General categories: Recommendation, Introduction, Tutoring, Education",error,1,2023-06-01
comment,Hello there! Im an upcoming MSCS student at Georgia Tech Europe campus. Wanted to connect with other people also doing their grad program at europe campus!,Neutral,"education, networking, graduate, europe.",1,2023-06-01
comment,I think you may be quantitatively biased.,Neutral,bias,5,2023-06-01
comment,"Hello /u/Objective-Turn-5903, welcome to /r/gatech

It appears that you have not participated much in /r/gatech. To submit your own posts to this subreddit, we requires a minimum account-age and a minimum subreddit-specific comment karma count. This is to enable you time to get acquainted with our subreddit and our rules. 

If you are using a throwaway account, please resubmit your post on your main account. If you feel like you MUST use a throwaway account for privacy purposes, you must request an exception: [message the moderators](https://www\.reddit\.com/message/compose?to=%2Fr%2Fgatech&subject=About my removed submission&message=I'm writing to you about my post: /r/gatech/comments/13xma8l/the_temu_website_makes_it_easy_to_find_affordable/. %0D%0DI think my post deserves an exception because\:).

*I am a bot, and this action was performed automatically. Please [contact the moderators of this subreddit](/message/compose/?to=/r/gatech) if you have any questions or concerns.*",Neutral,"reddit, gatech, account requirements, throwaway accounts, privacy, moderators.",1,2023-06-01
comment,"That's good. I've heard the climate there is very stressful, which is why I turned them down, but I consider transferring in the future. Also, from this subreddit, I've heard that registration is a pain in the ass. Do the pros of Gatech surpass the cons?",Neutral,college,1,2023-06-01
comment,I have tickets and will be there!,Positive,event,1,2023-06-01
comment,"Hello /u/SHOW-ME-Ur-tatas, welcome to /r/gatech

It appears that you have not participated much in /r/gatech. To submit your own posts to this subreddit, we requires a minimum account-age and a minimum subreddit-specific comment karma count. This is to enable you time to get acquainted with our subreddit and our rules. 

If you are using a throwaway account, please resubmit your post on your main account. If you feel like you MUST use a throwaway account for privacy purposes, you must request an exception: [message the moderators](https://www\.reddit\.com/message/compose?to=%2Fr%2Fgatech&subject=About my removed submission&message=I'm writing to you about my post: /r/gatech/comments/13xn7vy/anyone_looking_for_a_poker_group/. %0D%0DI think my post deserves an exception because\:).

*I am a bot, and this action was performed automatically. Please [contact the moderators of this subreddit](/message/compose/?to=/r/gatech) if you have any questions or concerns.*",Neutral,"reddit, gatech, throwaway accounts, subreddit rules",1,2023-06-01
comment,Better to fall for the test than to fall for the real deal.,"Neutral
Topic: Test, Fall",error,1,2023-06-01
comment,How much are the tickets? 👀,Neutral,prices,1,2023-06-01
comment,It doesn’t let me join,Negative,technology,1,2023-06-01
comment,Dm’ed you,Neutral,communication,1,2023-06-01
comment,Can you dm the link to me too,"Neutral
Topic: Request
Categories: Request",error,1,2023-06-01
comment,I can add you on GroupMe but it’s up to the admin,Neutral,groupme,2,2023-06-01
comment,"Thanks!    
We try our best to ensure everyone can be heard and that conversations can be respectful. Feel free to DM us if you have any concerns about the state of r/gatech or if you'd like to see any new additions/changes. Enjoy your day!",Positive,customer service,1,2023-06-01
comment,I assume it’s changed since it’s a new month. Were you able to find a good place to get the code?,Neutral,technology,1,2023-06-01
comment,How hard is it to internal transfer from Ivan Allen to Engg?,"Neutral
Topic: Internal transfer
Categories: Difficulty, Internal, Transfer",error,1,2023-06-01
comment,"Hello /u/scrapper-142,

It looks like you might be a prospective new student here at GT. If so, welcome to /r/gatech! Around admission season, we get a huge influx of very common and repeated questions from new students. Usually we pin a Q&A thread for all prospective student questions. Check for this megathread on the subreddit homepage. We also recommend that you try [searching google and the subreddit](https://www.reddit.com/r/gatech/comments/cd4gcw) for the answer to your question first. 

If you believe this is a mistake, or you think your post is truly worthy of its own dedicated post, then you can [message the moderators to approve your post](https://www\.reddit\.com/message/compose?to=%2Fr%2Fgatech&subject=About my removed submission&message=I'm writing to you about my submission: /r/gatech/comments/13xykw9/conditional_transfer_pathway_questions/. %0D%0DI think my submission should be approved because\:).

*I am a bot, and this action was performed automatically. Please [contact the moderators of this subreddit](/message/compose/?to=/r/gatech) if you have any questions or concerns.*","Neutral
Topic: Admissions, Questions, Guidelines, Moderation",error,1,2023-06-01
comment,"I just yesterday “paid” the housing deposit. Says I’m on a waitlist and even though it hasn’t given me a waitlist position yet I realize how late I was to do that. 

As an incoming freshman, how likely am I to get a housing spot?",Neutral,"housing, waitlist, freshman, deposit",1,2023-06-01
comment,"Hello /u/No_Commercial_3228, welcome to /r/gatech

It appears that you have not participated much in /r/gatech. To submit your own posts to this subreddit, we requires a minimum account-age and a minimum subreddit-specific comment karma count. This is to enable you time to get acquainted with our subreddit and our rules. 

If you are using a throwaway account, please resubmit your post on your main account. If you feel like you MUST use a throwaway account for privacy purposes, you must request an exception: [message the moderators](https://www\.reddit\.com/message/compose?to=%2Fr%2Fgatech&subject=About my removed submission&message=I'm writing to you about my post: /r/gatech/comments/13xzti1/share_some_of_the_great_products_that_i_have/. %0D%0DI think my post deserves an exception because\:).

*I am a bot, and this action was performed automatically. Please [contact the moderators of this subreddit](/message/compose/?to=/r/gatech) if you have any questions or concerns.*",Neutral,"reddit, gatech, account requirements",1,2023-06-01
comment,Ye ye ye got to keep up with the No. 1 seed! Hats off to the team!,Positive,sports,2,2023-06-01
comment,"Hello /u/mocapapi, welcome to /r/gatech

It appears that you have not participated much in /r/gatech. To submit your own posts to this subreddit, we requires a minimum account-age and a minimum subreddit-specific comment karma count. This is to enable you time to get acquainted with our subreddit and our rules. 

If you are using a throwaway account, please resubmit your post on your main account. If you feel like you MUST use a throwaway account for privacy purposes, you must request an exception: [message the moderators](https://www\.reddit\.com/message/compose?to=%2Fr%2Fgatech&subject=About my removed submission&message=I'm writing to you about my post: /r/gatech/comments/13y1czx/should_i_learn_linear_algebra_or_multivariable_in/. %0D%0DI think my post deserves an exception because\:).

*I am a bot, and this action was performed automatically. Please [contact the moderators of this subreddit](/message/compose/?to=/r/gatech) if you have any questions or concerns.*",Neutral,"reddit, gatech, account requirements, throwaway accounts, moderators.",1,2023-06-01
comment,Discord mod or bust.,Neutral,social media,1,2023-06-01
comment,That's really unfortunate. Did they ever make it clear why they were testing students in the first place?,Negative,education,1,2023-06-01
comment,"If UGA was gaging school, this would be it",Neutral,education,1,2023-06-01
comment,"Hmm…I’m guessing you’re a guy? I’m a guy too and I’ve had no problem riding the MARTA by myself anytime of the day (been panhandled once or twice), but my girlfriend used to use MARTA to commute regularly, and she has been harassed on it WAY too many times to make it safe for her to ride.

I’m an absolute public transport fanatic and advocate btw (can check my profile for that), but it’s very important to recognize how American public transport systems might not be the safest for certain groups. Perspective matters.",Negative,public transport,1,2023-06-02
comment,"And good designers, don’t forget about them too",Neutral,"designers
categories: design, creativity",1,2023-06-02
comment,Hell yeah! Great feeling watching such an underdog win it like this! When's the match?,Positive,sports,2,2023-06-02
comment,"Yeah, I hadn't seen it earlier though. I just think it's kind of ridiculous that something like this is happening, considering we should be celebrating free speech in a university setting instead of pretending we need to silence students.",Negative,"free speech, university, silencing, students.",2,2023-06-02
comment,"Yet that's only half the ""joke"". Learned the hard way that this subreddit can't really take jokes these days... and the mods? Well, lets just say if you like ""party"" words you would enjoy some of their emails",Negative,online community,1,2023-06-02
