type,text,VADER sentiment,VADER sentiment score,TextBlob sentiment,TextBlob sentiment score,date
comments,feel free dm resume might able give suggestion two,positive,0.5562,positive,0.45,04/30/2023
comments,cm pretty broad discipline dm resume might know someone depending skillset focus skills consider standout,positive,0.4939,positive,0.15625,04/30/2023
comments,hi everyone sidharta vadaparty nice meet senior cs georgia tech graduating spring going masters fall would like sublease room may 12th august 12th summer room available one gender lgbtqia friendly 1b 1b 2b 2b unit current roommate second two bedrooms fellow cs georgia tech student currently remote internship loves music film cooking apartment fully furnished comes wifi utilities laundry machine unit ac addition apartment kitchen stove oven sink fridge freezer unit monthly rent 1100 apartment 75 miles midtown publix miles target 18th street nw miles away centennial park 13 minutes bike georgia tech campus within reasonable walking distance blocks away apartment interested please dm discuss,positive,0.9474,positive,0.21562499999999998,04/30/2023
comments,,neutral,0.0,neutral,0.0,04/30/2023
comments,seems like something went wrong enrollment first run passport without looking account specifically bet duo enrolled flag account devices duo discovered bit catch 22 getting touch esd correct next step sending email another commenter mentioned get esd expert processes surprised want call help assistance 2fa requires vetting requester identity series questions answers security reasons done email,positive,0.459,neutral,-0.0375,04/30/2023
comments,thanks tag,positive,0.7096,positive,0.2,04/30/2023
comments,interview grind consists two things getting interview passing interview getting interview either fraud improve resume one boys freshman year said interned nonprofit llc created college apps got internship interview several faang equivalent companies also changed grad date junior standing cause ap credits passing interview skill issue know types internships applying swe interview leetcode bullshit behavioural rare case see cs trivia hard,negative,-0.5432,neutral,0.002777777777777768,04/30/2023
comments,many places apply focus certain regions,positive,0.2732,positive,0.35714285714285715,04/30/2023
comments,think people near zbar bit friendly newcomers,positive,0.5413,positive,0.2375,04/30/2023
comments,lost count point definitely 200 mark applications first applying stuff atlanta applying anywhere,positive,0.4404,positive,0.125,04/30/2023
comments,thanks dmed,positive,0.4926,positive,0.2,04/30/2023
comments,thank let dm,positive,0.4199,neutral,0.0,04/30/2023
comments,thank tips applying everything point game developer software engineer data engineer etc,positive,0.4199,negative,-0.4,04/30/2023
comments,boat years back job market still hot got internship upon graduation extremely lucky get full time months even though happy options time better sure fine,positive,0.9558,positive,0.39375,04/30/2023
comments,yeah hope works internship stuff super stressful,positive,0.6908,positive,0.3333333333333333,04/30/2023
comments,gatech 2020 rankings 2021 rankings 2022 rankings 2023 rankings back years rankings really drop went back normal position last year somewhat fluke department going downhill fact year 2022 gts cs research output highest ever us columbia ucsd great though would pick whichever gives funding columbia pretty sure cash cow mscs,positive,0.8838,positive,0.1962962962962963,05/01/2023
comments,think really important learn comfortable interviews lot people get super nervous concerned saying perfect things interviewers easily tell candidates trying put perfect attitude think getting internship big deal making 200x harder interview take breaths tell screw end world handle coding tell interviewer really liked interview ask good questions top companies applicants pass technical part personal aspects really separate especially gt reputation smart awkward come likable strong candidate,positive,0.9562,positive,0.3165413533834587,05/01/2023
comments,applying game roles make sure solid portfolio also make sure projects resume seem solid impactful,positive,0.7003,positive,0.12,05/01/2023
comments,remove bot auto removes posts thinks asking class removes posts actually relevant like subreddit active enough issue anyway,positive,0.1506,positive,0.0888888888888889,05/01/2023
comments,plus especially hard cycle,negative,-0.1761,negative,-0.5833333333333334,05/01/2023
comments,hi cm major going thing still one summer go literally hard finding internships afraid find one graduate,negative,-0.7537,negative,-0.27638888888888885,05/01/2023
comments,funny 50 come last months,positive,0.4927,positive,0.125,05/01/2023
comments,think zhiwu lin worst,negative,-0.6249,negative,-1.0,05/01/2023
comments,ahhhhh another 50 bomb,negative,-0.4939,neutral,0.0,05/01/2023
comments,hello parsakhaz welcome gatech appears participated much gatech submit posts subreddit requires minimum account age minimum subreddit specific comment karma count enable time get acquainted subreddit rules using throwaway account please resubmit post main account feel like must use throwaway account privacy purposes must request exception message moderators removed submission message writing post gatech comments 134g273 built_a_website_that_lets_you_take_mock 0d 0di think post deserves exception bot action performed automatically please contact moderators subreddit message compose gatech questions concerns,positive,0.8442,positive,0.29444444444444445,05/01/2023
comments,thank submitting gatech post pertains student org event please amend flair social club posts inappropriate flairs subject removal post general gt announcement please include link source helps people learn verify information bot action performed automatically please contact moderators subreddit message compose gatech questions concerns,positive,0.9205,neutral,0.004166666666666673,05/01/2023
comments,quant quant quant bot action performed automatically please contact moderators subreddit message compose gatech questions concerns,positive,0.3182,positive,0.1,05/01/2023
comments,said courses oxford program help toward degree requirement need credit hours humanities courses satisfy credit hours,positive,0.7133,neutral,0.0,05/01/2023
comments,committed gatech cs wait get fall 23 leads good housing dorms east side late chossing,positive,0.6478,positive,0.19999999999999998,05/01/2023
comments,gotta robert wood goat tho,neutral,0.0,neutral,0.0,05/01/2023
comments,add different context points approach interview two way street detailing skills bring company think interviewing company well making sure asking questions help uncover place call home years taking approach help alleviate nerves may feel desperate land gig possible throughout career never leave job next one lined certain amount confidence comes demeanor interviewing realize next job sure may want desperately looking leave hell hole current role company knowing way pay bills nail interview wonders nerves composure best luck op way nothing wrong bit swagger knowing georgia institute technology stamped degree,positive,0.9828,neutral,0.04285714285714285,05/01/2023
comments,hi contact gtpd file report awareness go headquarters call 404 894 2500 use livesafe app,neutral,0.0,neutral,0.0,05/01/2023
comments,hello attaboishmattaboi looks like might prospective new student gt welcome gatech around admission season get huge influx common repeated questions new students usually pin thread prospective student questions check megathread subreddit homepage also recommend try searching google subreddit answer question first believe mistake think post truly worthy dedicated post message moderators approve post removed submission message writing submission gatech comments 134km79 my_son_will_be_an_incoming_freshman_this_fall_and 0d 0di think submission approved bot action performed automatically please contact moderators subreddit message compose gatech questions concerns,positive,0.9726,positive,0.17845117845117847,05/01/2023
comments,makes difference admitted aerospace engineering program,positive,0.1027,neutral,0.0,05/01/2023
comments,language barrier valid complaint hate people say english speaking school professor cannot speak fluent english understandable accent allowed teach pay learn fluent english broken english never taken lin professors lot tas terrible accents,negative,-0.7765,negative,-0.3125,05/01/2023
comments,well considering number professors heavy accents institute fact everyone interact life easy understand accent need able get barrier,positive,0.5859,positive,0.24444444444444446,05/01/2023
comments,thats fine supposed learn paying teach able speak english english speaking university,negative,-0.6767,positive,0.22916666666666669,05/01/2023
comments,think would valid complaint ta little different primary instructor,negative,-0.1531,neutral,-0.02187499999999999,05/01/2023
comments,need nap pull one lectures like light,positive,0.3612,positive,0.4,05/01/2023
comments,never taken class even saying anything sound ignorant af,negative,-0.2732,positive,0.4,05/01/2023
comments,called said regalia probably time anyone happen something close foot gold hood could pick return atlanta area,neutral,0.0,neutral,0.0,05/01/2023
comments,speak english tho still teaching english,neutral,0.0,neutral,0.0,05/01/2023
comments,tho plenty international students university naturally happens internationally renown university,neutral,0.0,neutral,0.03333333333333333,05/01/2023
comments,enjoyed devices class lot took,positive,0.5106,positive,0.5,05/01/2023
comments,common problem wanted voice seems lot people problem,negative,-0.6597,negative,-0.3,05/01/2023
comments,taken fall 22 semester worst professor existence reads materials directly slides insults students ask questions lectures office hours expects students 100 understand material first time never,negative,-0.7845,negative,-0.21666666666666667,05/01/2023
comments,lol casually accuse custodians snagging wallet,positive,0.4356,positive,0.14999999999999997,05/01/2023
comments,god gives toughest battles strongest soldiers every student endure professor zhiwu lin ineptitude navy seal review feelings exactly,positive,0.1406,positive,0.25,05/01/2023
comments,completely normal receive response emailed least 20 30 different professors ph students finally admitted one group try restrict one two specific labs even though interested say pursue interests freaking hard,negative,-0.3935,neutral,-0.027380952380952384,05/01/2023
comments,decided bring rigor cs 3600,neutral,0.0,neutral,0.0,05/01/2023
comments,hello wanted ask anyone knows exact date transfer decisions release fall 2023 thank,positive,0.4738,positive,0.25,05/01/2023
comments,quantity hasler rating real low,negative,-0.3919,neutral,0.0,05/01/2023
comments,looks like may trying make post housing trying find roommates trade rooms sublet rent apartment find housing submission removed per rule may occasionally pin housing coordination megathread subreddit dedicated submissions check see one pinned also recommend exploring better suited platforms posts examples include gt subleases roommates facebook group facebook marketplace craigslist believe mistake message moderators removed submission message writing submission gatech comments 134oh77 university_house_midtown_cheap_summer_sublease 0d 0di think submission approved bot action performed automatically please contact moderators subreddit message compose gatech questions concerns,positive,0.9118,positive,0.19999999999999998,05/01/2023
comments,hello dullconclusion6529 welcome gatech appears participated much gatech submit posts subreddit requires minimum account age minimum subreddit specific comment karma count enable time get acquainted subreddit rules using throwaway account please resubmit post main account feel like must use throwaway account privacy purposes must request exception message moderators removed submission message writing post gatech comments 134oj5e bio_majors_summer_positionsopportunities 0d 0di think post deserves exception bot action performed automatically please contact moderators subreddit message compose gatech questions concerns,positive,0.8442,positive,0.29444444444444445,05/01/2023
comments,someone warn florida man city conor mcgregor,negative,-0.1027,neutral,0.0,05/01/2023
comments,understandable accent mean understandable might others best professors tech international thick accents idt burden fundamentally change way speak still speaking english,positive,0.3182,positive,0.07749999999999999,05/01/2023
comments,almost never frequent mega threads way annoying someone posts question infinitely likely see able provide advice understand need reduce clutter better way,positive,0.0516,neutral,0.02999999999999998,05/01/2023
comments,friend get internship whole undergrad cs made internship working personal project app help pre scan medical stuff covid made bs company name startup graduation got good job swe faang remember faang one pay 6figures put brother referral resume manipulated many levels passing interviews see guy describe resume,neutral,0.012,positive,0.27999999999999997,05/01/2023
comments,sounds like gatekeeping prof trying teach one thing sure profs help despite language barrier reach email,positive,0.8383,positive,0.5,05/01/2023
comments,hey congratulations glad everything ended going well thank appreciate,positive,0.9476,positive,0.5,05/01/2023
comments,brought intro graduate class graduates struggling cs3600,negative,-0.4215,neutral,0.0,05/01/2023
comments,burden actually teach understandable way job,negative,-0.4404,neutral,0.0,05/01/2023
comments,believe intention say none courses offered travel portion core required courses major likely big statement years ago certainly offers validity clarify intention confirmed classes satisfy need good go,positive,0.8381,positive,0.21041666666666667,05/01/2023
comments,thanks confused noticed post years ago,positive,0.2244,negative,-0.1,05/01/2023
comments,usually 70,neutral,0.0,negative,-0.25,05/01/2023
comments,made peace outcome really receive commencement end really concerns boat,positive,0.594,positive,0.2,05/01/2023
comments,say fraud resume wtf,negative,-0.8225,negative,-0.5,05/01/2023
comments,soley online applications person interactions,neutral,0.0,neutral,0.0,05/01/2023
comments,took intro film class boring hell learn shit easy class three short writing assignments,negative,-0.2263,negative,-0.19166666666666665,05/01/2023
comments,hi ece graduate student also ta omscs course took one online course,neutral,0.0,neutral,0.0,05/01/2023
comments,wanting able understand professor gatekeeping,neutral,0.0,positive,0.5,05/01/2023
comments,donate kendeda revolving closet,neutral,0.0,neutral,0.0,05/01/2023
comments,perhaps misunderstand trying say professors fluent english going limit lot qualified professors want teach someone decided professor cannot speak fluent english understandable accent allowed teach,negative,-0.1531,neutral,0.0,05/01/2023
comments,think wide range fluent english one understand unintelligible professors fluent english could still piece together saying well seem case,positive,0.3919,neutral,-0.03333333333333333,05/01/2023
comments,seen past release 15th think specific date nervously opening profile waiting,negative,-0.2263,negative,-0.125,05/01/2023
comments,got 95 essay class positive thing said readable,positive,0.5984,positive,0.22727272727272727,05/01/2023
comments,exact date speculating counting days checking lot well know feeling,positive,0.4912,positive,0.25,05/01/2023
comments,major way,neutral,0.0,positive,0.0625,05/01/2023
comments,every time open application portal become little obsessed haha applied electrical engineering,positive,0.3182,negative,-0.121875,05/01/2023
comments,love tech much hence user excited computer science ee sounds cool,positive,0.7832,positive,0.35624999999999996,05/01/2023
comments,good luck us,positive,0.7345,positive,0.7,05/01/2023
comments,yeah like bs essentially make look good enough pass resume screens,positive,0.765,positive,0.2333333333333333,05/01/2023
comments,would highly surprised isye senior design,positive,0.2944,positive,0.1,05/01/2023
comments,looks like may trying buy sell something submission removed per rule recommend exploring better suited platforms buying selling examples include gt thriftshop facebook group facebook marketplace craigslist believe mistake message moderators removed submission message writing submission omscs comments 134sczg willing_to_pay_someone_on_campus_to_buy_regalia 0d 0di think submission approved bot action performed automatically please contact moderators subreddit message compose gatech questions concerns,positive,0.8625,positive,0.3,05/01/2023
comments,goodwill pay donations green goodbyes collection boxes around campus donate clothing items,positive,0.0762,negative,-0.2,05/01/2023
comments,goodwill one northside drive believe,neutral,0.0,neutral,0.0,05/01/2023
comments,beliehe donate clothes revolving closet bottom floor kendeda building,neutral,0.0,neutral,0.0,05/01/2023
comments,seem confused word qualified means strong spoken english qualification someone lacking unqualified said patience kindness make great deal understandability professor difficult understand loathe repeat problem,positive,0.1779,positive,0.06666666666666665,05/01/2023
comments,okay least responding accent issue still professor teaching poorly fact professor might fluent english thick accent issue reeks sort american attitude immigrants minorities accommodate rather putting little bit effort better understand person,positive,0.6486,neutral,-0.0234375,05/01/2023
comments,attend midnight bud sing loudly flash lights time music,neutral,0.0,positive,0.1,05/01/2023
comments,understandable accent means question understandable subjective least understandable vast majority intended audience professors objectively strange accent relatively easy understand least learned pronunciation look table avva alpha yamah gamma waidient gradient professors objectively less accent difficult understand due style cadence inconsistency patience repeating,negative,-0.0617,negative,-0.12604166666666666,05/01/2023
comments,students paying tens thousands dollars year take classes professors paid teach accomodating exactly,neutral,0.0,positive,0.25,05/01/2023
comments,takes maybe like 10 effort understand person thick accent,positive,0.3612,negative,-0.30000000000000004,05/01/2023
comments,cool accomodating,positive,0.3182,positive,0.35,05/01/2023
comments,dog read literally talking accent like issue ta professor accent,positive,0.3612,neutral,0.0,05/01/2023
comments,thank submitting job listing gatech please include job pay salary compensation budget work seeking post include pay details subject removal bot action performed automatically please contact moderators subreddit message compose gatech questions concerns,positive,0.7709,neutral,-0.033333333333333326,05/01/2023
comments,fact professor might fluent english thick accent issue reeks sort american attitude immigrants minorities accommodate rather putting little bit effort better understand person talking accent think wanting understand professor reeks sort american attitude immigrants minorities accommodate rather putting little bit effort better understand person students paying lot money learn ones accommodating someone getting paid teach,positive,0.7003,neutral,0.040624999999999994,05/01/2023
comments,cannot believe bad reviews dr starner granted take cs 3600 cs 3651 devices thread class talking google glass probably lot interesting folk devices thread genuinely great professor always available questions checks checks assignments done zoom made fun actually guided little lost sorry hear 3600 bad experience favorite professor favorite class undergraduate cs 3651,positive,0.948,positive,0.08295454545454549,05/01/2023
comments,cryptic,neutral,0.0,neutral,0.0,05/01/2023
comments,seems like great day late night stroll,positive,0.765,positive,0.25,05/01/2023
comments,know friends roommates tas everyone else think invite wink,positive,0.5719,neutral,0.0,05/01/2023
comments,think find casual walks great way deal stress finals,positive,0.5233,positive,0.14999999999999997,05/01/2023
comments,agree perfect weather,positive,0.7351,positive,1.0,05/01/2023
comments,hello sad factor 8798 looks like might prospective new student gt welcome gatech around admission season get huge influx common repeated questions new students usually pin thread prospective student questions check megathread subreddit homepage also recommend try searching google subreddit answer question first believe mistake think post truly worthy dedicated post message moderators approve post removed submission message writing submission gatech comments 134yvuw asap_first_gen_pathway_program_questions 0d 0di think submission approved bot action performed automatically please contact moderators subreddit message compose gatech questions concerns,positive,0.9726,positive,0.11060606060606062,05/01/2023
comments,find,neutral,0.0,neutral,0.0,05/01/2023
comments,rule,neutral,0.0,neutral,0.0,05/01/2023
comments,,neutral,0.0,neutral,0.0,05/01/2023
comments,unrelated posts include low effort memes sketchy job listings buy sale lost found posts lease transfers political posts specific ties gt gt organizations community devoted georgia tech content related campus institute student body community guidelines x200b though op could try groupme facebook discord,positive,0.5371,neutral,0.0,05/01/2023
comments,cringe af,neutral,0.0,neutral,0.0,05/01/2023
comments,first gen pathway program retake class originally passed make better grade requirements exactly process work able,positive,0.504,positive,0.375,05/01/2023
comments,gonna happen,neutral,0.0,neutral,0.0,05/01/2023
comments,fuck comment,negative,-0.5423,negative,-0.4,05/01/2023
comments,would suggest looking smaller government internship positions ive seen many water wastewater districts begging applicants even,neutral,0.0,positive,0.25,05/01/2023
comments,yes crc equipment,positive,0.4019,neutral,0.0,05/01/2023
comments,hii,neutral,0.0,neutral,0.0,05/01/2023
comments,hello yeeturselftospace welcome gatech appears participated much gatech submit posts subreddit requires minimum account age minimum subreddit specific comment karma count enable time get acquainted subreddit rules using throwaway account please resubmit post main account feel like must use throwaway account privacy purposes must request exception message moderators removed submission message writing post gatech comments 1350hqn 1_point_away_from_an_a_should_i_speak_to_the_prof 0d 0di think post deserves exception bot action performed automatically please contact moderators subreddit message compose gatech questions concerns,positive,0.8442,positive,0.29444444444444445,05/01/2023
comments,feels like hes gone way make intro class difficult like min lectures topics dont rlly cumulate learning assigns hws exams topics,positive,0.3612,negative,-0.5,05/01/2023
comments,wrong class,negative,-0.4767,negative,-0.5,05/01/2023
comments,reach professors questions best information,positive,0.6486,positive,1.0,05/01/2023
comments,absolutely nothing,neutral,0.0,positive,0.2,05/01/2023
comments,hasler pretty bad bad enough bother writing review,negative,-0.8562,negative,-0.2874999999999999,05/01/2023
comments,yep better go make sure nothing happening case something happen,positive,0.7506,positive,0.5,05/01/2023
comments,plato closet buys clothes however quite picky buy clothes current style season locations city goodwill accept donations pay form tax deduction lol,positive,0.6124,positive,0.4,05/01/2023
comments,thank submitting news gatech post pertains sports please amend flair sports already please include link news source helps people learn verify information bot action performed automatically please contact moderators subreddit message compose gatech questions concerns,positive,0.8832,positive,0.1,05/01/2023
comments,saying professor accent try change accent saying immigrants general required accommodate americans fact people raging professors thick accents exactly discussing anything else things 100 professor needs accommodate student better help changing accent one,positive,0.2406,positive,0.125,05/01/2023
comments,yeah always good watchful eye,positive,0.6588,positive,0.7,05/01/2023
comments,cool mean want interact people thick accents good luck,positive,0.7893,positive,0.10937499999999997,05/01/2023
comments,charles gave introduction course welcome seminar college computing way back 2003 hearing introduce college talk saw computing going knew tech place nice see stuck around another 20 years,positive,0.2023,positive,0.4666666666666666,05/01/2023
comments,congrats dean isbell amazing achievement,positive,0.8309,positive,0.6000000000000001,05/01/2023
comments,alright anything specific machines use since site says brand type weight machines use specific details machines,positive,0.128,neutral,0.0,05/01/2023
comments,stupid fact everyone interact life easy understand accent need able get barrier lets specific student paying service expect bare minimum professor speak fluent english least course description state professor speak english different situation expected public interaction peers colleagues students pass regents exam proficiency english professors least pass exams,negative,-0.25,neutral,-0.03974358974358974,05/01/2023
comments,tell planning take summer second thoughts reading post,neutral,0.0,neutral,0.0,05/01/2023
comments,could say americans geographical knowledge pay learn english correct disagreement maybe also pay learn communicate person clarify instead whiny little bitch reddit,negative,-0.8364,negative,-0.09375,05/01/2023
