type,text,VADER sentiment,VADER sentiment score,TextBlob sentiment,TextBlob sentiment score,date
comments,people always drop first lecture fine,negative,-0.0772,positive,0.33333333333333337,01/09/2023
comments,thanks needed,positive,0.4926,positive,0.2,01/09/2023
comments,seen anyone fall,neutral,0.0,neutral,0.0,01/09/2023
comments,plenty times saw someone slip half way stairs butt proceeded sit puddles contemplating life,neutral,0.0,negative,-0.16666666666666666,01/09/2023
comments,nice buzz super frog mashup,positive,0.4215,positive,0.4666666666666667,01/09/2023
comments,anything,neutral,0.0,neutral,0.0,01/09/2023
comments,littyyyy,neutral,0.0,neutral,0.0,01/09/2023
comments,someone lot reddit karma endorse,positive,0.3182,neutral,0.0,01/09/2023
comments,feel need cleaned frequently bright colors stand well however dirt muck stand lot well,positive,0.6757,positive,0.7000000000000001,01/09/2023
comments,trans student love people get hurt amp exactly tasteful strike well thought lone top step dedicated intersex flag makes feel much like afterthought dislike love make conservatives mad,negative,-0.817,positive,0.22083333333333333,01/09/2023
comments,get lot better gt campus full lot dated kind ugly architecture entire campus weird mismatch potluck different styles classic red brick buildings something looks like shipping container,neutral,0.0276,neutral,0.046296296296296294,01/09/2023
comments,get saying gt relatively modern style school compared ivies even emory personally like modern style better traditional stone red brick styles,positive,0.8968,positive,0.15,01/09/2023
comments,nemesis,neutral,0.0,neutral,0.0,01/09/2023
comments,modern today ugly tomorrow though look van leer skiles record think _parts_ gt absolutely gorgeous whole gt campus kind incongruous mess style wise,positive,0.5127,positive,0.21785714285714283,01/09/2023
comments,honest right hodgepodge styles colonial esque stuff around tech tower bds mid late century stuff scattered around campus aged worst everything built last 20 years sure solution though even really old universities uniform style newer stuff going looks modern,positive,0.5629,neutral,0.02857142857142857,01/09/2023
comments,credits never contacted internship credits seems chill might vary semester,positive,0.3612,neutral,0.0,01/09/2023
comments,make travel signature request istart took like days,positive,0.3612,neutral,0.0,01/09/2023
comments,north ave bad experience,positive,0.431,negative,-0.6999999999999998,01/09/2023
comments,dawg,neutral,0.0,neutral,0.0,01/09/2023
comments,co op interfere ability attend classes,positive,0.3182,neutral,0.0,01/09/2023
comments,,neutral,0.0,neutral,0.0,01/09/2023
comments,one green screen step landing blends well forget could easily trip fall,positive,0.5009,positive,0.11666666666666667,01/09/2023
comments,imo front treads painted top left walking surface wear unevenly black painted steps seems like trip hazard even dry,positive,0.5106,positive,0.06666666666666668,01/09/2023
comments,dawgzzzz babbbyyy,neutral,0.0,neutral,0.0,01/09/2023
comments,lifelong tcu fan dad alum current tech student never invested game life,positive,0.3182,negative,-0.16666666666666666,01/09/2023
comments,takes cake,neutral,0.0,neutral,0.0,01/09/2023
comments,piss em,negative,-0.4019,neutral,0.0,01/09/2023
comments,always thought good coach much recruiter definitely made players plus always tricks sleeve,positive,0.5789,positive,0.3,01/09/2023
comments,need pressure wash,negative,-0.296,neutral,0.0,01/09/2023
comments,non econ student want take econ 2106 different sections taught different instructors wunderly stendig besedes auditing course care grading know instructors one choose,negative,-0.5732,neutral,0.0,01/09/2023
comments,relate favorite part campus,positive,0.4588,positive,0.5,01/09/2023
comments,could send link,neutral,0.0,neutral,0.0,01/09/2023
comments,sent chat,neutral,0.0,neutral,0.0,01/09/2023
comments,great coach schools,positive,0.6249,positive,0.8,01/09/2023
comments,like need cleaned look really bad right agree others add slip resistance,positive,0.0534,negative,-0.20714285714285707,01/09/2023
comments,gt gables 820w ok,positive,0.296,positive,0.5,01/09/2023
comments,greatest accomplishment beating notre dame navy broke 43 game losing streak,negative,-0.4939,positive,0.3,01/09/2023
comments,consistent mydaqs check library want buy one full price also want make sure availability consistent library labs,positive,0.3624,positive,0.3375,01/09/2023
comments,could area make stairs mesh better painting walls match also probably add something slip resistant,positive,0.4404,positive,0.5,01/09/2023
comments,nah tripping rooting uga georgia georgia,negative,-0.1027,neutral,0.0,01/09/2023
comments,kind long shot anyone russ 1001 semester post got deleted automod realized need partner assignment due wednesday,neutral,0.0,positive,0.14166666666666664,01/09/2023
comments,makes think spoofed,neutral,0.0,neutral,0.0,01/09/2023
comments,contact card sender listed grad student,neutral,0.0,neutral,0.0,01/09/2023
comments,yes,positive,0.4019,neutral,0.0,01/09/2023
comments,yes grad student clicked similar link email hijacked send emails,positive,0.4019,neutral,0.0,01/09/2023
comments,surprised anyone see spelled almost words correctly,positive,0.2263,positive,0.1,01/09/2023
comments,reason gt decided offer recitation classes cs 1331 day time commute hour school classes tuesdays worth driving two hours back recitation still get without going also resources guys use study cs 1331,positive,0.4719,positive,0.15,01/09/2023
comments,like saying rooting hitler represents europe,positive,0.3612,neutral,0.0,01/09/2023
comments,thanks voice reason need one,positive,0.4404,positive,0.2,01/09/2023
comments,indeed tacky thought blasting colors good idea,positive,0.4404,positive,0.7,01/09/2023
comments,post,neutral,0.0,neutral,0.0,01/09/2023
comments,fort worth native gt alum family season tickets frogs since 1955 riff ram bah zoo fuck georgia,negative,-0.128,negative,-0.05000000000000002,01/09/2023
comments,cs 1331 recitation time day normal lower division cs classes besides two exceptions 1301 1371 going took 1331 recitation required consisted tas going concepts answering questions format still worth driving check tas make sure nothing required nothing happens though,negative,-0.1446,positive,0.31666666666666665,01/09/2023
comments,idea like career maybe stick versatility 5th year speaking experience mechanical really nice kinda work wherever worked construction product engineering consumer electronics project manager moving software product manager role friends work automotive aerospace food beverage name idea wanted changed majors mse broad knew could take ton different ways say think career field interests see engineering branches suited area,positive,0.8173,positive,0.22083333333333333,01/09/2023
comments,success recruiting trail much different predecessors gt also coached time rivals drastically increased recruiting budgets staff sizes continued broke despite managed get guys need run offense wanted even managed put guys league,positive,0.5904,positive,0.15,01/09/2023
comments,recitation pretty helpful probably drive hours try using recitation slides office hours,positive,0.4588,positive,0.25,01/09/2023
comments,group bots,neutral,0.0,neutral,0.0,01/09/2023
comments,think terribly ugly never cleaned look like afterthought get sentiment think mural something would much aesthetically pleasing maybe meaningful throwing bunch paint stairs,positive,0.7722,neutral,1.850371707708594e-17,01/09/2023
comments,fuck good word,negative,-0.1531,positive,0.14999999999999997,01/09/2023
comments,appreciate comment guess gonna make habit attend office hours,positive,0.4574,neutral,0.0,01/09/2023
comments,oh aware came outta 1301 recitations offered multiple different days like said required us either highly recommended guess use slides office hours appreciate comment,positive,0.6988,positive,0.10250000000000001,01/09/2023
comments,great advice thank,positive,0.784,positive,0.8,01/09/2023
comments,amazing thank much,positive,0.7644,positive,0.4,01/09/2023
comments,first floor student center vending machines adjacent post office,neutral,0.0,positive,0.075,01/09/2023
comments,thanks,positive,0.4404,positive,0.2,01/09/2023
comments,section faq question,neutral,0.0,neutral,0.0,01/09/2023
comments,total beat,neutral,0.0,neutral,0.0,01/09/2023
comments,,neutral,0.0,neutral,0.0,01/09/2023
comments,sentences usually end period,positive,0.0516,negative,-0.25,01/09/2023
comments,master plan back day would taken care would consistency architecture always wished tech campus looked like emory campus oh well,positive,0.6855,neutral,0.0,01/09/2023
comments,seen since last campus looked reminds rainbow road mario kart,neutral,0.0,neutral,0.0,01/09/2023
comments,responding saying paint whole school rainbow,neutral,0.0,positive,0.2,01/09/2023
comments,last year fuga 14 year 15 much hate fuga got give credit kirby smart make difference,positive,0.1531,negative,-0.19523809523809524,01/09/2023
comments,extremely well deserved,positive,0.3384,negative,-0.125,01/09/2023
comments,tbf gatech put fight tcu,negative,-0.4364,neutral,0.0,01/09/2023
comments,better,neutral,0.0,positive,0.5,01/09/2023
comments,thank cpj everything happy student gt coach 2009 2013 feel bad current students years bad leadership taken gt athletics drain cpj appreciated 2008 2009 seasons remember buzz campus lively saturdays thursday night games legendary regardless winning losing everything seems deflated gt lacks real leadership cpj real leader bums drove away handle gt really desperately needs change lot leadership positions especially outside athletics way many spineless bums taking paychecks deserve students deserve better hope things change go jackets congrats cpj,positive,0.9777,positive,0.14545454545454548,01/09/2023
comments,yeah oh well,positive,0.5106,neutral,0.0,01/09/2023
comments,take vip junior design route cs could take lmc 3403 summer last semester vip take semester last semester vip,positive,0.9201,neutral,0.0,01/09/2023
comments,yeah leaning toward grad student account compromised well,positive,0.5106,neutral,0.0,01/09/2023
comments,could use holocaust sports banter,neutral,0.0,neutral,0.0,01/09/2023
comments,bulking season well least seriousness call tech dining sort situation,negative,-0.0516,negative,-0.3,01/10/2023
comments,anyone mind sharing syllabus honors 4510 also info regarding prof suguman would appreciated,positive,0.8655,positive,0.2,01/10/2023
comments,beat point spread,neutral,0.0,neutral,0.0,01/10/2023
comments,point bit disappointing classes big professors resorting online courses end getting attendance 8th number people registered course,negative,-0.4404,negative,-0.3,01/10/2023
comments,specifically isye interests specifically mechanical like ideas would like undergrad depending answers may able figure way pursue interests within meche especially final semesters room electives maybe minor find way continue meche would satisfy assessing interests least help narrow options,positive,0.7808,neutral,-0.009999999999999998,01/10/2023
comments,fyi online masters regular one,positive,0.4263,neutral,0.0,01/10/2023
comments,find ironic near binary bridge,negative,-0.128,positive,0.15000000000000002,01/10/2023
comments,would conservatives mad get put dirty ass shoes maybe even spit,negative,-0.8625,negative,-0.6125,01/10/2023
comments,dude covid happened late 2019,neutral,0.0,negative,-0.3,01/10/2023
comments,one important thing address used institute instructors send important notifications make sure either check regularly forward email address normally use note become gt employee forwarding may forbidden cancelled use account notifications email address gt certain stiill active student,positive,0.947,positive,0.21870748299319726,01/10/2023
comments,application currently process account,neutral,0.0,neutral,0.0,01/10/2023
comments,help,positive,0.4019,neutral,0.0,01/10/2023
comments,hang onto need around decision time,neutral,0.0,neutral,0.0,01/10/2023
comments,see thanks man scholarships apply scholarships give,positive,0.4404,positive,0.2,01/10/2023
comments,automatic far know financial aid complex absolutely qualified area probably best idea would browsing website see may apply button front page steps incoming students,positive,0.6369,positive,0.2,01/10/2023
comments,okay thanks,positive,0.5859,positive,0.35,01/10/2023
comments,honestly respect kirby smart someone like dabo swiney,positive,0.8908,positive,0.40714285714285714,01/10/2023
comments,yupe another compromised account good reminder duo annoying useful know someone enrolled yet could nudge help save us,positive,0.8999,positive,0.06666666666666664,01/10/2023
comments,funny well much mid century furniture interior design ages well buildings sheesh,positive,0.4678,positive,0.125,01/10/2023
comments,thought tcu gonna lose expect look worse us uga,negative,-0.7184,negative,-0.4,01/10/2023
comments,someone want exchange labs eas 2600 w2 section looking t4 h4 consider f2 waitlist class drop register time work labs currently fully booked,negative,-0.5046,neutral,0.0,01/10/2023
comments,ds amp helpers amp co provide best services market clients using innovative solutions cutting edge technologies always bring highest grade satisfaction clients much services cost prices flexible allow cater needs clients see projects view list projects browsing wildest dreams fantasies finding results would make happy anybody use services clients include abibas kike corporation uga lines amp circles inc comments see testimonials clients real rankings use cases fictional names,positive,0.97,positive,0.3,01/10/2023
comments,salty asses uga blew frogs water go georgia,neutral,0.0,neutral,0.0,01/10/2023
comments,,neutral,0.0,neutral,0.0,01/10/2023
comments,,neutral,0.0,neutral,0.0,01/10/2023
comments,,neutral,0.0,neutral,0.0,01/10/2023
comments,thank submitting news gatech post pertains sports please amend flair sports already please include link news source helps people learn verify information bot action performed automatically please contact moderators subreddit message compose gatech questions concerns,positive,0.8832,positive,0.1,01/10/2023
comments,cant get oscar report outage,neutral,0.0,neutral,0.0,01/10/2023
comments,whenever feel like,positive,0.3612,neutral,0.0,01/10/2023
comments,says virtual mail located post office correct amp x200b,neutral,0.0,neutral,0.0,01/10/2023
comments,math 3215 see canvas page able make first class anyone syllabus know canvas,neutral,0.0,positive,0.375,01/10/2023
comments,kirby class act coached anywhere else would probably like dabo likes shift blame rely god deflect issues management college football scene general never heard kirby use religion excuse poor results,positive,0.296,negative,-0.13333333333333333,01/10/2023
comments,agree part last years definitely way spoke band mentioned much liked sitting couch watching football interacting media boosters fully believe exactly probably gigs help teams counter offense point seems much alley stage life cents,positive,0.8765,positive,0.21000000000000002,01/10/2023
comments,absolutely correct paul johnson years bottom acc pool money spend staff still delivered middle high tier acc results,neutral,0.0,positive,0.12,01/10/2023
comments,damn guess new students never know feels like develop lung cancer riding bike behind gt bus,negative,-0.4151,negative,-0.13181818181818183,01/10/2023
comments,,negative,-0.296,neutral,0.0,01/10/2023
comments,fine tbh even think pay attention transcript admission unless fail classes,negative,-0.4767,neutral,-0.04166666666666666,01/10/2023
comments,hopefully quieter,positive,0.4019,neutral,0.0,01/10/2023
comments,heylo everyone yeah realm bedrock editions minecraft sorry java people wanted cross platform compatibility pretty much entirely vanilla survival minecraft world border sorts keep players within certain small radius spawn encourage much multiplayer interaction possible hopefully resulting factions clans nations form resources become constrained coming months might interesting dynamics popping yeah started brand new feel free invite friends stuff plan maintaining subscription around however long active link discord server link realm hope see,positive,0.9817,positive,0.059024309024309024,01/10/2023
comments,yes looks like noise pollution one targets well,positive,0.7644,neutral,0.0,01/10/2023
comments,smiles van leer great architecture maintenance upkeep deserve could chosen better color shades rotunda renovated hive would look lot better cleaned surfaces decaying cracks terrazzo floors repaired library beautiful renovation minus things like failing windows worn non matching flooring also would looked better original context part campus mid century buildings similar style gone agree incongruity especially west campus already many different colors brick built willage could built modern style building sticking one colors brick already present building designed look cool brochures marketing,positive,0.931,positive,0.2983333333333333,01/10/2023
comments,finally uga,neutral,0.0,neutral,0.0,01/10/2023
comments,would crc want entering anywhere main entrance,neutral,0.0387,positive,0.16666666666666666,01/10/2023
comments,first one supposed last semester supply chain issues common right also worth noting hybrid electric buses new georgia tech first customer get specific model bus also surprised see gold thing top bus renderings,positive,0.7096,positive,0.1522077922077922,01/10/2023
comments,took ugag long tie tech number national football championships maybe might want something education educational institute ranked 48 rankings except football amount spent athletic recruiting even red amp black came op ed piece fall saying athletic success great school start putting emphasis academics quality student life friend whose daughter goes tech friends go ugag friends tell stop working hard transfer courses easier hs mind terrible thing waste,positive,0.877,neutral,-0.04583333333333333,01/10/2023
comments,easier ece 2031 cs 4290 conte also anyone planning drop cs 4235,positive,0.264,neutral,0.0,01/10/2023
comments,took ugag long tie tech number national football championships maybe might want something education educational institute ranked 48 rankings except football amount spent athletic recruiting even red amp black came op ed piece fall saying athletic success great school start putting emphasis academics quality student life friend whose daughter goes tech friends go ugag friends tell stop working hard transfer courses easier hs mind terrible thing waste,positive,0.877,neutral,-0.04583333333333333,01/10/2023
comments,freshman possible assume tried cancel meal plan process outlined,negative,-0.25,neutral,0.0,01/10/2023
comments,switched bme ece transferred tech difficult meet minimum gpa change major also added lot time degree way prereqs structured best option regret even though hard hand degree flexible apply jobs specifically graduation really wanted learn something else always masters different field degrees good catch engineering jobs,positive,0.8917,positive,0.16726190476190478,01/10/2023
comments,sadly,negative,-0.6124,negative,-0.5,01/10/2023
comments,idk man hoping might two entrances smth,positive,0.34,neutral,0.0,01/10/2023
comments,think genuinely taken years life exactly,neutral,0.0,positive,0.325,01/10/2023
comments,trolley worse,negative,-0.4767,negative,-0.4,01/10/2023
comments,legal reasons,negative,-0.1779,positive,0.2,01/10/2023
comments,defined one play used college programs even pro teams one calls offenses option offenses,negative,-0.6542,neutral,0.0,01/10/2023
comments,next parking pass year august 15 2023 august 14 2024 think permit year always starts august 15th renewals location usually start april 1st general sales 23 24 starts around mid end april,neutral,0.0,neutral,-0.049999999999999996,01/10/2023
comments,take free bike scooter safety class 12 minutes take quiz end sign free helmet really wish everyone bikes uses scooter campus would take class,positive,0.908,positive,0.3333333333333333,01/10/2023
comments,check pts go office tech square hotel parking deck chance switch,negative,-0.1877,neutral,0.0,01/10/2023
comments,back day sucked diesel exhaust smog liked got 2021,negative,-0.5983,positive,0.3,01/10/2023
comments,damn excited java,neutral,-0.0387,positive,0.375,01/10/2023
comments,glenn towers well known best freshman dorms campus difference many others regards living conditions aesthetics atmosphere sense community surprisingly stark,positive,0.8176,positive,0.43333333333333335,01/10/2023
comments,believe people working crc,neutral,0.0,neutral,0.0,01/10/2023
comments,believe people working crc,neutral,0.0,neutral,0.0,01/10/2023
comments,sorry experiencing annoying prof david travel issues believe instructor likely added hr employee yet added instructor scheduling team select etc random occurrence unfortunate happens rarely way prevent unless guess ask directly prof maybe good idea might like happen often hopefully experience happening totally fine attend section lectures unless point available seats also section lectures recorded streamed live link canvas instructor page section join ms team streamed recorded going person also fine seats available least registered least ok,positive,0.3382,neutral,0.02935606060606063,01/10/2023
comments,thank much,positive,0.4199,positive,0.2,01/10/2023
comments,sure thing case class really tightly coordinated really matter section except studio allowed get points studio quizzes studios anyway sorry trouble case pretty annoying sorry deal,negative,-0.475,negative,-0.15357142857142858,01/10/2023
comments,problem thanks since possible watch lectures intentional fine seems like involved planning sorry attitude,negative,-0.2103,neutral,0.029166666666666674,01/10/2023
comments,prof barone,positive,0.4588,neutral,0.0,01/10/2023
comments,haha nice plot twist,positive,0.7003,positive,0.4,01/10/2023
comments,glenn towers newly renovated best living conditions lived harrison freshmen year bad nothing spectacular also never really issues either said best memories freshmen year quad harrison know quad life everyone also harrison study rooms top floor called catacombs cuz dead silent nice,positive,0.9027,positive,0.28363636363636363,01/10/2023
comments,table used determine credits transfer questions believe credits transfer listed table contact gatech registrar,positive,0.6124,neutral,0.0,01/10/2023
comments,know textbook someone took 1102 last semester yes unavoidable final exam bad sounds work like making infographics etc throughout year portfolio compiling writing reflective paragraphs explaining make sure save progress documents screenshots throughout year since need later,positive,0.9616,neutral,-0.039999999999999966,01/10/2023
comments,ima honest miss aesthetic trollies may rough ride looked iconic,positive,0.2144,positive,0.3333333333333333,01/10/2023
comments,windows bedrock edition included purchase java purchased previously,neutral,0.0,negative,-0.16666666666666666,01/10/2023
comments,probably typical behavioral questions explain handled recent conflict weaknesses etc,neutral,0.0,negative,-0.08333333333333333,01/10/2023
comments,anyone planning drop cs 3510,negative,-0.3527,neutral,0.0,01/10/2023
comments,could take last semester vip,positive,0.6166,neutral,0.0,01/10/2023
comments,financial aid health insurance ramifications well,positive,0.2732,neutral,0.0,01/10/2023
comments,little known fact hanson lowkey best bathrooms,positive,0.6369,positive,0.40625,01/10/2023
comments,hanson resident second,neutral,0.0,neutral,0.0,01/10/2023
comments,definitely summer history chairs history jazz example,positive,0.4019,neutral,0.0,01/10/2023
comments,map microwaves campus link faq amp x200b click red point give details microwave building,neutral,0.0,neutral,0.0,01/10/2023
comments,course edx stuck assignment,negative,-0.25,neutral,0.0,01/10/2023
comments,love splash highly symbolic color even though get part campus often gt sadly notorious walkways become difficult rain several pretty brick sidewalks become good approximations oiled glass rains,positive,0.7582,positive,0.08714285714285715,01/10/2023
comments,curious sending texts without incurring high costs,positive,0.3182,neutral,0.03,01/10/2023
comments,school music practice rooms four free also heard booked time,negative,-0.5504,positive,0.4,01/10/2023
comments,speed current major switching policies offer perspective practicing engineer like engineering general general technical interest super passionate mechanical specifically isye would good choice would also recommend get minor business managmemt day business minor also valuable lots careers general technical background business knowledge need,positive,0.7661,positive,0.09131944444444444,01/10/2023
comments,using connect american family costco membership full coverage much cheaper geico etc lower deductibles,negative,-0.296,positive,0.18333333333333335,01/10/2023
comments,back door street parking supposed locked go way usually go way,neutral,0.0,negative,-0.125,01/10/2023
comments,could use specific mod allows cross multiplayer geyser bitch setup days minecraft server support mind helping port,positive,0.3071,positive,0.06666666666666667,01/10/2023
comments,ok time,positive,0.1531,positive,0.5,01/10/2023
comments,record resized honors section second day class added seats large main section increasing size 250 280,positive,0.5106,positive,0.12698412698412698,01/10/2023
comments,sign classes,neutral,0.0,neutral,0.0,01/10/2023
