type,text,VADER sentiment,VADER sentiment score,TextBlob sentiment,TextBlob sentiment score,date
comments,university alabama huntsville space hardware team launched cubesat back 2016 think time around iirc maybe date wrong remember posters also remember friends launching rockets space senior projects,positive,0.5187,negative,-0.25,05/09/2023
comments,take shot every time get shafted,neutral,0.0,neutral,0.0,05/09/2023
comments,course name public policy course,neutral,0.0,neutral,0.0,05/09/2023
comments,nearly died trying got,negative,-0.5574,positive,0.1,05/09/2023
comments,able find anything team could link article certain first university meaning entirely student team reach space usc 2019 see solid rocket liquid one speaking folks yjsp masa michigan equivalent team student team done liquid rocket yet perhaps rockets huntsville using solid boosters,positive,0.3736,positive,0.16071428571428573,05/09/2023
comments,drink,neutral,0.0,neutral,0.0,05/09/2023
comments,hello alternative carpet14 welcome gatech appears participated much gatech submit posts subreddit requires minimum account age minimum subreddit specific comment karma count enable time get acquainted subreddit rules using throwaway account please resubmit post main account feel like must use throwaway account privacy purposes must request exception message moderators removed submission message writing post gatech comments 13dc11y gt_lite_website_not_been_working_for_anyone_else 0d 0di think post deserves exception bot action performed automatically please contact moderators subreddit message compose gatech questions concerns,positive,0.8442,positive,0.29444444444444445,05/09/2023
comments,course critique good alternative lite work,positive,0.4404,positive,0.7,05/09/2023
comments,yeah heard lite updates faster course critique based recent semester,positive,0.1531,neutral,0.0,05/09/2023
comments,issues lite semester see grades spring 2023 might,neutral,0.0,neutral,0.0,05/09/2023
comments,would mind letting know browser used chrome safari etc tried multiple devices still takes page found page,neutral,0.0,neutral,0.0,05/09/2023
comments,actually modified url worked turns link lite gt website went invalid url,positive,0.4278,neutral,0.0,05/09/2023
comments,got check post office excess federal loans would assume would similar process,neutral,0.0,neutral,0.0,05/09/2023
comments,scholarships also exceed pay depends scholarship allowing use money scholarships split total value case 30k evenly semesters meaning give school 15k semester scholarships simply give school full amount full amount applied fall semester full amount given upfront 30k cost 15k fall semester bursar account say total balance 15k two ways receiving money already direct pay set account experience couple weeks semester starts money directly deposited bank option set may pick check bursars office,positive,0.1531,positive,0.15625,05/09/2023
comments,still get pathway program opportunity waitlist first gen,positive,0.4215,positive,0.25,05/09/2023
comments,fuck gtplaydeaf,negative,-0.5423,negative,-0.4,05/09/2023
comments,hello ok firefighter7506 welcome gatech appears participated much gatech submit posts subreddit requires minimum account age minimum subreddit specific comment karma count enable time get acquainted subreddit rules using throwaway account please resubmit post main account feel like must use throwaway account privacy purposes must request exception message moderators removed submission message writing post gatech comments 13df5ij anyone_living_in_sentral_west_midtown_apartments 0d 0di think post deserves exception bot action performed automatically please contact moderators subreddit message compose gatech questions concerns,positive,0.8442,positive,0.3238095238095238,05/09/2023
comments,anyone staying sentral west midtown apartments summer im undergrad interning atlanta summer wondering students,neutral,0.0,neutral,0.0,05/09/2023
comments,hello clumsy hyena looks like might prospective new student gt welcome gatech around admission season get huge influx common repeated questions new students usually pin thread prospective student questions check megathread subreddit homepage also recommend try searching google subreddit answer question first believe mistake think post truly worthy dedicated post message moderators approve post removed submission message writing submission gatech comments 13dfci7 coop_vs_graduating_early_whats_the_wiser_option 0d 0di think submission approved bot action performed automatically please contact moderators subreddit message compose gatech questions concerns,positive,0.9726,positive,0.13060606060606064,05/09/2023
comments,hello clumsy hyena welcome gatech appears participated much gatech submit posts subreddit requires minimum account age minimum subreddit specific comment karma count enable time get acquainted subreddit rules using throwaway account please resubmit post main account feel like must use throwaway account privacy purposes must request exception message moderators removed submission message writing post gatech comments 13dfddb should_i_wait_4_years_and_coop_rather_than 0d 0di think post deserves exception bot action performed automatically please contact moderators subreddit message compose gatech questions concerns,positive,0.8442,positive,0.20952380952380953,05/09/2023
comments,yes creams useless tolerate accutane seemingly little side effects strongly believe usage outweigh benefits though digress,neutral,-0.0454,negative,-0.08472222222222224,05/09/2023
comments,good got karma thanks,positive,0.7263,positive,0.44999999999999996,05/10/2023
comments,could send correct link lite,neutral,0.0,neutral,0.0,05/10/2023
comments,looking sublet summer 2023 890 mo prorated including utl fully furnished private room 6b3b home park calhoun 15min walk culc private offstreet parking including house washer dryer plenty kitchenware appliances already place asap move lease runs july 31 dm interested,positive,0.4019,positive,0.08333333333333333,05/10/2023
comments,sure,positive,0.3182,positive,0.5,05/10/2023
comments,see verbiage seeking hope form necessary instead need complete hope transient request form also work transient school payment extension cover balance due institutions temporary hardship grant cover standard delays delivering financial aid funds respective burser accounts also ask transient school waivers standard fees confirm fees may duplicates coverages may carry tech,positive,0.8825,neutral,-0.0035714285714285704,05/10/2023
comments,would direct career center never used,neutral,0.0,neutral,0.0,05/10/2023
comments,thanks chat,positive,0.4404,positive,0.2,05/10/2023
comments,cs major suffices math courses according academic advisor think fine,positive,0.2023,positive,0.15972222222222224,05/10/2023
comments,thank submitting gatech post pertains student org event please amend flair social club posts inappropriate flairs subject removal post general gt announcement please include link source helps people learn verify information bot action performed automatically please contact moderators subreddit message compose gatech questions concerns,positive,0.9205,neutral,0.004166666666666673,05/10/2023
comments,able get site,neutral,0.0,positive,0.5,05/10/2023
comments,someone never hope thing glad lucky one,positive,0.4313,positive,0.41666666666666663,05/10/2023
comments,thank submitting job listing gatech please include job pay salary compensation budget work seeking post include pay details subject removal bot action performed automatically please contact moderators subreddit message compose gatech questions concerns,positive,0.7709,neutral,-0.033333333333333326,05/10/2023
comments,friend registrar office high priority nrs affect degree certification financial aid student visas potentially co op internships addendum told part hate handle nr grades take instructor 10 minutes upload hundred person spreadsheet takes minutes per student correct nr grades,negative,-0.1572,negative,-0.16,05/10/2023
comments,tack onto bursar might force split across semesters unless graduating something big indicated wanted 10k scholarship apply fall semester person paper applied fall spring automatically technically policy forget written,negative,-0.2263,neutral,0.0,05/10/2023
comments,reach professor advisor ask willing work bring situation could loop head department would probably help since benefits metrics student get good job nothing guaranteed know people done past able graduate,positive,0.5647,positive,0.3,05/10/2023
comments,phys 2xxx credits lectures part manage satisfy lab credit go credit 2xxx like know use also already credits phys 2211 phys 2212 ap physics exams still use phys 2xxx 3rd lab science requirement yes appreciate responses thanks,positive,0.9862,positive,0.1,05/10/2023
comments,lol nice try bot literally took,positive,0.6808,positive,0.7,05/10/2023
comments,begone bot,neutral,0.0,neutral,0.0,05/10/2023
comments,thanks,positive,0.4926,positive,0.2,05/10/2023
comments,hello rihabaltaf looks like might prospective new student gt welcome gatech around admission season get huge influx common repeated questions new students usually pin thread prospective student questions check megathread subreddit homepage also recommend try searching google subreddit answer question first believe mistake think post truly worthy dedicated post message moderators approve post removed submission message writing submission gatech comments 13dp3kl transferring_under_repp_as_an_international 0d 0di think submission approved bot action performed automatically please contact moderators subreddit message compose gatech questions concerns,positive,0.9726,positive,0.17845117845117847,05/10/2023
comments,hello rihabaltaf looks like might prospective new student gt welcome gatech around admission season get huge influx common repeated questions new students usually pin thread prospective student questions check megathread subreddit homepage also recommend try searching google subreddit answer question first believe mistake think post truly worthy dedicated post message moderators approve post removed submission message writing submission gatech comments 13dp5bb should_i_do_the_repp_pathway_program 0d 0di think submission approved bot action performed automatically please contact moderators subreddit message compose gatech questions concerns,positive,0.9726,positive,0.17845117845117847,05/10/2023
comments,correct end term process huge lot happen degrees certified,positive,0.3182,positive,0.4000000000000001,05/10/2023
comments,hello fearless_aside_7722 looks like might prospective new student gt welcome gatech around admission season get huge influx common repeated questions new students usually pin thread prospective student questions check megathread subreddit homepage also recommend try searching google subreddit answer question first believe mistake think post truly worthy dedicated post message moderators approve post removed submission message writing submission gatech comments 13drfjl boston_university_vs_gatech_for_cs 0d 0di think submission approved bot action performed automatically please contact moderators subreddit message compose gatech questions concerns,positive,0.9726,positive,0.17845117845117847,05/10/2023
comments,least destructive georgia tech student coping mechanism,positive,0.4973,negative,-0.44999999999999996,05/10/2023
comments,keep emailing ece department get official stance know bs ms program defer instead starting right away following applies need apply ms program regular admission process however students accepted bsms program graduate gpa return ms program within year graduate bs degree need take gre required letters recommendation full application bs ms faq kinda sounds like defer probably straightforward path back absolutely recommend taking internship make money pay school experience always key opportunity could get return offer could go straight working potentially convert internship full time take internship 100,positive,0.8411,positive,0.14672619047619048,05/10/2023
comments,good know maybe professor finally forced accountable failings maybe try blaming someone else knows,negative,-0.7579,positive,0.19999999999999996,05/10/2023
comments,thread sure case theory lot math classes threads,negative,-0.3017,positive,0.5,05/10/2023
comments,similar situation dept allowed take class offered summer statistics,neutral,0.0,neutral,0.0,05/10/2023
comments,generally total amount cannot exceed cost attendance gt around 32k state scholarships zell institutional grants would reduced first ensuring get maximum refund means aware coa since sounds like state probably hit cap also aware irs publication 970 associated 1098 receive,positive,0.7324,positive,0.1875,05/10/2023
comments,ohhh right dang nvm,neutral,0.0,positive,0.2857142857142857,05/10/2023
comments,hello itchki_in_mah_hart looks like might prospective new student gt welcome gatech around admission season get huge influx common repeated questions new students usually pin thread prospective student questions check megathread subreddit homepage also recommend try searching google subreddit answer question first believe mistake think post truly worthy dedicated post message moderators approve post removed submission message writing submission gatech comments 13dxsnm any_grad_students_here_living_in_oncampus_housing 0d 0di think submission approved bot action performed automatically please contact moderators subreddit message compose gatech questions concerns,positive,0.9726,positive,0.17845117845117847,05/10/2023
comments,anyone know alcoholedu sexual assault courses faset canvas page says complete link find anywhere gt website,positive,0.329,positive,0.3,05/10/2023
comments,pay taxes excess scholarship transferred bank account,negative,-0.1027,neutral,0.0,05/10/2023
comments,sure mean overload yes probably needed permit earlier maybe able get minor able take spring proactive getting permit get cs major restricted classes drop restrictions everyone well silver lining big classes waitlists tend move lot even waitlists full check coursicle track waitlist spot,negative,-0.2053,positive,0.1722222222222222,05/10/2023
comments,phys 2xxx elective cannot used satisfy lab science requirement lab component even could three lab science requirement specifies need take two different subjects take three subject assuming cs requirements count towards free electives though,positive,0.743,positive,0.07777777777777779,05/10/2023
comments,bme,neutral,0.0,neutral,0.0,05/10/2023
comments,believe nutrislice believe project get better nutritional information nature know ended though,positive,0.4404,positive,0.5,05/10/2023
comments,government actually shuts think anybody get internship anywhere,neutral,0.0,neutral,0.0,05/10/2023
comments,undergrad labs really going useful mostly set repetitive set tasks every day least experience,positive,0.2263,positive,0.09,05/10/2023
comments,extra space storage west pretty nice would recommend alone recommend sharing others quite big end lot space plan use lose money,negative,-0.569,positive,0.2125,05/10/2023
comments,park dalney bike garage free easy long bike registered gtpd,positive,0.7574,positive,0.2611111111111111,05/10/2023
comments,nutrislice allergen information sadly,negative,-0.4215,negative,-0.5,05/10/2023
comments,damn education pricing still inflating like banana republic currency,negative,-0.0772,neutral,0.0,05/10/2023
comments,thanks still need wait major restriction removed even though robotics minor permit provided still trying get waitlist,negative,-0.5848,positive,0.07083333333333335,05/10/2023
comments,yes bme sure would work want biomedical far better option,positive,0.7783,positive,0.3666666666666667,05/10/2023
comments,arriving fall start master program applied campus housing waitlist number 53 chances getting campus housing also look affordable campus housing meantime,positive,0.3527,neutral,0.0,05/10/2023
comments,hello personthingplace explosion1206 thanks feedback personthingplace frankly ever remove bot helps make moderating easier even though may remove relevant posts case encourage user modmail manual approval explosion1206 however agree megathreads annoying since decreased traffic case want work solution guys asking class registration questions talk mods see agree allow class registration class questions asked posts instead comments megathread,positive,0.9612,negative,-0.15,05/10/2023
comments,hey suggest emailing advisor,neutral,0.0,neutral,0.0,05/10/2023
comments,go process gtpd trying track owner register bike end starter bikes sold eventually,neutral,0.0,neutral,0.0,05/10/2023
comments,permits college computing hard come give permits cs minors special form send us phase registration even found coc little unreliable times last spring notoriously left many students without permit including finish minor summer sure works robotics minor advise reaching college computing advisors directly seeing workaround,positive,0.3333,positive,0.08779761904761904,05/10/2023
comments,think graduate internship program rules really allow let register couple hours gra full 20 13 33 mainly provision let thesis writing work intern check career center website exact details,negative,-0.1132,positive,0.17333333333333334,05/10/2023
comments,highkey jealous gra actually work 20 hrs week 40,negative,-0.4588,neutral,0.0,05/10/2023
comments,nope cannot lol check oie however ga work 40 hours per week school break,negative,-0.1695,positive,0.8,05/10/2023
comments,gra gta contingent working jobs campus edit situations missed op stating summer case op whatever wants including taking multiple jobs without classes,negative,-0.5267,neutral,0.03333333333333333,05/10/2023
comments,ok thank like great extracurriculars hard get,positive,0.8909,positive,0.3361111111111111,05/10/2023
comments,work ga 20 hours work intern 20,neutral,0.0,neutral,0.0,05/10/2023
comments,work ga 20 hours work intern 20,neutral,0.0,neutral,0.0,05/10/2023
comments,allowed work 20 hrs full time international student immigration rules allowed work campus gra gra gta rules,neutral,0.0,positive,0.175,05/10/2023
comments,yea likely ga require enroll school gra sort requires enroll classes ga comes hourly wage gra monthly stipend,neutral,0.0,neutral,0.0,05/10/2023
comments,like gpa decent extracurriculars covid year really involved think like clubs kinda hard get applied fall admission got waitlisted denied applied sprig transfer got,positive,0.2484,neutral,0.025000000000000005,05/10/2023
comments,seems pretty competitive familiar atm like program good wanna cs,positive,0.8645,positive,0.44166666666666665,05/10/2023
comments,hell yea,negative,-0.6808,neutral,0.0,05/10/2023
comments,international students work 40 hours summer hence confusion,negative,-0.296,neutral,0.0,05/10/2023
comments,okay try asking boss change status gra ga summer still gonna confirm oie though,positive,0.2263,positive,0.5,05/10/2023
comments,actually work gra part time internship combined total 20 hours less semester spring summer 14 hr wk gra hr wk internship,neutral,0.0,negative,-0.05555555555555555,05/10/2023
comments,hello the_woogee looks like might prospective new student gt welcome gatech around admission season get huge influx common repeated questions new students usually pin thread prospective student questions check megathread subreddit homepage also recommend try searching google subreddit answer question first believe mistake think post truly worthy dedicated post message moderators approve post removed submission message writing submission gatech comments 13e7611 highschool_to_maybe_georgia_tech_recommend 0d 0di think submission approved bot action performed automatically please contact moderators subreddit message compose gatech questions concerns,positive,0.9726,positive,0.17845117845117847,05/10/2023
comments,guess avoid fried shit,negative,-0.7003,negative,-0.2,05/10/2023
comments,yes hard anyway thanks information,positive,0.7633,neutral,-0.04583333333333334,05/10/2023
comments,hi got conditional pathway transfer offer georgia tech summer 2024 going university maryland fall 2023 transfer pathway transfer offer requires two course sequence lab science major trouble finding two course lab sequence could even take university maryland anyone knows better,negative,-0.5916,positive,0.12083333333333333,05/10/2023
comments,gt cs careers club discord channel dedicated find link gt hub discord check cs careers subreddits discord server,positive,0.2023,neutral,0.0,05/10/2023
comments,whats link discord server gt hub,negative,-0.1531,neutral,0.0,05/10/2023
comments,link exactly go discords hub thing put gt email address find georgia techs clubs list labeled gt cs careers club,positive,0.4084,positive,0.25,05/10/2023
comments,80 based everyone know,neutral,0.0,neutral,0.0,05/10/2023
comments,hi im current junior high school wants go computer science industry specifically gaming industry since webpages biased wanted ask current students gpa 1450 sat 31 act retake senior year game development program gatech game development program teachers like hands game development program career connections possible gatech consider going elsewhere please thank lovely day,positive,0.9251,neutral,-0.037777777777777785,05/10/2023
comments,doubt would concrete compendium clubs stuff summer best bet contact clubs interested ask officers directly know parts vgdev things summer instance found discord announcements,negative,-0.2144,positive,0.375,05/10/2023
comments,buzz studios film club going active summer two productions filming atlanta june july,positive,0.508,negative,-0.13333333333333333,05/10/2023
comments,gabe trying beat promoting buzz studios reddit every damn time challenge impossible second president year feel free contact interested,positive,0.749,neutral,-0.004166666666666652,05/10/2023
comments,info got emailed,neutral,0.0,neutral,0.0,05/10/2023
comments,dramatech always stuff,neutral,0.0,neutral,0.0,05/10/2023
comments,juggling club meeting least week dm groupme link,neutral,0.0,negative,-0.3,05/10/2023
comments,think removing ban class discussions would work like wrote post 2340 got removed 2340 name even though mega thread type question start discussion cs 2340 still current state,negative,-0.1406,neutral,0.0,05/10/2023
comments,three years later final obliterated grade,negative,-0.4767,neutral,0.0,05/10/2023
comments,awesome thanks,positive,0.8217,positive,0.6,05/10/2023
comments,fencing least week makerspaces might also open super sure,negative,-0.7692,positive,0.13333333333333333,05/10/2023
comments,relatable graduated final scarred memory life,neutral,0.0,neutral,0.0,05/10/2023
comments,hello googolgamertm welcome gatech appears participated much gatech submit posts subreddit requires minimum account age minimum subreddit specific comment karma count enable time get acquainted subreddit rules using throwaway account please resubmit post main account feel like must use throwaway account privacy purposes must request exception message moderators removed submission message writing post gatech comments 13ec0b5 how_did_yall_get_in_to_georgia_tech 0d 0di think post deserves exception bot action performed automatically please contact moderators subreddit message compose gatech questions concerns,positive,0.8442,positive,0.29444444444444445,05/10/2023
comments,fr one acts summer,neutral,0.0,neutral,0.0,05/10/2023
comments,gt dragonflyers occasional meetings summer interested learning chinese yoyo pm get discord server link,positive,0.5461,positive,0.08333333333333333,05/11/2023
comments,hello kneelbeforegoldtop looks like might prospective new student gt welcome gatech around admission season get huge influx common repeated questions new students usually pin thread prospective student questions check megathread subreddit homepage also recommend try searching google subreddit answer question first believe mistake think post truly worthy dedicated post message moderators approve post removed submission message writing submission gatech comments 13ede4p anyone_take_me_2202_recently_incoming_student 0d 0di think submission approved bot action performed automatically please contact moderators subreddit message compose gatech questions concerns,positive,0.9726,positive,0.17845117845117847,05/11/2023
comments,vietnamese student association viet join hosting official events week welcome lot informal hangouts get food play video games discord stuff,positive,0.7537,positive,0.8,05/11/2023
comments,hello adept setting 2104 welcome gatech appears participated much gatech submit posts subreddit requires minimum account age minimum subreddit specific comment karma count enable time get acquainted subreddit rules using throwaway account please resubmit post main account feel like must use throwaway account privacy purposes must request exception message moderators removed submission message writing post gatech comments 13ef3x1 scheller_college_of_business 0d 0di think post deserves exception bot action performed automatically please contact moderators subreddit message compose gatech questions concerns,positive,0.8442,positive,0.33809523809523806,05/11/2023
comments,think invention studio open,neutral,0.0,neutral,0.0,05/11/2023
comments,nutrition dining hall joke,positive,0.296,neutral,0.0,05/11/2023
comments,gt rowing hosting learn row sessions come see like,positive,0.8236,neutral,0.0,05/11/2023
