type,text,VADER sentiment,VADER sentiment score,TextBlob sentiment,TextBlob sentiment score,date
comments,gotten good advice recap resolving incomplete student instructor make arrangements instructor possible try resolve early semester instructor discretion way extra final schedule end term material still fresh mind incomplete must resolved end next semester enrollment automatically age still recoverable present extra challenges means guaranteed taken final instructor graded computed final semester grade need submit online request grade change instant require approval instructor dean department head designated alternate instructor know url department advise course prerequisite something selected spring term probably removed course registered course may well need permit,positive,0.9531,positive,0.0846153846153846,12/31/2022
comments,thank much stories draft first episode done waiting friend finish composing music recording put january try find someone gatech counseling services answer questions well talk campus police still open stories though want talk let know done without guys,positive,0.8107,positive,0.15,12/31/2022
comments,partial disagree really hard transfer students mesh variety reasons yet good social safety net important keep mental health check attending social events especially first weeks necessary meet peers establish safety net said reasonable cap time spent events,positive,0.719,positive,0.09807692307692305,12/31/2022
comments,impression bs ms students dont option phase reg first sem ur readmitted ive heard,positive,0.2263,positive,0.25,01/01/2023
comments,go frawgs,neutral,0.0,neutral,0.0,01/01/2023
comments,hope refs bail tcu like bailed georgia way hell first,negative,-0.34,positive,0.25,01/01/2023
comments,kicker one fucking job,neutral,0.0,negative,-0.6,01/01/2023
comments,aint happy new year rn uga escaped another win,negative,-0.0541,positive,0.5787878787878787,01/01/2023
comments,big gt fan give ga credit folding good game,positive,0.4324,positive,0.09999999999999998,01/01/2023
comments,dawgs fricken golden horseshoe shoved rear ends shows fairly clean game kicker hit anything longer 48 yds length necessary game winning field goal 50 yes bastards,positive,0.5423,positive,0.061111111111111116,01/01/2023
comments,sorry chief best place college admissions advice bunch students,negative,-0.691,positive,0.25,01/01/2023
comments,suggestion mods pls separate threads admission registration since different audiences people seeking admission vs current students questions classes,positive,0.0772,neutral,0.0,01/01/2023
comments,dual enrollment sure ap much harder get credit least experience,positive,0.5994,neutral,0.03333333333333335,01/01/2023
comments,allowed,neutral,0.0,neutral,0.0,01/01/2023
comments,thwg hail hypnotoad happy new year,positive,0.6124,positive,0.4681818181818182,01/01/2023
comments,tortured fanbase nothing bad ever happens,negative,-0.1901,negative,-0.6999999999999998,01/01/2023
comments,riff ram bah zoo glory hypnotoad go frogs froggies fight hell freezes fight em ice someone fort worth grew die hard tcu fan awful years watched rise relevancy gt alum school maybe home go frogs hell georgia,negative,-0.9287,negative,-0.33055555555555555,01/01/2023
comments,actually available yet able get one even closer deck,neutral,0.0,positive,0.45,01/01/2023
comments,hey able buy semester permits btw,neutral,0.0,positive,0.5,01/01/2023
comments,nope got cs undergrad rn,neutral,0.0,neutral,0.0,01/01/2023
comments,email ur resume laura call ur,neutral,0.0,neutral,0.0,01/01/2023
comments,terms getting takes dual enrollment courses tech like basically guaranteed get course take distance learning dual tech aps beneficial get however dual enrollment courses colleges beneficial ap comes getting credit classes admitted tech,positive,0.8976,neutral,0.0,01/01/2023
comments,happy new year,positive,0.6114,positive,0.4681818181818182,01/01/2023
comments,lol need new glasses review rules football bit tcu get bailed last night targeting call,positive,0.1531,positive,0.31212121212121213,01/01/2023
comments,need graduate applying,neutral,0.0,neutral,0.0,01/01/2023
comments,high school teachers counselors tell ap credits help get never seen evidence true way relatively confident tell students take ap classes gets money directly high school dual enrollment starters whether take dual enrollment ap credits one factors college admittance boards consider find list considered factors tech online important take either one colleges like tech check rigor within high school schedule secondly tech students know never seen indication taking one helped anyone get thirdly spoken college professor stated also believes taking one bearing someone getting admittedly professor tech professor professor within university system georgia terms one beneficial would say dual enrollment without hesitation took much dual enrollment dual enrollment easily provide college credit long verify college dual enroll transfer credit tech also dual enrollment prepares actual structure speed expectations college much better ap ever could think worth noting dual enrolling tech decent degree success near guarantee get however definitely requirement dual enrolled local community college got tech good luck brother tech awesome fun place hope gets join us,positive,0.9971,positive,0.2581818181818182,01/01/2023
comments,nope,neutral,0.0,neutral,0.0,01/01/2023
comments,apply graduate im graduating next spring got fall,neutral,0.0,neutral,0.0,01/01/2023
comments,oh alright thanks help,positive,0.784,positive,0.2,01/01/2023
comments,almost gotta respect built great program hopefully key follows kirby dabos footsteps,positive,0.8632,positive,0.4,01/01/2023
comments,long take finish next spring need go another semesters,neutral,0.0,neutral,-0.025,01/01/2023
comments,qb also fucking run ball get better spot maybe even closer stead tries throw twice reasons fucking hell,positive,0.2382,negative,-0.19999999999999998,01/01/2023
comments,mean cant blame qb choice thats coaches,positive,0.2584,negative,-0.3125,01/01/2023
comments,fair point really botched calls,positive,0.3182,positive,0.44999999999999996,01/01/2023
comments,gt better support us natty understand love see dwags lose almost much want see tech win close,positive,0.5621,positive,0.5,01/01/2023
comments,took get disciple greatest college football coach modern era two decades choke jobs historically weak sec west,negative,-0.296,positive,0.18125,01/01/2023
comments,gtfo damn inbred,negative,-0.4019,neutral,0.0,01/01/2023
comments,brother one asking lmao,positive,0.5994,positive,0.6,01/01/2023
comments,check grade distribution,neutral,0.0,neutral,0.0,01/01/2023
comments,thanks help everyone much appreciated happy new years,positive,0.9168,positive,0.3340909090909091,01/01/2023
comments,asked last night know answer thought students went process might shareable experience,positive,0.4588,neutral,0.0,01/01/2023
comments,huge michigan fan gt grad please trust ohio state much worse uga yeah go horned frogs,positive,0.5896,neutral,2.7755575615628914e-17,01/01/2023
comments,thanks feedback problem reddit allows posts megathreads pinned pin one admission another registration able pin important posts like housing announcements without unpinning could however make post contains links specific megathreads sort acting like gateway experience mod known decrease traffic linked posts help people need answers nonetheless share feedback mods let know decision make,positive,0.4948,positive,0.21666666666666667,01/01/2023
comments,year plan business majors know used one old georgia tech website seem find,neutral,0.0,positive,0.1,01/01/2023
comments,know guys took 50 credits dual enrollment ap didnt know dual enrollment first spent last years highschool college instead became valedictorian highschool year without even seeing anyone hs due inflat gpa college classes admitted gatech advantage also graduated tech sure normal,positive,0.3939,positive,0.1125,01/01/2023
comments,hey yellow jacket applied ga tech started joint enrollment ninth grade online valdosta state dual enrollment tenth grade online columbus state hs senior graduating year early 60 college credits taken ever taken one ap class took ap environmental science studied months get one hardest classes ever taken honestly even worth stressing much college classes lot easier especially dual enrollment foundational ones tldr dual enrollment better option,positive,0.9474,positive,0.24285714285714285,01/01/2023
comments,wow literally situation applied ga tech sure chances made feel lot better thank,positive,0.8661,positive,0.3666666666666667,01/01/2023
comments,actually question applying tech everyone high school counseling office told ap absolutely way go getting accepted higher rigor schools like others mentioned looking back retrospect think school benefits keeping students program ended dual enrolling senior year definitely right decision came tech 40 credit hours combined dual enrollment ap really streamlined registering taking classes every semester spent tech,positive,0.8885,positive,0.12446428571428571,01/01/2023
comments,dual enrollment way go check make sure courses transfer tech ap credits harder earn tech may even take ap stats,positive,0.7351,positive,0.2,01/01/2023
comments,ask advisor,neutral,0.0,neutral,0.0,01/01/2023
comments,already plus advisor new gt thanks tho,positive,0.7206,positive,0.16818181818181818,01/01/2023
comments,believe saw four year plan scheller website somewhere definitely seen one advisors remember one find send,negative,-0.3089,neutral,0.0,01/01/2023
comments,never said bail tcu lol,positive,0.4215,positive,0.8,01/01/2023
comments,minimum requirements course wise calc differential equations linear algebra probability statistics good coding knowledge things matter major,positive,0.7119,positive,0.4875,01/01/2023
comments,wait need take next year probability stats apply credits hs already,positive,0.3612,neutral,0.0,01/01/2023
comments,well still need far degree first apply saying minimum course requirements get maybe 3rd year therefore doesnt really matter major completely still need letters rec professors good georgia tech gpa etc,positive,0.5732,positive,0.2017857142857143,01/01/2023
comments,three friends qcf program undergrad majors aerospace chemical mechanical worth,positive,0.6124,positive,0.3,01/01/2023
comments,pretty helpful know thanks,positive,0.8478,positive,0.225,01/01/2023
comments,really depends career path think want want leave urself open cs almost switched ie ik quite bit curriculum amp threads concentration also went wide range recruiting diff roles feel free message,positive,0.6542,positive,0.125,01/01/2023
comments,swing couch building school music ask around,neutral,0.0,neutral,0.0,01/01/2023
comments,booked marked goes dead page,negative,-0.6486,negative,-0.05,01/01/2023
comments,wish butker,positive,0.4019,neutral,0.0,01/01/2023
comments,gt give ga credit sir piss em,negative,-0.3182,neutral,0.0,01/01/2023
comments,ummmmm sorry piss em go frogs,negative,-0.4588,negative,-0.5,01/01/2023
comments,gt almost gotta respect watch piss em,neutral,0.0314,neutral,0.0,01/01/2023
comments,like play music campanile olden times long ago would chime hour nice repertoire school songs heard decade though quite nice sound analog campanile digital odd one silent,positive,0.1419,positive,0.19761904761904758,01/01/2023
comments,stains would fixed quick pressure wash job,negative,-0.296,positive,0.21666666666666667,01/01/2023
comments,confused renovate entire fountain surrounding area keep old steps,negative,-0.3804,negative,-0.10000000000000002,01/01/2023
comments,joke replaced whole thing lots people complaining back announced need replace amphitheater old fountain,negative,-0.2023,positive,0.10000000000000002,01/01/2023
comments,institute fully renovated fountain area within last year completing construction within last weeks silly ironic opening title area _looks_ though renovations years ago marble blocks uneven pieces stone already broken oxidation stains abound,negative,-0.6597,negative,-0.15,01/01/2023
comments,start program next week undergrad statistics minored math,neutral,0.0,neutral,0.0,01/01/2023
comments,think ought win games deriding georgia,positive,0.2585,positive,0.8,01/01/2023
comments,pretty sure know decent statistics major coursework get qcf profile page saw guy master material sciences engineering columbia qcf gt,positive,0.7579,positive,0.24479166666666666,01/01/2023
comments,ofc yeah wondering theoretically possible finish requirements early also gre gmat seen app requirements idk anything,neutral,-0.0,positive,0.05,01/01/2023
comments,ah ok good know also gre gmat barely know anything could tell studied would really helpful,positive,0.8016,positive,0.3625,01/01/2023
comments,gre gmat entrance exam graduate school took gre plenty prep courses free online,positive,0.5106,positive,0.4,01/01/2023
comments,ah alright thanks,positive,0.636,positive,0.2,01/01/2023
comments,definitely dual enrollment english sociology psychology tech take ap lit credit lang 1101 dual english 1101 1102 take 1102 tech anyways,positive,0.6486,neutral,0.0,01/01/2023
comments,gt gt heard decade though fountain audible innocent sadly may late,negative,-0.1027,negative,-0.09999999999999999,01/01/2023
comments,explains lot honestly,positive,0.4588,positive,0.6,01/01/2023
comments,thought got rid steps entirely thought shitpost beyond ridiculous already rusty months old reason 42069 donate tech edit come reply shitpost would figured 42069 makes clear,negative,-0.3612,neutral,-0.033333333333333326,01/01/2023
comments,probably used good old boy construction company dean students stake know school,positive,0.4404,positive,0.39999999999999997,01/01/2023
comments,hail hypnotoad,positive,0.0772,neutral,0.0,01/01/2023
comments,math 3012 really good,positive,0.4927,positive,0.7,01/01/2023
comments,getting see home team beat alma mater rival going fantastic even know wear tcu hat tech jersey local tcu bar way around,positive,0.5574,positive,0.2,01/01/2023
comments,horrible abomination need crush dwags,negative,-0.6249,negative,-1.0,01/01/2023
comments,sadly think speakers campanile got connected anything renovation spent fair bit time troubleshooting back five years ago fun detour usual duties including climb base shaft recall successful reviving ask around folks see plans,positive,0.8219,neutral,0.012499999999999983,01/01/2023
comments,think oxidation stains runoff grassy area,neutral,0.0,neutral,0.0,01/01/2023
comments,url work anymore new one,neutral,0.0,positive,0.13636363636363635,01/01/2023
comments,tis vintage,neutral,0.0,neutral,0.0,01/01/2023
comments,thank submitting job listing gatech please include job pay salary compensation budget work seeking post include pay details subject removal bot action performed automatically please contact moderators subreddit message compose gatech questions concerns,positive,0.7709,neutral,-0.033333333333333326,01/02/2023
comments,hey resources use,neutral,0.0,neutral,0.0,01/02/2023
comments,main thing used practice exam ncees go really understand solve problems going fine enough would probably look test bank sort,neutral,-0.0258,positive,0.19583333333333336,01/02/2023
comments,thank submitting job listing gatech please include job pay salary compensation budget work seeking post include pay details subject removal bot action performed automatically please contact moderators subreddit message compose gatech questions concerns,positive,0.7709,neutral,-0.033333333333333326,01/02/2023
comments,exactly going say needs power wash look like new,positive,0.3612,positive,0.19318181818181818,01/02/2023
comments,cool,positive,0.4376,positive,0.35,01/02/2023
comments,gt support use gmail find directions many places like link however involved research activities advise,positive,0.548,positive,0.5,01/02/2023
comments,interesting,positive,0.4019,positive,0.5,01/02/2023
comments,amazing,positive,0.5859,positive,0.6000000000000001,01/02/2023
comments,need watch macgyver reruns use magnet string magnet create one striking metal rod hard magnetize banging causes temporary molecular structural alignment ions run end thereby creating magnet believe called inverse magnetostrictive effect mechanical stress applied ferromagnetic material temporarily change magnetic susceptibility material magnet gers stuck drain grate slip something next pass gap,negative,-0.6595,positive,0.06944444444444443,01/02/2023
comments,talk 2nd new pi honest lab pi consider offering help lab find another person labs agree,positive,0.8176,positive,0.24545454545454545,01/02/2023
comments,comments accounts named armchairs saying alts smells funny,positive,0.5927,positive,0.25,01/02/2023
comments,look past years oscar another tool like courseoff gt scheduler see usually offered summer answer question,positive,0.3612,negative,-0.25,01/02/2023
comments,depends specific class others made good points already,positive,0.5927,positive,0.35,01/02/2023
comments,got aa community college florida dual enrollment got knocked entire year credits dual gt gt gt ap thing aware lot stricter stem credit transfers humanities lost year since none stem transferred even still strongly advocate dual,positive,0.5719,positive,0.22777777777777777,01/02/2023
comments,personal website lacks mobile page even simple one business website mobile indication front end skills going hard time luring people join think return university trying make startup,positive,0.2023,negative,-0.09722222222222222,01/02/2023
comments,yeah sorry lol chianli commented shits giggles friend made alt account thing,positive,0.6808,positive,0.15000000000000002,01/02/2023
comments,tf fav part send email,positive,0.4588,neutral,0.0,01/02/2023
comments,lmao bru mans lacks mobile page think solution create one tell go get degree jeez also website pretty cool imo computer,positive,0.9153,positive,0.39999999999999997,01/02/2023
comments,thanks input made personal site long ago making complete top priority mine right right mobile business site unfinished mobile focus time either everything feel need refine encourage check sites desktop sure imperfections glaring issues feel free pm,positive,0.9413,positive,0.24682539682539678,01/02/2023
comments,unnecessary struggled lot essays easiest answer,negative,-0.5764,negative,-0.4,01/02/2023
comments,ty lol,positive,0.6597,positive,0.8,01/02/2023
comments,say put project let jackets know usually goes working type situation burned experience idea man even though op front end experience themself state respondent would need carry wants programmer work project like things typically happen project typically fails end getting lot work done little pay important distinction types projects normal startups offered partial ownership company almost singlehandedly building product founder even bothered incorporate create legal company saying project choose make sure ready work get started make sure position properly compensated legally binding contract get screwed work advice best luck venture,positive,0.9789,positive,0.14305555555555557,01/02/2023
comments,microwave upper level bookstore next buzzard center used forever might wanna check first,neutral,0.0,neutral,0.0375,01/02/2023
comments,going say explicitly sketchy job posting sketchy job posting rules merkytv made considerable case job post described backend included work front end deemed set put bunch work one guy potentially burn whoever works let deter startups gt created great deal successful ones,positive,0.959,positive,0.4125,01/02/2023
comments,2031 takes ton time like 3x time think going take 3084 basically math class take much time expect hour class 3550 took lot time professor liked homeworks well mini projects creating control systems simulink time familiar,positive,0.872,positive,0.39166666666666666,01/02/2023
comments,find woman looking thing scam,positive,0.4585,neutral,0.0,01/02/2023
comments,add manually feature set repeat much work looks,neutral,0.0,positive,0.2,01/02/2023
comments,download ics,neutral,0.0,neutral,0.0,01/02/2023
comments,always done manually like calendar event names specific format repeat weekly feature definitely helps class canceled major event like exam easier edit way,positive,0.9022,neutral,0.020833333333333332,01/02/2023
comments,hmm brown streaks around base tech shaft almost like metaphor something could metaphor imagine help,negative,-0.3089,negative,-0.8,01/02/2023
comments,export schedule gtscheduler ics file import google calendar,neutral,0.0,neutral,0.0,01/02/2023
comments,try get core class concentration done soon help better decide concentration want give time space classes require pre reqs ended able take extra classes fun meet 12 hours,positive,0.8481,positive,0.325,01/02/2023
comments,currently stay woodruff honestly bad issues like residence halls worst thing study business across highway way side big deal bus system stop right infront willage overall think woodruff perfect want keep finances low say 5th floor woodruff south got renovated recently still choice getting rooms,positive,0.5372,neutral,-0.046031746031746014,01/02/2023
comments,much connected student center staff utilize speaker tech rec area,neutral,0.0,positive,0.05,01/02/2023
comments,thank detailed reply,positive,0.4199,positive,0.4,01/02/2023
comments,bearded dragon,neutral,0.0,neutral,0.0,01/02/2023
comments,hi wanted ask rule post violates read rules nothing popped violate rule take know post looks little sketchy trying get something going wanted ask around interest,positive,0.1901,negative,-0.1875,01/02/2023
comments,please read rule current state post business model uncomfortable letting stay op revised business model possible approved future previous startup posts sub try looking,positive,0.3612,negative,-0.13333333333333333,01/02/2023
comments,see take post shortly thank assistance,positive,0.3612,neutral,0.0,01/02/2023
comments,deposits new students open tried paying think opened yet since said payments available yet,negative,-0.4215,positive,0.1787878787878788,01/02/2023
comments,yellow buzz got mutation gif emote free_emotes_pack sweat_smile gif emote free_emotes_pack sweat_smile gif emote free_emotes_pack smile,neutral,0.0,positive,0.15,01/02/2023
comments,subleasing roomy home park house may end july bedrooms baths kitchens fridges parking cars 20 yearly street parking 859 monthly rent negotiable utilities right next goodfellas north campus half block away bio quad area campus across street green bus route stop want walk bike campus open groups individuals rooms available summer dm info must student intern sublease,negative,-0.5859,positive,0.05317460317460317,01/02/2023
comments,wow glad lazy ignored,positive,0.4588,positive,0.11666666666666665,01/02/2023
comments,use courseoff click share charge well,positive,0.5106,neutral,0.0,01/02/2023
comments,found could send,neutral,0.0,neutral,0.0,01/03/2023
comments,start going school chemical engineering website looking admission requirements electrical engineering need contact officials guarantee 99 information need already online,positive,0.25,neutral,0.0,01/03/2023
comments,,neutral,0.0,neutral,0.0,01/03/2023
comments,page also lists people contact,neutral,0.0,neutral,0.0,01/03/2023
comments,thanks,positive,0.4404,positive,0.2,01/03/2023
comments,last time years ago machines qr codes could scan watch short video use doubt replaced still available also intimidated everybody either new new point,positive,0.4416,positive,0.13454545454545455,01/03/2023
comments,spring 2023 fall 2023 rising second year date gth website says jan 18th housing application opens mean need select building room want live come later,positive,0.1154,neutral,-0.04403409090909091,01/03/2023
comments,question graduation requirements core humanities 1101 1102 credits count towards regular english requirements classes count towards two requirements time,positive,0.4329,neutral,0.0,01/03/2023
comments,gt 36 credit hours coming double major math physics years read need 36 hours separate coursework double major amount credits coming major math physics without increase workload someone done familiar advise,positive,0.5687,positive,0.09375,01/03/2023
comments,without increase workload mean calculate fit hours semesters summer semesters pretty sure could question whether whether would enjoy hard shit little life outside classes made best friends gt would recommend enjoying something besides academics,positive,0.9667,positive,0.18712121212121213,01/03/2023
comments,catalyst midtown 1329 month negotiable fully furnished room living room plenty amenities features 24 hr gym kitchen appliances etc dm details takeover 1b1b 4b4b approx 10 15 minutes gt campus lease ends may 31 short lease need find someone else takeover case summer plans dm details interested,positive,0.561,positive,0.125,01/03/2023
comments,catalyst midtown 1329 month negotiable fully furnished room living room plenty amenities features 24 hr gym kitchen appliances etc dm details takeover 1b1b 4b4b approx 10 15 minutes gt campus lease ends may 31 short lease need find someone else takeover case summer plans dm details interested,positive,0.561,positive,0.125,01/03/2023
comments,many mris piedmont west intersection howell mill 75 went chemo radiation last year,neutral,0.0,positive,0.25,01/03/2023
comments,sure last tech could subscribe full package adobe cc reduced student price usg technology store believe free went something like 200 year place fitbit fiasco started believe,positive,0.4155,positive,0.3125,01/03/2023
comments,try opi outpatient imaging multiple locations great prices,positive,0.6249,positive,0.4,01/03/2023
comments,second opi got mri done,neutral,0.0,neutral,0.0,01/03/2023
