type,text,VADER sentiment,VADER sentiment score,TextBlob sentiment,TextBlob sentiment score,date
comments,oh nice see website thanks,positive,0.7177,positive,0.4,05/16/2023
comments,clue thanks,positive,0.2481,positive,0.2,05/16/2023
comments,ok freshman,positive,0.296,positive,0.5,05/16/2023
comments,thank submitting news gatech post pertains sports please amend flair sports already please include link news source helps people learn verify information bot action performed automatically please contact moderators subreddit message compose gatech questions concerns,positive,0.8832,positive,0.1,05/16/2023
comments,gonna ask question looks like resolution bad,negative,-0.4572,negative,-0.6999999999999998,05/16/2023
comments,says online lol know ga tech works transfer students would like live campus,positive,0.6486,positive,0.4681818181818182,05/16/2023
comments,roof es,neutral,0.0,neutral,0.0,05/16/2023
comments,quick patched,neutral,0.0,positive,0.3333333333333333,05/16/2023
comments,bro also psyching much want get feel like smart enough school,positive,0.1661,positive,0.13809523809523808,05/16/2023
comments,hello huevaberto looks like might prospective new student gt welcome gatech around admission season get huge influx common repeated questions new students usually pin thread prospective student questions check megathread subreddit homepage also recommend try searching google subreddit answer question first believe mistake think post truly worthy dedicated post message moderators approve post removed submission message writing submission gatech comments 13jejib testing_out_of_courses_at_gt_math_2550_and_psyc 0d 0di think submission approved bot action performed automatically please contact moderators subreddit message compose gatech questions concerns,positive,0.9726,positive,0.17845117845117847,05/16/2023
comments,top gtri parking deck absolutely glorious views every way,positive,0.7639,positive,0.35,05/16/2023
comments,always wondered like never go crc crc fee,positive,0.3026,neutral,0.0,05/16/2023
comments,exceptions crc stamps health athletics fees generally require co opting interning think exempt part time student,positive,0.1531,positive,0.05000000000000002,05/16/2023
comments,take class mandatory fees mandatory,positive,0.0772,neutral,0.0,05/16/2023
comments,crosland willage 3rd floor balcony outside dining hall stucen 3rd floor windows good,neutral,0.0,positive,0.175,05/16/2023
comments,wait get roof,neutral,0.0,neutral,0.0,05/16/2023
comments,hello upbeat_frosting_2743 welcome gatech appears participated much gatech submit posts subreddit requires minimum account age minimum subreddit specific comment karma count enable time get acquainted subreddit rules using throwaway account please resubmit post main account feel like must use throwaway account privacy purposes must request exception message moderators removed submission message writing post gatech comments 13jgcat should_i_transfer_colleges_as_a_premed 0d 0di think post deserves exception bot action performed automatically please contact moderators subreddit message compose gatech questions concerns,positive,0.8442,positive,0.29444444444444445,05/16/2023
comments,hello thatgirldelia2 welcome gatech appears participated much gatech submit posts subreddit requires minimum account age minimum subreddit specific comment karma count enable time get acquainted subreddit rules using throwaway account please resubmit post main account feel like must use throwaway account privacy purposes must request exception message moderators removed submission message writing post gatech comments 13jgifi should_i_transfer_colleges_as_a_premed 0d 0di think post deserves exception bot action performed automatically please contact moderators subreddit message compose gatech questions concerns,positive,0.8442,positive,0.29444444444444445,05/16/2023
comments,invention studio opens 22nd,neutral,0.0,neutral,0.0,05/16/2023
comments,hello gayman9000 welcome gatech appears participated much gatech submit posts subreddit requires minimum account age minimum subreddit specific comment karma count enable time get acquainted subreddit rules using throwaway account please resubmit post main account feel like must use throwaway account privacy purposes must request exception message moderators removed submission message writing post gatech comments 13jh0l9 two_questions_about_the_fafset_orientation 0d 0di think post deserves exception bot action performed automatically please contact moderators subreddit message compose gatech questions concerns,positive,0.8442,positive,0.29444444444444445,05/16/2023
comments,hello illustratortrick3745 looks like might prospective new student gt welcome gatech around admission season get huge influx common repeated questions new students usually pin thread prospective student questions check megathread subreddit homepage also recommend try searching google subreddit answer question first believe mistake think post truly worthy dedicated post message moderators approve post removed submission message writing submission gatech comments 13jh43e incoming_graduate_student_looking_for_roommates 0d 0di think submission approved bot action performed automatically please contact moderators subreddit message compose gatech questions concerns,positive,0.9726,positive,0.17845117845117847,05/16/2023
comments,increase tuition tech looks like hope scholarship amount increases next year state students love said cut tech budget unlikely able hire professors instructors keep student instructor ratios miserably high,positive,0.6996,positive,0.132,05/16/2023
comments,great select state students get admitted scholarships made flagship institutions impossible access georgian students take advantage scholarship get relegated directional schools,positive,0.7845,positive,0.06666666666666671,05/16/2023
comments,ulc balcony 4th floor facing east,neutral,0.0,neutral,0.0,05/16/2023
comments,mine took complete reason professor missed email asking signature complete form signed opt days,negative,-0.296,positive,0.1,05/16/2023
comments,yes source originally applied cs applied compe transfer might depend transfer offer though would ask admissions,positive,0.4019,positive,0.375,05/16/2023
comments,hello stunningcommunity241 welcome gatech appears participated much gatech submit posts subreddit requires minimum account age minimum subreddit specific comment karma count enable time get acquainted subreddit rules using throwaway account please resubmit post main account feel like must use throwaway account privacy purposes must request exception message moderators removed submission message writing post gatech comments 13jhyft what_to_do_in_summer_onaround_campus_as_a_new 0d 0di think post deserves exception bot action performed automatically please contact moderators subreddit message compose gatech questions concerns,positive,0.8442,positive,0.29444444444444445,05/16/2023
comments,repp courses completed still got denied debating saying fuck applying uga spring instead waiting summer done repp stats worse ee get gt repp done doubt,negative,-0.8468,negative,-0.4,05/16/2023
comments,hey transferred conditional semester clayton state try best give advice understanding sounds like heading freshman year try help experience shoes first major gsu matter apply around november gain access tech application portal able apply transfer student upload copy unofficial transcript importantly select major admission tech clayton cs major computer engineering major think asked something major application think reason verify told understanding tech cares gpa classes taken amount classes taken minimum 30 hours post highschool want note super important least enroll major kind close want registration purposes gsu example imagine communications major would issues getting higher level math classes got plenty time need restart admissions process mostly make sure taken classes least stem overall gpa also reach gsu repp dual degree coordinat help got special back channels ask gt admissions department questions directly also recommend go ahead email undergraduate admissions office verify help need please hesitate reach either responding pm ing best luck,positive,0.9954,positive,0.25116567460317457,05/16/2023
comments,cscareerquestions,neutral,0.0,neutral,0.0,05/16/2023
comments,yeah taking remote classes idk theyre still charging crc health bus fees etc,positive,0.0859,negative,-0.1,05/16/2023
comments,would also post facebook groups like gt thrift shop lot students sublease ask opinions ppl lived apartments give recent honest answer,positive,0.7845,positive,0.3,05/16/2023
comments,campus yes campus getting trouble campus could put tough spot someone else could keep cat parents avoid course action might end returning cat shelter stressful cat atlanta shelters always stretched thin think long term plans keeps cat breaks graduation 10 maybe 15 years litter boxes need regular upkeep daily every day sometimes smell matter sometimes cat track litter everywhere like silly kitty regular vacuuming cleaning needed feasibly handle things dorm cats need playtime exercise attention guarantee needs met everyday true need much floor space dog would still enrichment needs vertical space goes long way guarantee safe place hide take time alone also lot people cat allergies varying degrees would considerate guests people come close contact highly highly recommend fostering try adopt shelter cover foster cat expenses including healthcare roommates opportunity assess whether permanent forever cat still good idea fostered around 20 cats one time last year campus apartment technically pet rental fee never actually charged use lifeline animal services typically visit locations chamblee one nearby fulton county animal services think recently opened new location atlanta humane society used,positive,0.9655,neutral,0.006122090469916547,05/16/2023
comments,yes repp courses completed along around extra classes giving total 60 credits application process luck dependent likely killed application unpaid community work guessing reviewers really care jobs would prefer see unpaid community work instead also means gpa credits probably less pull typical transfer average gpa 55 credits selling community service could still get would put full faith due holistic review process uncertain mistakenly led believe repp state working 30 hours per week top average gpa credit hours would get plan applying try get much community service completed really stand could well get,positive,0.3562,positive,0.05572916666666666,05/16/2023
comments,wait need professor signature,neutral,0.0,neutral,0.0,05/16/2023
comments,gpa drops,neutral,0.0,neutral,0.0,05/16/2023
comments,also college would say comes close tech thinking kennesaw spceet sure,negative,-0.3491,positive,0.5,05/16/2023
comments,yes get priority registration flexible deadlines depending severity may even help getting class rides car takes wheelchair users online material tests professor talk ods see much documentation would need sometimes describing symptoms saying youre process getting diagnosis enough,positive,0.743,positive,0.1,05/16/2023
comments,oh thought meant hope scholarship,positive,0.4404,neutral,0.0,05/16/2023
comments,also meal packing food orgs go donate atlanta homeless community remember name though,neutral,0.0,neutral,0.0,05/16/2023
comments,would definitely wear sneakers random totally unscripted stroll though,positive,0.4019,negative,-0.16666666666666666,05/16/2023
comments,great prepared definitely prepared find reading doc like script consider bullet points even pictures jog memory speak naturally authentically practicing presentation skills would helpful find difficult form thoughts without script know everyone finds meaning purpose working identifying makes passionate really elevate confidence make less stressful interview someone know chose major watched loved one get prosthetic leg learn live passionate low cost medical devices maybe story true shows interviewer looking paycheck potential good colleague asset company maybe another useful exercise think would like see candidate think group mates classmates past thought underperformed performed really well qualities made ideal work made difficult consider embody qualities admire people tailor responses around kind try take lessons away every interview experience got,positive,0.996,positive,0.16055440771349863,05/16/2023
comments,gt cs careers club lot students similar situations answer question directly market rough year think without solid internships took lot apps applying early land anything good graduating end year would start applying anything open mass july august new grad positions open force feel free drop resume discord server linked want critique,positive,0.6095,positive,0.13363636363636364,05/16/2023
comments,anything helpful add like paying dining related student center fee basically closed exceptions limited hours near lunchtime one two places really annoyed order work gra research full time means paying 506 10 fees 12 hours non credit research class literally paying income call living poverty level income,negative,-0.7572,neutral,-0.0316326530612245,05/16/2023
comments,also dumb,negative,-0.8519,negative,-0.375,05/16/2023
comments,tech ridiculous,negative,-0.3612,negative,-0.3333333333333333,05/16/2023
comments,yes fine want triple check email academic advisor,positive,0.4019,positive,0.20833333333333334,05/16/2023
comments,man treat got 20 submit everything work permit weeks ago still waiting checked processing time uscis website says weeks 80 f1 cases little worried heard anything uscis stay 60 days graduation without work permit uscis authorization already graduated grey zone waiting 60 day period probably email check 20 file work permit asap get another 90 days find job day work permit approved making max 150 days total time right everything goes favor probably push little may odds ever favor,positive,0.8682,neutral,-0.027857142857142858,05/16/2023
comments,hello frequent training757 welcome gatech appears participated much gatech submit posts subreddit requires minimum account age minimum subreddit specific comment karma count enable time get acquainted subreddit rules using throwaway account please resubmit post main account feel like must use throwaway account privacy purposes must request exception message moderators removed submission message writing post gatech comments 13jkgmf check_for_student_grants_its_a_simple_step_that 0d 0di think post deserves exception bot action performed automatically please contact moderators subreddit message compose gatech questions concerns,positive,0.8442,positive,0.2666666666666667,05/16/2023
comments,anything helpful add like paying dining related student center fee basically closed exceptions limited hours near lunchtime one two places student center fees relate dining specifically two fees pay related operations building debt service pay neither stop summer fees lower spring,negative,-0.4798,neutral,-0.03877551020408164,05/16/2023
comments,meant advisor sorry needs sign opt recommendation thingy oie issue updated 20,negative,-0.0772,negative,-0.5,05/16/2023
comments,would much expensive use crc could opt fee,neutral,0.0,negative,-0.5,05/16/2023
comments,lack context know exactly asking however sounds like something would kept confidential security,positive,0.3818,positive,0.25,05/16/2023
comments,found link policy library listed jobs georgia tech link gives 404 error assumed updated one somewhere,negative,-0.5499,neutral,0.0,05/16/2023
comments,probably aware advisor involved opt process reaching confirm thank btw crucial info,positive,0.5562,positive,0.125,05/16/2023
comments,already said people page go annoy oie person,negative,-0.4404,neutral,0.0,05/16/2023
comments,anyone master doc groupmes classes summer 2023,neutral,0.0,neutral,0.0,05/16/2023
comments,may defer reject offer already past deadline cpt submission,negative,-0.5994,negative,-0.25,05/16/2023
comments,nice shot share details camera lens film,positive,0.686,positive,0.6,05/16/2023
comments,fees drive crazy also make us pay instead payroll deduction get taxed income pay right back,negative,-0.5411,negative,-0.10476190476190476,05/16/2023
comments,find lmk,neutral,0.0,neutral,0.0,05/16/2023
comments,yeahhh sounds good concept face horribly disfigured upscale model,negative,-0.5647,negative,-0.15000000000000002,05/16/2023
comments,admissions already got email saying pathways results june 15th,neutral,0.0,neutral,0.0,05/16/2023
comments,yeah got decision april 1st pun intended think remember reading somewhere report midpoint grades review app get done freshman either june july report midpoint grades met criterion sounds like something might gone wrong call admissions department asap try explain situation,positive,0.1531,negative,-0.5,05/16/2023
comments,way fall 2023 right,negative,-0.296,positive,0.2857142857142857,05/16/2023
comments,sadly true required usg even state law really appealing part,negative,-0.3597,positive,0.425,05/16/2023
comments,reported fall semester grades turned spring semester grades cause deadline grades june 1st,neutral,0.0,neutral,0.0,05/16/2023
comments,oh summer 23 conditionals admit summer semester pathways get admitted fall semester conditiona applicant submit midpoint grades review app later get spring semester grades double check admission portal clarify pathway sounds like another pathway need help hesitate pm,positive,0.815,neutral,0.0,05/16/2023
comments,double check pathway portal let take pm need help,positive,0.5081,neutral,0.0,05/16/2023
comments,ohhh makes sense first gen pathway,neutral,0.0,positive,0.25,05/16/2023
comments,gotcha yeah pretty sure guys admit fall glad figured starting get worried,positive,0.88,positive,0.3125,05/16/2023
comments,state truthfully looked uga state backup list 20 state schools looking know picky gt also feel like need something make application better community work probably good idea,positive,0.9191,positive,0.5666666666666667,05/16/2023
comments,hello ckennyc4 looks like might prospective new student gt welcome gatech around admission season get huge influx common repeated questions new students usually pin thread prospective student questions check megathread subreddit homepage also recommend try searching google subreddit answer question first believe mistake think post truly worthy dedicated post message moderators approve post removed submission message writing submission gatech comments 13jpufr help_with_misconduct_violation 0d 0di think submission approved bot action performed automatically please contact moderators subreddit message compose gatech questions concerns,positive,0.9726,positive,0.17845117845117847,05/16/2023
comments,partly historical crc originally built venue 96 olympics sold tech fee usg tech intended pay facility upkeep staffing,negative,-0.1027,positive,0.1875,05/17/2023
comments,50 gt 2022 class georgia acceptance rate 35 state 13 state source,positive,0.4588,neutral,0.0,05/17/2023
comments,lol remote international covid nothing got waived except 100 fee,positive,0.4215,positive,0.23333333333333336,05/17/2023
comments,thank submitting job listing gatech please include job pay salary compensation budget work seeking post include pay details subject removal bot action performed automatically please contact moderators subreddit message compose gatech questions concerns,positive,0.7709,neutral,-0.033333333333333326,05/17/2023
comments,hello popular sympathy 696 welcome gatech appears participated much gatech submit posts subreddit requires minimum account age minimum subreddit specific comment karma count enable time get acquainted subreddit rules using throwaway account please resubmit post main account feel like must use throwaway account privacy purposes must request exception message moderators removed submission message writing post 0d 0di think post deserves exception bot action performed automatically please contact moderators subreddit message compose gatech questions concerns,positive,0.8442,positive,0.33809523809523806,05/17/2023
comments,scholarship given state students make impossible state students get accepted,positive,0.2732,negative,-0.6666666666666666,05/17/2023
comments,actually looking hire cs grad right ideally atlanta based interest energy sector huge plus anyone sees looking send dm,positive,0.8481,positive,0.39642857142857146,05/17/2023
comments,tech known outrageous student fees gotten better without special institutional fee still get upvote,negative,-0.1727,neutral,-0.047619047619047616,05/17/2023
comments,try calling said get hopes learning experience,negative,-0.3252,neutral,0.0,05/17/2023
comments,rates dated yesterday approved usg gt announced yet housing increase going happen sooner later rates increased four years find housing anywhere gone period next year tech apartments increasing 42 121 semester span four years gsu comparable units 4br 2ba gone anywhere 391 semester 546 semester uga comparable units increased 322 semester source archives page dining rates going uga rate increase least point pay raises one potential reason rank file tech dining employees started 12 hr 2021 start 15 38 per spreadsheet ydsa shared petition,positive,0.8227,negative,-0.22000000000000003,05/17/2023
comments,shout ydsa advocacy glad getting better wages,positive,0.836,positive,0.5,05/17/2023
comments,hello muchtodoabtnothing welcome gatech appears participated much gatech submit posts subreddit requires minimum account age minimum subreddit specific comment karma count enable time get acquainted subreddit rules using throwaway account please resubmit post main account feel like must use throwaway account privacy purposes must request exception message moderators removed submission message writing post gatech comments 13k3laj internship_in_atlanta_new_to_atlanta 0d 0di think post deserves exception bot action performed automatically please contact moderators subreddit message compose gatech questions concerns,positive,0.8442,positive,0.29444444444444445,05/17/2023
comments,given last day finals 12 14 first day spring classes get 12 15 24 days,neutral,0.0,positive,0.125,05/17/2023
comments,submission removed violating rule poor title titles must descriptive post body link clickbait readers able know post going reading title use poor grammar lazy abbreviations ur plz please include irrelevant commentary title hi reddit plz help sure right place ask use excessive punctuation please improve title try post believe mistake message moderators removed submission message writing submission gatech comments 13k4r38 compe_ppl_how_restricted_are_cs_classes_during 0d 0di think submission approved bot action performed automatically please contact moderators subreddit message compose gatech questions concerns,negative,-0.7999,neutral,-0.04603174603174604,05/17/2023
comments,appears may seeking advice regarding specific classes submission removed per rule seeking advice class registration please post question comment appropriate megathread seeking information specific class recommend directly contacting class professor ta academic advisor believe mistake message moderators removed submission message writing submission gatech comments 13k4wv6 is_cs3600_like_cs50s_intro_to_ai_course 0d 0di think submission approved bot action performed automatically please contact moderators subreddit message compose gatech questions concerns,positive,0.7579,positive,0.11666666666666665,05/17/2023
comments,ms cybersecurity decisions gotten decision yet consider reject go ahead usc,negative,-0.4696,neutral,0.0,05/17/2023
comments,submission removed gatech following reason rule post belongs megathread reply message auto generated message questions message moderators removed submission message writing submission 0d 0dmy issue,neutral,0.0,neutral,0.0,05/17/2023
comments,hello everyone would appreciate advice currently summer transfer admit taking classes however failed one required classes transfer major extenuating circumstance last minute fail due slacking classes currently retaking class right georgia tech emailed admissions said would review transcript require explanation needed wondering chances rescinded anyone advice know summer transfer similar position thanks,positive,0.775,negative,-0.057678571428571426,05/17/2023
comments,hi society collegiate leadership achievement multidisciplinary honor society 90 000 members 650 universities colleges nationwide scla mission help students transition college post college career members access online learning platform focuses four areas academic career financial literacy health wellness life skills student receives individualized development plan curated content help prepare achieve professional goals scla community offers powerful networking opportunities 90 000 peers connect network various stages careers fields online community events webinars keep members connected offer opportunities develop critical skills prepare jobs internships graduate school offer scholarship events well please reach questions concerns best belinda scla member services,positive,0.9756,positive,0.1875,05/17/2023
comments,12 25 campus closed semester ends 12 14,neutral,0.0,negative,-0.1,05/17/2023
comments,next year tech apartments increasing 42 semester think upperclassman apartments like nav increased 242 42,positive,0.5574,neutral,0.0,05/17/2023
comments,annoying process submit careebuzz first approval submits oie wait approval stage took weeks month late annoying thing oie says expedite process best thing soon post careerbuzz try see get push expedite afterwards wait oie try asking expedite start working authorized circumstance ask employer push start date back get authorized like others said try also annoying oie person see help,positive,0.8307,negative,-0.20714285714285716,05/17/2023
