type,text,VADER sentiment,VADER sentiment score,TextBlob sentiment,TextBlob sentiment score,date
comments,hello young padawan still got many years ahead really envy youth lots profs gatech willing accept free labor labs gotta email expressing interest would spend time reading abstracts profs interested research read projects lab pages typically project page publication page may lack expertise many advanced biomolecular techniques encounter something understand reading page search wikipedia learn additionally coding less knowledge barrier see certain bio medicinal labs mathematical modelling typically require advanced mathematics like linear algebra differential equations need know solve analytically,positive,0.9422,positive,0.19387755102040818,01/06/2023
comments,online humanities course recommendations,neutral,0.0,neutral,0.0,01/06/2023
comments,bump,neutral,0.0,neutral,0.0,01/06/2023
comments,yes definitely enough think almost next,positive,0.6597,neutral,0.0,01/06/2023
comments,freshman bme major wondering schedule would doable alongside research bmed 2110 math 2552 phys 2211 engl 1102 mse 2001 math 2552 phys 2211 engl 1102,neutral,0.0,positive,0.0625,01/06/2023
comments,probably get,neutral,0.0,neutral,0.0,01/06/2023
comments,find good boi,positive,0.5228,positive,0.7,01/06/2023
comments,yet hopefully tomorrow,negative,-0.3716,neutral,0.0,01/06/2023
comments,good luck thoughts good boi,positive,0.7345,positive,0.7,01/06/2023
comments,yeah first year room part honors llc,positive,0.6705,positive,0.25,01/06/2023
comments,dm might someone ask,neutral,0.0,neutral,0.0,01/06/2023
comments,love spring dining rants posted monthly basis lol,positive,0.6908,positive,0.65,01/06/2023
comments,gtia,neutral,0.0,neutral,0.0,01/06/2023
comments,korean fairly easy online,positive,0.4404,positive,0.43333333333333335,01/06/2023
comments,shared gt cat pic groupme reach longer home park groupme someone send done already,positive,0.2655,neutral,0.0,01/06/2023
comments,might dumb question become apart honors llc,neutral,0.0,negative,-0.375,01/06/2023
comments,hey sent friend request discord lot similar interests video games dungeons dragons digital art stuffed animals also 2nd year switching major lmc soon,positive,0.6996,neutral,0.015625,01/06/2023
comments,familiar proctoring covid non covid online classes summer may slightly different general proctoring mild wild depending professor class done ones quiz canvas time limit nothing another join microsoft teams meeting turn cameras hardcore used exam lockdown browser,positive,0.4215,positive,0.17166666666666666,01/06/2023
comments,cat got couple times back living hp cats smart know house left put familiar wet food stinkier better dirty laundry cat likes thus smell put near enterance home open without startling cat ideally would outside sliding glass door see staying inside stay somewhere keep food laundry sight prepared wait hours repeat tomorrow cats usually come back get cold hungry stubborn take days decide want return strat cats return gently coax towards couple nibbles start pet amenable scruff firmly quickly carry back inside good luck keep eyes peeled familiar friendly smells best bet summoning kitty home quickly,positive,0.9763,positive,0.14816468253968254,01/06/2023
comments,pretty much first years share traditional dorm rooms gt mentioned apply honors lc private bedroom apartment first year costs extra first year campus housing apartment style private bedroom bathroom shared one person common living kitchen area shared,positive,0.9364,positive,0.07777777777777778,01/06/2023
comments,apply already heard,neutral,0.0,neutral,0.0,01/06/2023
comments,dm ed,positive,0.4588,neutral,0.0,01/06/2023
comments,look thank,positive,0.4199,neutral,0.0,01/06/2023
comments,thank submitting news gatech post pertains sports please amend flair sports already please include link news source helps people learn verify information bot action performed automatically please contact moderators subreddit message compose gatech questions concerns,positive,0.8832,positive,0.1,01/06/2023
comments,entirely depends want get move,positive,0.0772,neutral,0.0,01/06/2023
comments,application get gt basically anyone applies gets,positive,0.1406,neutral,0.0,01/06/2023
comments,anyone taken leamy 2202 wondering good professor exams doable going retaking dynamics thermo get waitlist want see leamy class doable took wood last semester great teacher exams absurdly hard resemble homework practice problems whatsoever good grasp dynamics end passing,positive,0.7615,positive,0.38166666666666665,01/06/2023
comments,think fixed exam schedules banned general college let us students choose exam times students suffer literally less points away getting final precalculus exam sleep deprived painfully hungry sometimes fixed exam schedules made skip whole meal screw fixed exam schedules sick math exams painful empty stomach painfully hungry exams bad sleep deprived fixed exam schedules painful unhealthy like nobody wants even deserves starved sleep deprived meal times,negative,-0.9938,negative,-0.23711484593837534,01/06/2023
comments,likely get class waitlist position number 35 likely phase possible get class,positive,0.168,neutral,0.0,01/06/2023
comments,possible else try friday waitlists dropped,neutral,0.0,neutral,0.0,01/06/2023
comments,following,neutral,0.0,neutral,0.0,01/06/2023
comments,idea waitlist starts moving open seats class since phase waitlist since phase bio class btws know cs waitlist supposed start today get emails bio department,neutral,0.0,neutral,0.0,01/06/2023
comments,deep learning right took last semester legit fastest moving weight list ever see think went 50 class day weight list started moving fun class problem sets intimidating af,negative,-0.7391,positive,0.1464285714285714,01/06/2023
comments,class,neutral,0.0,neutral,0.0,01/06/2023
comments,cs 2050,neutral,0.0,neutral,0.0,01/06/2023
comments,know,neutral,0.0,neutral,0.0,01/06/2023
comments,7641 ml 7643 deep learning,neutral,0.0,neutral,0.0,01/06/2023
comments,one fastest moving weight list likely get weight list however took yrs ago lot changed since chance always sometimes waitlists math classes move surprisingly fast,positive,0.5411,positive,0.1,01/06/2023
comments,someone please explain intro physics phys 2211 registration codes genuinely idea class section goes lab section,neutral,0.0258,positive,0.4,01/06/2023
comments,waitlist position bigger waitlist master student registering graduate level class class full waitlist capacity 150 waitlist actual 129 means still 21 waitlist seats available however check student detail schedule says waitlist position class 254 possible appreciate insights,positive,0.5191,positive,0.15,01/06/2023
comments,clarify aiming double count classes sem become full ms students fall right,negative,-0.296,positive,0.2119047619047619,01/06/2023
comments,yep specialization,positive,0.296,neutral,0.0,01/06/2023
comments,check student detail schedule waitlist combined undergrad grad crosslisted version class might able find true position taking 254 total capacity undergrad,positive,0.4215,positive,0.2833333333333333,01/06/2023
comments,admitted 12 30 friends admitted two weeks hopefully decisions still released best luck,positive,0.9392,positive,1.0,01/06/2023
comments,waitlist position popped log oscar 403 forbidden fuck going amp x200b edit anyone else experiencing issue registrar tells received reports outages please make reports issue,negative,-0.7351,negative,-0.4,01/06/2023
comments,thing,neutral,0.0,neutral,0.0,01/06/2023
comments,slightly less freaked knowing thank,negative,-0.4095,negative,-0.16666666666666666,01/06/2023
comments,yea thing happened bunch waitlisted courses right 2pm got emails saying popped time something going still get oscar either gt awful registration,negative,-0.3751,negative,-0.35714285714285715,01/06/2023
comments,likely get psyc 2210 waitlist still heard anything back yet,neutral,0.0,neutral,0.0,01/06/2023
comments,registrar tells received reports outages please make report outage,neutral,0.0258,neutral,0.0,01/06/2023
comments,registrar tells received reports outages please make report outage,neutral,0.0258,neutral,0.0,01/06/2023
comments,lots good info items consider weeks pretty vague would choose either ask something like shadow pi lab member week longer term research project would look pretty sweet college application essay feel like shadow cop also may interesting shadow grad student post doc spend lot time lab researching someone 18 lab rough pi anyone interact need noted take training class need agendas signed ok guardian forms student shadow afternoon time prep wrap high schooler may dissuade pis saying yes may forget follow whole procedure others noted would cast wide net yet also look places like emory gsu,positive,0.9793,positive,0.18416666666666667,01/06/2023
comments,hour buzzport still everyone else,neutral,0.0,neutral,0.0,01/06/2023
comments,heads limit beyond two hour daily reservation instance could reserve every day two hours need extend reservation beyond two hour limit day student assistant print studio able help,positive,0.5267,positive,0.25,01/06/2023
comments,make sure report incident 30 minutes ago registrar unaware issues,positive,0.128,positive,0.25,01/06/2023
comments,hopefully everyone else,positive,0.4574,neutral,0.0,01/06/2023
comments,wait online suny course equivalent,neutral,0.0,neutral,0.0,01/06/2023
comments,end dorming people need private place things like prayer reservations spaces student center formerly available exhibition hall sure something solution end less favorable situation,positive,0.8476,positive,0.12666666666666668,01/06/2023
comments,trouble logging anything gt related around time posted think fixed though,neutral,0.0343,neutral,-0.03333333333333333,01/06/2023
comments,back,neutral,0.0,neutral,0.0,01/06/2023
comments,got thanks,positive,0.4926,positive,0.2,01/06/2023
comments,first year upperclassman housing apartment style,neutral,0.0,positive,0.25,01/06/2023
comments,could someone add google docs classes orgs clubs semester think helpful,positive,0.4215,neutral,0.0,01/06/2023
comments,grading pay hours per week allotted class based course enrollment courses multiple graders 3000 4000 level really depends course number sections pay increased last semester first time awhile information website date grading homework exams allowed dependent instructor needs help graders asked continue working needed final exam week including helping grading final exams questions hesitate mail,positive,0.89,positive,0.075,01/06/2023
comments,board game club play rpg type games,positive,0.34,negative,-0.4,01/06/2023
comments,sure case honors program llcs general probably highest chance getting room though definitely guaranteed,positive,0.773,positive,0.18333333333333335,01/06/2023
comments,shower comments sub reddit cs major,neutral,0.0,positive,0.0625,01/06/2023
comments,hci,neutral,0.0,neutral,0.0,01/06/2023
comments,invention studio couple options printable stickers layered vinyl stickers start need bring image file jpeg png etc open hours thumb drive download get help use silhouette software change file cut one cameo 4s hard quantitative limit printing mass club org ask bring printable vinyl used machine,positive,0.1149,negative,-0.14583333333333334,01/06/2023
comments,robotics damn think might rejected,negative,-0.7184,neutral,0.0,01/06/2023
comments,enjoy summer college friends worry research internships come,positive,0.5267,positive,0.4,01/06/2023
comments,also phd student took mine automotive 404 897 1600 probably best place close midtown,positive,0.6369,positive,1.0,01/06/2023
comments,problem btw run engine power accelerating,negative,-0.4696,neutral,0.0,01/06/2023
comments,ive number waitlist phys 2211 lab since beginning phase chance continue let people course try get classical physics class available spots,positive,0.3182,positive,0.2,01/06/2023
comments,ball,neutral,0.0,neutral,0.0,01/06/2023
comments,salam come msa events unrelated yet,neutral,0.0,neutral,0.0,01/06/2023
comments,switching,neutral,0.0,neutral,0.0,01/06/2023
comments,music technology,neutral,0.0,neutral,0.0,01/06/2023
comments,year,neutral,0.0,neutral,0.0,01/06/2023
comments,100 agree someone also looking pursue phd worked labs even kind work undergrad buddies physics extremely math heavy flies right head taken fair share college math give time enjoy last summer college get research positions time contribute project build better relationship professors phd students rather deadweight need worry,positive,0.8481,positive,0.2700892857142857,01/06/2023
comments,class cover msts markov chains randomized rounding heard might covered even syllabus,neutral,0.0,neutral,0.0,01/06/2023
comments,interest filmmaking highly recommend buzz studios great group people lot fun,positive,0.9258,positive,0.42,01/06/2023
comments,2016,neutral,0.0,neutral,0.0,01/06/2023
comments,know car stuff well believe get power accelerating,positive,0.177,neutral,0.0,01/06/2023
comments,cats may respond name called giving name likely invoke sympathy appeal peoples emotions thus make likely actually help search,positive,0.34,neutral,0.0,01/06/2023
comments,anyone know registration website updates real time sitting page section closed someone leaves show happening show page updates,neutral,0.0,positive,0.05,01/06/2023
comments,chance need change sparkplugs pretty easy depending engine check engine light suggest try drive advanced auto parts howell mill obd reader diagnose exact issue,positive,0.8442,positive,0.3466666666666667,01/06/2023
comments,also wake noon,neutral,0.0,neutral,0.0,01/06/2023
comments,yes msts think two,negative,-0.2382,neutral,0.0,01/06/2023
comments,need take 1554 2551 time advisor said able register second math phase registration doesnt look like case anymore help,positive,0.2228,positive,0.25,01/06/2023
comments,hiya sent ya friend request decently big stuffed animal stan idk counts digital art much photography,positive,0.3578,positive,0.06666666666666667,01/06/2023
comments,like warm apple pie,positive,0.5267,positive,0.6,01/06/2023
comments,modern car started running like shit nowhere like bad miss look coils plugs first pretty simple thing check inexpensive replace provide detailed information probably give better armchair guess make model run check engine light happens try accelerate engine shake usual,positive,0.3939,positive,0.085,01/06/2023
comments,ask lmao,positive,0.5994,positive,0.6,01/07/2023
comments,neuro junior gunning join lab summer fall freshman year decided wait following summer much appreciates decision hindsight want take couple semesters gain skills put level labs really interested looking sure professors take ignite folks little chance lab specific interest area would want stick several semesters years enjoy summer really feel need something research related start reading journal articles tech physics labs use narrow field interest possible labs interest figure skills would needed contribute research prioritize taking classes focus skills cs specific math etc first couple semesters long term commitment one lab love benefit earlier short term commitment another realize want congrats acceptance best luck,positive,0.9978,positive,0.1506578947368421,01/07/2023
comments,awesome blossom accepted thank,positive,0.9036,positive,1.0,01/07/2023
comments,thank suggestion person activities people still bit comfort zone hopefully sometime future confidence try,positive,0.9077,neutral,0.0,01/07/2023
comments,know lab gsu taken high schooler past neurodevelopment stuff alley feel free message,positive,0.743,positive,0.10333333333333335,01/07/2023
comments,interested screenwriting currently place think would comfortable sharing work others hopefully future build confidence give try thank suggestion,positive,0.9723,positive,0.1625,01/07/2023
comments,qualified answer since use marta daily commute fyi live border smyrna atlanta city monroe heights long story short risk night classes ending 15 pm pay 15 10 day time uber go home instead walking way marta station thankfully one day last semester thing spring semester well yes daytime regularly walk dm smith savant building area north avenue marta station however use gold stinger line midtown station station area actually quite safe,positive,0.8698,positive,0.07329545454545454,01/07/2023
comments,always stay smart aware surroundings walk north avenue station border campus quite short never anything ordinary worrisome happen many times walk around area,negative,-0.4019,positive,0.14285714285714285,01/07/2023
comments,love whenever feel ready know absolutely free come help set interested well obligation share work comfortable though everyone supportive helpful kind thing well,positive,0.9635,positive,0.40714285714285714,01/07/2023
comments,woman yes assuming asking crc walk crc go around empty usually wait person max machines everyone minds business one bugged never noticed anyone staring either go workouts leave,negative,-0.2666,negative,-0.175,01/07/2023
comments,midtown station nicer area north ave station one stop north,positive,0.1779,neutral,0.0,01/07/2023
comments,mean try reaching labs early spring,positive,0.2023,negative,-0.10625,01/07/2023
comments,walked marta along north ave times late 00 never problems guy though ymmv,positive,0.3089,negative,-0.3,01/07/2023
comments,feel like walk station would okay still lot foot traffic even getting dark might run panhandlers ramp connector outside episcopal church city life station get pretty empty apart rush hour feels kinda sketchy although never issues midtown next station pleasant,positive,0.8804,positive,0.1761904761904762,01/07/2023
comments,oml second year transfer made feel seen got bro,neutral,0.0,neutral,0.0,01/07/2023
comments,midtown station nicer,positive,0.4404,neutral,0.0,01/07/2023
comments,fit schedule feel comfortable midtown station circumstance north ave one little sketchier honestly still worry like pm,positive,0.71,positive,0.303125,01/07/2023
comments,kinda overblown pubp major would also want wake pm,negative,-0.0572,positive,0.0625,01/07/2023
comments,easiest classes approaches intelligence cs majors,positive,0.7096,neutral,0.0,01/07/2023
comments,missed waitlist notification entirely fault got timezones mixed requeued waitlist however student detail schedule still shows old notification expires date time time waitlisted waitlist position correctly updated assume correctly waitlisted,negative,-0.5994,neutral,0.03333333333333333,01/07/2023
comments,atl native commuted semesters pm classes short woman mistaken 17 year old lol driven every marta station recommend marta saves money time especially accidents time unsafe people make pay attention surroundings walk like mission walk past people know put fuck face problems use side puts next highway entrance enough light traffic varsity bp gas station marta station also plenty people working moving area concern use side next coda less traveled may comfortable think actually less light along street,positive,0.6859,positive,0.07976190476190477,01/07/2023
comments,statistically enormously higher chance getting shot walking around mall,positive,0.3134,positive,0.25,01/07/2023
comments,take marta walk regularly north ave station short woman never issues walk usually dark take tech trolley gold route campus midtown station,neutral,0.0,neutral,-0.049999999999999996,01/07/2023
comments,dunno see thanks lot responses realize close midtown station helped get fear north ave station really appreciate everyone,positive,0.6278,positive,0.2,01/07/2023
comments,guess add one bad experience couple years back guy followed kept talking tried get go dark alley went waffle house got ride home gtpd around midnight thanksgiving still believe area safe threatening violence displaying weapon nothing similar happened since suspect anyone following marta followed gtpd get like minutes drive home,positive,0.5529,negative,-0.05833333333333331,01/07/2023
comments,day time safe nighttime let tell one experience walking first set escalators two yelling saying going fuck face high tailed escalator platform night guy definite mental issues walking passengers waiting yelling profanities faces literally minutes later marta cop came talked left began nervous going throw someone tracks news ny lately last time went station dark unless crowd people,negative,-0.34,neutral,0.026000000000000002,01/07/2023
comments,believe waitlist started moving yesterday provided decent number people section wait little,positive,0.0772,neutral,-0.010416666666666671,01/07/2023
comments,depends waitlist many people section maybe wait couple days see moves,neutral,0.0,positive,0.5,01/07/2023
comments,started yesterday,neutral,0.0,neutral,0.0,01/07/2023
comments,fine,positive,0.2023,positive,0.4166666666666667,01/07/2023
comments,sure send dm,positive,0.68,positive,0.5,01/07/2023
comments,thank tips appreciate,positive,0.6696,neutral,0.0,01/07/2023
comments,thank taking ur time write super helpful,positive,0.8588,positive,0.3333333333333333,01/07/2023
comments,trying see connections teachers think cold emailing might option point kind crossing fingers right comforting know labs students,positive,0.5916,positive,0.09523809523809523,01/07/2023
comments,night get quite sketch homeless people cat calling always someone crazy around midtown station however think part fun enjoy,positive,0.6588,neutral,0.03333333333333335,01/07/2023
comments,reason renting near school next year lmao know us cities issues mental health homeless really cannot deal anymore every time go marta station scared standing near tracks international student third world country sad see far safer travel public transport us except pickpockets everywhere,negative,-0.431,neutral,0.045454545454545456,01/07/2023
comments,aware cheapest insurance companies often worst customer service find ways pay claims cancel policy one consumer reporter clark howard list best car insurance companies price coverage depend heavily car choose zip code live age driving history credit score door sedans cars lower replacement cost cheaper sports cars higher,negative,-0.0526,positive,0.07272727272727272,01/07/2023
comments,anyone know cs 2340 waitlist likely move whatsoever,neutral,0.0,neutral,0.0,01/07/2023
comments,wandered around atlanta night study break norfolk southern parking lot tech square still walmart thing club behind varsity never issues got asked money bunch oh fine,positive,0.2714,neutral,0.005555555555555554,01/07/2023
comments,wondering well average gpa course looks high ren tan relatively new instructor could large difference,positive,0.1406,positive,0.09016233766233767,01/07/2023
comments,also trolley takes gold line although takes quite bit longer walking north ave safety priority midtown preferred station walked north ave station probably hundreds times though fine either way would pretty rare something bad happen,positive,0.5106,positive,0.06666666666666674,01/07/2023
comments,safe walk get sketchier later night gtpd regularly patrols area ever feel unsafe like someone following call ride,positive,0.6369,positive,0.125,01/07/2023
comments,done many times always fine aware surroundings,positive,0.2023,positive,0.3888888888888889,01/07/2023
comments,yeah go midtown station want ride bus rather walking lazy lol north ave station pretty far classes gold bus stop usually nearby,neutral,0.0129,positive,0.13,01/07/2023
comments,able get class morning finally waitlist people bit crazy,negative,-0.4003,neutral,-0.033333333333333326,01/07/2023
comments,great hear,positive,0.6588,positive,0.8,01/07/2023
comments,driving technically way dangerous transit atlanta took marta years never witnessed sort attack someone train way accidents common site otoh drive,negative,-0.8437,negative,-0.3,01/07/2023
comments,international student always got insurance minimal coverage since first car 2018 half year coverage 2020 mazda like 600 still relatively expensive learned insurance fee atlanta high compared areas prepared,positive,0.545,negative,-0.05944444444444443,01/07/2023
comments,classes showing sections available including one pinned,neutral,0.0,positive,0.4,01/07/2023
comments,waterproof materials id love make sticker car,positive,0.6696,positive,0.5,01/07/2023
comments,cs georgia tech prestigious experience professors give every opportunity succeed long put effort lot competitive schools huge hustle culture brink toxic always hear people talking little study amazing internships research theyre things easy get caught feeling like imposter among peers everyone moves pace sometimes people forget human one another comes things sure put effort great good luck,positive,0.9842,positive,0.3550925925925926,01/07/2023
comments,printable stuff promoted water resistant sure would suitable car solid colored layered vinyl promoted indoor outdoor link layered vinyl stock oracal 631 oracal 651,positive,0.6414,positive,0.35000000000000003,01/07/2023
comments,please use megathread,positive,0.3182,neutral,0.0,01/07/2023
comments,honest prefer midtown station safety bus takes campus way lol reasons cuz last time went north ave many people lowkey scared bit cuz alone,positive,0.296,positive,0.475,01/07/2023
comments,2nd suggestion take stinger midtown station especially dark days start getting longer reevaluate comfort level,positive,0.3612,negative,-0.15,01/07/2023
comments,took withdrew curved grades 10 start semester 80 70 etc open also curving end semester said favor never way around homeworks 30 two midterms 15 final 30 actually teaches good helpful office hours focused attended probably would able get grade needed,positive,0.9427,positive,0.24,01/07/2023
