type,text,VADER sentiment,VADER sentiment score,TextBlob sentiment,TextBlob sentiment score,date
comments,yellowjackets every time see something sub right one rly throws lol,positive,0.4215,positive,0.5428571428571429,05/03/2023
comments,yeah quite self guided given access lot real world platforms resources great mentorship ask think good experience,positive,0.9151,positive,0.5666666666666667,05/03/2023
comments,paid always paid labor value,positive,0.34,neutral,0.0,05/03/2023
comments,general intelligence measured entrance exam,positive,0.4767,positive,0.05000000000000002,05/03/2023
comments,think technically happen within clery act boundaries may procedure,neutral,0.0,neutral,0.0,05/03/2023
comments,copy pasting needs disabled cannot copy paste code external tools like chatgpt agree frustrating also conditional statement times code probably function reduce length experience generally time issue final exams gt unlike midterms,positive,0.6485,negative,-0.11000000000000001,05/03/2023
comments,email saying might late,neutral,0.0,negative,-0.3,05/03/2023
comments,always go paid company offering otherwise trying scam free labor,negative,-0.1027,positive,0.4,05/03/2023
comments,already declared major major confirmation form wanted change major enroll classes would go,neutral,0.0,positive,0.0625,05/03/2023
comments,say,neutral,0.0,neutral,0.0,05/03/2023
comments,update seen shooter apprehended source,neutral,0.0,neutral,0.0,05/03/2023
comments,bees,neutral,0.0,neutral,0.0,05/03/2023
comments,went back engineers even blacksmiths object golden tornado though never liked one,negative,-0.1139,neutral,0.0,05/03/2023
comments,imo would mistake wait january apply help much anyway still freshman companies eyes earlier better applying companies open weeks school starts would polish resume summer start applying later first weeks school applying new postings come want best possible chance underclassmen programs specifically minorities putting reasonable graduation date seems fine depending credits possible graduate less seems like driven would recommend applying year even harder freshman still possible great learning experience next year worst,positive,0.9466,positive,0.12424242424242424,05/03/2023
comments,hey mind dm program,neutral,0.0,neutral,0.0,05/03/2023
comments,probably better asking uga kennesawstate year old thread gt college gpa one matters one ever going care hs gpa sat score years experience field probably competitive master program second bachelor seldom worth time,positive,0.7825,positive,0.22499999999999998,05/03/2023
comments,think miss going person though,negative,-0.1531,neutral,0.0,05/03/2023
comments,think right direct threats campus past usually pretty quick,positive,0.1027,positive,0.14380952380952378,05/03/2023
comments,paying tens thousands dollars absolutely burden understandable lmao,positive,0.1832,positive,0.4,05/03/2023
comments,pronouncing words correctly part learning language language class take take points pronouncing words way fits mainstream accent language,neutral,0.0,neutral,0.0,05/03/2023
comments,wish actual format us formatting super annoying,positive,0.5994,negative,-0.15555555555555559,05/03/2023
comments,hello according fysa website cohort 50 people attend gte program,positive,0.3453,neutral,0.0,05/03/2023
comments,hello nathana2csalt welcome gatech appears participated much gatech submit posts subreddit requires minimum account age minimum subreddit specific comment karma count enable time get acquainted subreddit rules using throwaway account please resubmit post main account feel like must use throwaway account privacy purposes must request exception message moderators removed submission message writing post gatech comments 1379eha how_is_georgia_techs_startup_scene 0d 0di think post deserves exception bot action performed automatically please contact moderators subreddit message compose gatech questions concerns,positive,0.8442,positive,0.29444444444444445,05/04/2023
comments,tech startup scene strong sense access second none resources peers help make start compare stanford ivies,positive,0.7608,positive,0.21666666666666665,05/04/2023
comments,last year long coding sucked understand directions either got 89 rounded cares worth 1332 better landslide beat class good 1331 test taker good cs student coder,positive,0.9531,positive,0.35833333333333334,05/04/2023
comments,bit late thread think give helpful perspectives context graduating phd gt weekend actually physics department undergrad major physics graduated undergrad getting degree one toughest periods life mental health gpa grad school depend lot apply program please also understand go physics program many research topics fields programs use physics happy take physics majors also generally considered bad stay school undergrad grad exceptions get less diversity thought perspective education dont change institutions note part physics like physics broad identify areas sub disciplines interested affect advice get grad school industry government jobs lastly topic classmates broad generalization speaking one physics majors conceited assholes idk people like boast smart minimize academic struggles others tend go physics classmates making feel lesser sub par indication changed departments grad school stopped experiencing effect describe dumb find supportive empathetic people lift support rather bring,positive,0.9661,neutral,0.04778439153439154,05/04/2023
comments,hello creative_custard_383 welcome gatech appears participated much gatech submit posts subreddit requires minimum account age minimum subreddit specific comment karma count enable time get acquainted subreddit rules using throwaway account please resubmit post main account feel like must use throwaway account privacy purposes must request exception message moderators removed submission message writing post gatech comments 137acz2 gtpd_georgia_tech_play_deaf 0d 0di think post deserves exception bot action performed automatically please contact moderators subreddit message compose gatech questions concerns,positive,0.8442,positive,0.29444444444444445,05/04/2023
comments,thank submitting job listing gatech please include job pay salary compensation budget work seeking post include pay details subject removal bot action performed automatically please contact moderators subreddit message compose gatech questions concerns,positive,0.7709,neutral,-0.033333333333333326,05/04/2023
comments,apologize advance terrible english really bad wording things concisely thanks response context want pursue grad school moving around changing countries entire life lived different countries us kinda fell love atlanta georgia tech much torture much reminds home city naples italy similar stories north burning atlanta like naples regno delle due sicillie vs north love see south continue develop progress recall physics advisor faset saying plenty brilliant undergrads end going harvard princeton mit caltech etc despite happy would keep tech thinking ever make point apply grad school certainly gt also see mean surrounding people put really good friend physics class definitely find people like made feel better problem thank much,positive,0.9829,positive,0.13883928571428572,05/04/2023
comments,yes know know many committed students right attend gte waitlist student choose interested fysa want know chance get wl,positive,0.9247,positive,0.3452380952380952,05/04/2023
comments,charge damn phone,negative,-0.4019,neutral,0.0,05/04/2023
comments,thinking cs fall little high school experience would recommend get good start material want fall behind fall open preferably low cost courses resources think would helpful summer sure start thank much,positive,0.8525,positive,0.12156249999999999,05/04/2023
comments,take unpaid internship think way company pay interns pay full time employees competitively fairly hint answer resounding,negative,-0.2263,positive,0.4166666666666667,05/04/2023
comments,unpaid internships borderline illegal,negative,-0.5574,negative,-0.15,05/04/2023
comments,mention needing memorize little details syntax 2023 super unnecessary,positive,0.5994,negative,-0.08472222222222224,05/04/2023
comments,yes know skill issue imagine like spelling tests english,positive,0.6249,neutral,0.0,05/04/2023
comments,unfortunate choice automatic signature line situation,negative,-0.5095,negative,-0.5,05/04/2023
comments,love,positive,0.6696,positive,0.5,05/04/2023
comments,went morning,neutral,0.0,neutral,0.0,05/04/2023
comments,paid good get part time unpaid might worth long working much unpaid also probably better nonprofits sure though,positive,0.6915,positive,0.3357142857142857,05/04/2023
comments,hello candidatekitchen414 looks like might prospective new student gt welcome gatech around admission season get huge influx common repeated questions new students usually pin thread prospective student questions check megathread subreddit homepage also recommend try searching google subreddit answer question first believe mistake think post truly worthy dedicated post message moderators approve post removed submission message writing submission gatech comments 137ls6o major_advice_for_an_incoming_undergraduate 0d 0di think submission approved bot action performed automatically please contact moderators subreddit message compose gatech questions concerns,positive,0.9726,positive,0.17845117845117847,05/04/2023
comments,hi accepted electrical engineering undergraduate considering changing major computer engineering maybe computer science get insight read posts subreddit people said hard ece students take cs classes major restrictions smth still true cuz posts written around years ago anyway hope get job related chip design phones computers entirely sure yet wondering would better major computer science thread related chip design stuff since said seems like ece students hard time registering cs courses want get educated hardware software question would better major computer science computer engineering stick ee thanks,positive,0.9672,positive,0.13205128205128205,05/04/2023
comments,congrats friend go live life,positive,0.8302,positive,0.13636363636363635,05/04/2023
comments,wait section o1 handwritten,neutral,0.0,neutral,0.0,05/04/2023
comments,thank much confirmation nice summer break,positive,0.8834,positive,0.4,05/04/2023
comments,happened 03 away 90 professor round discretion,neutral,0.0,negative,-0.2,05/04/2023
comments,honorlocked copy pasting disabled coding question pretty dumb yeah,positive,0.2732,negative,-0.10833333333333334,05/04/2023
comments,took class friend got 53 came got 89 something got professors weird strict lines ultimately,positive,0.3612,negative,-0.25,05/04/2023
comments,definitely seems common stem courses experience profs round publish rounding criteria ahead time closest instance 89 95 would round 89 94 would remain german music classes always rounded though,positive,0.2144,negative,-0.13999999999999999,05/04/2023
comments,grad school always open new victims students congrats btw,positive,0.5707,positive,0.06818181818181818,05/04/2023
comments,depends professor got got folks merciful,neutral,0.0,neutral,0.0,05/04/2023
comments,yes depends prof maybe department depending class typically prof classes like calc phys might department policy rounding,positive,0.6662,negative,-0.16666666666666666,05/04/2023
comments,official definition grade cutoffs generally explicitly syllabus 90 generally gets rounded somewhere half percent listed cutoff lower required listed 90 89 90 strictly meet cutoff prof could give,negative,-0.296,neutral,-0.02222222222222221,05/04/2023
comments,mostly hated scroll massive block instructions able write code tiny box,negative,-0.7964,negative,-0.1,05/04/2023
comments,copy whole homework taking test paste later get coding part,neutral,0.0,positive,0.1,05/04/2023
comments,look pts website emory shuttle page shows fall spring summer service schedule,neutral,0.0,neutral,0.0,05/04/2023
comments,probably harm asking,negative,-0.5296,neutral,0.0,05/04/2023
comments,got 89 76 microeconomics last semester emailed didnt round,neutral,0.0,negative,-0.1,05/04/2023
comments,professor different school direct relationship percent score final letter grade professors list cutoffs syllabus others keep ambiguous end year look grades create cutoffs based distribution make cutoffs push grade would cause much bias honestly worry grade grade may lot farther cut think,positive,0.4226,positive,0.18,05/04/2023
comments,speak require pretty deep familiarity uiuc say average ga tech student comes around 30 ap credits capped definitely check ap table online ga tech people involved extracurriculars happy think personality fine others shut ins happy overworked ppl depends many factors,positive,0.9446,positive,0.32708333333333334,05/04/2023
comments,school passes 40 students also worse gt,negative,-0.1029,negative,-0.4,05/04/2023
comments,may 4th still waiting fingers crossed x200b edit got email saying decision coming may 12th 5pm et,neutral,0.0,neutral,0.0,05/04/2023
comments,looking commencement program right seem like nearly everyone graduating highest honors,positive,0.7461,positive,0.19285714285714284,05/04/2023
comments,thanks,positive,0.4926,positive,0.2,05/04/2023
comments,congratulations,positive,0.636,neutral,0.0,05/04/2023
comments,still trying find internship date unpaid may way get one disagree bad thing cases unpaid versus internship internship something relates field study looks good rsum think unpaid fine could always say preference would paid would consider unpaid depending position,negative,-0.3182,positive,0.17380952380952383,05/04/2023
comments,minimum zell coverage cover one class,negative,-0.296,neutral,0.0,05/04/2023
comments,contact financial aid zell 100 whether take one class five charged credit hour summer disparity may charging hope rates definitely ask,positive,0.7506,neutral,0.0,05/04/2023
comments,nope false minimum zell taken one class two summers row zell paid 100 information outlined georgia futures website makes clear minimum number hours required,negative,-0.128,negative,-0.15000000000000002,05/04/2023
comments,im still waiting hopefully soon,positive,0.5538,neutral,0.0,05/04/2023
comments,hello apprehensive yam47 looks like might prospective new student gt welcome gatech around admission season get huge influx common repeated questions new students usually pin thread prospective student questions check megathread subreddit homepage also recommend try searching google subreddit answer question first believe mistake think post truly worthy dedicated post message moderators approve post removed submission message writing submission gatech comments 137ss3d how_competitive_is_the_tm_minor_in_computing_and 0d 0di think submission approved bot action performed automatically please contact moderators subreddit message compose gatech questions concerns,positive,0.9726,positive,0.17845117845117847,05/04/2023
comments,subletting fully furnished room 3b3b home park 2000 including utilities whole summer amenities include parking house washer dryer roommates quiet clean dm pictures details,positive,0.7407,positive,0.18888888888888888,05/04/2023
comments,whoops commented rush right also taken one class summer covered always told min summer fall though sure actually true,positive,0.2115,positive,0.37857142857142856,05/04/2023
comments,competitive minor computing business incoming freshman gt wants major cs intel info wondering difficult get minor saw website highly competitive wondering actually difficult,negative,-0.4085,negative,-0.09678571428571428,05/04/2023
comments,gpa inflation,neutral,0.0,neutral,0.0,05/04/2023
comments,got major desperate need someone talk,negative,-0.7835,negative,-0.26875,05/04/2023
comments,false,neutral,0.0,negative,-0.4000000000000001,05/04/2023
comments,one us one us,neutral,0.0,neutral,0.0,05/04/2023
comments,probably threshold pretty low highest honors 55 really think honors high honors,positive,0.9001,positive,0.1525,05/04/2023
comments,unpaid internships scam,negative,-0.5719,positive,0.2,05/04/2023
comments,hey good im growing little antsy feel pain lol im actually coming accounting major lol cue stupid business student memes drawn scheller atlanta far career opportunity networking im female state tell bout,positive,0.751,positive,0.1638888888888889,05/04/2023
comments,minimum semester urban rumor georgia futures website specifically says multiple places,negative,-0.296,neutral,0.0,05/04/2023
comments,best luck friend,positive,0.886,positive,1.0,05/04/2023
comments,omg scheller good wanted business dual point sayin thing also female cs love break male dominated fields dang stem hands state well current uni,positive,0.7791,positive,0.24,05/04/2023
comments,grade inflation georgia tech,neutral,0.0,neutral,0.0,05/04/2023
comments,wohooooooo congratulations,positive,0.7586,neutral,0.0,05/04/2023
comments,great feeling big accomplishment congrats,positive,0.8516,positive,0.4,05/04/2023
comments,hello speak spanish little english looking someone wants learn spanish language exchange,neutral,0.0,neutral,0.0025000000000000022,05/04/2023
comments,personally beg differ found extremely challenging reach shocked much smarter x200b think school really fucking hard shocked overwhelming number succeeding,positive,0.4914,negative,-0.07023809523809522,05/04/2023
comments,heard faset,neutral,0.0,neutral,0.0,05/04/2023
comments,hi also starting fall housing freshman open till june heard west pretty chill quite whereas party side closer everything,positive,0.4939,positive,0.08333333333333333,05/04/2023
comments,better students,positive,0.4404,positive,0.5,05/04/2023
comments,know right either raise add super duper highester honors love put resume,positive,0.6369,positive,0.373015873015873,05/04/2023
comments,worry still nightmares rest life back class test study incredibly common,positive,0.3412,negative,-0.15,05/04/2023
comments,congratulations,neutral,0.0,neutral,0.0,05/04/2023
comments,,neutral,0.0,neutral,0.0,05/04/2023
comments,anyone know could waitlist position three waitlisted classes fall must bug registration system wonder actual waitlist position since gotten waitlist notification email yet,neutral,0.0,neutral,0.0,05/04/2023
comments,earl bike shop far best bike shop bought two bikes mtn road earl team knowledgeable amazing also many weekly outings far octane hit,positive,0.8402,positive,0.4600000000000001,05/04/2023
comments,yes since 1976,positive,0.6809,neutral,0.0,05/04/2023
comments,thanks contacted say late update switching schedule around,positive,0.4926,neutral,-0.04999999999999999,05/04/2023
comments,ah yes paper 2004 relevant,positive,0.4019,positive,0.4,05/04/2023
comments,im samford right bham al alpharetta native hbu,neutral,0.0,positive,0.2857142857142857,05/04/2023
comments,saw email email thought decision email almost heart attack,negative,-0.4284,neutral,0.0,05/04/2023
comments,used work alpharetta norcross old coworker actually bham college well also email decisions released,positive,0.5053,positive,0.05,05/04/2023
comments,oh also go kennesaw forgot mention,neutral,0.0,neutral,0.0,05/04/2023
comments,oh cool love alpharetta yes saw subject line transfer decision release almost heart attack haha,positive,0.8929,positive,0.22083333333333333,05/04/2023
comments,alpharetta great like going omg glad sooner day expected ahhh,positive,0.9241,positive,0.39999999999999997,05/04/2023
comments,true depends student much time spare extra curricular check ap table online site also clarity thanks,positive,0.839,positive,0.1875,05/04/2023
comments,remember last exam drunk night like go see professor 10am good times,positive,0.481,positive,0.06666666666666665,05/04/2023
comments,final last final brave enough legal reasons joke pls take care,positive,0.8625,positive,0.16666666666666666,05/04/2023
comments,hey similiar situation happens already accepted miss gpa requirements end semester rescind acceptance anyway go handling,positive,0.6136,neutral,0.0,05/04/2023
comments,know space hardware club sometimes pretty area directly cities restricted airspace questionable legality,negative,-0.3269,negative,-0.05000000000000001,05/04/2023
comments,congratulations never say never,positive,0.4102,neutral,0.0,05/04/2023
comments,thanks reply yeah wondering airspace atl launches campus seemed bit odd,positive,0.4215,neutral,0.016666666666666677,05/04/2023
comments,grade inflation always big problem worsens universities across country find gt specific one prior 2004 invite try finding,negative,-0.25,neutral,0.0,05/04/2023
comments,congrats patiently waiting turn,positive,0.5267,neutral,0.0,05/04/2023
comments,impossible waitlist three classes last week 50 one 10 another 25 another really make sense simultaneously three,neutral,0.0,negative,-0.15555555555555553,05/04/2023
comments,iv applied 30jan received card month visited said request declined applied 21 april received yet,neutral,0.0,neutral,0.0,05/04/2023
comments,whatever gt starter bikes avoided,negative,-0.0772,neutral,0.0,05/04/2023
comments,lol get hand downs relatively cheap perfect hardcore cycle purist,positive,0.8658,positive,0.7333333333333334,05/04/2023
comments,anyone know cofc always morning undergraduates trying plan spring 24,neutral,0.0,neutral,0.0,05/04/2023
comments,care elaborate,positive,0.4939,positive,0.5,05/04/2023
comments,cheap road bike need spend 4k 600 going get done,neutral,0.0,positive,0.4,05/04/2023
comments,attendance policy gt classes counter intuitive seems find occasionally better miss class take break struggling overall worried much heard colleges allow three misses classes semester graded quizzes attendance really scared,negative,-0.779,positive,0.22499999999999998,05/04/2023
comments,look guy got way,neutral,0.0,neutral,0.0,05/04/2023
comments,atl airspace starts 500 msl 500 feet work,neutral,0.0,neutral,0.0,05/04/2023
comments,yeah offer good service organization perform poorly difficult contact difficult get good information interpersonal skills working lacking personal experience,neutral,-0.0258,positive,0.07999999999999999,05/04/2023
comments,yeah agree issue said yeah offer good service organization perform poorly difficult contact difficult get good information interpersonal skills working lacking personal experience,positive,0.5916,positive,0.07999999999999999,05/04/2023
comments,hello old_tangerine1802 welcome gatech appears participated much gatech submit posts subreddit requires minimum account age minimum subreddit specific comment karma count enable time get acquainted subreddit rules using throwaway account please resubmit post main account feel like must use throwaway account privacy purposes must request exception message moderators removed submission message writing post gatech comments 1386vbt why_is_this_school_so_selfsegregating 0d 0di think post deserves exception bot action performed automatically please contact moderators subreddit message compose gatech questions concerns,positive,0.8442,positive,0.29444444444444445,05/04/2023
comments,hello sufficient eye 8234 welcome gatech appears participated much gatech submit posts subreddit requires minimum account age minimum subreddit specific comment karma count enable time get acquainted subreddit rules using throwaway account please resubmit post main account feel like must use throwaway account privacy purposes must request exception message moderators removed submission message writing post gatech comments 1386wgo why_is_this_school_so_self_segregating 0d 0di think post deserves exception bot action performed automatically please contact moderators subreddit message compose gatech questions concerns,positive,0.8442,positive,0.29444444444444445,05/04/2023
comments,hello looxizo welcome gatech appears participated much gatech submit posts subreddit requires minimum account age minimum subreddit specific comment karma count enable time get acquainted subreddit rules using throwaway account please resubmit post main account feel like must use throwaway account privacy purposes must request exception message moderators removed submission message writing post gatech comments 1386xx5 decision_release_date_for_transferpathway 0d 0di think post deserves exception bot action performed automatically please contact moderators subreddit message compose gatech questions concerns,positive,0.8442,positive,0.29444444444444445,05/04/2023
comments,hello iambatman2023 welcome gatech appears participated much gatech submit posts subreddit requires minimum account age minimum subreddit specific comment karma count enable time get acquainted subreddit rules using throwaway account please resubmit post main account feel like must use throwaway account privacy purposes must request exception message moderators removed submission message writing post gatech comments 1387e8m so_theres_a_cost_of_living_adjustment_which_has 0d 0di think post deserves exception bot action performed automatically please contact moderators subreddit message compose gatech questions concerns,positive,0.8442,positive,0.29444444444444445,05/04/2023
comments,graduated 1989 still nightmares like,positive,0.4199,neutral,0.0,05/04/2023
comments,congratulations,positive,0.6981,neutral,0.0,05/04/2023
comments,1000 completely fine intro bought specialized allez,positive,0.2716,positive,0.4166666666666667,05/04/2023
comments,considered normal wear tear good,positive,0.4404,positive,0.425,05/05/2023
comments,yellow jackets letsgo,neutral,0.0,neutral,0.0,05/05/2023
comments,oh gosh considering getting involved papayago larger birds superior haha bit drive,positive,0.2924,positive,0.3,05/05/2023
comments,congrats getting,positive,0.5707,neutral,0.0,05/05/2023
