type,text,VADER sentiment,VADER sentiment score,TextBlob sentiment,TextBlob sentiment score,date
comments,sadly im talking 3210 pretty sure 3210 prereq advanced os thanks offer,positive,0.7351,positive,0.17,01/12/2023
comments,ummm seem rickrolled creator original intent rude,negative,-0.3117,neutral,0.037500000000000006,01/12/2023
comments,probably one leetcode wizards 15 studied college worked three shifts mcdonald computer solving leetcode paper debugging heart also home paper getting wet determined got 3rd highest leetcode ranking still work mcdonald bc forgot speak english,positive,0.4096,neutral,-0.03333333333333333,01/12/2023
comments,activate two factor,neutral,0.0,neutral,0.0,01/12/2023
comments,go raise hell,negative,-0.6808,neutral,0.0,01/12/2023
comments,welcome tech,positive,0.4588,positive,0.8,01/12/2023
comments,ufo trying steal gatech obelisc,negative,-0.4939,neutral,0.0,01/12/2023
comments,love ufo,positive,0.6369,positive,0.5,01/12/2023
comments,linktree,neutral,0.0,neutral,0.0,01/12/2023
comments,spread word anyone would interested event want miss,positive,0.4445,positive,0.25,01/12/2023
comments,hard loved courses people smart scary made really good friends housing homepark cheaper fun official grad housing imho,positive,0.9699,positive,0.18710317460317458,01/12/2023
comments,prepared curious show passion,positive,0.7351,negative,-0.1,01/12/2023
comments,would say skim paper deep know main points authored involved able say research interests least point parts research like,positive,0.5423,positive,0.09166666666666666,01/12/2023
comments,noticed tuesday worked click route click individual stop least think working estimate changing gave walked,negative,-0.296,negative,-0.15,01/12/2023
comments,one roommates linear diff calc last semester said lot work ended classes,neutral,0.0,neutral,0.0,01/12/2023
comments,similar situation dm like,positive,0.4199,neutral,0.0,01/12/2023
comments,since credits basically add one full math class anyway also already took calculus would likely fine feel would say go,positive,0.5106,positive,0.25555555555555554,01/12/2023
comments,zeil affected health insurance financial aid etc might though,negative,-0.1531,neutral,0.0,01/12/2023
comments,even go ga tech junior another uni highly recommend others joining clubs meet people interests also making friends major department easy way maintain solid group friends important academic success always study taking classes potentially stick years way stay positive,positive,0.9827,positive,0.17590067340067342,01/12/2023
comments,rush fraternity spring rush starts friday 7pm,neutral,0.0,neutral,0.0,01/12/2023
comments,perdue pete fursona,neutral,0.0,neutral,0.0,01/12/2023
comments,conflict another class must take graduate unfortunately,negative,-0.5719,negative,-0.5,01/12/2023
comments,see second section 4731 see second section 7632 grad version sure permits waitlists usually drop,negative,-0.624,positive,0.0625,01/12/2023
comments,might wanna check planning doubling 1552 1554 day looking restrictions pretty sure said double linear 1551 please check remember 1554 1553 taken 1551 linear general,positive,0.8807,positive,0.2,01/12/2023
comments,would restriction still allow registered classes currently impression course restriction prevented registration whatever reason course related,negative,-0.0772,neutral,0.0,01/12/2023
comments,let add fine maybe update math restrictions website recently dropped rule,positive,0.2023,positive,0.20833333333333334,01/12/2023
comments,pdf link case need,neutral,0.0,neutral,0.0,01/12/2023
comments,fine,positive,0.2023,positive,0.4166666666666667,01/12/2023
comments,opt fees,neutral,0.0,neutral,0.0,01/12/2023
comments,umbrellas terrible worthless invention anyone buys deserves endure rain terrible good waste space umbrella,negative,-0.8979,negative,-0.45999999999999996,01/12/2023
comments,similar boat cs minor get permit time get one class worked schedule require extra prereqs looks like need take extra class final summer semester,positive,0.5672,neutral,-0.01,01/12/2023
comments,thank,positive,0.5229,neutral,0.0,01/12/2023
comments,dang makes regret sharing big wiki made help people plan senior capstone stuff chose create non trad student thing allowed graduate lt years found really tricky research logistical consequences various capstone paths info split several different parties tech depending manages ended making tech comms project specifically maybe dig share,positive,0.1469,neutral,0.04,01/12/2023
comments,time friday waitlists go away free,positive,0.5106,positive,0.4,01/12/2023
comments,sounds like super helpful definitely think worth spending time find share,positive,0.9325,positive,0.2111111111111111,01/12/2023
comments,officially though done actual person might delayed last semester delayed around 10 30,negative,-0.4215,neutral,0.0,01/12/2023
comments,,neutral,0.0,neutral,0.0,01/12/2023
comments,well quite true shall see decisions made pilot completed,negative,-0.1151,positive,0.35,01/12/2023
comments,looking temporarily rent room months around mid february 20f please pm spare room need roommate,positive,0.3182,neutral,0.0,01/12/2023
comments,industrial design architecture major wondering people thoughts two majors ultimately decided transfer,neutral,0.0,neutral,0.03125,01/13/2023
comments,little know letting everybody waterproof notebook,neutral,0.0,negative,-0.1875,01/13/2023
comments,welcome,positive,0.7184,positive,0.8,01/13/2023
comments,thank submitting news gatech post pertains sports please amend flair sports already please include link news source helps people learn verify information bot action performed automatically please contact moderators subreddit message compose gatech questions concerns,positive,0.8832,positive,0.1,01/13/2023
comments,happening well glad one experiencing,positive,0.6249,positive,0.5,01/13/2023
comments,get figured yet advisor helped class need graduate either frustrated,negative,-0.5709,negative,-0.7,01/13/2023
comments,approved experiential learning internship careerbuzz however registered internship course day half point screwed registrar put course anything,negative,-0.1926,negative,-0.16666666666666666,01/13/2023
comments,approved experiential learning internship careerbuzz however registered internship course day half point screwed registrar put course anything,negative,-0.1926,negative,-0.16666666666666666,01/13/2023
comments,actually one reasons wrote first iterations notifygt years back definitely means guaranteed decent success getting class waitlists purged 9am use www notifygt com want receive text message case happens,positive,0.775,positive,0.11944444444444442,01/13/2023
comments,limit server resources tracking priorities based available seats class 20 available seats checked less often class full,neutral,0.0,positive,0.24583333333333335,01/13/2023
comments,10 naruto runs classes dude different tier us,neutral,0.0,neutral,0.0,01/13/2023
comments,bunch cs classes cut capacity however many students already registered noticed cs 7650 4650 cs 7643 cs 7632 capacities less number registered students banking registering waitlists dropped today pretty annoying,negative,-0.0772,negative,-0.05416666666666667,01/13/2023
comments,anyone planning dropping cs 6515 cs 6301 really need classes,neutral,0.0,positive,0.2,01/13/2023
comments,anyone planning dropping cs 3251 ece 2031 csa csb really need,neutral,0.0,positive,0.2,01/13/2023
comments,annoying something similar happened cs 2340 capacity cut active amount students ig 10 people drop course anyone new join,negative,-0.3167,negative,-0.19924242424242425,01/13/2023
comments,bruv,neutral,0.0,neutral,0.0,01/13/2023
comments,anyone planning drop cs 4731 cs 7632 game ai desperately need class,negative,-0.7128,negative,-0.5,01/13/2023
comments,funny thing already registered cs 7643 probably one last people fully expected kicked saw capacity change,positive,0.4404,neutral,0.049999999999999996,01/13/2023
comments,im supposed graduate semester cant get single ing cs class,neutral,0.0,negative,-0.07142857142857142,01/13/2023
comments,online section cs 7632 game ai anyone needs,neutral,0.0,negative,-0.4,01/13/2023
comments,someone honest know sure show genuinely interested topic wanting learn enthusiasm attitude 90 got research professor,positive,0.8876,positive,0.45,01/13/2023
comments,one put pumpkin last year,neutral,0.0,neutral,0.0,01/13/2023
comments,huh guy allegedly stole money sleeping city paid consultant,neutral,0.0,negative,-0.1,01/13/2023
comments,really hope mistake sure would need cut capacity,negative,-0.368,positive,0.35,01/13/2023
comments,waiting cv suddenly turned registering online game ai guess works,neutral,0.0,negative,-0.2,01/13/2023
comments,love,positive,0.6369,positive,0.5,01/13/2023
comments,section looks much difficult compared section tho,negative,-0.4201,negative,-0.5,01/13/2023
comments,see two situations related,neutral,0.0,neutral,0.0,01/13/2023
comments,plenty problems work heard interactive textbook helps understand actually whether visualizations allowing tweak initial conditions see affect outcome best way make sure get imo get together others explain process classmates tas tutors plus leaders instructors friends,positive,0.8687,positive,0.375,01/13/2023
comments,contacted advisors registrar coc asked multiple discords groupmes one idea fuck going gt suctioning away money also demanding hours nothing today idea get fixed least send fucking email something instead leaving everyone dark edit registration closed nothing happened lmao huge portion cs classes cap reduced one able register anything name graduating seniors agree definitely important neither faculty advisors idea going problem new information sent,negative,-0.9381,neutral,0.04886363636363635,01/13/2023
comments,acknowledged mistake possibility purpose,negative,-0.34,neutral,0.0,01/13/2023
comments,heard workload lesser simpler section professor apparently changed syllabus,neutral,0.0,neutral,0.025,01/13/2023
comments,lt,neutral,0.0,neutral,0.0,01/13/2023
comments,already received permit still waiting tttt,neutral,0.0,neutral,0.0,01/13/2023
comments,guess stinger exactly free either 85 semester even infuriating people use pay,negative,-0.7956,negative,-0.09999999999999998,01/13/2023
comments,idea lol purpose even confusing 10 people would eventually get kicked last day registration beyond even gt ability fuck people seeing happened yet hope temporary know fixed choice ignore obligations sit computer,negative,-0.7181,neutral,0.039999999999999994,01/13/2023
comments,emailed registrar office said bug cs department made changes provide reason rather wait coc advisor gets back make sure,positive,0.3182,positive,0.25,01/13/2023
comments,email sent something prioritizing degree candidates,neutral,0.0,neutral,0.0,01/13/2023
comments,copy paste email said,neutral,0.0,neutral,0.0,01/13/2023
comments,guy making quick buck cheap posters,neutral,0.0,positive,0.3666666666666667,01/13/2023
comments,get email friend students may noticed fluctuations class capacities coc prioritizing degree candidates time info remaining class capacities forthcoming please continue watch email subject,positive,0.8047,negative,-0.16666666666666666,01/13/2023
comments,think bchm major able access soo,neutral,0.0,positive,0.28125,01/13/2023
comments,question,neutral,0.0,neutral,0.0,01/13/2023
comments,hope bcz syllabus made class look difficult lol,positive,0.4939,positive,0.15000000000000002,01/13/2023
comments,never poster sale eternal,neutral,0.0,neutral,0.0,01/13/2023
comments,post megathread,neutral,0.0,neutral,0.0,01/13/2023
comments,wow great way confuse students,positive,0.7906,positive,0.45,01/13/2023
comments,understaff one biggest departments gt fuck everyone,negative,-0.1697,negative,-0.4,01/13/2023
comments,cs 4731 jeff wilson anyone taken,neutral,0.0,neutral,0.0,01/13/2023
comments,happens every university onceonthisisland,neutral,0.0,neutral,0.0,01/13/2023
comments,wilson taught 4731 teaches graduate omscs version 7632 look,neutral,0.0,neutral,0.0,01/13/2023
comments,another email,neutral,0.0,neutral,0.0,01/13/2023
comments,get kicked works prevent someone dropping someone else taking slot folks sort thing need example deal prioritizing students absolutely need course graduation,neutral,0.0258,positive,0.2,01/13/2023
comments,today,neutral,0.0,neutral,0.0,01/13/2023
comments,need person cs7632 graduating semester cs7633 necessary background possible switch someone,neutral,0.0,neutral,0.0,01/13/2023
comments,well generally public services operate frustrated use fees indirect way raising tuition since use financial aid cover fees,negative,-0.5709,negative,-0.2333333333333333,01/13/2023
comments,ah okay makes sense actually thanks response dean isbell apologies rather angry rants better reddit platforms happen idea timeline like approximately capacities would return normal thank,positive,0.8735,positive,0.075,01/13/2023
comments,take online difficulty,negative,-0.34,neutral,0.0,01/13/2023
comments,different content online version game focused using unity assignments etc person theoretical less focused games,positive,0.4364,negative,-0.14166666666666666,01/13/2023
comments,given registration ends hours chance going back normal soon,positive,0.25,positive,0.075,01/13/2023
comments,capacities return normal actually assign individual permits totally uncommon see course people purported capacity whether happens case likely depends many physical seats possibly available putting everyone,neutral,0.0,positive,0.23125,01/13/2023
comments,boat get override permit take time worked classes took time,negative,-0.296,neutral,0.0,01/13/2023
comments,see thanks information case trying get class currently shows 87 85 although 95 95 yesterday need graduate chance take professor leave tech seeing theory people dropped physical classroom empty seats went class thursday hoping able register class also think speak many students say frustration much situation lack communication truly appreciate taking time respond comments reddit turn reddit receive official communication stressful time sensitive manner like know email sent tim brown believe explaining reason capacity reduction students received reason advice offered keep checking email,positive,0.1901,positive,0.17500000000000002,01/13/2023
comments,advice think could given,neutral,0.0,neutral,0.0,01/13/2023
comments,anyone happen experience waitlist study abroad programs updated status atlas able reach program manager coc study abroad told currently position 26 chances getting waitlist rescind application way increase odds getting,positive,0.3695,positive,0.25,01/13/2023
comments,took look google sites cleared lived keep trying think way recover meantime,positive,0.1531,neutral,0.0,01/13/2023
comments,tim brown email know went advisees graduating seniors entire coc guess reducing capacities makes nobody else register work today get graduating seniors classes,neutral,0.0,neutral,0.0,01/13/2023
comments,fwiw cs faculty staff unhappy input happening gt decided admit total students show state enrollment great unlike usg schools shrinking students choose major want restrictions switching 25 institute cs trying hire lots faculty two three faculty candidate visits every week spring term spend hours one wondering week go job talks interview candidates meetings discuss whether liked candidates,positive,0.8016,positive,0.17250000000000001,01/13/2023
comments,today friday 5pm,neutral,0.0,neutral,0.0,01/13/2023
comments,gif emote free_emotes_pack sob,neutral,0.0,neutral,0.0,01/13/2023
comments,much advice increasing number advisors number classes cs department 4th semester gatech cs major never gotten classes wanted take solely relied last day phase sit front computer hours try snipe classes spots opened suddenly taken away us capacity lower actual moreover sent maybe 10 15 emails advisors faculty departments etc time tech received responses total times mention advisor changed twice well clearly way busy overloaded means proper form communication anybody administration side either phase phase track graduate years obviously beneficial financial reasons due lack class availability consistently getting late time tickets receiving help administration seems push back graduation roadmap sorry reply seems little angry stressed frustrated course registrations,negative,-0.736,negative,-0.08421052631578947,01/13/2023
comments,nah getting going grad school absolutely problems registration miracle good planning investment infrastructure school actually cares students go back gt throw fucking riot,positive,0.4154,positive,0.059999999999999984,01/13/2023
comments,guess instance quite hard offer anything concrete one knows general whether capacity change case case basis thinking maybe also situation problem students generally rely phase friday free try get class holds barred opportunity denied know whether actually get pm obviously ensuring graduating students get need quite important fact done specific day causing lot uncertainty confusion 20 far aware communication come whether capacities reverted also think might misunderstanding capacity return normal graduating students taken care course overfull would 97 95 example students needed added people dropped could 93 95 something others could register course looking 85 85 cs 7632 exactly 10 people dropped something else aware happening,negative,-0.8074,positive,0.1255952380952381,01/13/2023
comments,think people want reassured open channels communication waiting periods fun sitting around stressed future limbo flawed system obviously first last time people deal something similar lifetime know else tell people going continue angry something like happens every semester figuring addressed ongoing conversation staff students often culture tech seems encourage opacity times like get may resource problem rather people intentionally lacking transparency ton intelligent individuals institution sure right people put heads together least iterative progress towards better solution leaves less people less stressed believe dan forsyth told week everyone kansas anymore moment first test grades coming office mental health services brings staff handle influx students maybe worth considering applying similar solution situation bet lot administrative jobs gt probably could responsibilities shifted certain weeks maybe would require extra training order speed processes would need learn,positive,0.9807,positive,0.07936507936507935,01/13/2023
comments,know fair compare graduate program undergrad especially cs,positive,0.3182,positive,0.35,01/13/2023
comments,doubt im degree candidate way benefited helping get class,negative,-0.3612,neutral,0.0,01/13/2023
comments,lived sq5 free chargers centergy parking deck typically charged know tech parking decks chargers well sure ones easy google needed supercharge go atlantic station,positive,0.6877,positive,0.2916666666666667,01/13/2023
comments,gotcha live campus stuck situation pay chargepoint chargers offer access free chargers debating purchasing tesla,positive,0.1585,positive,0.2681818181818182,01/13/2023
comments,noticed class need seemingly one degree candidate register thing happen since locked people dropping quite curious,positive,0.3804,negative,-0.1,01/13/2023
comments,entire university like gt particularly catastrophic regards registration us thing,positive,0.212,positive,0.08333333333333333,01/13/2023
comments,registered gra registration deadline heard back yet registration closes hour,neutral,0.0,neutral,0.0,01/13/2023
comments,centergy parking deck also visitor parking 20 day depending rates chargepoint charges could potentially cheaper need charge,negative,-0.2732,neutral,0.0,01/13/2023
comments,sometime 2019 credits large workload get anything hands also pretty busy semester lots research digests presented participating students understood little presented brief look research process recommend low pressure,positive,0.5927,positive,0.06279761904761905,01/13/2023
comments,friend another university gets fill courses plan taking survey months registration create classes sign automatically course registration registration move things around like imagine bliss,positive,0.8885,neutral,0.0,01/13/2023
comments,understaffed gt one highest counts cs faculty country might poor course scheduling,negative,-0.0688,negative,-0.4,01/13/2023
comments,advanced graphene battery team particular reason recommend,negative,-0.1205,positive,0.2833333333333333,01/13/2023
comments,join tbh except holiday one let pick different day,positive,0.2579,neutral,0.0,01/13/2023
comments,liked interactive one easier read could change values simulations helped visualize still go textbook make sure missing anything get interactive one,positive,0.8373,positive,0.30000000000000004,01/13/2023
comments,speaking email hours since last official communication least 3510 seen 10 people drop one person register still remains closed understand prioritizing degree candidates really even seem like left prioritize,negative,-0.4965,neutral,-0.04,01/13/2023
comments,yes advanced graphene battery team recommend beyond one day spent learning different graphene technologies researched gt value added forced look read research otherwise good assist research hands work otherwise get details would really made impact make easy get involved based avoid large workload comment recommend probably get hands experience research assisting wanted would uphill battle whole way think goes spirit vip system join large commitment great payoff either course opinion someone else may better luck term much better experience,positive,0.9909,positive,0.28937728937728935,01/13/2023
comments,see thank honest thoughts might give go first semester see interested introduced research figure think lose much work,positive,0.8676,positive,0.325,01/13/2023
comments,realized tuesday morning,neutral,0.0,neutral,0.0,01/13/2023
comments,called mandatory reason way opt,negative,-0.296,neutral,0.0,01/13/2023
comments,sadly go back normal,negative,-0.4215,positive,0.075,01/13/2023
comments,faculty frustrated well one telling us going class caps keep shifting without notice course changes many tas need someone said letting degree candidates totally broken got differently next year,negative,-0.7808,negative,-0.15,01/13/2023
comments,curious situations like supposed fixed seniors getting earlier time tickets registration,neutral,0.049,neutral,0.0,01/13/2023
comments,yes theory practice guess cause overcrowding classes slowness degree candidates someone wants graduate sign right things phase say tough say let fix really really want people graduate,positive,0.5531,positive,0.0742063492063492,01/13/2023
comments,advisement understaffed think ones setting course caps capacity issue many solutions involve building new lecture halls hiring faculty coc done plenty latter also issue tas dr bruckman mentioned cs 3600 800 seats semester 8pm like different rooms unprecedented kind move takes really alleviate capacity issues every course,positive,0.3555,positive,0.29090909090909095,01/13/2023
comments,add library offers poster printing using printing money refreshes every semester iirc even somehow blown already like bucks poster get whatever want would recommend,positive,0.6486,positive,0.1,01/13/2023
comments,placing interested well,positive,0.6239,positive,0.25,01/13/2023
comments,current major want business economics different schools scheller college business ivan allen college liberal arts respectively,positive,0.4019,neutral,0.015625,01/13/2023
comments,hi missed registration deadline supposed remove class semester pay payment deadline marked dropped transcript,neutral,-0.0402,positive,0.1,01/13/2023
comments,maybe protesting registrar would better,neutral,0.0258,positive,0.5,01/13/2023
comments,registrar pointing blame cs,negative,-0.34,neutral,0.0,01/13/2023
comments,someone fill happened graduating senior placed front waitlist take one class next fall degree yalls shoes curious different previous years,positive,0.4497,negative,-0.06666666666666667,01/13/2023
comments,,neutral,0.0,neutral,0.0,01/13/2023
comments,respectfully coc care protesting anything waste breath edit idk sorry long enough,negative,-0.2723,negative,-0.05,01/13/2023
comments,would nice could show less 80 minutes maybe could,positive,0.4215,positive,0.21666666666666667,01/13/2023
comments,theres chargers student center parking deck w02,neutral,0.0,negative,-0.1,01/13/2023
comments,fine want anything fine discourage others trying something spread defeatism helps one tbh,positive,0.8191,positive,0.4166666666666667,01/13/2023
comments,pay right,negative,-0.5803,positive,0.2857142857142857,01/13/2023
comments,agree points think hiring faculty would super practical already many hence think understaffed lots room improvement logistics hopefully gets better sorted coming years,positive,0.9359,positive,0.4444444444444444,01/13/2023
comments,dang quite sure would go check least tho see electric cars charged everytime park also slow charging station outlets charger really notice type payment system could,negative,-0.0947,neutral,0.024999999999999994,01/13/2023
comments,really sorry bro want get peers protest anything going transfer somewhere like berkeley,positive,0.2272,negative,-0.5,01/13/2023
comments,may succinct explanation numbers mean brain dumped graduated,negative,-0.4019,negative,-0.3125,01/13/2023
comments,yeah sorry know bad clear think broader world things effective hearing dealing coc feel coc cares,positive,0.7227,negative,-0.12499999999999992,01/13/2023
comments,please call gt georgia,neutral,-0.0146,neutral,0.0,01/13/2023
comments,bro,neutral,0.0,neutral,0.0,01/13/2023
